sen_str,swapped_sen_str,leaf_rule
"Για να το θέσουμε ξεκάθαρα , η μόνη διαφορά ανάμεσα σε έναν επίσημο αντιπρόσωπο που παρέχει υπηρεσίες μετά την πώληση σήμερα και έναν επίσημο επισκευαστή σ το προτεινόμενο καθεστώς αύριο είναι ότι ο τελευταίος μπορεί να μην έχει έκθεση από την οποία να πωλεί αυτοκίνητα .","Για να το θέσουμε ξεκάθαρα , η μόνη διαφορά ανάμεσα σε έναν επίσημο αντιπρόσωπο παρέχει που υπηρεσίες μετά την πώληση σήμερα και έναν επίσημο επισκευαστή σ το προτεινόμενο καθεστώς αύριο είναι ότι ο τελευταίος μπορεί να μην έχει έκθεση από την οποία να πωλεί αυτοκίνητα .",[0] -> [22]
"Το 1978 , η πρωτεύουσα του νησιού μεταφέρθηκε σ το Πατητήρι , το οποίο πήρε το όνομά του από τα πατητήρια των σταφυλιών που υπήρχαν εδώ , την εποχή που το νησί παρήγαγε και εξήγαγε ονομαστό κόκκινο κρασί .","Το 1978 , η πρωτεύουσα του νησιού μεταφέρθηκε σ το Πατητήρι , πήρε το οποίο το όνομά του από τα πατητήρια των σταφυλιών που υπήρχαν εδώ , την εποχή που το νησί παρήγαγε και εξήγαγε ονομαστό κόκκινο κρασί .",[0] -> [22]
"Η επικοινωνία του φρουρίου με την ξηρά γινόταν με μια ξύλινη κινητή γέφυρα , η οποία ένωνε την πύλη του φρουρίου με το απέναντι ύψωμα .","Η επικοινωνία του φρουρίου με την ξηρά γινόταν με μια ξύλινη κινητή γέφυρα , ένωνε η οποία την πύλη του φρουρίου με το απέναντι ύψωμα .",[0] -> [22]
Βλέπει το λαμπάκι που σβήνει σ τη συσκευή και μου λέει :,Βλέπει το λαμπάκι σβήνει που σ τη συσκευή και μου λέει :,[0] -> [22]
"Η απουσία αμαξιών σε συνδυασμό με τους πολύχρωμους κήπους , τα δέντρα και τα λουλούδια που περιβάλλουν τα σπίτια , μαγεύουν τον επισκέπτη .","Η απουσία αμαξιών σε συνδυασμό με τους πολύχρωμους κήπους , τα δέντρα και τα λουλούδια περιβάλλουν που τα σπίτια , μαγεύουν τον επισκέπτη .",[0] -> [22]
"Επομένως , δηλώνω και ισχυρίζομαι με σαφήνεια : το λόμπι που εργάζεται ενάντια σε αυτό είναι ουσιαστικά ένα λόμπι , το οποίο υποστηρίζει μόνο εκείνους που παραβιάζουν τους κανόνες και δεν σέβονται τις ρυθμίσεις .","Επομένως , δηλώνω και ισχυρίζομαι με σαφήνεια : το λόμπι που εργάζεται ενάντια σε αυτό είναι ουσιαστικά ένα λόμπι , το οποίο υποστηρίζει μόνο εκείνους παραβιάζουν που τους κανόνες και δεν σέβονται τις ρυθμίσεις .",[0] -> [22]
"Το Κογκρέσο της Βιέννης συνεχίζει την πολιτική της ένωσης με τελικό αποτέλεσμα την ίδρυση της Γερμανικής Ομοσπονδίας , η οποία αποτελείται από 38 γερμανικά κράτη .","Το Κογκρέσο της Βιέννης συνεχίζει την πολιτική της ένωσης με τελικό αποτέλεσμα την ίδρυση της Γερμανικής Ομοσπονδίας , αποτελείται η οποία από 38 γερμανικά κράτη .",[0] -> [22]
"Ο Παπαδάκης , που είναι προνοητικός , έχει φέρει μαζί του και έναν τοπογραφικό χάρτη της περιοχής και έτσι εντοπίζουμε εύκολα το σπίτι της Όγκντεν .","Ο Παπαδάκης , είναι προνοητικός που , έχει φέρει μαζί του και έναν τοπογραφικό χάρτη της περιοχής και έτσι εντοπίζουμε εύκολα το σπίτι της Όγκντεν .",[0] -> [22]
Πηγές της Αντιπολίτευσης αναφέρουν ότι « οι κυβερνητικές δυνάμεις προσπαθούν να αποτρέψουν τις ομάδες του Ερυθρού Σταυρού να γίνουν μάρτυρες της σφαγής που συντελείται από τους σύρους στρατιώτες που καταδιώκουν και εκτελούν τους εναπομείναντες αντάρτες » .,Πηγές της Αντιπολίτευσης αναφέρουν ότι « οι κυβερνητικές δυνάμεις προσπαθούν να αποτρέψουν τις ομάδες του Ερυθρού Σταυρού να γίνουν μάρτυρες της σφαγής που συντελείται από τους σύρους στρατιώτες καταδιώκουν που και εκτελούν τους εναπομείναντες αντάρτες » .,[0] -> [22]
Θα γίνεται ενημέρωση των πολιτών γενικά αλλά και των πολιτών που ανήκουν σε ομάδες που είναι ιδιαίτερα ευαίσθητες όσον αφορά τα προβλήματα που προκαλούνται από αυτά τα αίτια .,Θα γίνεται ενημέρωση των πολιτών γενικά αλλά και των πολιτών που ανήκουν σε ομάδες είναι ιδιαίτερα ευαίσθητες που όσον αφορά τα προβλήματα που προκαλούνται από αυτά τα αίτια .,[0] -> [22]
"Επίσης , θεωρούμε πως είναι σημαντικό να διοργανωθεί μια περιφερειακή διάσκεψη που θα συμβάλει σ τη συμφιλίωση των χωρών της περιοχής των Μεγάλων Λιμνών και θα αποκαταστήσει τη χαμένη εμπιστοσύνη των διαφόρων λαών που κατοικούν εκεί .","Επίσης , θεωρούμε πως είναι σημαντικό να διοργανωθεί μια περιφερειακή διάσκεψη θα συμβάλει που σ τη συμφιλίωση των χωρών της περιοχής των Μεγάλων Λιμνών και θα αποκαταστήσει τη χαμένη εμπιστοσύνη των διαφόρων λαών που κατοικούν εκεί .",[0] -> [22]
"« Κάποιος ήταν μαζί σας , που σας βοήθησε ν' ανοίξετε την πόρτα » τους λέω .","« Κάποιος ήταν μαζί σας , σας βοήθησε που ν' ανοίξετε την πόρτα » τους λέω .",[0] -> [22]
"Αυτό είναι κάτι που , φοβάμαι , θα χαρακτηρίσει ολοένα και περισσότερο την προεδρία σας , αλλά θα έχουμε ολοένα και περισσότερες ευκαιρίες να λαμβάνουμε σκληρές αποφάσεις .","Αυτό είναι κάτι , φοβάμαι , θα χαρακτηρίσει που ολοένα και περισσότερο την προεδρία σας , αλλά θα έχουμε ολοένα και περισσότερες ευκαιρίες να λαμβάνουμε σκληρές αποφάσεις .",[0] -> [22]
"Αλλάζω αμέσως θέμα , και τους αναπτύσσω τη θεωρία μου σχετικά με την εκτέλεση του Λαλόπουλου και τα στοιχεία που με οδήγησαν σ' αυτήν .","Αλλάζω αμέσως θέμα , και τους αναπτύσσω τη θεωρία μου σχετικά με την εκτέλεση του Λαλόπουλου και τα στοιχεία με οδήγησαν που σ' αυτήν .",[0] -> [22]
Μπορώ να φανταστώ τις φήμες που θα έχουν ήδη αρχίσει να κυκλοφορούν .,Μπορώ να φανταστώ τις φήμες θα έχουν ήδη αρχίσει που να κυκλοφορούν .,[0] -> [22]
"Το 1978 , η πρωτεύουσα του νησιού μεταφέρθηκε σ το Πατητήρι , το οποίο πήρε το όνομά του από τα πατητήρια των σταφυλιών που υπήρχαν εδώ , την εποχή που το νησί παρήγαγε και εξήγαγε ονομαστό κόκκινο κρασί .","Το 1978 , η πρωτεύουσα του νησιού μεταφέρθηκε σ το Πατητήρι , το οποίο πήρε το όνομά του από τα πατητήρια των σταφυλιών υπήρχαν που εδώ , την εποχή που το νησί παρήγαγε και εξήγαγε ονομαστό κόκκινο κρασί .",[0] -> [22]
"Θα ήθελα να υπενθυμίσω ορισμένα από τα τελευταία μέτρα που έχουμε παρουσιάσει για τη βελτίωση αυτής της ασφάλειας , όπως για παράδειγμα την οδηγία που εγκρίθηκε πρόσφατα σχετικά με τα ωράρια εργασίας για τις οδικές μεταφορές , η οποία θα έχει σαφείς συνέπειες για την ασφάλεια .","Θα ήθελα να υπενθυμίσω ορισμένα από τα τελευταία μέτρα που έχουμε παρουσιάσει για τη βελτίωση αυτής της ασφάλειας , όπως για παράδειγμα την οδηγία εγκρίθηκε που πρόσφατα σχετικά με τα ωράρια εργασίας για τις οδικές μεταφορές , η οποία θα έχει σαφείς συνέπειες για την ασφάλεια .",[0] -> [22]
"Ευχαριστώ , κύριε Πρόεδρε , κυρίες και κύριοι βουλευτές , το Ευρωπαϊκό Κοινοβούλιο που έλαβε την πρωτοβουλία να καταρτίσει μια έκθεση σχετικά με τις επιπτώσεις των μεταφορών σ την υγεία .","Ευχαριστώ , κύριε Πρόεδρε , κυρίες και κύριοι βουλευτές , το Ευρωπαϊκό Κοινοβούλιο έλαβε που την πρωτοβουλία να καταρτίσει μια έκθεση σχετικά με τις επιπτώσεις των μεταφορών σ την υγεία .",[0] -> [22]
"Το λιμάνι του νησιού , οι Καμάρες , βρίσκεται ανάμεσα σε δύο βουνά , τα οποία έχουν λευκές εκκλησίες σ τις κορυφές τους .","Το λιμάνι του νησιού , οι Καμάρες , βρίσκεται ανάμεσα σε δύο βουνά , έχουν τα οποία λευκές εκκλησίες σ τις κορυφές τους .",[0] -> [22]
"Καθώς ρωσικά στρατεύματα περιπολούν το Μπαχτσισαράι της Κριμαίας , οι Τάταροι , που αποτελούν μειονότητα σε σχέση με τους σλαβόφωνους γείτονές τους , ανησυχούν για το μέλλον τους σε μια περιοχή που μπορεί να βρεθεί ξανά υπό τον έλεγχο της Ρωσίας .","Καθώς ρωσικά στρατεύματα περιπολούν το Μπαχτσισαράι της Κριμαίας , οι Τάταροι , που αποτελούν μειονότητα σε σχέση με τους σλαβόφωνους γείτονές τους , ανησυχούν για το μέλλον τους σε μια περιοχή μπορεί που να βρεθεί ξανά υπό τον έλεγχο της Ρωσίας .",[0] -> [22]
"“ Αυτή είναι η γραμμή , σύντροφε ” , που σήμαινε “ Σκάσε και κάνε αυτό που σου λένε ” .","“ Αυτή είναι η γραμμή , σύντροφε ” , σήμαινε που “ Σκάσε και κάνε αυτό που σου λένε ” .",[0] -> [22]
"Μεταξύ των πρωτοβουλιών που είναι απαραίτητο να αναληφθούν για το μέλλον , θα ήθελα να αναφέρω δύο που είναι ίσως οι σπουδαιότερες :","Μεταξύ των πρωτοβουλιών που είναι απαραίτητο να αναληφθούν για το μέλλον , θα ήθελα να αναφέρω δύο είναι ίσως οι σπουδαιότερες που :",[0] -> [22]
"Αποτέλεσμα της έκρηξης αποτελεί ο θάνατος ενός καμικάζι και ενός φρουρού ασφαλείας , καθώς επίσης και ο τραυματισμός μιας γυναίκας , η οποία βρισκόταν εκεί για να λάβει θεώρηση εισόδου .","Αποτέλεσμα της έκρηξης αποτελεί ο θάνατος ενός καμικάζι και ενός φρουρού ασφαλείας , καθώς επίσης και ο τραυματισμός μιας γυναίκας , βρισκόταν η οποία εκεί για να λάβει θεώρηση εισόδου .",[0] -> [22]
Η τρίτη ιδέα που διατύπωσα πριν από δύο μήνες είναι η μόνη η οποία πολύ φοβούμαι δεν έχει κανένα κοινό σημείο με τα όσα αναφέρατε σ την ομιλία σας σήμερα το πρωί :,Η τρίτη ιδέα που διατύπωσα πριν από δύο μήνες είναι η μόνη πολύ φοβούμαι δεν έχει η οποία κανένα κοινό σημείο με τα όσα αναφέρατε σ την ομιλία σας σήμερα το πρωί :,[0] -> [22]
"« Έχουμε βάσιμες υποψίες ότι η παράνομη δραστηριότητά του δεν περιοριζόταν σ τις μίζες , αλλά είχε ολόκληρη επιχείρηση λαθρεμπορίου και χρησιμοποιούσε πολλά από τα σκάφη που αγκυροβολούσαν σ τις μαρίνες » .","« Έχουμε βάσιμες υποψίες ότι η παράνομη δραστηριότητά του δεν περιοριζόταν σ τις μίζες , αλλά είχε ολόκληρη επιχείρηση λαθρεμπορίου και χρησιμοποιούσε πολλά από τα σκάφη αγκυροβολούσαν που σ τις μαρίνες » .",[0] -> [22]
"Οι λόφοι και οι κοιλάδες του έχουν ελαιόδεντρα και είναι κατάφυτες , γεγονός που διαφοροποιεί το τοπίο , κατά πολύ , σε σχέση με τα άλλα νησιά του Αιγαίου , όπου η βλάστηση είναι σχεδόν ανύπαρκτη .","Οι λόφοι και οι κοιλάδες του έχουν ελαιόδεντρα και είναι κατάφυτες , γεγονός διαφοροποιεί που το τοπίο , κατά πολύ , σε σχέση με τα άλλα νησιά του Αιγαίου , όπου η βλάστηση είναι σχεδόν ανύπαρκτη .",[0] -> [22]
"Επίσης , το Ευρωπαϊκό Δικαστήριο έδωσε πολύ καλές και υπεύθυνες ερμηνείες του υφισταμένου δικαίου με αποφάσεις που χαράζουν νέες κατευθύνσεις , ειδικά και τώρα με την τελική εισήγηση ως προς την υπόθεση του Ελσίνκι .","Επίσης , το Ευρωπαϊκό Δικαστήριο έδωσε πολύ καλές και υπεύθυνες ερμηνείες του υφισταμένου δικαίου με αποφάσεις χαράζουν που νέες κατευθύνσεις , ειδικά και τώρα με την τελική εισήγηση ως προς την υπόθεση του Ελσίνκι .",[0] -> [22]
« Τον έδωσε σ' αυτούς που τον έβαλαν να σκοτώσει τον Σωτηρόπουλο » του απαντώ .,« Τον έδωσε σ' αυτούς τον έβαλαν που να σκοτώσει τον Σωτηρόπουλο » του απαντώ .,[0] -> [22]
"Το νησάκι είναι ακατοίκητο , όμως σε αυτό λειτουργεί διεθνές κατασκηνωτικό κέντρο που φιλοξενεί , κάθε χρόνο , παιδιά σχολικής ηλικίας από την Ελλάδα και από το εξωτερικό , ιατρείο , εστιατόριο και αναψυκτήρια .","Το νησάκι είναι ακατοίκητο , όμως σε αυτό λειτουργεί διεθνές κατασκηνωτικό κέντρο φιλοξενεί που , κάθε χρόνο , παιδιά σχολικής ηλικίας από την Ελλάδα και από το εξωτερικό , ιατρείο , εστιατόριο και αναψυκτήρια .",[0] -> [22]
"« Με κολοβούς μισθούς μας βάζανε να κυνηγάμε τον κόσμο , που κι αυτός είχε πετσοκομμένο εισόδημα » λέει ένας άλλος .","« Με κολοβούς μισθούς μας βάζανε να κυνηγάμε τον κόσμο , είχε που κι αυτός πετσοκομμένο εισόδημα » λέει ένας άλλος .",[0] -> [22]
« Έκανα μια λίστα με τις επιχειρήσεις που ήρθαν σ την Ελλάδα » .,« Έκανα μια λίστα με τις επιχειρήσεις ήρθαν που σ την Ελλάδα » .,[0] -> [22]
"Επιθυμώ , καταρχάς , να δηλώσω ότι οι κατηγορίες οι οποίες βαρύνουν τους εν λόγω βουλευτές είναι σοβαρές .","Επιθυμώ , καταρχάς , να δηλώσω ότι οι κατηγορίες βαρύνουν οι οποίες τους εν λόγω βουλευτές είναι σοβαρές .",[0] -> [22]
Για το λόγο αυτό αναγκαζόμαστε να διαπιστώσουμε ότι σ το προσεχές μέλλον δεν θα είναι δυνατή η άρση της απαγόρευσης για τη χορήγηση σε παμφάγα ζώα ζωοτροφών που περιέχουν κρεατάλευρα και οστεάλευρα .,Για το λόγο αυτό αναγκαζόμαστε να διαπιστώσουμε ότι σ το προσεχές μέλλον δεν θα είναι δυνατή η άρση της απαγόρευσης για τη χορήγηση σε παμφάγα ζώα ζωοτροφών περιέχουν που κρεατάλευρα και οστεάλευρα .,[0] -> [22]
« Ένας φάκελος με στοιχεία που εξηγούν γιατί ήθελα να συνεχίσω την έρευνα » του απαντώ .,« Ένας φάκελος με στοιχεία εξηγούν που γιατί ήθελα να συνεχίσω την έρευνα » του απαντώ .,[0] -> [22]
Απέρριψε επίσης τις φήμες που αναφέρουν ότι « οι ΗΠΑ θα διατηρούν και στρατιωτική βάση κοντά σ το συγκεκριμένο αεροδρόμιο » .,Απέρριψε επίσης τις φήμες αναφέρουν που ότι « οι ΗΠΑ θα διατηρούν και στρατιωτική βάση κοντά σ το συγκεκριμένο αεροδρόμιο » .,[0] -> [22]
"Παρόμοιο καθεστώς επιδιώκουν και οι πόλεις σ τα ανατολικά της Λιβύης , οι οποίες είναι πλούσιες σε κοιτάσματα πετρελαίου .","Παρόμοιο καθεστώς επιδιώκουν και οι πόλεις σ τα ανατολικά της Λιβύης , είναι πλούσιες οι οποίες σε κοιτάσματα πετρελαίου .",[0] -> [22]
Αυτοί είναι οι πρώτοι που μας ανοίγουν μια πόρτα .,Αυτοί είναι οι πρώτοι μας ανοίγουν που μια πόρτα .,[0] -> [22]
"Το μόνο συνεπώς που μπορούσαν να κάνουν ήταν ν' αυξήσουν την επιρροή τους σ τους πληθυσμούς της περιοχής , παράλληλα μ' εκείνη προς τον Σουλτάνο σ τη Κωνσταντινούπολη , για όσο χρόνο θα "" παρέμενε "" ( ή θα του επέτρεπαν ) τη συνέχεια της Αυτοκρατορίας του , προκειμένου να είναι έτοιμες να υποστηρίξουν ένα ή περισσότερους από τους διαδόχους του οθωμανικού καθεστώτος που θα μπορούσαν να ήταν οι Σέρβοι , οι Έλληνες , οι Βούλγαροι , οι Αλβανοί , ακόμα και οι γηγενείς Μακεδόνες , που οι πιθανότητές να ιδρύσουν ανεξάρτητα έθνη δεν ήταν και εντελώς ανύπαρκτες .","Το μόνο συνεπώς που μπορούσαν να κάνουν ήταν ν' αυξήσουν την επιρροή τους σ τους πληθυσμούς της περιοχής , παράλληλα μ' εκείνη προς τον Σουλτάνο σ τη Κωνσταντινούπολη , για όσο χρόνο θα "" παρέμενε "" ( ή θα του επέτρεπαν ) τη συνέχεια της Αυτοκρατορίας του , προκειμένου να είναι έτοιμες να υποστηρίξουν ένα ή περισσότερους από τους διαδόχους του οθωμανικού καθεστώτος θα μπορούσαν που να ήταν οι Σέρβοι , οι Έλληνες , οι Βούλγαροι , οι Αλβανοί , ακόμα και οι γηγενείς Μακεδόνες , που οι πιθανότητές να ιδρύσουν ανεξάρτητα έθνη δεν ήταν και εντελώς ανύπαρκτες .",[0] -> [22]
Σε πολλές ευρωπαϊκές πρωτεύουσες έγιναν διαδηλώσεις συμπαράστασης σ τους επαναστάτες ενώ το προεδρείο της Βουλής των Ελλήνων σ την Αθήνα έπαιρνε πλήθος τηλεγραφήματα από διασημότητες της εποχής που συνιστούσαν σ την ελληνική κυβέρνηση να τηρήσει πιο αποφασιστική στάση υπέρ των Κρητικών .,Σε πολλές ευρωπαϊκές πρωτεύουσες έγιναν διαδηλώσεις συμπαράστασης σ τους επαναστάτες ενώ το προεδρείο της Βουλής των Ελλήνων σ την Αθήνα έπαιρνε πλήθος τηλεγραφήματα από διασημότητες της εποχής συνιστούσαν που σ την ελληνική κυβέρνηση να τηρήσει πιο αποφασιστική στάση υπέρ των Κρητικών .,[0] -> [22]
"Πρέπει να κοιμήθηκα ένα δεκάωρο περίπου , που για μένα είναι το απόλυτο θαύμα .","Πρέπει να κοιμήθηκα ένα δεκάωρο περίπου , για μένα είναι το απόλυτο θαύμα που .",[0] -> [22]
"Ήταν η πρώτη φορά που οι « σύμμαχοι » διαχώριζαν ανοιχτά την θέση τους από τους Σοβιετικούς , τον μπολσεβικισμό και τον σοσιαλισμό , γεγονός που προανήγγειλε την περίοδο του « Ψυχρού Πολέμου » .","Ήταν η πρώτη φορά που οι « σύμμαχοι » διαχώριζαν ανοιχτά την θέση τους από τους Σοβιετικούς , τον μπολσεβικισμό και τον σοσιαλισμό , γεγονός προανήγγειλε που την περίοδο του « Ψυχρού Πολέμου » .",[0] -> [22]
