sen_str,swapped_sen_str,leaf_rule
"Για δύο συνεχείς ημέρες περιοχές από την Οκλαχόμα μέχρι την Αλαμπάμα επλήγησαν από ισχυρούς ανεμοστρόβιλους που ισοπέδωσαν ολόκληρες γειτονιές , ενώ στοίχισαν την ζωή σε τουλάχιστον 30 άτομα .","Για δύο συνεχείς ημέρες περιοχές από την Οκλαχόμα μέχρι την Αλαμπάμα επλήγησαν από ισχυρούς ανεμοστρόβιλους ισοπέδωσαν που ολόκληρες γειτονιές , ενώ στοίχισαν την ζωή σε τουλάχιστον 30 άτομα .",[0] -> [22]
"Αυτός ο χώρος που αποτελεί μια πλούσια μορφολογία εδάφους με λίμνες , βουνά και ποταμούς διασχίζονταν από την αρχαιότητα από τρεις κύριες οδούς , τις κοιλάδες του Αξιού και του Στρυμόνα που συνέδεαν την κεντρική Ευρώπη με το Αιγαίο και τη ρωμαϊκή Εγναντία οδό που διερχόμενη από το Μοναστήρι και τη Θεσσαλονίκη έφθανε σ τη Κωνσταντινούπολη .","Αυτός ο χώρος αποτελεί που μια πλούσια μορφολογία εδάφους με λίμνες , βουνά και ποταμούς διασχίζονταν από την αρχαιότητα από τρεις κύριες οδούς , τις κοιλάδες του Αξιού και του Στρυμόνα που συνέδεαν την κεντρική Ευρώπη με το Αιγαίο και τη ρωμαϊκή Εγναντία οδό που διερχόμενη από το Μοναστήρι και τη Θεσσαλονίκη έφθανε σ τη Κωνσταντινούπολη .",[0] -> [22]
"Αυτό συμβαίνει με την αποκαλούμενη ρήτρα διαθεσιμότητας , που επιτρέπει , για παράδειγμα , σε ένα βρετανό καταναλωτή να αγοράσει ένα αυτοκίνητο με δεξιόστροφη λήψη κίνησης σε μια χώρα όπου οδηγούν αριστερά .","Αυτό συμβαίνει με την αποκαλούμενη ρήτρα διαθεσιμότητας , επιτρέπει που , για παράδειγμα , σε ένα βρετανό καταναλωτή να αγοράσει ένα αυτοκίνητο με δεξιόστροφη λήψη κίνησης σε μια χώρα όπου οδηγούν αριστερά .",[0] -> [22]
"Πρότεινε να επιτεθούν μαζί με άλλους επαναστάτες που ήταν σ το Ακρωτήρι , σ τους Τούρκους και να τους εκτοπίσουν από την πεδιάδα ( η Μαλάξα είναι σε κάποιο υψόμετρο ) .","Πρότεινε να επιτεθούν μαζί με άλλους επαναστάτες ήταν σ το Ακρωτήρι που , σ τους Τούρκους και να τους εκτοπίσουν από την πεδιάδα ( η Μαλάξα είναι σε κάποιο υψόμετρο ) .",[0] -> [22]
"Εάν εξετάσουμε πώς σχετίζονται διάφορες ασθένειες μεταξύ τους , διαπιστώνουμε ότι η τρομώδης νόσος , ο οποίος αποτελεί την παλαιότερη μορφή ΣΕΒ είναι γνωστός εδώ και αρκετούς αιώνες , ενώ η ΣΕΒ , η οποία πλήττει τα βοοειδή , δεν ήταν γνωστή πριν από το 1986 .","Εάν εξετάσουμε πώς σχετίζονται διάφορες ασθένειες μεταξύ τους , διαπιστώνουμε ότι η τρομώδης νόσος , ο οποίος αποτελεί την παλαιότερη μορφή ΣΕΒ είναι γνωστός εδώ και αρκετούς αιώνες , ενώ η ΣΕΒ , πλήττει η οποία τα βοοειδή , δεν ήταν γνωστή πριν από το 1986 .",[0] -> [22]
"Χαιρετίζω μάλιστα ιδιαιτέρως την ομιλία του σ τις 13_Ιανουαρίου , σ την οποία υποσχέθηκε τη μεταρρύθμιση των ισλαμικών ιεροδιδασκαλείων που ενστάλαξαν τόσο μίσος εναντίον της Δύσης και καλλιέργησαν την ατμόσφαιρα η οποία οδήγησε σ τη περυσινή σφαγή των χριστιανών που συμμετείχαν ειρηνικά σε λατρευτική εκδήλωση .","Χαιρετίζω μάλιστα ιδιαιτέρως την ομιλία του σ τις 13_Ιανουαρίου , σ την οποία υποσχέθηκε τη μεταρρύθμιση των ισλαμικών ιεροδιδασκαλείων ενστάλαξαν που τόσο μίσος εναντίον της Δύσης και καλλιέργησαν την ατμόσφαιρα η οποία οδήγησε σ τη περυσινή σφαγή των χριστιανών που συμμετείχαν ειρηνικά σε λατρευτική εκδήλωση .",[0] -> [22]
"Για καλή μου τύχη , με παίρνει σ το ενδιάμεσο ο Δημητριού , για να μου πει ότι , σύμφωνα με τον κλειδαρά , το σύστημα ασφαλείας έχει παραβιαστεί , αλλά αυτός που το έκανε θα πρέπει να ήταν μάστορας , γιατί εκ πρώτης όψεως δε φαίνεται τίποτα .","Για καλή μου τύχη , με παίρνει σ το ενδιάμεσο ο Δημητριού , για να μου πει ότι , σύμφωνα με τον κλειδαρά , το σύστημα ασφαλείας έχει παραβιαστεί , αλλά αυτός το έκανε που θα πρέπει να ήταν μάστορας , γιατί εκ πρώτης όψεως δε φαίνεται τίποτα .",[0] -> [22]
"Το Βίδο συνδέεται με το παλιό λιμάνι της Κέρκυρας με καραβάκια που αναχωρούν , καθημερινά , κάθε μισή ώρα από τις 9 π.μ. μέχρι τις 9 μ.μ.","Το Βίδο συνδέεται με το παλιό λιμάνι της Κέρκυρας με καραβάκια αναχωρούν που , καθημερινά , κάθε μισή ώρα από τις 9 π.μ. μέχρι τις 9 μ.μ.",[0] -> [22]
"Του εξηγήσαμε γιατί έπρεπε να μεταφέρει την εταιρεία του σ την Ελλάδα , αλλά εκείνος ήταν ανένδοτος , σε αντίθεση με τον γιο του , που ήθελε πάντα να επιστρέφει σ την Ελλάδα .","Του εξηγήσαμε γιατί έπρεπε να μεταφέρει την εταιρεία του σ την Ελλάδα , αλλά εκείνος ήταν ανένδοτος , σε αντίθεση με τον γιο του , ήθελε που πάντα να επιστρέφει σ την Ελλάδα .",[0] -> [22]
"Ξανακάθομαι , με την ελπίδα ότι ίσως ο επίτροπος δώσει ορισμένες απαντήσεις που θα μου ανοίξουν κάποια πόρτα .","Ξανακάθομαι , με την ελπίδα ότι ίσως ο επίτροπος δώσει ορισμένες απαντήσεις θα μου ανοίξουν που κάποια πόρτα .",[0] -> [22]
"Τελευταίο παράδειγμα , που προσεγγίζει την πρότασή σας , κύριε Πρόεδρε : να οργανώσουμε συναντήσεις μελών της κοινωνίας των πολιτών από τις υποψήφιες χώρες και από τα κράτη μέλη προκειμένου να εξετάσουμε , από κοινού , τα αρνητικά και τα θετικά σημεία του πραγματικά ιστορικού αυτού σχεδίου και να μεγιστοποιήσουμε τις πιθανότητες επιτυχούς υλοποίησής του .","Τελευταίο παράδειγμα , προσεγγίζει που την πρότασή σας , κύριε Πρόεδρε : να οργανώσουμε συναντήσεις μελών της κοινωνίας των πολιτών από τις υποψήφιες χώρες και από τα κράτη μέλη προκειμένου να εξετάσουμε , από κοινού , τα αρνητικά και τα θετικά σημεία του πραγματικά ιστορικού αυτού σχεδίου και να μεγιστοποιήσουμε τις πιθανότητες επιτυχούς υλοποίησής του .",[0] -> [22]
"Τρίτον , είναι συμβατή με όλα τα εθνικά συστήματα και προσφέρει μηχανισμούς που επιτρέπουν την ομαλή ένταξη νέων ρυθμίσεων σε καθένα από αυτά .","Τρίτον , είναι συμβατή με όλα τα εθνικά συστήματα και προσφέρει μηχανισμούς επιτρέπουν που την ομαλή ένταξη νέων ρυθμίσεων σε καθένα από αυτά .",[0] -> [22]
Η ενοποίηση των νόμων μπορεί να γίνει βέβαια μέσω της δικής μας άρνησης να συζητούμε ή να απορρίπτουμε ευθέως προτάσεις οι οποίες δεν είναι ενοποιημένες .,Η ενοποίηση των νόμων μπορεί να γίνει βέβαια μέσω της δικής μας άρνησης να συζητούμε ή να απορρίπτουμε ευθέως προτάσεις δεν είναι ενοποιημένες οι οποίες .,[0] -> [22]
Σε διάστημα μερικών ετών οι ευρωπαϊκοί κανόνες επέτρεψαν τη σημαντική μείωση αυτών των ρυπάνσεων που οφείλονται σ την οδική κυκλοφορία·,Σε διάστημα μερικών ετών οι ευρωπαϊκοί κανόνες επέτρεψαν τη σημαντική μείωση αυτών των ρυπάνσεων οφείλονται που σ την οδική κυκλοφορία·,[0] -> [22]
"« Το ερώτημα είναι αν τον έκλεψε για να τον πουλήσει ή αν τον πήρε , επειδή έψαχνε κάτι που βρίσκεται σ τον υπολογιστή » .","« Το ερώτημα είναι αν τον έκλεψε για να τον πουλήσει ή αν τον πήρε , επειδή έψαχνε κάτι βρίσκεται που σ τον υπολογιστή » .",[0] -> [22]
"Ο χειρότερος σεισμός των τελευταίων 30 ετών σ την Ιταλία αφήνει σεισμόπληκτους σε 26 πόλεις και χωριά , εκατοντάδες τραυματίες σ το νοσοκομείο της πόλης , που και αυτό έχει υποστεί ζημιές και κάπου 15.000 « κόκκινα » κτίρια .","Ο χειρότερος σεισμός των τελευταίων 30 ετών σ την Ιταλία αφήνει σεισμόπληκτους σε 26 πόλεις και χωριά , εκατοντάδες τραυματίες σ το νοσοκομείο της πόλης , και αυτό έχει υποστεί που ζημιές και κάπου 15.000 « κόκκινα » κτίρια .",[0] -> [22]
"« Η γυναίκα σου είναι από εκείνες τις νοικοκυρές , που σε λίγο θα γίνουν εκθέματα μουσείου » .","« Η γυναίκα σου είναι από εκείνες τις νοικοκυρές , σε λίγο θα γίνουν που εκθέματα μουσείου » .",[0] -> [22]
"Τ' αγαπημένα μας το χωστό , που τρυπώναμε σ τ' αποπίθαρα κι όπου αλλού βάλει ο μυαλός τ' ανθρώπου , οι αμάδες που τρυπούσαμε τσι κεφαλές μας και βάναμε ύστερα καβαλίνες κι ό,τι άλλες γιατρικουλιές , το ζυγωτό που το στρώναμε σ τ' ατζιρίτι και έβγαινε η γλώσσα μας δυο πιθαμές , καλή ώρα , σαν του σκύλου μας που τρώει και κοιμάται ή σαν και μερικούς που περνούν ζωή σκύλινη κι ας κάνουν τσοι παντέρμους και τσοι κατεχιάρηδες .","Τ' αγαπημένα μας το χωστό , που τρυπώναμε σ τ' αποπίθαρα κι όπου αλλού βάλει ο μυαλός τ' ανθρώπου , οι αμάδες που τρυπούσαμε τσι κεφαλές μας και βάναμε ύστερα καβαλίνες κι ό,τι άλλες γιατρικουλιές , το ζυγωτό που το στρώναμε σ τ' ατζιρίτι και έβγαινε η γλώσσα μας δυο πιθαμές , καλή ώρα , σαν του σκύλου μας που τρώει και κοιμάται ή σαν και μερικούς περνούν που ζωή σκύλινη κι ας κάνουν τσοι παντέρμους και τσοι κατεχιάρηδες .",[0] -> [22]
"Μαζί μου σ το περιπολικό κάθονται ο Δερμιτζάκης , που εκτελεί καθήκοντα οδηγού , ο Βλασόπουλος και ο Παπαδάκης .","Μαζί μου σ το περιπολικό κάθονται ο Δερμιτζάκης , εκτελεί που καθήκοντα οδηγού , ο Βλασόπουλος και ο Παπαδάκης .",[0] -> [22]
"Τούτο αποβαίνει κυρίως σε βάρος των ποιοτικών κριτηρίων , ιδίως των κοινωνικών , των οικολογικών και των κριτηρίων που αφορούν τις επιπτώσεις σ την υγεία .","Τούτο αποβαίνει κυρίως σε βάρος των ποιοτικών κριτηρίων , ιδίως των κοινωνικών , των οικολογικών και των κριτηρίων αφορούν που τις επιπτώσεις σ την υγεία .",[0] -> [22]
Μια από τις πιο όμορφες εικόνες της Σίφνου είναι το εκκλησάκι της Παναγίας της Χρυσοπηγής που βρίσκεται χτισμένο σε ένα πελώριο βράχο που ουσιαστικά εισβάλλει σ το απόλυτο μπλε της θάλασσας .,Μια από τις πιο όμορφες εικόνες της Σίφνου είναι το εκκλησάκι της Παναγίας της Χρυσοπηγής βρίσκεται που χτισμένο σε ένα πελώριο βράχο που ουσιαστικά εισβάλλει σ το απόλυτο μπλε της θάλασσας .,[0] -> [22]
Λυπάμι του κουπιλούδ’ π’ σι κουκλώθ’κι .,Λυπάμι του κουπιλούδ’ σι κουκλώθ’κι π’ .,[0] -> [22]
"Ακριβώς πίσω από την παραλία βρίσκεται η λίμνη Στροφυλιά , ένας σπάνιος υδροβιότοπος , ο οποίος αποτελεί μία προστατευόμενη περιοχή από το Δήμο Σκιάθου σ το πλαίσιο Ευρωπαϊκών Προγραμμάτων .","Ακριβώς πίσω από την παραλία βρίσκεται η λίμνη Στροφυλιά , ένας σπάνιος υδροβιότοπος , αποτελεί ο οποίος μία προστατευόμενη περιοχή από το Δήμο Σκιάθου σ το πλαίσιο Ευρωπαϊκών Προγραμμάτων .",[0] -> [22]
"Οι εργαζόμενοι έχουν ζωτικό συμφέρον όσον αφορά τη μεσαία τάξη και τις βιοτεχνίες , που είναι το στήριγμα όλων των εθνικών οικονομιών της ΕΕ και εξασφαλίζουν το 70% των θέσεων εργασίας και το 75% των θέσεων εκπαίδευσης .","Οι εργαζόμενοι έχουν ζωτικό συμφέρον όσον αφορά τη μεσαία τάξη και τις βιοτεχνίες , είναι το στήριγμα που όλων των εθνικών οικονομιών της ΕΕ και εξασφαλίζουν το 70% των θέσεων εργασίας και το 75% των θέσεων εκπαίδευσης .",[0] -> [22]
""" Η Ουκρανία είναι νέο κράτος "" , δηλώνει ο Αμπντουραμάν Εγκίζ του κόμματος Μετζλίς για τους Τατάρους της Κριμαίας , "" για όλες τις μειονότητες που ζουν σ την Κριμαία , γυρίσαμε μια νέα σελίδα "" .",""" Η Ουκρανία είναι νέο κράτος "" , δηλώνει ο Αμπντουραμάν Εγκίζ του κόμματος Μετζλίς για τους Τατάρους της Κριμαίας , "" για όλες τις μειονότητες ζουν που σ την Κριμαία , γυρίσαμε μια νέα σελίδα "" .",[0] -> [22]
"Ακολουθώντας τους κανονισμούς , οι οποίοι υπαγορεύουν την προσέγγιση νησιών σε συγκεκριμένες αποστάσεις , το σεβασμό προς τα ζώα και την διατήρηση της καθαριότητας , οι επισκέπτες μπορούν να βρεθούν σε αυτό το τοπίο μοναδικής ομορφιάς και σημασίας .","Ακολουθώντας τους κανονισμούς , υπαγορεύουν οι οποίοι την προσέγγιση νησιών σε συγκεκριμένες αποστάσεις , το σεβασμό προς τα ζώα και την διατήρηση της καθαριότητας , οι επισκέπτες μπορούν να βρεθούν σε αυτό το τοπίο μοναδικής ομορφιάς και σημασίας .",[0] -> [22]
"Πλοίαρχοι ή μηχανικοί , που μετακόμισαν σε άλλη εταιρεία και πιστεύουν ότι θα βγάλουν κανένα δωράκι διά της απειλής .","Πλοίαρχοι ή μηχανικοί , μετακόμισαν που σε άλλη εταιρεία και πιστεύουν ότι θα βγάλουν κανένα δωράκι διά της απειλής .",[0] -> [22]
"« Εσύ να τ' ακούς , που άφησες την αστυνομία για να κάνεις ελεύθερο επάγγελμα » λέει γελώντας η Κατερίνα σ τη Μάνια .","« Εσύ να τ' ακούς , άφησες που την αστυνομία για να κάνεις ελεύθερο επάγγελμα » λέει γελώντας η Κατερίνα σ τη Μάνια .",[0] -> [22]
"Σ τις 3_Σεπτεμβρίου_1895 ξέσπασε επανάσταση , που δεν βρήκε σύμφωνο το Βενιζέλο , ο οποίος θεωρούσε ότι οι Κρητικοί δεν έπρεπε να ενεργούν αυτοβούλως αλλά σε συνεννόηση με την ελληνική κυβέρνηση σ την Αθήνα .","Σ τις 3_Σεπτεμβρίου_1895 ξέσπασε επανάσταση , δεν βρήκε που σύμφωνο το Βενιζέλο , ο οποίος θεωρούσε ότι οι Κρητικοί δεν έπρεπε να ενεργούν αυτοβούλως αλλά σε συνεννόηση με την ελληνική κυβέρνηση σ την Αθήνα .",[0] -> [22]
Η καθιέρωση του ευρώ αποτελεί επιστέγασμα και ανταμοιβή των συνεχών προσπαθειών που έγιναν σ την πορεία προς τη Νομισματική Ένωση .,Η καθιέρωση του ευρώ αποτελεί επιστέγασμα και ανταμοιβή των συνεχών προσπαθειών έγιναν που σ την πορεία προς τη Νομισματική Ένωση .,[0] -> [22]
"Τέταρτον , αντικατοπτρίζει τις θέσεις των δύο νομοθετών , καθώς 15 τουλάχιστον από τις τροπολογίες που εγκρίθηκαν από το Κοινοβούλιο σ το πλαίσιο των δύο αναγνώσεων ενσωματώθηκαν σ το κείμενο .","Τέταρτον , αντικατοπτρίζει τις θέσεις των δύο νομοθετών , καθώς 15 τουλάχιστον από τις τροπολογίες εγκρίθηκαν που από το Κοινοβούλιο σ το πλαίσιο των δύο αναγνώσεων ενσωματώθηκαν σ το κείμενο .",[0] -> [22]
"Από την άποψη αυτή , υπήρξε εξαιρετικά επίκαιρο το ψήφισμα που εγκρίναμε αυτή την εβδομάδα και που διασυνδέει τη βοήθεια έκτακτης ανάγκης , την αποκατάσταση και την αναπτυξιακή πολιτική .","Από την άποψη αυτή , υπήρξε εξαιρετικά επίκαιρο το ψήφισμα που εγκρίναμε αυτή την εβδομάδα και διασυνδέει που τη βοήθεια έκτακτης ανάγκης , την αποκατάσταση και την αναπτυξιακή πολιτική .",[0] -> [22]
"Σ τα περίχωρα της πόλης υπάρχουν μνημεία και ερείπια που μαρτυρούν την ιστορία της , όπως τα τείχη της αρχαίας πόλης , η ακρόπολη , το αρχαίο θέατρο , η αγορά , το Ιερό του Διονύσου και ο Ναός του Πυθίου Απόλλωνα .","Σ τα περίχωρα της πόλης υπάρχουν μνημεία και ερείπια μαρτυρούν που την ιστορία της , όπως τα τείχη της αρχαίας πόλης , η ακρόπολη , το αρχαίο θέατρο , η αγορά , το Ιερό του Διονύσου και ο Ναός του Πυθίου Απόλλωνα .",[0] -> [22]
"Ευελπιστώ ότι η απόφαση αυτή , συμπεριλαμβανομένης και της αιτιολογικής έκθεσης που την συνοδεύει , θα διαβιβαστεί σ τις γαλλικές αρχές , εφόσον υπερψηφιστεί από το Κοινοβούλιο .","Ευελπιστώ ότι η απόφαση αυτή , συμπεριλαμβανομένης και της αιτιολογικής έκθεσης την συνοδεύει που , θα διαβιβαστεί σ τις γαλλικές αρχές , εφόσον υπερψηφιστεί από το Κοινοβούλιο .",[0] -> [22]
"Αυτός ο χώρος που αποτελεί μια πλούσια μορφολογία εδάφους με λίμνες , βουνά και ποταμούς διασχίζονταν από την αρχαιότητα από τρεις κύριες οδούς , τις κοιλάδες του Αξιού και του Στρυμόνα που συνέδεαν την κεντρική Ευρώπη με το Αιγαίο και τη ρωμαϊκή Εγναντία οδό που διερχόμενη από το Μοναστήρι και τη Θεσσαλονίκη έφθανε σ τη Κωνσταντινούπολη .","Αυτός ο χώρος που αποτελεί μια πλούσια μορφολογία εδάφους με λίμνες , βουνά και ποταμούς διασχίζονταν από την αρχαιότητα από τρεις κύριες οδούς , τις κοιλάδες του Αξιού και του Στρυμόνα συνέδεαν που την κεντρική Ευρώπη με το Αιγαίο και τη ρωμαϊκή Εγναντία οδό που διερχόμενη από το Μοναστήρι και τη Θεσσαλονίκη έφθανε σ τη Κωνσταντινούπολη .",[0] -> [22]
