sen_str,swapped_sen_str,leaf_rule
"בניגוד ל נאשמי משפט גבעתי ב ה נאשמים ב משפט גבעתי א ערערו ב זמן_ _של_ _הוא על פסק ה דין ו גזר ה דין , ו מספר ימים לאחר ש הוגש ה ערעור , ביטלו את ה ערעור לאחר ש הובטח ל_ _הם כי ב צה""ל יקלו ב עונש_ _של_ _הם ו הם יקבלו חנינה .","בניגוד ל נאשמי משפט גבעתי ב ה נאשמים ב משפט גבעתי א ערערו ב זמן_ _של_ _הוא על פסק ה דין ו גזר ה דין , ו מספר ימים לאחר ש הוגש ה ערעור , ביטלו את ה ערעור לאחר ש הובטח ל_ _הם כי ב צה""ל יקלו ב עונש_ _של_ _הם ו יקבלו הם חנינה .",[0] -> [1] -> [33]
"לא ייתכן ש הוא יירד מן ה מטוס ו ינחת על ה דשא של_ _אנחנו , בלי ש יאמר : אני רוצה .","לא ייתכן ש יירד הוא מן ה מטוס ו ינחת על ה דשא של_ _אנחנו , בלי ש יאמר : אני רוצה .",[0] -> [1] -> [33]
"טירת ה כרמל היתה קרובה יותר ל ניצחון ש נמנע הודות ל ה_ יכולת ה טובה של מנו שוורץ , ה שוער ה וותיק ו ה מנוסה של בת ים , ל_ _היא היה זה תיקו חמישי העונה .","טירת ה כרמל היתה קרובה יותר ל ניצחון ש נמנע הודות ל ה_ יכולת ה טובה של מנו שוורץ , ה שוער ה וותיק ו ה מנוסה של בת ים , ל_ _היא היה תיקו זה חמישי העונה .",[0] -> [1] -> [33]
"הצבה_ _של_ _הוא של רוברטו מארה ש הובא ל ה_ קבוצה כ חלוץ , מצדיקה את ה השקעה ו זה ה משחק ה שני ש הוא כובש שערים .","הצבה_ _של_ _הוא של רוברטו מארה ש הובא ל ה_ קבוצה כ חלוץ , מצדיקה את ה השקעה ו ה משחק זה ה שני ש הוא כובש שערים .",[0] -> [1] -> [33]
כאן הוא גם נתקל ב ה_ הפגנה ה ראשונה נגד מלחמה ב ה_ מפרץ ה פרסי .,כאן גם נתקל הוא ב ה_ הפגנה ה ראשונה נגד מלחמה ב ה_ מפרץ ה פרסי .,[0] -> [1] -> [33]
יש לשים לב ל ה_ ניסוח : טירן פולק מדבר ב שפה של תחזית ש הוא בטוח ש אמנם תתגשם .,יש לשים לב ל ה_ ניסוח : טירן פולק מדבר ב שפה של תחזית ש בטוח הוא ש אמנם תתגשם .,[0] -> [1] -> [33]
"אבל תחזית_ _של_ _הוא כמו_ _היא כ קריאה ל כל מאן דהוא , לקום ו לנקום את רצח כהנא ב ערבים באשר הם ערבים .","אבל תחזית_ _של_ _הוא כמו_ _היא כ קריאה ל כל מאן דהוא , לקום ו לנקום את רצח כהנא ב ערבים באשר ערבים הם .",[0] -> [1] -> [33]
"אם ב כל זאת אתם רוצים סבסוד ל מחשבה_ _של_ _אתם ו ל מעשה_ _של_ _אתם , על_ _אתם להשיג את_ _הוא ב ה_ דרך ה מיושנת : לפנות ל ה_ קרן , ו לשכנע אנשים בעלי כסף ש אתם זכאים ל חלק ממנו _הוא .","אם ב כל זאת רוצים אתם סבסוד ל מחשבה_ _של_ _אתם ו ל מעשה_ _של_ _אתם , על_ _אתם להשיג את_ _הוא ב ה_ דרך ה מיושנת : לפנות ל ה_ קרן , ו לשכנע אנשים בעלי כסף ש אתם זכאים ל חלק ממנו _הוא .",[0] -> [1] -> [33]
"ה מנה ה עיקרית , סלטימבוקה , היא דוגמה נוספת ל כך ש ב פרגו לא שומרים על רמה אחידה של בישול ו היא משתנה מ ביקור ל ביקור .","ה מנה ה עיקרית , סלטימבוקה , היא דוגמה נוספת ל כך ש ב פרגו לא שומרים על רמה אחידה של בישול ו משתנה היא מ ביקור ל ביקור .",[0] -> [1] -> [33]
"על - פי ה פקודות ה קיימות , ברור ל כל שוטר ש אם מישהו מתנפל על_ _הוא עם סכין , הוא רשאי לפתוח על_ _הוא ב אש .","על - פי ה פקודות ה קיימות , ברור ל כל שוטר ש אם מתנפל מישהו על_ _הוא עם סכין , הוא רשאי לפתוח על_ _הוא ב אש .",[0] -> [1] -> [33]
""" אפשר להבין זאת , פאפא "" , הוא קרא ב חזרה , "" אחרי הכל , את_ _אני נגזר על_ _אתה לעשות ב כוחות עצמך בלבד "" .",""" אפשר להבין זאת , פאפא "" , קרא הוא ב חזרה , "" אחרי הכל , את_ _אני נגזר על_ _אתה לעשות ב כוחות עצמך בלבד "" .",[0] -> [1] -> [33]
"לא שיננו ב __ _של_ _הם ש היא מחייבת את_ _הם לבצר את ה דמוקרטיה ( עוד דוגמה ל תגובה סטריאוטיפית : מה עניין ה משטר ה דמוקרטי ל כאן , כאשר היטלר עצמו עלה ל ה_ שלטון ב מסגרת משטר כ ה_ זה י""ש ) , להילחם ב גזענות , להגן על מיעוטים ו על זכויות ה אדם , להימנע מ ביצוע פקודות בלתי חוקיות "" .","לא שיננו ב __ _של_ _הם ש מחייבת היא את_ _הם לבצר את ה דמוקרטיה ( עוד דוגמה ל תגובה סטריאוטיפית : מה עניין ה משטר ה דמוקרטי ל כאן , כאשר היטלר עצמו עלה ל ה_ שלטון ב מסגרת משטר כ ה_ זה י""ש ) , להילחם ב גזענות , להגן על מיעוטים ו על זכויות ה אדם , להימנע מ ביצוע פקודות בלתי חוקיות "" .",[0] -> [1] -> [33]
"לגבי אלה ש היה ל_ _הם ספק , הרי ש אמש הוא הוסר .","לגבי אלה ש היה ל_ _הם ספק , הרי ש אמש הוסר הוא .",[0] -> [1] -> [33]
"ב מקרה כ ה_ זה , ב היעדר_ _של_ _הוא של תיאום מוקדם בין ישראל ל ארה""ב , עלול ה צבא ה אמריקאי לספוג אבידות , ש יוגדרו על ידי מפקד_ _של_ _הוא כ מיותרות ו נובעות מ ה עובדה ש לא הם קבעו את עיתוי_ _של_ _היא של ה מלחמה .","ב מקרה כ ה_ זה , ב היעדר_ _של_ _הוא של תיאום מוקדם בין ישראל ל ארה""ב , עלול ה צבא ה אמריקאי לספוג אבידות , ש יוגדרו על ידי מפקד_ _של_ _הוא כ מיותרות ו נובעות מ ה עובדה ש לא קבעו הם את עיתוי_ _של_ _היא של ה מלחמה .",[0] -> [1] -> [33]
"ו כך זה נמשך ו נמשך , על - פני 16 עמוד_ _של_ _הוא של כתב ה עת .","ו כך נמשך זה ו נמשך , על - פני 16 עמוד_ _של_ _הוא של כתב ה עת .",[0] -> [1] -> [33]
"ו אילנה נחום מעירה : "" זה רע מאוד אם יגיעו אל_ _אנחנו מ כורח "" .","ו אילנה נחום מעירה : "" רע זה מאוד אם יגיעו אל_ _אנחנו מ כורח "" .",[0] -> [1] -> [33]
"אין ל_ _אני ספק , ש היה גרעין די רציני של אנשים ש חלק_ _של_ _הם עדיין נמצאים ב ה_ תנועה ו ב ה_ ישיבה , ו חלק מהם _הם כבר לא נמצאים ב ה_ מסגרות ה פורמליות של ה תנועה , ו אני בין_ _הם .","אין ל_ _אני ספק , ש היה גרעין די רציני של אנשים ש חלק_ _של_ _הם עדיין נמצאים ב ה_ תנועה ו ב ה_ ישיבה , ו חלק מהם _הם כבר לא נמצאים ב ה_ מסגרות ה פורמליות של ה תנועה , ו בין_ _הם אני .",[0] -> [1] -> [33]
""" הננו רוצים לדעת מיהם אלו ש בחרו את צירי ה מועצה ה קודמת , אשר לאחר חמש שנים הוכח ש הם אינם ראויים ל תפקיד_ _של_ _הם .",""" רוצים הננו לדעת מיהם אלו ש בחרו את צירי ה מועצה ה קודמת , אשר לאחר חמש שנים הוכח ש הם אינם ראויים ל תפקיד_ _של_ _הם .",[0] -> [1] -> [33]
"זו כנראה ה סיבה ש גם כאשר הוא מתאהב ב תיירת קורבן מזימה_ _של_ _הוא הוא אינו יכול להניח ל רגש_ _של_ _הוא לסחוף את_ _הוא , ו מעדיף לחזור ל מעשה ה הונאה .","זו כנראה ה סיבה ש גם כאשר מתאהב הוא ב תיירת קורבן מזימה_ _של_ _הוא הוא אינו יכול להניח ל רגש_ _של_ _הוא לסחוף את_ _הוא , ו מעדיף לחזור ל מעשה ה הונאה .",[0] -> [1] -> [33]
"ב מקום_ _של_ _הוא מינה את סגן_ _של_ _הוא , וילי קרף , ש אף הוא מתמודד ב ה_ מכרז , ש תוצאה_ _של_ _הוא ייוודעו ב - 28 ב חודש זה .","ב מקום_ _של_ _הוא מינה את סגן_ _של_ _הוא , וילי קרף , ש מתמודד אף הוא ב ה_ מכרז , ש תוצאה_ _של_ _הוא ייוודעו ב - 28 ב חודש זה .",[0] -> [1] -> [33]
"ה בעלים , רפי אדר , התגורר זמן מה ב איטליה ו הוא מכנה את ה מקום של_ _הוא , ה מעוצב ב פשטות אך ב רחבות , "" טרטוריה "" , ו ב כך מפגין חוסר יומרות מעורר הערכה .","ה בעלים , רפי אדר , התגורר זמן מה ב איטליה ו מכנה הוא את ה מקום של_ _הוא , ה מעוצב ב פשטות אך ב רחבות , "" טרטוריה "" , ו ב כך מפגין חוסר יומרות מעורר הערכה .",[0] -> [1] -> [33]
"היא פורשת מן ה חיים ב מובן מסוים , שכן היא מוותרת על חיי חברה ו נישואין , נעשית מורה ב בית ספר ל בנות ו לובשת שחורים כ אחת ה נזירות .","היא פורשת מן ה חיים ב מובן מסוים , שכן מוותרת היא על חיי חברה ו נישואין , נעשית מורה ב בית ספר ל בנות ו לובשת שחורים כ אחת ה נזירות .",[0] -> [1] -> [33]
"מאחר ש ה דלתות הן ה מעניקות ל ה_ מטבח את חזות_ _של_ _הוא , ו הן גם ה רגישות ביותר ל בלאי , יש ב הצעה זו כדי לעניין צרכנים רבים .","מאחר ש ה דלתות הן ה מעניקות ל ה_ מטבח את חזות_ _של_ _הוא , ו גם ה רגישות הן ביותר ל בלאי , יש ב הצעה זו כדי לעניין צרכנים רבים .",[0] -> [1] -> [33]
"לייבוביץ הורה ל_ _הוא להיכנס חזרה ל חדר ה מנהל ו אמר ל_ _הוא : "" אני אירה ב_ _אתה "" .","לייבוביץ הורה ל_ _הוא להיכנס חזרה ל חדר ה מנהל ו אמר ל_ _הוא : "" אירה אני ב_ _אתה "" .",[0] -> [1] -> [33]
ככל ש הוא זוכר לא נוצר בין_ _הם קשר מיוחד ; ב אותה תקופה לא התעניין ב ילדות .,ככל ש זוכר הוא לא נוצר בין_ _הם קשר מיוחד ; ב אותה תקופה לא התעניין ב ילדות .,[0] -> [1] -> [33]
"לצד מה ש עשה ל טובה_ _של_ _הם של תושבי ה גטו עצמם , עשה משהו גם ל טובת ה היסטוריה : הוא הרבה לעמוד מאחורי חלון בית ה מרקחת של_ _הוא , עקב אחרי שגרת ה חיים ב ה_ גטו , לרבות ה מעצרים ה המוניים ו ה גירושים , ו כל מה ש ראה רשם ב זיכרון_ _של_ _הוא .","לצד מה ש עשה ל טובה_ _של_ _הם של תושבי ה גטו עצמם , עשה משהו גם ל טובת ה היסטוריה : הרבה הוא לעמוד מאחורי חלון בית ה מרקחת של_ _הוא , עקב אחרי שגרת ה חיים ב ה_ גטו , לרבות ה מעצרים ה המוניים ו ה גירושים , ו כל מה ש ראה רשם ב זיכרון_ _של_ _הוא .",[0] -> [1] -> [33]
ו זה אינו מבצע מ ה סוג ש יש לגשת אל_ _הוא ללא מימון נכבד .,ו אינו מבצע זה מ ה סוג ש יש לגשת אל_ _הוא ללא מימון נכבד .,[0] -> [1] -> [33]
אבל מה הוא חושב קורה שם עכשיו ?,אבל מה חושב הוא קורה שם עכשיו ?,[0] -> [1] -> [33]
""" הוא לא הקשיב ל מוסיקה , הקפיד להתפלל פעמיים ב יום ו ב ה_ הפסקות נהג לעיין ב ספר ה קוראן .",""" לא הקשיב הוא ל מוסיקה , הקפיד להתפלל פעמיים ב יום ו ב ה_ הפסקות נהג לעיין ב ספר ה קוראן .",[0] -> [1] -> [33]
"ב ה_ חוברות ו ב ה_ פרסומים ה רשמיים , ש הם מקבלים ב נציגויות ישראל ב חו""ל , אין מזכירים את ה קיבוץ .","ב ה_ חוברות ו ב ה_ פרסומים ה רשמיים , ש מקבלים הם ב נציגויות ישראל ב חו""ל , אין מזכירים את ה קיבוץ .",[0] -> [1] -> [33]
"יש ב ה_ מרשם של אולפנים פתוחים ל ה_ קהל גם פתרון אקולוגי : הם משחררים את ה חברה מ אלפי תלבושות , חלקי תפאורה ו אבזרים , ש אלמלא נמצא ל_ _הם שימוש ממוחזר כ ה_ זה היו נותרים לשכב ב ה_ מחסנים כ אבן ש אין ל_ _היא הופכין .","יש ב ה_ מרשם של אולפנים פתוחים ל ה_ קהל גם פתרון אקולוגי : משחררים הם את ה חברה מ אלפי תלבושות , חלקי תפאורה ו אבזרים , ש אלמלא נמצא ל_ _הם שימוש ממוחזר כ ה_ זה היו נותרים לשכב ב ה_ מחסנים כ אבן ש אין ל_ _היא הופכין .",[0] -> [1] -> [33]
לפעמים היא שואלת את עצמה מה שלום בלומה של_ _היא .,לפעמים שואלת היא את עצמה מה שלום בלומה של_ _היא .,[0] -> [1] -> [33]
"ב יצוא ה יהלומים נרשמה עלייה של 2 % ב ה_ חודשיים ה אחרונים , ו אילו ב ה_ יצוא ה חקלאי חלה ירידה של 17 % , ו זה הגיע ל 66 מיליוני ד ב ממוצע ל חודש .","ב יצוא ה יהלומים נרשמה עלייה של 2 % ב ה_ חודשיים ה אחרונים , ו אילו ב ה_ יצוא ה חקלאי חלה ירידה של 17 % , ו הגיע זה ל 66 מיליוני ד ב ממוצע ל חודש .",[0] -> [1] -> [33]
"לנוכח הפסדי כתר ו טענה_ _של_ _הוא של מקסוול על אי - אמינות ה נתונים ש נמסרו ל_ _הוא כש רכש את ה חברה , יש חשש ש הוא ינסה להוריד את מחיר ה רכישה .","לנוכח הפסדי כתר ו טענה_ _של_ _הוא של מקסוול על אי - אמינות ה נתונים ש נמסרו ל_ _הוא כש רכש את ה חברה , יש חשש ש ינסה הוא להוריד את מחיר ה רכישה .",[0] -> [1] -> [33]
"כאשר פטריוטים רוצים להימנע מ וויכוח רציני עם ליברלים , הם פוטרים את_ _הם ב מלים "" לוקה ב שנאה עצמית "" , או "" סוכן אש""ף "" .","כאשר פטריוטים רוצים להימנע מ וויכוח רציני עם ליברלים , פוטרים הם את_ _הם ב מלים "" לוקה ב שנאה עצמית "" , או "" סוכן אש""ף "" .",[0] -> [1] -> [33]
"ח""כ סולודר האשימה את משרד ה אוצר ש הפך את חברת מקורות ל בת ערובה ל העלאת מחירי ה מים , ו זאת נוכח ה איומים של חברת ה חשמל להפסיק מ ה יום את אספקת ה חשמל ל מקורות בגין חוב_ _של_ _היא .","ח""כ סולודר האשימה את משרד ה אוצר ש הפך את חברת מקורות ל בת ערובה ל העלאת מחירי ה מים , ו נוכח ה איומים זאת של חברת ה חשמל להפסיק מ ה יום את אספקת ה חשמל ל מקורות בגין חוב_ _של_ _היא .",[0] -> [1] -> [33]
""" אנו מקווים כי נהיה ה חיילים ה ראשונים ש יחזרו ל כוויית .",""" מקווים אנו כי נהיה ה חיילים ה ראשונים ש יחזרו ל כוויית .",[0] -> [1] -> [33]
"עולים חדשים מגיעים ל ה_ עיירה , ש כבר נגזרה על_ _היא כליה , ו הנה היא מתעוררת ל ה_ חיים , אם כי ה עתיד עדיין מעורפל .","עולים חדשים מגיעים ל ה_ עיירה , ש כבר נגזרה על_ _היא כליה , ו הנה מתעוררת היא ל ה_ חיים , אם כי ה עתיד עדיין מעורפל .",[0] -> [1] -> [33]
"כרס_ _של_ _הם ה סגלגלות ו רגל_ _של_ _הם ה דקות מעידים על ה חיים ה טובים ש היו ל_ _הם ב ה_ אמירות ה עשירה לפני ה פלישה ה עיראקית , אך גם על ה עובדה ש הם עדיין רחוקים מאוד מ כושר לחימה נאות .","כרס_ _של_ _הם ה סגלגלות ו רגל_ _של_ _הם ה דקות מעידים על ה חיים ה טובים ש היו ל_ _הם ב ה_ אמירות ה עשירה לפני ה פלישה ה עיראקית , אך גם על ה עובדה ש עדיין רחוקים הם מאוד מ כושר לחימה נאות .",[0] -> [1] -> [33]
"תנורי נפט ( ללא ארובה ) עלולים גם הם , כמובן , להיות מסוכנים , משום ש הם צורכים את חמצן ה חדר ו מזהמים את ה אוויר , ו אף קיימת סכנת התלקחות .","תנורי נפט ( ללא ארובה ) עלולים גם הם , כמובן , להיות מסוכנים , משום ש צורכים הם את חמצן ה חדר ו מזהמים את ה אוויר , ו אף קיימת סכנת התלקחות .",[0] -> [1] -> [33]
"ב שנת 1983 נתחדשה ה חקירה נגד טובייה , אך הוא שוב נעלם .","ב שנת 1983 נתחדשה ה חקירה נגד טובייה , אך שוב נעלם הוא .",[0] -> [1] -> [33]
"כש לורה מתוודה ב פנים_ _של_ _הוא כי איננה מתפללת , הוא מגנה את ה אתיאיזם ו תוך ש הוא "" זורח ב אור קר "" ( של ה רציונאליזם ? ) הוא אומר כי ה אתיאיסטים אנשים עלובים הם ו "" ה עלוב ש ב_ _הם הוא ש הם עצמם חסרים גדלה עד כדי כך ש אינם יכולים לתפוש את מושג ה יישות ה אלוהית "" .","כש לורה מתוודה ב פנים_ _של_ _הוא כי איננה מתפללת , הוא מגנה את ה אתיאיזם ו תוך ש "" זורח הוא ב אור קר "" ( של ה רציונאליזם ? ) הוא אומר כי ה אתיאיסטים אנשים עלובים הם ו "" ה עלוב ש ב_ _הם הוא ש הם עצמם חסרים גדלה עד כדי כך ש אינם יכולים לתפוש את מושג ה יישות ה אלוהית "" .",[0] -> [1] -> [33]
אך זה לא היה מספיק טוב ל ה_ קרן .,אך לא היה מספיק טוב זה ל ה_ קרן .,[0] -> [1] -> [33]
עכשיו זה השתנה .,עכשיו השתנה זה .,[0] -> [1] -> [33]
"כך למשל ב אתיופיה , ב סודאן , ב סהרה ה ספרדית ו ב ארצות אחרות ב אפריקה ; כך ב הודו , ב סרי לנקה , ב אינדונזיה ו ב מדינות נוספות ב אסיה ; ו כך אצל ה שכנה קפריסין .","כך למשל ב אתיופיה , ב סודאן , ב סהרה ה ספרדית ו ב ארצות אחרות ב אפריקה ; ב הודו כך , ב סרי לנקה , ב אינדונזיה ו ב מדינות נוספות ב אסיה ; ו כך אצל ה שכנה קפריסין .",[0] -> [1] -> [33]
"סקר דעת - קהל ש נערך ב שבוע ש עבר בקרב אזרחים ש השתתפו ב ה_ בחירות ל בתי ה נבחרים ה אמריקאיים ( בטרם הודעת ה נשיא על משלוח ה כוחות ה נוספים ) , מעלה כי 71 % מבין ה נשאלים ה לבנים צידדו ב הצבת ה כוחות ה אמריקאיים ב ה_ מפרץ ו רק 44 % מ שחורי ה עור אמרו כי הם תומכים ב הצבת ה כוחות ה אמריקאיים שם .","סקר דעת - קהל ש נערך ב שבוע ש עבר בקרב אזרחים ש השתתפו ב ה_ בחירות ל בתי ה נבחרים ה אמריקאיים ( בטרם הודעת ה נשיא על משלוח ה כוחות ה נוספים ) , מעלה כי 71 % מבין ה נשאלים ה לבנים צידדו ב הצבת ה כוחות ה אמריקאיים ב ה_ מפרץ ו רק 44 % מ שחורי ה עור אמרו כי תומכים הם ב הצבת ה כוחות ה אמריקאיים שם .",[0] -> [1] -> [33]
"בכלל , זו היתה שיחה מאוד פסימית מ צד_ _של_ _הוא .","בכלל , היתה שיחה זו מאוד פסימית מ צד_ _של_ _הוא .",[0] -> [1] -> [33]
"ו אם תרצו גם זה , בעצם , עושה את כל ה הבדל .","ו אם תרצו , בעצם , עושה גם זה את כל ה הבדל .",[0] -> [1] -> [33]
"ב כתבה זו התרכזנו ב חנויות ה עודפים של מגה , ש הן מן ה ראשונות ש מכרו ב שיטה זו .","ב כתבה זו התרכזנו ב חנויות ה עודפים של מגה , ש מן ה ראשונות הן ש מכרו ב שיטה זו .",[0] -> [1] -> [33]
"רק לאחר כיבוש שער נהדר זה התעורר ה משחק ו נוצרו מספר מצבים ליד ה שערים , אך היה זה יום_ _של_ _הוא של ה פועל ש הצליח לשמור , משחק שני ב רציפות , על רשת נקייה , ו אתמול ב משחק_ _של_ _הוא ה שישי אף זכה ב ניצחון ראשון .","רק לאחר כיבוש שער נהדר זה התעורר ה משחק ו נוצרו מספר מצבים ליד ה שערים , אך היה יום_ זה _של_ _הוא של ה פועל ש הצליח לשמור , משחק שני ב רציפות , על רשת נקייה , ו אתמול ב משחק_ _של_ _הוא ה שישי אף זכה ב ניצחון ראשון .",[0] -> [1] -> [33]
"הוא הדגיש כי ה מועצה כונסה על - פי דרישת לנדאו ו הצביעה על הצעה ש הוא עצמו העלה , ו הוסיף כי לנדאו משתמש נגד_ _הוא ב ביטויים ש היו מקובלים ב שנות ה חמישים .","הוא הדגיש כי ה מועצה כונסה על - פי דרישת לנדאו ו הצביעה על הצעה ש העלה הוא עצמו , ו הוסיף כי לנדאו משתמש נגד_ _הוא ב ביטויים ש היו מקובלים ב שנות ה חמישים .",[0] -> [1] -> [33]
"זה יהיה משחק ה בכורה של ישראל ב ה_ טורניר ה קדם אולימפי , ו אילו ל יוון יהיה זה משחק שני לאחר ה הפסד ב שוודיה 0 5 .","זה יהיה משחק ה בכורה של ישראל ב ה_ טורניר ה קדם אולימפי , ו אילו ל יוון יהיה משחק זה שני לאחר ה הפסד ב שוודיה 0 5 .",[0] -> [1] -> [33]
"אפשר ש היה זה רחוק מ דעה_ _של_ _הוא של פטריק וייט ( גרמניסט ב מקצוע_ _של_ _הוא ) , ש כתב כאן אודיסיאה מודרנית , לקרוא ל גיבור_ _של_ _הוא ב שם_ _של_ _הוא של מתרגם הומרוס ל גרמנית ( להוציא את ה שם ה אמצעי ) ה משורר יוהאן היינריך פס ( 1751-1826 ) , אבל בוודאי אין זה מקרה כלל , ש ב יוונית , ש גם ב_ _היא היה וייט מצוי , פירוש_ _של_ _היא של ה מלה "" פוס "" הוא אור , שכן נושא ה רומאן ה זה הוא מלחמת ה אור ב ה_ חושך .","אפשר ש היה רחוק זה מ דעה_ _של_ _הוא של פטריק וייט ( גרמניסט ב מקצוע_ _של_ _הוא ) , ש כתב כאן אודיסיאה מודרנית , לקרוא ל גיבור_ _של_ _הוא ב שם_ _של_ _הוא של מתרגם הומרוס ל גרמנית ( להוציא את ה שם ה אמצעי ) ה משורר יוהאן היינריך פס ( 1751-1826 ) , אבל בוודאי אין זה מקרה כלל , ש ב יוונית , ש גם ב_ _היא היה וייט מצוי , פירוש_ _של_ _היא של ה מלה "" פוס "" הוא אור , שכן נושא ה רומאן ה זה הוא מלחמת ה אור ב ה_ חושך .",[0] -> [1] -> [33]
"הנה מה ש אמר ה גנרל שורצקוף : "" אני סבור ש יש דרכים חלופיות ל דהירה ל בגדד , ל הוצאה_ _של_ _הוא של שלטון ה בעת מ חפירה_ _של_ _הוא , ו ל השמדת כולם כדי להשליט שלום ו יציבות ב ה_ אזור "" .","הנה מה ש אמר ה גנרל שורצקוף : "" סבור אני ש יש דרכים חלופיות ל דהירה ל בגדד , ל הוצאה_ _של_ _הוא של שלטון ה בעת מ חפירה_ _של_ _הוא , ו ל השמדת כולם כדי להשליט שלום ו יציבות ב ה_ אזור "" .",[0] -> [1] -> [33]
"אם אתה לומד זאת ב בית ספר פרטי ב אותה תוכנית , אין ל_ _אתה לא תואר ו לא הדר .","אם לומד אתה זאת ב בית ספר פרטי ב אותה תוכנית , אין ל_ _אתה לא תואר ו לא הדר .",[0] -> [1] -> [33]
