sen_str,swapped_sen_str,leaf_rule
"ב בקשה ל בית - ה דין טען עו""ד חיים ברנזון כי ה עיקול ה ישן אינו מספיק ו חלו מאז שינויים מהותיים .","ב בקשה ל בית - ה דין טען עו""ד חיים ברנזון כי אינו מספיק ה עיקול ה ישן ו חלו מאז שינויים מהותיים .",[0] -> [1] -> [2] -> [3] -> [27]
ו מה ש יוצא וייט לחקור הוא מה טיב_ _של_ _היא של אמונה זו ה זורחת ב אור קר .,ו מה ש יוצא וייט לחקור הוא טיב_ מה _של_ _היא של אמונה זו ה זורחת ב אור קר .,[0] -> [1] -> [2] -> [3] -> [27]
"כעת , ב יחד עם תוספות אחרות , נתח ה איגודים יהיה 8.5 מיליון שקל .","כעת , ב יחד עם תוספות אחרות , יהיה 8.5 מיליון שקל נתח ה איגודים .",[0] -> [1] -> [2] -> [3] -> [27]
"על אף ה השראה ש שאב ו ספג מ חיים_ _של_ _הוא ב תל - אביב , היו חיים_ _של_ _הוא ב סוף_ _של_ _הוא של דבר קשי - יום .","על אף ה השראה ש שאב ו ספג מ חיים_ _של_ _הוא ב תל - אביב , היו ב סוף_ _של_ _הוא של דבר קשי - יום חיים_ _של_ _הוא .",[0] -> [1] -> [2] -> [3] -> [27]
"ה ממונה על ה חקירה מסר כי התגלה ש א - נוסייר היה חובב אקדחים , ו ב דירה_ _של_ _הוא נמצאו חוברות רבות של מגזינים ה מיועדים ל שכירי חרב .","ה ממונה על ה חקירה מסר כי התגלה ש היה חובב א - נוסייר אקדחים , ו ב דירה_ _של_ _הוא נמצאו חוברות רבות של מגזינים ה מיועדים ל שכירי חרב .",[0] -> [1] -> [2] -> [3] -> [27]
"בחירה_ _של_ _הוא ב ה_ סונטה של מוצרט היתה מוטעית : ביצוע_ _של_ _הוא היה מכני ו נעדר - השראה , ו צליל ה פסנתר של_ _הוא היה נוקשה ו נקישתי .","בחירה_ _של_ _הוא ב ה_ סונטה של מוצרט היתה מוטעית : ביצוע_ _של_ _הוא היה מכני ו נעדר - השראה , ו היה נוקשה צליל ה פסנתר של_ _הוא ו נקישתי .",[0] -> [1] -> [2] -> [3] -> [27]
"קצין אחד , ב תקן תת - ניצב , יהיה בעל ניסיון רב ב תחום ה מבצעים , ה סיור ו ה שיטור , ו קצין אחר , ב תקן ניצב - משנה , יהיה בעל ניסיון ו ידע ב תחום ה מודיעין .","קצין אחד , ב תקן תת - ניצב , יהיה בעל ניסיון רב ב תחום ה מבצעים , ה סיור ו ה שיטור , ו , יהיה בעל קצין אחר , ב תקן ניצב - משנה ניסיון ו ידע ב תחום ה מודיעין .",[0] -> [1] -> [2] -> [3] -> [27]
""" משמעות ה דבר היא ש מועצת ה עם , ש כיהנה במשך חמש שנים , היתה מושחתת .",""" משמעות ה דבר היא ש , היתה מושחתת מועצת ה עם , ש כיהנה במשך חמש שנים .",[0] -> [1] -> [2] -> [3] -> [27]
"ב ימי ה מלחמה ה קרה היה טוקי אנטי - קומוניסט נלהב , ו הארקין היה יונה נלהבת .","ב ימי ה מלחמה ה קרה היה אנטי - קומוניסט טוקי נלהב , ו הארקין היה יונה נלהבת .",[0] -> [1] -> [2] -> [3] -> [27]
"ו אילולא נתפסה ב יהירות_ _של_ _היא ה מעצמתית ל ה_ אשליה כי היא מסוגלת לתכנן מראש מי ו מה יבואו ב עיראק במקום סדאם חוסיין ו קלגס_ _של_ _הוא , אפשר ש ה גנרל היה משתחרר מ תהייה_ _של_ _הוא , ו אולי אפילו מזכיר ה מדינה היה חדל לרקוד ב שתי חתונות .","ו אילולא נתפסה ב יהירות_ _של_ _היא ה מעצמתית ל ה_ אשליה כי היא מסוגלת לתכנן מראש מי ו מה יבואו ב עיראק במקום סדאם חוסיין ו קלגס_ _של_ _הוא , אפשר ש היה משתחרר ה גנרל מ תהייה_ _של_ _הוא , ו אולי אפילו מזכיר ה מדינה היה חדל לרקוד ב שתי חתונות .",[0] -> [1] -> [2] -> [3] -> [27]
"ל דבר_ _של_ _הוא , טענה_ _של_ _הוא של ה וועד נגד ה מכירה ל גורמים פרטיים "" אינם ל ה_ עניין "" ו לפיכך הוא מסרב להיפגש עם_ _הוא .","ל דבר_ _של_ _הוא , "" אינם ל ה_ עניין טענה_ _של_ _הוא של ה וועד נגד ה מכירה ל גורמים פרטיים "" ו לפיכך הוא מסרב להיפגש עם_ _הוא .",[0] -> [1] -> [2] -> [3] -> [27]
"לו היה ה עם זה ש בוחר , לא היתה בחירה_ _של_ _הוא גרועה "" .","לו היה זה ה עם ש בוחר , לא היתה בחירה_ _של_ _הוא גרועה "" .",[0] -> [1] -> [2] -> [3] -> [27]
ה פדגוגית ה ברלינאית כריסטה מלר - המאן אומרת ש הורים אינם מתרשמים מ קריאה_ _של_ _הן של ה בנות ל עזרה .,ה פדגוגית ה ברלינאית כריסטה מלר - המאן אומרת ש אינם מתרשמים הורים מ קריאה_ _של_ _הן של ה בנות ל עזרה .,[0] -> [1] -> [2] -> [3] -> [27]
"מ בחינה מסוימת עשה כהנא שירות טוב ל ה_ דמוקרטיה ה ישראלית : כל עוד נדמה היה ש יש ל_ _הוא מונופול על ה תביעה לגרש את ה ערבים , לא היה ה רעיון ראוי ל התייחסות רצינית יותר מ כל דבר אחר ש אנשים רושמים על צד_ _של_ _הן ה פנימי של ה דלתות ב בתי שימוש ציבוריים .","מ בחינה מסוימת עשה כהנא שירות טוב ל ה_ דמוקרטיה ה ישראלית : כל עוד נדמה היה ש יש ל_ _הוא מונופול על ה תביעה לגרש את ה ערבים , לא היה ראוי ה רעיון ל התייחסות רצינית יותר מ כל דבר אחר ש אנשים רושמים על צד_ _של_ _הן ה פנימי של ה דלתות ב בתי שימוש ציבוריים .",[0] -> [1] -> [2] -> [3] -> [27]
""" ה ספר משאיר את_ _אתה תוהה "" , הוא אומר , "" האם הכל היה בדיחה .",""" ה ספר משאיר את_ _אתה תוהה "" , הוא אומר , "" האם היה בדיחה הכל .",[0] -> [1] -> [2] -> [3] -> [27]
"ב פרק זה עוסק וייט ב ה_ שאלה מי בעצם היה פוס , ו מביא גרסות שונות : פוס היה ה שטן , פוס היה אדם מעוות , פוס הוא ה מיתוס ש אינו כלה לעולם , כפי ש אומרת לורה : "" פוס לא מת , הוא נמצא שם עדיין , כך אומרים , ב מרחבי ה ארץ , ו תמיד יהיה , ו אגדת חיים_ _של_ _הוא תיכתב ב סוף_ _של_ _הוא של דבר , בידי אלה ש הוטרדו בגין_ _היא "" .","ב פרק זה עוסק וייט ב ה_ שאלה מי בעצם היה פוס , ו מביא גרסות שונות : פוס היה ה שטן , היה אדם פוס מעוות , פוס הוא ה מיתוס ש אינו כלה לעולם , כפי ש אומרת לורה : "" פוס לא מת , הוא נמצא שם עדיין , כך אומרים , ב מרחבי ה ארץ , ו תמיד יהיה , ו אגדת חיים_ _של_ _הוא תיכתב ב סוף_ _של_ _הוא של דבר , בידי אלה ש הוטרדו בגין_ _היא "" .",[0] -> [1] -> [2] -> [3] -> [27]
"ב ימי ה מלחמה ה קרה היה טוקי אנטי - קומוניסט נלהב , ו הארקין היה יונה נלהבת .","ב ימי ה מלחמה ה קרה היה טוקי אנטי - קומוניסט נלהב , ו היה יונה הארקין נלהבת .",[0] -> [1] -> [2] -> [3] -> [27]
קשה לדבר על התפתחות כאשר חומר ה גלם ה כסף אינו מצוי אפילו ב ה_ מינימום ה נחוץ .,קשה לדבר על התפתחות כאשר אינו מצוי חומר ה גלם ה כסף אפילו ב ה_ מינימום ה נחוץ .,[0] -> [1] -> [2] -> [3] -> [27]
"זו ה פעם ה ראשונה ש ב אליפות זו תהיה בדיקת סמים רטרואקטיווית , ל ה_ חצי שנה ה אחרונה , כך ש סביר כי ה הישגים יהיו הפעם פחות טובים .","זו ה פעם ה ראשונה ש ב אליפות זו תהיה בדיקת סמים רטרואקטיווית , ל ה_ חצי שנה ה אחרונה , כך ש סביר כי יהיו הפעם פחות טובים ה הישגים .",[0] -> [1] -> [2] -> [3] -> [27]
"שני עמים אוחזים ב אותו חבל ארץ ; ל כל אחד טענות ה זכות ה לגיטימיות ו ה מוכרות , רגשות חיבה אל ה מולדת , ו נכונות או כורח בלתי - מתפשר להיאבק על פיסת ה ארץ ש ישבו ב_ _היא ב ה_ עבר ו איש אינו רוצה לצאת מן_ _היא .","שני עמים אוחזים ב אותו חבל ארץ ; ל כל אחד טענות ה זכות ה לגיטימיות ו ה מוכרות , רגשות חיבה אל ה מולדת , ו נכונות או כורח בלתי - מתפשר להיאבק על פיסת ה ארץ ש ישבו ב_ _היא ב ה_ עבר ו אינו רוצה איש לצאת מן_ _היא .",[0] -> [1] -> [2] -> [3] -> [27]
"עכשיו פופולרי לנגח את "" תסביך ה שואה "" , כאילו לא היתה ה שואה אסון לאומי מחריד ( ש בהכרח מביא גם חרדות קיצוניות ו תגובות שליליות אחרות ) אלא קומפלקס פסיכולוגי .","עכשיו פופולרי לנגח את "" תסביך ה שואה "" , כאילו לא היתה אסון ה שואה לאומי מחריד ( ש בהכרח מביא גם חרדות קיצוניות ו תגובות שליליות אחרות ) אלא קומפלקס פסיכולוגי .",[0] -> [1] -> [2] -> [3] -> [27]
"ו אף - על - פי - כן , עיירת ה פיתוח אינה תופעת טבע , מעשה ה השגחה ה עליונה ; היא רק תולדה של מחדלי ה אדם .","ו אף - על - פי - כן , אינה תופעת עיירת ה פיתוח טבע , מעשה ה השגחה ה עליונה ; היא רק תולדה של מחדלי ה אדם .",[0] -> [1] -> [2] -> [3] -> [27]
בגין ו רבין נזעקו לא מפני ש תכניות יעקובי ו רמון אינן מעשיות .,בגין ו רבין נזעקו לא מפני ש אינן מעשיות תכניות יעקובי ו רמון .,[0] -> [1] -> [2] -> [3] -> [27]
"ו זו אינה ה דוגמה ה יחידה ל כך , ש ב ה_ ממשלה עדיין לא קלטו ש ה עסקים אינם כ ה_ רגיל .","ו זו אינה ה דוגמה ה יחידה ל כך , ש ב ה_ ממשלה עדיין לא קלטו ש אינם כ ה_ רגיל ה עסקים .",[0] -> [1] -> [2] -> [3] -> [27]
אפשר ש ה אמריקאים מתחילים להבין ש ה אילוצים ה קואליציוניים של שמיר עם ה ימין ה קיצוני ב ה_ ליכוד ו מ חוץ_ _של_ _היא ל_ _הוא אינם אלא רעלה ש יש להסיר את_ _היא .,אפשר ש ה אמריקאים מתחילים להבין ש אינם אלא רעלה ה אילוצים ה קואליציוניים של שמיר עם ה ימין ה קיצוני ב ה_ ליכוד ו מ חוץ_ _של_ _היא ל_ _הוא ש יש להסיר את_ _היא .,[0] -> [1] -> [2] -> [3] -> [27]
"לפני ש חזר ל ה_ ארץ ב 1985 היה ברנע סגן פרופסור ל אנדוקרינולוגיה ב אוניברסיטת ייל ש ב ארה""ב ו השתתף ב ה_ עבודות ה ראשונות ב הפריית מבחנה שם .","לפני ש חזר ל ה_ ארץ ב 1985 היה סגן פרופסור ל אנדוקרינולוגיה ב אוניברסיטת ייל ש ב ארה""ב ו השתתף ברנע ב ה_ עבודות ה ראשונות ב הפריית מבחנה שם .",[0] -> [1] -> [2] -> [3] -> [27]
פרשנים פוליטיים ב ניו - דלהי אמרו כי ממשלת שקאר תהיה ממשלת מעבר עד ה בחירות ה חדשות ש ייערכו לאחר ש יירגעו ה רוחות בין ה הינדים ל ה_ מוסלמים ב שאלת ה מסגד ב איודיה .,פרשנים פוליטיים ב ניו - דלהי אמרו כי תהיה ממשלת ממשלת שקאר מעבר עד ה בחירות ה חדשות ש ייערכו לאחר ש יירגעו ה רוחות בין ה הינדים ל ה_ מוסלמים ב שאלת ה מסגד ב איודיה .,[0] -> [1] -> [2] -> [3] -> [27]
לא היו פריצות מ ה אגף ו סיכוני ה שער היו אך ו רק מ בעיטות מ רחוק .,לא היו פריצות מ ה אגף ו היו אך ו רק מ בעיטות סיכוני ה שער מ רחוק .,[0] -> [1] -> [2] -> [3] -> [27]
"ב התייחסו ל תביעת ה אוצר מ ה הסתדרות , לכלול ב ה_ שקט ה תעשייתי גם סכסוכי עבודה ייחודיים , אומר זילוני כי ה הסתדרות אינה יכולה להתחייב ב שם עובדים ש פנו ל ערכאות משפטיות , מה גם ש ה עילה ל סכסוכים אלה אינה קשורה ב הסכמי ה שכר ה ארציים אלא ב נושאים יחודיים .","ב התייחסו ל תביעת ה אוצר מ ה הסתדרות , לכלול ב ה_ שקט ה תעשייתי גם סכסוכי עבודה ייחודיים , אומר זילוני כי אינה יכולה ה הסתדרות להתחייב ב שם עובדים ש פנו ל ערכאות משפטיות , מה גם ש ה עילה ל סכסוכים אלה אינה קשורה ב הסכמי ה שכר ה ארציים אלא ב נושאים יחודיים .",[0] -> [1] -> [2] -> [3] -> [27]
"ב ה_ יום ש היתה ה עמותה אמורה לשלם את יתרת ה מס , ב סך כ 66 אלף ש""ח , התנתה זאת ב קבלת עשר דירה_ _של_ _היא .","ב ה_ יום ש היתה אמורה ה עמותה לשלם את יתרת ה מס , ב סך כ 66 אלף ש""ח , התנתה זאת ב קבלת עשר דירה_ _של_ _היא .",[0] -> [1] -> [2] -> [3] -> [27]
"אולם ה איחוי אינו מחזיק מעמד זמן רב , ו יש לבצע את ה ניתוח לפני ה חתונה .","אולם אינו מחזיק ה איחוי מעמד זמן רב , ו יש לבצע את ה ניתוח לפני ה חתונה .",[0] -> [1] -> [2] -> [3] -> [27]
""" מארק היה גם איש של פוזות .",""" היה גם איש מארק של פוזות .",[0] -> [1] -> [2] -> [3] -> [27]
"ד""ר דן גלעדי הדגיש ש למרות ש ה היסטוריוגרפיה ה יהודית עוסקת בעיקר ב ה_ התיישבות ה חקלאית ה יהודית , מרבית ה אוכלוסייה ה יהודית היתה עירונית מובהקת ל כל אורך ה תקופה .","ד""ר דן גלעדי הדגיש ש למרות ש ה היסטוריוגרפיה ה יהודית עוסקת בעיקר ב ה_ התיישבות ה חקלאית ה יהודית , היתה עירונית מרבית ה אוכלוסייה ה יהודית מובהקת ל כל אורך ה תקופה .",[0] -> [1] -> [2] -> [3] -> [27]
"ש רוב מורדי ה גטאות ה בולטים ו מנחילי מורשת ה שואה , ו רבים מ מעצבי ו מנחילי סמלים לאומיים אחרים , היו בכלל אנשי שמאל .","ש , היו בכלל אנשי רוב מורדי ה גטאות ה בולטים ו מנחילי מורשת ה שואה , ו רבים מ מעצבי ו מנחילי סמלים לאומיים אחרים שמאל .",[0] -> [1] -> [2] -> [3] -> [27]
"די ב ה_ רמז , ש אחד מן_ _הם יצא זמן לא רב לאחר קבלת ה פרס ל מלחמה ש שם_ _של_ _היא היה "" מלחמת שלום - ה גליל "" .","די ב ה_ רמז , ש אחד מן_ _הם יצא זמן לא רב לאחר קבלת ה פרס ל מלחמה ש היה "" מלחמת שם_ _של_ _היא שלום - ה גליל "" .",[0] -> [1] -> [2] -> [3] -> [27]
הננו מקווים ש מועצת ה עם ה חדשה תהיה אמיתית ו לא דמיונית .,הננו מקווים ש תהיה אמיתית מועצת ה עם ה חדשה ו לא דמיונית .,[0] -> [1] -> [2] -> [3] -> [27]
"מר - חיים ציין כי ה גירעון ב ה_ תקציב ה רגיל היה נמוך מ תחזית של 22 מיליון ש""ח , ש צוינה ב ה_ תקציב .","מר - חיים ציין כי היה נמוך ה גירעון ב ה_ תקציב ה רגיל מ תחזית של 22 מיליון ש""ח , ש צוינה ב ה_ תקציב .",[0] -> [1] -> [2] -> [3] -> [27]
"ה הסדר , מ יום 14.3.89 , קבע כי כל עוד יהיה ה פיקוח על ה מחירים ב משק ה גז ב תוקף , יהיה מינהל ה דלק חייב להתערב ב קביעת גובה ה עמלות של סוכני ה גז .","ה הסדר , מ יום 14.3.89 , קבע כי כל עוד יהיה ב תוקף ה פיקוח על ה מחירים ב משק ה גז , יהיה מינהל ה דלק חייב להתערב ב קביעת גובה ה עמלות של סוכני ה גז .",[0] -> [1] -> [2] -> [3] -> [27]
"יש יותר מ סיכוי טוב להניח ש אילו מערכת ה חינוך ו כלי ה תקשורת היו שומרים על איזון עדין ו מורכב בין ה צו ה לאומי ל ה_ צו ה מוסרי , איזון כ ה_ זה היה מצליח להישמר גם ב ה_ מסע ל פולין .","יש יותר מ סיכוי טוב להניח ש אילו מערכת ה חינוך ו כלי ה תקשורת היו שומרים על איזון עדין ו מורכב בין ה צו ה לאומי ל ה_ צו ה מוסרי , היה מצליח איזון כ ה_ זה להישמר גם ב ה_ מסע ל פולין .",[0] -> [1] -> [2] -> [3] -> [27]
"ה שבועון "" אקונומיסט "" משוכנע כי ה הסבר ה עיקרי הוא ש ממשלת ניו זילנד היתה נועזת , אך לא נועזת דיה : היא נמנעה מ לטפל ב היבט חיוני ש בלעדי_ _הוא לא תצליח שום רפורמה , דהיינו מערכת ה עבודה , ה שכר ו ה איגוד ה מקצועי .","ה שבועון "" אקונומיסט "" משוכנע כי ה הסבר ה עיקרי הוא ש היתה נועזת ממשלת ניו זילנד , אך לא נועזת דיה : היא נמנעה מ לטפל ב היבט חיוני ש בלעדי_ _הוא לא תצליח שום רפורמה , דהיינו מערכת ה עבודה , ה שכר ו ה איגוד ה מקצועי .",[0] -> [1] -> [2] -> [3] -> [27]
"מתברר איפוא כי "" פוס "" אינו רק אודיסיאה מודרנית , מסע חניכה רצוף תלאות של גיבור , ה מביאו את _הוא ל כלל בגרות ו חוכמה ו מחזירו את _הוא אל חיק איש_ _של_ _הוא ה נאמנה .","מתברר איפוא כי אינו רק אודיסיאה "" פוס "" מודרנית , מסע חניכה רצוף תלאות של גיבור , ה מביאו את _הוא ל כלל בגרות ו חוכמה ו מחזירו את _הוא אל חיק איש_ _של_ _הוא ה נאמנה .",[0] -> [1] -> [2] -> [3] -> [27]
"ב ה_ דקות ה אחרונות , כש ה ניצחון לא היה ניתן ל עירעור , החלה ראשל""ץ ב משחק וירטואוזי ב הנהגה_ _של_ _הוא של ספנסר , ש הסב הנאה ל קהל ה צופים .","ב ה_ דקות ה אחרונות , כש לא היה ניתן ה ניצחון ל עירעור , החלה ראשל""ץ ב משחק וירטואוזי ב הנהגה_ _של_ _הוא של ספנסר , ש הסב הנאה ל קהל ה צופים .",[0] -> [1] -> [2] -> [3] -> [27]
"ישנו קיטל ש משווה ל ביקורת ה עיתונות אופי דידאקטי , ו מחנך את ה עיתונות מה לעשות , ב ביטחון עצמי של מי ש זכה ב 004 אלף שקל ב ה_ טוטו , ו ה עיתונות כבר אינה מקור ה פרנסה ה יחיד של_ _הוא .","ישנו קיטל ש משווה ל ביקורת ה עיתונות אופי דידאקטי , ו מחנך את ה עיתונות מה לעשות , ב ביטחון עצמי של מי ש זכה ב 004 אלף שקל ב ה_ טוטו , ו כבר אינה מקור ה עיתונות ה פרנסה ה יחיד של_ _הוא .",[0] -> [1] -> [2] -> [3] -> [27]
"לפני ארבע שנים היה ה נשיא סרזו ה אזרח ה ראשון ש התמנה ל ה_ תפקיד מ אז ה הפיכה ה צבאית , ש בוצעה ב 1954 ב סיוע סוכנות ה ביון ה אמריקאית .","לפני ארבע שנים היה ה אזרח ה נשיא סרזו ה ראשון ש התמנה ל ה_ תפקיד מ אז ה הפיכה ה צבאית , ש בוצעה ב 1954 ב סיוע סוכנות ה ביון ה אמריקאית .",[0] -> [1] -> [2] -> [3] -> [27]
"ו מה ש עוד ברור : מצב קופת ה התאחדות ל ספורט בהחלט יהיה פחות טוב , אם למרות הכל יממש ללקין את נסיעה_ _של_ _הוא ל אוסטרליה .","ו מה ש עוד ברור : בהחלט יהיה פחות טוב מצב קופת ה התאחדות ל ספורט , אם למרות הכל יממש ללקין את נסיעה_ _של_ _הוא ל אוסטרליה .",[0] -> [1] -> [2] -> [3] -> [27]
"למרות ש יחסי ה חוץ של ישראל אינם כעת ב שיא פריחה_ _של_ _הם , פנה משרד ראש ה ממשלה ל וועדת ה כספים לקבל תוספת תקציבית של 1.3 מיליון ש""ח בגין אירוח ראשי מדינה ב ה_ ארץ .","למרות ש אינם כעת ב שיא יחסי ה חוץ של ישראל פריחה_ _של_ _הם , פנה משרד ראש ה ממשלה ל וועדת ה כספים לקבל תוספת תקציבית של 1.3 מיליון ש""ח בגין אירוח ראשי מדינה ב ה_ ארץ .",[0] -> [1] -> [2] -> [3] -> [27]
"ו לאחר ש תחושה כ ה_ זו אכן התפשטה ב חלקים גדולים למדי של ה חברה , מה ה פלא ש מי ש ממשיך להעיז ו להתרגש מ סמלים לאומיים יהיה חשוד ב נטייה ימנית מסוכנת .","ו לאחר ש תחושה כ ה_ זו אכן התפשטה ב חלקים גדולים למדי של ה חברה , מה ה פלא ש יהיה חשוד מי ש ממשיך להעיז ו להתרגש מ סמלים לאומיים ב נטייה ימנית מסוכנת .",[0] -> [1] -> [2] -> [3] -> [27]
מקלטי ה נשים ב מערב גרמניה מלאים ב נשים טורקיות ש ה בריחה מ ה בעל היתה עבור_ _הן ה מוצא ה אחרון .,מקלטי ה נשים ב מערב גרמניה מלאים ב נשים טורקיות ש היתה עבור_ _הן ה מוצא ה בריחה מ ה בעל ה אחרון .,[0] -> [1] -> [2] -> [3] -> [27]
"ל ה_ ממסד ה פלשתיני ו ל רוב ערביי ישראל ידוע זה כבר ש ה בעיה של_ _הם איננה כפי ש אמר סרי נוסייבה רעיון_ _של_ _הוא של כהנא , אלא מדיניות_ _של_ _הוא של ה שלטון ה ישראלי .","ל ה_ ממסד ה פלשתיני ו ל רוב ערביי ישראל ידוע זה כבר ש איננה כפי ש אמר סרי נוסייבה רעיון_ ה בעיה של_ _הם _של_ _הוא של כהנא , אלא מדיניות_ _של_ _הוא של ה שלטון ה ישראלי .",[0] -> [1] -> [2] -> [3] -> [27]
"ו אם ו כאשר נזכה ב ה_ שלום ה מיוחל , ימני או שמאלני , ו ה ילדים של היום יהיו ה זקנים של מחר , האם ה טקסים מרובי ה שירים ה עצובים ו קטעי ה קריאה ו הורדת ה דגל ל חצי ה תורן ו קדיש ו עוד כהנה ו כהנה סמלים יהיו בגדר סגידה ביזארית ?","ו אם ו כאשר נזכה ב ה_ שלום ה מיוחל , ימני או שמאלני , ו יהיו ה זקנים ה ילדים של היום של מחר , האם ה טקסים מרובי ה שירים ה עצובים ו קטעי ה קריאה ו הורדת ה דגל ל חצי ה תורן ו קדיש ו עוד כהנה ו כהנה סמלים יהיו בגדר סגידה ביזארית ?",[0] -> [1] -> [2] -> [3] -> [27]
"אשר ל קרן פורד שמרנים מתלוננים ש מדיניות העדפת שחורים כ קיזוז ל אפליית ה עבר ( עצה מספר 7 , היה שחור ) ש היא נוקטת , היא שריד ל ליברליזם קדום .","אשר ל קרן פורד שמרנים מתלוננים ש מדיניות העדפת שחורים כ קיזוז ל אפליית ה עבר ( , היה שחור עצה מספר 7 ) ש היא נוקטת , היא שריד ל ליברליזם קדום .",[0] -> [1] -> [2] -> [3] -> [27]
לא התרשמתי ש החלטת פרקליטות ה מחוז שלא להעמידם את _הם ל דין פלילי היתה מגמתית ו הושפעה מ הנחיות פוליטיות כלשהן .,לא התרשמתי ש היתה מגמתית החלטת פרקליטות ה מחוז שלא להעמידם את _הם ל דין פלילי ו הושפעה מ הנחיות פוליטיות כלשהן .,[0] -> [1] -> [2] -> [3] -> [27]
