sen_str,swapped_sen_str,leaf_rule
"מזכ""ל התאחדות ה תעשיינים , דב לאוטמן , טען כי החלטות ה ממשלה ב תחום עידוד ה תעשייה אינן נכונות , ו כי עתויין אומלל .","מזכ""ל התאחדות ה תעשיינים , דב לאוטמן , טען כי אינן נכונות החלטות ה ממשלה ב תחום עידוד ה תעשייה , ו כי עתויין אומלל .",[0] -> [1] -> [2] -> [3] -> [27]
"לעתים קרובות ה כלה אינה יכולה לרוץ ו בוודאי לא לרקוד , כפי ש מצפים מן_ _היא ב חתונה טורקית .","לעתים קרובות אינה יכולה ה כלה לרוץ ו בוודאי לא לרקוד , כפי ש מצפים מן_ _היא ב חתונה טורקית .",[0] -> [1] -> [2] -> [3] -> [27]
"את כל ה ארבעה כבש כוכב_ _של_ _הם ה ארגנטיני , מאזן הבקעה אישי נדיר ו מרשים , אבל לא שיא הבקעה לאומי .","את כל ה ארבעה כוכב_ _של_ _הם ה ארגנטיני כבש , מאזן הבקעה אישי נדיר ו מרשים , אבל לא שיא הבקעה לאומי .",[0] -> [1] -> [2] -> [3] -> [4] -> [5] -> [6] -> [7] -> [15]
את שני ה שערים הבקיע דארן גקסון .,את שני ה שערים דארן גקסון הבקיע .,[0] -> [1] -> [2] -> [3] -> [4] -> [5] -> [6] -> [7] -> [15]
"נ מוראלי חשוב השיג ה פועל תל אביב ב ה_ משחק ש לא התעלה ל רמה גבוהה ו אלמלא ה מאבק ה צמוד ו ה סיום ה דרמאטי , לפני ה הארכה , הוא היה מוכתר כ מאכזב .","נ מוראלי חשוב ה פועל תל אביב השיג ב ה_ משחק ש לא התעלה ל רמה גבוהה ו אלמלא ה מאבק ה צמוד ו ה סיום ה דרמאטי , לפני ה הארכה , הוא היה מוכתר כ מאכזב .",[0] -> [1] -> [2] -> [3] -> [4] -> [5] -> [6] -> [7] -> [15]
את ה מאפיינים הללו ניסתה קיני לשקף ב ה_ עלילה ו ב ה_ דמויות ב ה_ מחזה .,את ה מאפיינים הללו קיני ניסתה לשקף ב ה_ עלילה ו ב ה_ דמויות ב ה_ מחזה .,[0] -> [1] -> [2] -> [3] -> [4] -> [5] -> [6] -> [7] -> [15]
"ה משחק ה ראשון בין שתי ה קבוצות , ש נערך גם הוא ב בלגיה , ניצחו ה בלגים 3 0 .","ה משחק ה ראשון בין שתי ה קבוצות , ש נערך גם הוא ב בלגיה , ה בלגים ניצחו 3 0 .",[0] -> [1] -> [2] -> [3] -> [4] -> [5] -> [6] -> [7] -> [15]
"כמעט כל מי ש נתקל ב_ _הוא הפך מארק ל דמות ב סיפור_ _של_ _הוא : ה נשים ש ב חיים_ _של_ _הוא , ידיד_ _של_ _הוא יורק פרס ו איש_ _של_ _הוא , פקיד ה קבלה ב מלון "" ויקטורי "" , נהגי מוניות , רועי זונות , תיירות אמריקאיות ו שוטרים .","כמעט כל מי ש נתקל ב_ _הוא מארק הפך ל דמות ב סיפור_ _של_ _הוא : ה נשים ש ב חיים_ _של_ _הוא , ידיד_ _של_ _הוא יורק פרס ו איש_ _של_ _הוא , פקיד ה קבלה ב מלון "" ויקטורי "" , נהגי מוניות , רועי זונות , תיירות אמריקאיות ו שוטרים .",[0] -> [1] -> [2] -> [3] -> [4] -> [5] -> [6] -> [7] -> [15]
""" קיטש ו מוות "" , מכנה שגב את מה ש ראה , תוך ש הוא מצטרף ב כך ל רשימה ארוכה ו צפופה של כותבים .",""" קיטש ו מוות "" , שגב מכנה את מה ש ראה , תוך ש הוא מצטרף ב כך ל רשימה ארוכה ו צפופה של כותבים .",[0] -> [1] -> [2] -> [3] -> [4] -> [5] -> [6] -> [7] -> [15]
"דברים אלה מסר אתמול ראש עיריית תל - אביב , שעה ש העיד בפני ה בוררים ש מונו על פי החלטת בית ה משפט , לפסוק ב ה_ סכסוך בין ה עירייה ל לשכת ה מהנדסים .","דברים אלה ראש עיריית תל - אביב מסר אתמול , שעה ש העיד בפני ה בוררים ש מונו על פי החלטת בית ה משפט , לפסוק ב ה_ סכסוך בין ה עירייה ל לשכת ה מהנדסים .",[0] -> [1] -> [2] -> [3] -> [4] -> [5] -> [6] -> [7] -> [15]
"את מה ש יש מגדיר מנכ""ל ה התאחדות ל ספורט , שמואל ללקין , כ "" תקציבי קיום "" ו גם "" תקציבים אומללים "" .","את מה ש יש מנכ""ל ה התאחדות ל ספורט , שמואל ללקין מגדיר , כ "" תקציבי קיום "" ו גם "" תקציבים אומללים "" .",[0] -> [1] -> [2] -> [3] -> [4] -> [5] -> [6] -> [7] -> [15]
"13 מ ה דירות תקבל ה חברה , ו 11 ה נותרות יעברו ל ה_ עמותה .","13 מ ה דירות ה חברה תקבל , ו 11 ה נותרות יעברו ל ה_ עמותה .",[0] -> [1] -> [2] -> [3] -> [4] -> [5] -> [6] -> [7] -> [15]
"את ה סרט ביים ריקי טוניאצי , בן_ _של_ _הוא של ה שחקן ה איטלקי אוגו טוניאצי , ש נפטר לפני ימים אחדים .","את ה סרט ריקי טוניאצי , בן_ _של_ _הוא של ה שחקן ה איטלקי אוגו טוניאצי , ש נפטר לפני ימים אחדים ביים .",[0] -> [1] -> [2] -> [3] -> [4] -> [5] -> [6] -> [7] -> [15]
"את גיבור_ _של_ _הוא של וייט , בניגוד ל גיבור_ _של_ _הוא ה קלאסי של הומרוס , משיג ה מוות ו הוא אינו זוכה לשוב .","את גיבור_ _של_ _הוא של וייט , בניגוד ל גיבור_ _של_ _הוא ה קלאסי של הומרוס , ה מוות משיג ו הוא אינו זוכה לשוב .",[0] -> [1] -> [2] -> [3] -> [4] -> [5] -> [6] -> [7] -> [15]
"כל זה הוליד ה ליכוד ו לא "" כך "" .","כל זה ה ליכוד ו לא "" כך "" הוליד .",[0] -> [1] -> [2] -> [3] -> [4] -> [5] -> [6] -> [7] -> [15]
"את ה היתרים ל הקמת ה תחנות ייתן מתאם ה פעולות ב ה_ שטחים , שמואל גורן .","את ה היתרים ל הקמת ה תחנות מתאם ה פעולות ב ה_ שטחים , שמואל גורן ייתן .",[0] -> [1] -> [2] -> [3] -> [4] -> [5] -> [6] -> [7] -> [15]
"תשורת המשך אשר ל_ _היא תנאים ה ניתנים ל חוסכים ותיקים בלבד "" , כותב סניף מ סניפי בנק לאומי ל ה_ לקוחה , ש תוכנית ה חיסכון צמודת - ה מדד של_ _היא עמדה ל פידיון ב ה_ חודש ש עבר ( אוקטובר ) .","תשורת המשך אשר ל_ _היא תנאים ה ניתנים ל חוסכים ותיקים בלבד "" , סניף מ סניפי בנק לאומי כותב ל ה_ לקוחה , ש תוכנית ה חיסכון צמודת - ה מדד של_ _היא עמדה ל פידיון ב ה_ חודש ש עבר ( אוקטובר ) .",[0] -> [1] -> [2] -> [3] -> [4] -> [5] -> [6] -> [7] -> [15]
"את ישראל מייצגים ב ה_ קרן מנכ""לי משרדי ה תעשייה ו ה אוצר ו ה מדען ה ראשי של משרד ה תעשייה ו ה מסחר .","את ישראל מנכ""לי משרדי ה תעשייה ו ה אוצר ו ה מדען ה ראשי של משרד ה תעשייה ו ה מסחר מייצגים ב ה_ קרן .",[0] -> [1] -> [2] -> [3] -> [4] -> [5] -> [6] -> [7] -> [15]
את ה סיור יארגן נציג חברת ה תעופה ב ה_ ארץ .,את ה סיור נציג חברת ה תעופה ב ה_ ארץ יארגן .,[0] -> [1] -> [2] -> [3] -> [4] -> [5] -> [6] -> [7] -> [15]
"את ה הצעה יזם ה פיקוח על ה בנקים , מתוך הנחה ש ב ה_ שנים ה קרובות ייאלצו ה בנקים להרחיב את מגוון ה פעילות ה עסקית של_ _הם לנוכח ה תחרות ה רבה ש תהיה ב ה_ ענף .","את ה הצעה ה פיקוח על ה בנקים יזם , מתוך הנחה ש ב ה_ שנים ה קרובות ייאלצו ה בנקים להרחיב את מגוון ה פעילות ה עסקית של_ _הם לנוכח ה תחרות ה רבה ש תהיה ב ה_ ענף .",[0] -> [1] -> [2] -> [3] -> [4] -> [5] -> [6] -> [7] -> [15]
"16 הפקות אמיתיות ב שנה תעשה יוניוורסל ב אתר ב אורלנדו , מספר ה עולה על זה של מ - ג - מ .","16 הפקות אמיתיות ב שנה יוניוורסל תעשה ב אתר ב אורלנדו , מספר ה עולה על זה של מ - ג - מ .",[0] -> [1] -> [2] -> [3] -> [4] -> [5] -> [6] -> [7] -> [15]
"את נאות קדומים ייסד ב שנות ה שבעים נגה הראובני , בן_ _של_ _הם של ד""ר אפרים ו חנה הראובני , אשר חקרו ב שנות ה עשרים של ה מאה ה נוכחית את צמחיית ה ארץ ו את זיקה_ _של_ _היא אל ה צמחים ה מתוארים ב ה_ מקורות .","את נאות קדומים נגה הראובני , בן_ _של_ _הם של ד""ר אפרים ו חנה הראובני , אשר חקרו ב שנות ה עשרים של ה מאה ה נוכחית את צמחיית ה ארץ ו את זיקה_ _של_ _היא אל ה צמחים ה מתוארים ב ה_ מקורות ייסד ב שנות ה שבעים .",[0] -> [1] -> [2] -> [3] -> [4] -> [5] -> [6] -> [7] -> [15]
"את ה הודעה על בוא_ _של_ _הוא של אורח , זר , גרמני , מבשרת ל_ _היא ה משרתת רוז פרשן "" שפחת ה מידות ה טובות "" , ה קדושה , מרים המגדלית של ה רומאן ה זה , ה עתידה ללדת את ה תינוקת מרסי ( חמלה ) , ש אותו_ _היא תאמץ לורה ל בת ב בוא ה עת .","את ה הודעה על בוא_ _של_ _הוא של אורח , זר , גרמני , ה משרתת רוז פרשן "" שפחת ה מידות ה טובות "" , ה קדושה , מרים המגדלית של ה רומאן ה זה , ה עתידה ללדת את ה תינוקת מרסי ( חמלה ) , ש אותו_ _היא תאמץ לורה ל בת ב בוא ה עת מבשרת ל_ _היא .",[0] -> [1] -> [2] -> [3] -> [4] -> [5] -> [6] -> [7] -> [15]
"את ה תערוכה הביאה ל מילאנו ה אוצרת מרילינה מרדט דריה דה - צוליאנו , ו היא חונכת אולם תצוגות ב ה_ רחוב ה מפורסם ביותר ב מילאנו , ויה מונטה נפוליאונה .","את ה תערוכה ה אוצרת מרילינה מרדט דריה דה - צוליאנו הביאה ל מילאנו , ו היא חונכת אולם תצוגות ב ה_ רחוב ה מפורסם ביותר ב מילאנו , ויה מונטה נפוליאונה .",[0] -> [1] -> [2] -> [3] -> [4] -> [5] -> [6] -> [7] -> [15]
"דברים אלה אמר אתמול שר ה אוצר , יצחק מודעי , ב ערב עיון ש קיים ה מרכז ה ישראלי ל ניהול ב נושא ה תוכנית ה כלכלית ו השלכה_ _של_ _היא על ה משק .","דברים אלה שר ה אוצר , יצחק מודעי אמר אתמול , ב ערב עיון ש קיים ה מרכז ה ישראלי ל ניהול ב נושא ה תוכנית ה כלכלית ו השלכה_ _של_ _היא על ה משק .",[0] -> [1] -> [2] -> [3] -> [4] -> [5] -> [6] -> [7] -> [15]
את ה תיסכול הוציאו ברד ליף ו - ויין קמבל על עוזר ה מאמן גדי קידר .,את ה תיסכול ברד ליף ו - ויין קמבל הוציאו על עוזר ה מאמן גדי קידר .,[0] -> [1] -> [2] -> [3] -> [4] -> [5] -> [6] -> [7] -> [15]
"דברים אלה השמיע ה נשיא גורג בוש כ תשובה על שאלה ב דבר טיב ה יחסים בין ארה""ב ו ישראל .","דברים אלה ה נשיא גורג בוש השמיע כ תשובה על שאלה ב דבר טיב ה יחסים בין ארה""ב ו ישראל .",[0] -> [1] -> [2] -> [3] -> [4] -> [5] -> [6] -> [7] -> [15]
את ה הצגה ביים יצחק שאולי .,את ה הצגה יצחק שאולי ביים .,[0] -> [1] -> [2] -> [3] -> [4] -> [5] -> [6] -> [7] -> [15]
""" שאלה טובה "" , השיב בורחס , "" הייתי מת ... "" .",""" שאלה טובה "" , בורחס השיב , "" הייתי מת ... "" .",[0] -> [1] -> [2] -> [3] -> [4] -> [5] -> [6] -> [7] -> [15]
אבל כמה כסף העניקה קרן מקארתור ל פיסיקאים מבריקים ה מתעמקים ב בעיה זו ו אינם סובלים מ שיתוק טרגי בעקבות מחלה מנוונת חסרת רחמים ?,אבל כמה כסף קרן מקארתור העניקה ל פיסיקאים מבריקים ה מתעמקים ב בעיה זו ו אינם סובלים מ שיתוק טרגי בעקבות מחלה מנוונת חסרת רחמים ?,[0] -> [1] -> [2] -> [3] -> [4] -> [5] -> [6] -> [7] -> [15]
"את ה מודעות פרסמה "" ה יחידה ה לאומית ה מהפכנית של גואטמאלה "" ארגון גג ה מייצג את קבוצות ה גרילה ב ה_ מדינה .","את ה מודעות "" ה יחידה ה לאומית ה מהפכנית של גואטמאלה "" ארגון גג ה מייצג את קבוצות ה גרילה ב ה_ מדינה פרסמה .",[0] -> [1] -> [2] -> [3] -> [4] -> [5] -> [6] -> [7] -> [15]
"את ארה""ב מייצגים נציגי משרד ה תעשייה , ה חוץ , ו מכון ה תקנים ה אמריקאי .","את ארה""ב נציגי משרד ה תעשייה , ה חוץ , ו מכון ה תקנים ה אמריקאי מייצגים .",[0] -> [1] -> [2] -> [3] -> [4] -> [5] -> [6] -> [7] -> [15]
"הסבר נוסף מספק יורק פרס , ש היה שכן_ _של_ _הוא של מארק ב בניין מגורים ב וורשה ו אחד מ ידיד_ _של_ _הוא ה טובים ב ישראל : "" מארק בא ל ישראל כי הוזמן על - ידי מעריב .","הסבר נוסף יורק פרס , ש היה שכן_ _של_ _הוא של מארק ב בניין מגורים ב וורשה ו אחד מ ידיד_ _של_ _הוא ה טובים ב ישראל מספק : "" מארק בא ל ישראל כי הוזמן על - ידי מעריב .",[0] -> [1] -> [2] -> [3] -> [4] -> [5] -> [6] -> [7] -> [15]
"את ה שערים ה אחרים ל רומא , ש עלתה ל ה_ סיבוב ה שלישי ב גביע אופ""א , הבקיעו דזידרי ו מוצי .","את ה שערים ה אחרים ל רומא , ש עלתה ל ה_ סיבוב ה שלישי ב גביע אופ""א , דזידרי ו מוצי הבקיעו .",[0] -> [1] -> [2] -> [3] -> [4] -> [5] -> [6] -> [7] -> [15]
"מה ש עושים תום וולף ל ניו - יורק ו מרטין אמיס ל לונדון של זמן_ _של_ _אנחנו , הצליח לעשות ל ה_ עיר ה גדולה ב ישראל דווקא יוצר פולני , מוכשר כמו שד , ש התוודע ל ה_ כרך ה תל - אביבי של אז .","מה ש עושים תום וולף ל ניו - יורק ו מרטין אמיס ל לונדון של זמן_ _של_ _אנחנו , דווקא יוצר פולני , מוכשר כמו שד , ש התוודע ל ה_ כרך ה תל - אביבי של אז הצליח לעשות ל ה_ עיר ה גדולה ב ישראל .",[0] -> [1] -> [2] -> [3] -> [4] -> [5] -> [6] -> [7] -> [15]
"את ה פנים צובעת גורביץ ב צבעי טוש , ו מדביקה שיער מ חוטי משיחה צהובים .","את ה פנים גורביץ צובעת ב צבעי טוש , ו מדביקה שיער מ חוטי משיחה צהובים .",[0] -> [1] -> [2] -> [3] -> [4] -> [5] -> [6] -> [7] -> [15]
כמו - כן יש לפתח ו אני משוכנע ש כבר מפתחים ב ה_ משטרה תרגולות ו טכניקות של שמירה ו הגנה הדדית של ה שוטרים זה על זה .,כמו - כן יש לפתח ו משוכנע אני ש כבר מפתחים ב ה_ משטרה תרגולות ו טכניקות של שמירה ו הגנה הדדית של ה שוטרים זה על זה .,[0] -> [1] -> [33]
"קורת רוח הוא שואב מ ה הצלחות ב גודו , ב סייף , ב שיט , ב קליעה , ב כדורמים , ב כדוריד ו גם ב התעמלות .","קורת רוח שואב הוא מ ה הצלחות ב גודו , ב סייף , ב שיט , ב קליעה , ב כדורמים , ב כדוריד ו גם ב התעמלות .",[0] -> [1] -> [33]
אני מדגישה ש כל זה לא בהכרח שלילי ב עין_ _של_ _אני .,אני מדגישה ש לא בהכרח שלילי כל זה ב עין_ _של_ _אני .,[0] -> [1] -> [33]
"ב כתר מעריכים כי מר - חיים , ש הוא חבר ב מועצת ה מנהלים של כתר , ימשיך להיות פעיל ב מערכת ה הוצאה ל ה_ אור של ה חברה .","ב כתר מעריכים כי מר - חיים , ש חבר הוא ב מועצת ה מנהלים של כתר , ימשיך להיות פעיל ב מערכת ה הוצאה ל ה_ אור של ה חברה .",[0] -> [1] -> [33]
לא היה קשה לחזות ש כך יקרה .,לא היה קשה לחזות ש יקרה כך .,[0] -> [1] -> [33]
"גם היטלר היה מערבב צווחות מאיימות עם דברי נועם , גם הוא לא היה שוכח לרמוז על נכונות_ _של_ _הוא להסדיר בעיות ב דרכי שלום , כדי להוליך שולל בני שיח שוטים או מיתממים .","גם היטלר היה מערבב צווחות מאיימות עם דברי נועם , לא היה שוכח גם הוא לרמוז על נכונות_ _של_ _הוא להסדיר בעיות ב דרכי שלום , כדי להוליך שולל בני שיח שוטים או מיתממים .",[0] -> [1] -> [33]
"לאורך כל ה דרך הקפדתי לא לדכא את ה רוח , ללא פאתוס מיותר , אבל להרטיט את ה נפש זה היה תפקיד_ _של_ _אני , ו אני הזדהיתי עם_ _הוא , ו זה תוכן סיפור_ _של_ _אני .","לאורך כל ה דרך הקפדתי לא לדכא את ה רוח , ללא פאתוס מיותר , אבל להרטיט את ה נפש זה היה תפקיד_ _של_ _אני , ו הזדהיתי אני עם_ _הוא , ו זה תוכן סיפור_ _של_ _אני .",[0] -> [1] -> [33]
"בעיקר הן אוהבות לאסוף אנשים ש אילולא כן אפשר ש לא היו נפגשים לעולם : אקדמאים ו פוליטיקאים , ביורוקרטים ו נבחרי ציבור , פנאטים של ה שמאל ו פנאטים של ה ימין .","בעיקר אוהבות הן לאסוף אנשים ש אילולא כן אפשר ש לא היו נפגשים לעולם : אקדמאים ו פוליטיקאים , ביורוקרטים ו נבחרי ציבור , פנאטים של ה שמאל ו פנאטים של ה ימין .",[0] -> [1] -> [33]
"שניהם יחדיו , לורה על ערש דווי ו פוס ה גוסס , צופים ב כוכב ה שביט ה מופיע ב ה_ שמים ו גורם ל פוס לאבד את נוקשות_ _של_ _הוא עד ש הוא מצליח "" להבקיע ל_ _הוא דרך אל ממלכת ה אור "" .","שניהם יחדיו , לורה על ערש דווי ו פוס ה גוסס , צופים ב כוכב ה שביט ה מופיע ב ה_ שמים ו גורם ל פוס לאבד את נוקשות_ _של_ _הוא עד ש מצליח הוא "" להבקיע ל_ _הוא דרך אל ממלכת ה אור "" .",[0] -> [1] -> [33]
"בועז קוינטנר , ה בעלים ו ה טבח של התגורר ב רומא משך שלוש שנים ו הוא אחד מ בעלי ה מסעדות ה איטלקיות ה מקומיים ש עבר חניכה קולינארית ב איטליה .","בועז קוינטנר , ה בעלים ו ה טבח של התגורר ב רומא משך שלוש שנים ו אחד הוא מ בעלי ה מסעדות ה איטלקיות ה מקומיים ש עבר חניכה קולינארית ב איטליה .",[0] -> [1] -> [33]
"ו אני מדבר ספציפית על ה גדה ה מערבית ו על עזה "" .","ו מדבר אני ספציפית על ה גדה ה מערבית ו על עזה "" .",[0] -> [1] -> [33]
"טיבו , ש היה ספקן מלכתחילה , מתאהב ב ה_ רוע ו ב ה_ אפשרויות ה עצומות ה גלומות ב_ _הוא , ו סוף_ _של_ _הוא ש הוא מחליף את ה שטן עצמו ו לובש את דמות ה זאב ה אימתני ו ה שחור .","טיבו , ש היה ספקן מלכתחילה , מתאהב ב ה_ רוע ו ב ה_ אפשרויות ה עצומות ה גלומות ב_ _הוא , ו סוף_ _של_ _הוא ש מחליף הוא את ה שטן עצמו ו לובש את דמות ה זאב ה אימתני ו ה שחור .",[0] -> [1] -> [33]
"אם כך ה דבר , נדמה ש הוא היה כימאי טוב אך פסיכולוג מפוקפק מאוד : אין כמו ה פרסים הללו כדי להצית מחלוקת ו מריבה , לעיתים הרסנית בעליל .","אם כך ה דבר , נדמה ש היה כימאי הוא טוב אך פסיכולוג מפוקפק מאוד : אין כמו ה פרסים הללו כדי להצית מחלוקת ו מריבה , לעיתים הרסנית בעליל .",[0] -> [1] -> [33]
""" הוא התמוטט על מכונית פגו "" , סיפר אתמול בס , "" השכבתי את_ _הוא על ה רצפה ו הוצאתי את ה סכין .",""" התמוטט הוא על מכונית פגו "" , סיפר אתמול בס , "" השכבתי את_ _הוא על ה רצפה ו הוצאתי את ה סכין .",[0] -> [1] -> [33]
"על ה עירייה להוכיח קצת יותר כבוד ב עניינים בסיסיים ה קשורים ל נוחיות ה תושבים , אפילו הם נוגעים רק ב ה_ מים ב בית ה כבוד .","על ה עירייה להוכיח קצת יותר כבוד ב עניינים בסיסיים ה קשורים ל נוחיות ה תושבים , אפילו נוגעים הם רק ב ה_ מים ב בית ה כבוד .",[0] -> [1] -> [33]
כאשר מנהל בית - ה ספר ה תיכון קלאנמצה ב מינכן אסר על מליה להופיע ב מטפחת ראש היא נאלצה לעבור ל בית - ספר תיכון אחר ב נויהאוזר .,כאשר מנהל בית - ה ספר ה תיכון קלאנמצה ב מינכן אסר על מליה להופיע ב מטפחת ראש נאלצה היא לעבור ל בית - ספר תיכון אחר ב נויהאוזר .,[0] -> [1] -> [33]
"הן ניצבות ב תחתית סולם ה שכר , הן בעלות השכלה מועטה , ה יחס אל_ _הן מבזה ו מזלזל , עובדות ב דרך כלל ב עבודות ה נחשבות פחותות ערך , ללא כל הטבות סוציאליות , ו ה דבר רק מגביר את תלות_ _של_ _הן ב ה_ בעל , ה מפרנס ה ראשי .","הן ניצבות ב תחתית סולם ה שכר , בעלות הן השכלה מועטה , ה יחס אל_ _הן מבזה ו מזלזל , עובדות ב דרך כלל ב עבודות ה נחשבות פחותות ערך , ללא כל הטבות סוציאליות , ו ה דבר רק מגביר את תלות_ _של_ _הן ב ה_ בעל , ה מפרנס ה ראשי .",[0] -> [1] -> [33]
"היום , יותר מ אי - פעם , נכונים יהודים ישראליים , ב מספרים גדלים ו הולכים , לקלוט את סיסמה_ _של_ _הוא של מאיר כהנא : "" עמוק בתוך לב_ _של_ _אתם אתם יודעים ש אני צודק "" .","היום , יותר מ אי - פעם , נכונים יהודים ישראליים , ב מספרים גדלים ו הולכים , לקלוט את סיסמה_ _של_ _הוא של מאיר כהנא : "" עמוק בתוך לב_ _של_ _אתם אתם יודעים ש צודק אני "" .",[0] -> [1] -> [33]
"מסעדנים , ה חושבים ש הם יודעים די ו הותר על ה מטבח ה איטלקי ו מסוגלים להשכיל את לקוח_ _של_ _הם .","מסעדנים , ה חושבים ש יודעים הם די ו הותר על ה מטבח ה איטלקי ו מסוגלים להשכיל את לקוח_ _של_ _הם .",[0] -> [1] -> [33]
יש אנשים ה מתקשים להבטיח ב פרצוף פוקר ש הם יציעו פתרון ל בעיה חברתית מרכזית .,יש אנשים ה מתקשים להבטיח ב פרצוף פוקר ש יציעו הם פתרון ל בעיה חברתית מרכזית .,[0] -> [1] -> [33]
מה הוא יודע למה ה אחד נהג כך ו ה שני אחרת .,מה יודע הוא למה ה אחד נהג כך ו ה שני אחרת .,[0] -> [1] -> [33]
"ו לכן אני אומר ל כל ילדי ישראל : אל תפחדו ! סעו ל ירושלים , אפילו אם יורים או אם מתעופפים שם סכינים .","ו לכן אומר אני ל כל ילדי ישראל : אל תפחדו ! סעו ל ירושלים , אפילו אם יורים או אם מתעופפים שם סכינים .",[0] -> [1] -> [33]
