sen_str,swapped_sen_str,leaf_rule
"על כן אפשר לקרוא את "" פוס "" גם אחרת ו להבין את דמות_ _של_ _הוא כ התגלמות_ _של_ _היא של ה נפש ה גרמנית : ה פגאניות , ש כנגד_ _היא הוא מציג כאן את ה נצרות , אינה מאפיינת רק את ה ילידים ה קאניבלים , אלא גם את פוס , ה גרמני ה מגאלומאן , ה איש משולל ה רחמים , איש אכזר ו דורסני ה מאמין כי אין גבולות ל כוח_ _של_ _הוא , ו כי יש ב יכולת ה אדם לדעת הכל , ה איש ה יוצא לכבוש טריטוריה ו מקריב על מזבח שאפתנות_ _של_ _הוא חסרת ה מעצורים חיי אדם בלא ש יחוש צער או חרטה .","על כן אפשר לקרוא את "" פוס "" גם אחרת ו להבין את דמות_ _של_ _הוא כ התגלמות_ _של_ _היא של ה נפש ה גרמנית : , אינה מאפיינת ה פגאניות , ש כנגד_ _היא הוא מציג כאן את ה נצרות רק את ה ילידים ה קאניבלים , אלא גם את פוס , ה גרמני ה מגאלומאן , ה איש משולל ה רחמים , איש אכזר ו דורסני ה מאמין כי אין גבולות ל כוח_ _של_ _הוא , ו כי יש ב יכולת ה אדם לדעת הכל , ה איש ה יוצא לכבוש טריטוריה ו מקריב על מזבח שאפתנות_ _של_ _הוא חסרת ה מעצורים חיי אדם בלא ש יחוש צער או חרטה .",[0] -> [1] -> [2] -> [3] -> [27]
"כמו חילונים רבים ראיתי ב_ _הם טפילים , משום ש רובם _הם אינם משרתים ב צה "" ל ו נציג_ _של_ _הם ב ה_ כנסת שואפים לכפות על ה מדינה חוקי הלכה .","כמו חילונים רבים ראיתי ב_ _הם טפילים , משום ש אינם משרתים רובם _הם ב צה "" ל ו נציג_ _של_ _הם ב ה_ כנסת שואפים לכפות על ה מדינה חוקי הלכה .",[0] -> [1] -> [2] -> [3] -> [27]
"ח""כ צחי הנגבי טען כי ריבלין אינו ראוי ל פרס על התנהגות_ _של_ _הוא ה מחפירה , ש ב_ _היא הכשיר את אש""ף ב ה_ כנסת .","ח""כ צחי הנגבי טען כי אינו ראוי ריבלין ל פרס על התנהגות_ _של_ _הוא ה מחפירה , ש ב_ _היא הכשיר את אש""ף ב ה_ כנסת .",[0] -> [1] -> [2] -> [3] -> [27]
"ו עוד הבדל : מסע ה חניכה ש טווה וייט הוא מסע דתי ו אילו ה מסע ה הומרי הוא מסע חילוני , מסע נוצרי בעליל לעומת מסע_ _של_ _הוא ה פגאני של הומרוס .","ו : מסע ה חניכה ש טווה וייט הוא מסע עוד הבדל דתי ו אילו ה מסע ה הומרי הוא מסע חילוני , מסע נוצרי בעליל לעומת מסע_ _של_ _הוא ה פגאני של הומרוס .",[0] -> [1] -> [2] -> [3] -> [27]
"אבל צעדים אלה לא הספיקו , ו יש משפטנים ה טוענים , כי ה תוצאה ה יחידה היתה העברת ה עומס מ בתי - ה משפט ה מחוזיים ל בתי - משפט ה שלום .","אבל צעדים אלה לא הספיקו , ו יש משפטנים ה טוענים , כי היתה העברת ה תוצאה ה יחידה ה עומס מ בתי - ה משפט ה מחוזיים ל בתי - משפט ה שלום .",[0] -> [1] -> [2] -> [3] -> [27]
"ל כהנא לא היתה מעולם "" תנועה "" של ממש , ו ב אחרית יום_ _של_ _הוא גם ה מעטים ש התיימרו להוות את_ _היא היו למעשה רק חבורה של בודדים , לא "" תנועה "" .","ל כהנא לא היתה מעולם "" תנועה "" של ממש , ו ב אחרית יום_ _של_ _הוא היו למעשה רק חבורה גם ה מעטים ש התיימרו להוות את_ _היא של בודדים , לא "" תנועה "" .",[0] -> [1] -> [2] -> [3] -> [27]
"כך או אחרת , חבורת ה שוודים ודאי לא היתה מעניקה את ה פרס ל שקספיר ו אולי דווקא כן ?","כך או אחרת , ודאי לא היתה מעניקה חבורת ה שוודים את ה פרס ל שקספיר ו אולי דווקא כן ?",[0] -> [1] -> [2] -> [3] -> [27]
"אין פירוש ה דבר , ש ה כיוון ה חדש - ישן הוא ה רצוי .","אין , ש ה כיוון ה חדש - ישן הוא ה רצוי פירוש ה דבר .",[0] -> [1] -> [2] -> [3] -> [27]
"ו אילו ה פקידים ש יעסקו ב גביית קנסות מנהליים ו קנסות על עבירות של ברירת משפט , יהיו עובדי ה גופים ה ממונים על ביצוע ה תקנה , ש מ כוח_ _של_ _היא הוטל ה קנס , או עובדי ה גופים ה ממונים על אכיפת אותה תקנה .","ו אילו , יהיו עובדי ה פקידים ש יעסקו ב גביית קנסות מנהליים ו קנסות על עבירות של ברירת משפט ה גופים ה ממונים על ביצוע ה תקנה , ש מ כוח_ _של_ _היא הוטל ה קנס , או עובדי ה גופים ה ממונים על אכיפת אותה תקנה .",[0] -> [1] -> [2] -> [3] -> [27]
"ה מוזר הוא , ש אותו בנק לאומי ( כמו_ _הוא כ בנק מזרחי ) מציע ל ה_ חוסך תוכנית צמודת - מדד ש ב_ _היא הפסד מדד , אך בלי ש ייהנה מ ה תנאים ה ניתנים ל חוסכים ותיקים בלבד "" , כלומר הקדמת מועדים ב שנה אחת .","ה מוזר הוא , ש מציע אותו בנק לאומי ( כמו_ _הוא כ בנק מזרחי ) ל ה_ חוסך תוכנית צמודת - מדד ש ב_ _היא הפסד מדד , אך בלי ש ייהנה מ ה תנאים ה ניתנים ל חוסכים ותיקים בלבד "" , כלומר הקדמת מועדים ב שנה אחת .",[0] -> [1] -> [2] -> [3] -> [27]
"אלי לנדאו הגיב אתמול ב אומרו כי ה כינוס ו ה הצבעה אינם חוקיים , ו כי הוא מתכוון לפנות ל בית - ה משפט ב דרישה לבטל את תוצאות ה הצבעה .","אלי לנדאו הגיב אתמול ב אומרו כי אינם חוקיים ה כינוס ו ה הצבעה , ו כי הוא מתכוון לפנות ל בית - ה משפט ב דרישה לבטל את תוצאות ה הצבעה .",[0] -> [1] -> [2] -> [3] -> [27]
"אם שני ה צדדים ה נוגעים ו ה צדדים ה בין - לאומיים ה אחרים לא יגיעו ל פתרון משביע רצון , יועלה ה משבר בפני פורום בין - לאומי עליון , ש תוצאות פסיקה_ _של_ _הוא ו החלטה_ _של_ _הוא יהיו תקפות ו מחייבות .","אם שני ה צדדים ה נוגעים ו ה צדדים ה בין - לאומיים ה אחרים לא יגיעו ל פתרון משביע רצון , יועלה ה משבר בפני פורום בין - לאומי עליון , ש יהיו תקפות תוצאות פסיקה_ _של_ _הוא ו החלטה_ _של_ _הוא ו מחייבות .",[0] -> [1] -> [2] -> [3] -> [27]
"אם מדובר עדיין ב בודדים , מצב_ _של_ _הוא של ה מלך איננו חמור , אבל ייתכן ש אנשי ה גיהאד ה איסלמי , ש יזמו את ה פעולה , ביקשו להכות את ה משטר ע""י בחירת חברי חוליה ה נמנים על ה גוף ה נאמן ביותר ל ה_ מלך .","אם מדובר עדיין ב בודדים , איננו חמור מצב_ _של_ _הוא של ה מלך , אבל ייתכן ש אנשי ה גיהאד ה איסלמי , ש יזמו את ה פעולה , ביקשו להכות את ה משטר ע""י בחירת חברי חוליה ה נמנים על ה גוף ה נאמן ביותר ל ה_ מלך .",[0] -> [1] -> [2] -> [3] -> [27]
"מילר הדגיש ש יעד ה מחקר יהיה איתור מחסומים ה מונעים מ בני מיעוטים להצביע , דבר ש ל דעה_ _של_ _הוא עשוי היה להיות צעד ראשון לקראת העלאת שיעור ה הצבעה .","מילר הדגיש ש יהיה איתור יעד ה מחקר מחסומים ה מונעים מ בני מיעוטים להצביע , דבר ש ל דעה_ _של_ _הוא עשוי היה להיות צעד ראשון לקראת העלאת שיעור ה הצבעה .",[0] -> [1] -> [2] -> [3] -> [27]
"אם ה מושג "" תיאום אסטראטגי "" הוא בעל תוכן גם כש ארה""ב אינה צריכה עוד לחשוש מ מהלכים סובייטיים ב ה_ מזרח ה תיכון , אזי רשאית ישראל לצפות , כי ה אמריקאים יעבירו אל_ _היא , ב דרך קבע ו ללא הפסד זמן , את דיווחי ה לוויינים על תנועות ה צבא ה עיראקי .","אם ה מושג "" תיאום אסטראטגי "" הוא בעל תוכן גם כש אינה צריכה ארה""ב עוד לחשוש מ מהלכים סובייטיים ב ה_ מזרח ה תיכון , אזי רשאית ישראל לצפות , כי ה אמריקאים יעבירו אל_ _היא , ב דרך קבע ו ללא הפסד זמן , את דיווחי ה לוויינים על תנועות ה צבא ה עיראקי .",[0] -> [1] -> [2] -> [3] -> [27]
לעתים קרובות הורים אינם נותנים סיכוי ל רשויות ה נוער לטפל ב ילדים ה סובלים מ התעללות .,לעתים קרובות אינם נותנים הורים סיכוי ל רשויות ה נוער לטפל ב ילדים ה סובלים מ התעללות .,[0] -> [1] -> [2] -> [3] -> [27]
פתאום חשבתי על משפחה_ _של_ _היא של סבה_ _של_ _אני ש כולם היו חסידים .,פתאום חשבתי על משפחה_ _של_ _היא של סבה_ _של_ _אני ש היו חסידים כולם .,[0] -> [1] -> [2] -> [3] -> [27]
""" ה פציעות אינן קלות .",""" אינן קלות ה פציעות .",[0] -> [1] -> [2] -> [3] -> [27]
"אם ליטא תהיה עצמאית , לא יהיה ל ה_ רפובליקה ה אוטונומית ה גרמנית קניגסברג , שום גשר יבשתי עם שאר חלקי ברית - ה מועצות .","אם תהיה עצמאית ליטא , לא יהיה ל ה_ רפובליקה ה אוטונומית ה גרמנית קניגסברג , שום גשר יבשתי עם שאר חלקי ברית - ה מועצות .",[0] -> [1] -> [2] -> [3] -> [27]
""" ברור ל מנגנוני ה ביטחון , כי גורמים חיצוניים היו מעורבים ב מימון פעילות_ _של_ _הוא של ה ארגון , משום ש רבים מ מנהיג_ _של_ _הוא היו יוצאים ב אופן קבוע ל חו""ל ו ל מקומות מסוימים ב אפגניסטאן , פקיסטאן ו סודאן שם ממוקמים בסיסי ה אימונים של ה ארגון .",""" ברור ל מנגנוני ה ביטחון , כי גורמים חיצוניים היו מעורבים ב מימון פעילות_ _של_ _הוא של ה ארגון , משום ש היו יוצאים רבים מ מנהיג_ _של_ _הוא ב אופן קבוע ל חו""ל ו ל מקומות מסוימים ב אפגניסטאן , פקיסטאן ו סודאן שם ממוקמים בסיסי ה אימונים של ה ארגון .",[0] -> [1] -> [2] -> [3] -> [27]
""" כתיבה ב דרך כלל אינה התנסות כה מאושרת בשביל_ _אני "" , אומר ה מחבר .",""" ב דרך כלל אינה התנסות כתיבה כה מאושרת בשביל_ _אני "" , אומר ה מחבר .",[0] -> [1] -> [2] -> [3] -> [27]
"מזכיר ה הגנה של ארה""ב , ריצארד צייני , אמר שלשום כי ה ממשל אינו מתכוון להחליף את ה כוחות ה מוצבים ב ה_ מפרץ ב שיטה של רוטאציה .","מזכיר ה הגנה של ארה""ב , ריצארד צייני , אמר שלשום כי אינו מתכוון ה ממשל להחליף את ה כוחות ה מוצבים ב ה_ מפרץ ב שיטה של רוטאציה .",[0] -> [1] -> [2] -> [3] -> [27]
"מי היה מאמין לפני כמה חודשים , כי ה דרבי של אשדוד יהיה ה משחק ה מדובר ביותר ב ה_ ליגה ה ארצית ו אולי אף יותר מ כך .","מי היה מאמין לפני כמה חודשים , כי יהיה ה משחק ה דרבי של אשדוד ה מדובר ביותר ב ה_ ליגה ה ארצית ו אולי אף יותר מ כך .",[0] -> [1] -> [2] -> [3] -> [27]
""" במשך עשרות שנים היה ילצין ביורוקרט ש דבר_ _של_ _הוא היה חוק "" , אומר סגן ה רקטור של אוניברסיטת קזאן , מיקרקסים אוסמנוב .",""" במשך עשרות שנים היה ילצין ביורוקרט ש היה חוק דבר_ _של_ _הוא "" , אומר סגן ה רקטור של אוניברסיטת קזאן , מיקרקסים אוסמנוב .",[0] -> [1] -> [2] -> [3] -> [27]
"תוכנית ה אוצר היתה ש משרד ה תעשייה יפנה את ה משרדים ש הוא מחזיק ב "" בניין דוד "" ב רחוב קרן ה יסוד ב ירושלים ו יעבירם את _הם ל מיבנה אחר סמוך ו ל ה_ בניין ה ראשי של ה משרד .","תוכנית ה אוצר היתה ש יפנה משרד ה תעשייה את ה משרדים ש הוא מחזיק ב "" בניין דוד "" ב רחוב קרן ה יסוד ב ירושלים ו יעבירם את _הם ל מיבנה אחר סמוך ו ל ה_ בניין ה ראשי של ה משרד .",[0] -> [1] -> [2] -> [3] -> [27]
"מכיוון ש כך , ראוי לבדוק גם את ה ביקורת ה מושמעת על מכללות אלה , על - מנת לבחון את השלכה_ _של_ _הן לגבי ה רפורמה ה עתידית : "" ה מכללות אינן אקדמיות "" .","מכיוון ש כך , ראוי לבדוק גם את ה ביקורת ה מושמעת על מכללות אלה , על - מנת לבחון את השלכה_ _של_ _הן לגבי ה רפורמה ה עתידית : "" אינן אקדמיות ה מכללות "" .",[0] -> [1] -> [2] -> [3] -> [27]
"בחירה_ _של_ _הוא ב ה_ סונטה של מוצרט היתה מוטעית : ביצוע_ _של_ _הוא היה מכני ו נעדר - השראה , ו צליל ה פסנתר של_ _הוא היה נוקשה ו נקישתי .","בחירה_ _של_ _הוא ב ה_ סונטה של מוצרט היתה מוטעית : היה מכני ביצוע_ _של_ _הוא ו נעדר - השראה , ו צליל ה פסנתר של_ _הוא היה נוקשה ו נקישתי .",[0] -> [1] -> [2] -> [3] -> [27]
"כמו כן מוצע ש אם לא רשם ה עד עצמו את הודעה_ _של_ _הוא ב ה_ משטרה , תהיה עדות זו חייבת ב סיוע ב ראיה אחרת כדי ש יוכל ה שופט להרשיע את_ _הוא על פה_ _של_ _היא .","כמו כן מוצע ש אם לא רשם ה עד עצמו את הודעה_ _של_ _הוא ב ה_ משטרה , תהיה חייבת עדות זו ב סיוע ב ראיה אחרת כדי ש יוכל ה שופט להרשיע את_ _הוא על פה_ _של_ _היא .",[0] -> [1] -> [2] -> [3] -> [27]
ה רושם הוא ש ה ממסד ה צרפתי מצפה ש ימותו ב שקט .,ה רושם הוא ש מצפה ה ממסד ה צרפתי ש ימותו ב שקט .,[0] -> [1] -> [2] -> [3] -> [27]
"אמנם ה קיבוץ אינו קולחוז , אבל זה לא בשביל_ _הם , הם אומרים .","אמנם אינו קולחוז ה קיבוץ , אבל זה לא בשביל_ _הם , הם אומרים .",[0] -> [1] -> [2] -> [3] -> [27]
"גם כאשר ה דמויות אומרות משפטים , ש אפילו וודי אלן לא היה מתבייש להיות חתום על_ _הם , ה צליל ה איטלקי מוסיף ל_ _הם מידה של ספונטניות ו אנרגיה ש הופכת את_ _הם ל מוצלחים יותר מ מה ש הם באמת .","גם כאשר ה דמויות אומרות משפטים , ש לא היה מתבייש אפילו וודי אלן להיות חתום על_ _הם , ה צליל ה איטלקי מוסיף ל_ _הם מידה של ספונטניות ו אנרגיה ש הופכת את_ _הם ל מוצלחים יותר מ מה ש הם באמת .",[0] -> [1] -> [2] -> [3] -> [27]
"פרוסות ה פרושוטו ש הוגשו ב מנת ה אנטיפסטו ה מעורב היו בסדר , אבל ה חציל , ש נצלה ב גריל ו אחר כך טוגן , היה ספוג ב שמן זית ש פגם ב טעם_ _של_ _הוא .","פרוסות ה פרושוטו ש הוגשו ב מנת ה אנטיפסטו ה מעורב היו בסדר , אבל , היה ספוג ה חציל , ש נצלה ב גריל ו אחר כך טוגן ב שמן זית ש פגם ב טעם_ _של_ _הוא .",[0] -> [1] -> [2] -> [3] -> [27]
"עוד קבע בג""ץ כי החלטת ה מועצה ה מקומית להוסיף 35 % ל ה_ ארנונה ה כללית ש הוטלה השנה על "" מבנים עיסקיים "" נוגדת החלטת מליאת ה מועצה עצמה , ש קבעה כי שיעור ה תוספת של ה ארנונה ה כללית ל שנת ה מס 1989-90 יהיה 25 % בלבד , מבלי להוציא מ כלל שיעור זה את ה "" מבנים ה עיסקיים "" .","עוד קבע בג""ץ כי החלטת ה מועצה ה מקומית להוסיף 35 % ל ה_ ארנונה ה כללית ש הוטלה השנה על "" מבנים עיסקיים "" נוגדת החלטת מליאת ה מועצה עצמה , ש קבעה כי יהיה 25 % שיעור ה תוספת של ה ארנונה ה כללית ל שנת ה מס 1989-90 בלבד , מבלי להוציא מ כלל שיעור זה את ה "" מבנים ה עיסקיים "" .",[0] -> [1] -> [2] -> [3] -> [27]
"לכאורה , לא יכול היה להתבטא ב נימה ידידותית יותר ; אבל קיום ה שגרה , ש לפי_ _היא נציגי שתי ה מדינות נפגשים אחת ל חצי שנה ל שיחות על תיאום אסטראטגי , אינו מבטיח כש ל עצמו , כי ואשינגטון ו ירושלים באמת "" משדרות על אותו גל "" .","לכאורה , לא יכול היה להתבטא ב נימה ידידותית יותר ; אבל , אינו מבטיח קיום ה שגרה , ש לפי_ _היא נציגי שתי ה מדינות נפגשים אחת ל חצי שנה ל שיחות על תיאום אסטראטגי כש ל עצמו , כי ואשינגטון ו ירושלים באמת "" משדרות על אותו גל "" .",[0] -> [1] -> [2] -> [3] -> [27]
"ה צפי של מומחים ל ענייני הגנה ב וואשינגטון , אפוא , הוא כי אולטימאטום התקפי של ממשל בוש יידחה עד ל חודשים אפריל - מאי של ה שנה ה באה , אף כי קיימת מודעות רבה ב ה_ ממשל ל ה_ בעייתיות ה פוליטית ש ב החזקת כוחות גדולים ב תחומי סעודיה ב עת קיום_ _של_ _הוא של ה חאג .","ה צפי של מומחים ל ענייני הגנה ב וואשינגטון , אפוא , הוא כי יידחה אולטימאטום התקפי של ממשל בוש עד ל חודשים אפריל - מאי של ה שנה ה באה , אף כי קיימת מודעות רבה ב ה_ ממשל ל ה_ בעייתיות ה פוליטית ש ב החזקת כוחות גדולים ב תחומי סעודיה ב עת קיום_ _של_ _הוא של ה חאג .",[0] -> [1] -> [2] -> [3] -> [27]
כמו - כן קשה לגבות קנסות ב סכומים קטנים ש גבייה_ _של_ _הם אינה כדאית מ בחינה כלכלית משום ש היא כרוכה ב הפעלת מנגנון יקר .,כמו - כן קשה לגבות קנסות ב סכומים קטנים ש אינה כדאית גבייה_ _של_ _הם מ בחינה כלכלית משום ש היא כרוכה ב הפעלת מנגנון יקר .,[0] -> [1] -> [2] -> [3] -> [27]
"רומאן ש ה מוטיוואציה ל כתיבה_ _של_ _הוא אינה מובנת מתוך_ _הוא , לעולם ייוותר חיוור ו בלתי מעניין , גם אם יהיה כתוב היטב .","רומאן ש אינה מובנת ה מוטיוואציה ל כתיבה_ _של_ _הוא מתוך_ _הוא , לעולם ייוותר חיוור ו בלתי מעניין , גם אם יהיה כתוב היטב .",[0] -> [1] -> [2] -> [3] -> [27]
"כמעט טרגדיה היא ש פליט יהודי מ גרמניה ה נאצית , אשר הצלחה_ _של_ _הוא ה אישיות היו תמצית ה חלום ה אמריקאי , מסיים את ה קריירה ה פוליטית של_ _הוא ב אופן כל כך מביש .","כמעט טרגדיה היא ש , מסיים פליט יהודי מ גרמניה ה נאצית , אשר הצלחה_ _של_ _הוא ה אישיות היו תמצית ה חלום ה אמריקאי את ה קריירה ה פוליטית של_ _הוא ב אופן כל כך מביש .",[0] -> [1] -> [2] -> [3] -> [27]
"ובכן , התברר ש בעלי ה רעיונות ה מעניינים היו אנשים כמו רוברט בורק , מרטין פלדסטיין , צארלס מאריי ו אלן בלום ש גם הודות ל ה_ תמיכה ה פילנטרופית ש קיבלו ב שנות ה 70 ו או ב ראשית שנות ה 80 אין צורך להציגם את _הם ב ה_ ציבור .","ובכן , התברר ש היו אנשים בעלי ה רעיונות ה מעניינים כמו רוברט בורק , מרטין פלדסטיין , צארלס מאריי ו אלן בלום ש גם הודות ל ה_ תמיכה ה פילנטרופית ש קיבלו ב שנות ה 70 ו או ב ראשית שנות ה 80 אין צורך להציגם את _הם ב ה_ ציבור .",[0] -> [1] -> [2] -> [3] -> [27]
"ממילא , טום הארקין , תומך עקיב ב סיוע ה חוץ , היה אחד ה מקבלים ה גדולים ביותר של תרומות יהודיות ב שש ה שנים ה אחרונות .","ממילא , , היה אחד ה מקבלים טום הארקין , תומך עקיב ב סיוע ה חוץ ה גדולים ביותר של תרומות יהודיות ב שש ה שנים ה אחרונות .",[0] -> [1] -> [2] -> [3] -> [27]
מקור בעל גישה ישירה ל ה_ מידע טען באוזני ה עיתון ש הכנסת ה ברוטו של מילקן מ ה שותפויות היתה מיליארד דולר .,מקור בעל גישה ישירה ל ה_ מידע טען באוזני ה עיתון ש היתה מיליארד דולר הכנסת ה ברוטו של מילקן מ ה שותפויות .,[0] -> [1] -> [2] -> [3] -> [27]
"סרגיו , ש רכש ל עצמו מוניטין ב מסעדת ה חצר ב יפו , ממונה כאן על ה מטבח ו איש אינו יכול להתלונן ש ה אוכל אינו איטלקי אותנטי .","סרגיו , ש רכש ל עצמו מוניטין ב מסעדת ה חצר ב יפו , ממונה כאן על ה מטבח ו איש אינו יכול להתלונן ש אינו איטלקי ה אוכל אותנטי .",[0] -> [1] -> [2] -> [3] -> [27]
"ב פרק זה עוסק וייט ב ה_ שאלה מי בעצם היה פוס , ו מביא גרסות שונות : פוס היה ה שטן , פוס היה אדם מעוות , פוס הוא ה מיתוס ש אינו כלה לעולם , כפי ש אומרת לורה : "" פוס לא מת , הוא נמצא שם עדיין , כך אומרים , ב מרחבי ה ארץ , ו תמיד יהיה , ו אגדת חיים_ _של_ _הוא תיכתב ב סוף_ _של_ _הוא של דבר , בידי אלה ש הוטרדו בגין_ _היא "" .","ב פרק זה עוסק וייט ב ה_ שאלה מי בעצם היה פוס , ו מביא גרסות שונות : היה ה שטן פוס , פוס היה אדם מעוות , פוס הוא ה מיתוס ש אינו כלה לעולם , כפי ש אומרת לורה : "" פוס לא מת , הוא נמצא שם עדיין , כך אומרים , ב מרחבי ה ארץ , ו תמיד יהיה , ו אגדת חיים_ _של_ _הוא תיכתב ב סוף_ _של_ _הוא של דבר , בידי אלה ש הוטרדו בגין_ _היא "" .",[0] -> [1] -> [2] -> [3] -> [27]
"ל דוגמה , ה בעיה ה קצרה ו ה פשוטה ביותר ב קבוצה זו : ה מספר 17 הוא מספר ראשוני יחיד ש הוא סכום של ארבעה מספרים ראשוניים עוקבים : 17 7 5 3 2 .","ל דוגמה , : ה מספר 17 הוא מספר ה בעיה ה קצרה ו ה פשוטה ביותר ב קבוצה זו ראשוני יחיד ש הוא סכום של ארבעה מספרים ראשוניים עוקבים : 17 7 5 3 2 .",[0] -> [1] -> [2] -> [3] -> [27]
אבל מה ש עשה את ה מנה בלתי אכילה לחלוטין היה ה רוטב .,אבל היה ה רוטב מה ש עשה את ה מנה בלתי אכילה לחלוטין .,[0] -> [1] -> [2] -> [3] -> [27]
"זו טעות אופטית נפוצה : מי ש "" אין ל_ _הוא זהות "" ( ו מה פשר ה מושג ה זה ? ) ב דרך - כלל גם אינו מודע ל כך , ו בוודאי ש אינו יודע היכן לחפש את_ _היא .","זו טעות אופטית נפוצה : ב דרך - כלל גם אינו מודע מי ש "" אין ל_ _הוא זהות "" ( ו מה פשר ה מושג ה זה ? ) ל כך , ו בוודאי ש אינו יודע היכן לחפש את_ _היא .",[0] -> [1] -> [2] -> [3] -> [27]
