sen_str,swapped_sen_str,leaf_rule
"दूरसंचार जैसे प्रमुख क्षेत्रों में एफडीआई बढ़ाने के माकपा के विरोध को लेकर पूछे गए सवाल के जवाब में जोशी ने कहा कि यदि उन्होंने इसका विरोध किया है और इसके बावजूद कांग्रेस नेतृत्व वाली यूपीए सरकार को समर्थन देना जारी है , तो यह गलत है ।","दूरसंचार जैसे प्रमुख क्षेत्रों में एफडीआई बढ़ाने के माकपा के विरोध को लेकर पूछे गए सवाल के जवाब में जोशी ने कहा कि यदि इसका विरोध किया उन्होंने है और इसके बावजूद कांग्रेस नेतृत्व वाली यूपीए सरकार को समर्थन देना जारी है , तो यह गलत है ।",[0] -> [2]
हालांकि उन्होंने इसे रैगिंग का मामला मानने से इन्कार कर दिया ।,हालांकि इसे रैगिंग का मामला मानने से इन्कार कर उन्होंने दिया ।,[0] -> [2]
उन्होंने कहा कि एड्स और टीबी के गठजोड़ से चुनौती खड़ी हो गई है और इसी कारण टीबी से होने वाली मौतें बढ़ रही हैं ।,उन्होंने कहा कि एड्स और टीबी के गठजोड़ से चुनौती खड़ी हो गई है और इसी कारण बढ़ टीबी से होने वाली मौतें रही हैं ।,[0] -> [2]
कुंबले व हरभजन के साथ इन दोनों तेज गेंदबाजों की टीम में मौजूदगी का मतलब हुआ कि भारत लंबे अरसे बाद किसी टूर्नामेंट में अपने पूरी क्षमता वाले गेंदबाजी आक्रमण के साथ उतरेगा ।,कुंबले व हरभजन के साथ इन दोनों तेज गेंदबाजों की टीम में मौजूदगी का मतलब हुआ कि लंबे अरसे बाद किसी टूर्नामेंट में अपने पूरी क्षमता वाले गेंदबाजी आक्रमण के साथ उतरेगा भारत ।,[0] -> [2]
सरकारी आंकड़ों में मरने वालों की संख्या बढ़कर ७७६३ हो गई है लेकिन अंडमान में लापता लोगों की संख्या में काफी कमी आई है और उनकी संख्या ३००० रह गई है .,सरकारी आंकड़ों में मरने वालों की संख्या बढ़कर हो ७७६३ गई है लेकिन अंडमान में लापता लोगों की संख्या में काफी कमी आई है और उनकी संख्या ३००० रह गई है .,[0] -> [2]
वैज्ञानिक सौ ऐसे ग्रहों का पता लगा चुके हैं जो हमारे सौरमंडल से बाहर हैं .,वैज्ञानिक सौ ऐसे ग्रहों का पता लगा चुके हैं हमारे सौरमंडल जो से बाहर हैं .,[0] -> [2]
संजय की पत्नी से दरवाजा खुलवाकर पुलिस टीम अंदर घुस गई ।,संजय की पत्नी से दरवाजा खुलवाकर अंदर घुस पुलिस टीम गई ।,[0] -> [2]
उत्तर प्रदेश की पूर्व मुख्यमंत्री मायावती और उनके तत्कालीन कैबिनेट सहयोगियों के खिलाफ भ्रष्टाचार के मामलों में जांच काफी अहम मोड़ पर पहुँच गई है ।,उत्तर प्रदेश की पूर्व मुख्यमंत्री मायावती और उनके तत्कालीन कैबिनेट सहयोगियों के खिलाफ भ्रष्टाचार के मामलों में काफी अहम मोड़ पर पहुँच जांच गई है ।,[0] -> [2]
दुलइमी ने बताया कि आशा पारिख उनकी पसंदीदा अदाकारा हैं ।,दुलइमी ने बताया कि उनकी पसंदीदा अदाकारा आशा पारिख हैं ।,[0] -> [2]
जेल में बंद विवादास्पद राजद सांसद सैयद शहाबुद्दीन को एक और झटका लगा है ।,जेल में बंद विवादास्पद राजद सांसद सैयद शहाबुद्दीन को लगा एक और झटका है ।,[0] -> [2]
२० जून को ' जी ' के इस थ्रिलर की लाँच पर रोक लगाने से इन्कार करते हुए अदालत ने इस घरेलू टीवी कंपनी से अपना जवाब और हलफनामा सोमवार को या उसके पहले दाखिल करने को कहा ।,२० जून को ' जी ' के इस थ्रिलर की लाँच पर रोक लगाने से इन्कार करते हुए इस घरेलू टीवी कंपनी से अपना जवाब और हलफनामा सोमवार को या उसके पहले दाखिल करने को कहा अदालत ने ।,[0] -> [2]
उसके बाद युवराज भी चलते बने ।,उसके बाद चलते बने युवराज भी ।,[0] -> [2]
उन्होंने अदालत से कहा कि जब उन पर हमला किया गया तब वह निहत्थे थे और ऐसे में वे कुछ नहीं कर सकते थे ।,उन्होंने अदालत से कहा कि जब उन पर हमला किया गया तब निहत्थे थे वह और ऐसे में वे कुछ नहीं कर सकते थे ।,[0] -> [2]
इसके साथ ही डिजनी के रिसॉर्ट में ठहरने का अनुभव भी बेहद अनूठा है ।,इसके साथ ही डिजनी के रिसॉर्ट में बेहद अनूठा ठहरने का अनुभव भी है ।,[0] -> [2]
मुख्यमंत्री ने स्पष्ट किया ' मैंने केंद्रीय नेतृत्व से बात की है और उन्होंने मुझे अपने पद पर बने रहने के लिए कहा है,मुख्यमंत्री ने स्पष्ट किया ' मैंने केंद्रीय नेतृत्व से बात की है और मुझे अपने पद पर बने रहने के लिए कहा उन्होंने है,[0] -> [2]
संसदीय कार्यमंत्री गुलाम नबी आजाद से मिलकर निकले भाजपा प्रवक्ता वी. के. मल्होत्रा ने दोटूक शब्दों में कहा कि इस संसद की कार्यवाही तब तक सुचारु रूप से नहीं चलेगी जब तक दागी मंत्री पद से हटा नहीं दिए जाते ।,संसदीय कार्यमंत्री गुलाम नबी आजाद से मिलकर निकले भाजपा प्रवक्ता वी. के. मल्होत्रा ने दोटूक शब्दों में कहा कि तब तक सुचारु रूप से नहीं चलेगी इस संसद की कार्यवाही जब तक दागी मंत्री पद से हटा नहीं दिए जाते ।,[0] -> [2]
"लेकिन वे अपने पुत्र के बर्ताव की जिम्मेदारी नहीं ले सकते , क्योंकि उसकी उन्हें जानकारी ही नहीं थी ।","लेकिन वे अपने पुत्र के बर्ताव की जिम्मेदारी नहीं ले सकते , क्योंकि उसकी जानकारी उन्हें ही नहीं थी ।",[0] -> [2]
इस मामले में बॉलीवुड अभिनेता सलमान खान आरोपी हैं ।,इस मामले में आरोपी बॉलीवुड अभिनेता सलमान खान हैं ।,[0] -> [2]
ताज को सात अजूबों की सूची में स्थान प्राप्त करने का गौरव प्राप्त हुआ है ।,ताज को प्राप्त हुआ सात अजूबों की सूची में स्थान प्राप्त करने का गौरव है ।,[0] -> [2]
उन्होंने कहा यह कहना गलत है कि सरकार बदले की नीयत से काम कर रही है ।,उन्होंने कहा यह कहना गलत है कि बदले की नीयत से काम कर सरकार रही है ।,[0] -> [2]
"परिस्थितियों से तंग आकर एक दिन असवत और उस्मान यहां से निकल पड़े , लेकिन लालबत्ती के उल्लंघन के आरोप में एक पुलिस वाले ने उन्हें रोक लिया ।","परिस्थितियों से तंग आकर एक दिन असवत और उस्मान यहां से निकल पड़े , लेकिन लालबत्ती के उल्लंघन के आरोप में उन्हें रोक एक पुलिस वाले ने लिया ।",[0] -> [2]
महिला एवं बाल विकास सचिव के मुताबिक मंत्रियों के समूह ने अनैतिक व्यापार संशोधन विधेयक पर भी मुहर लगा दी है ।,महिला एवं बाल विकास सचिव के मुताबिक अनैतिक व्यापार संशोधन विधेयक पर भी मुहर लगा मंत्रियों के समूह ने दी है ।,[0] -> [2]
मालूम हो कि सोनिया गांधी राष्ट्रीय सलाहकार परिषद की अध्यक्ष भी हैं ।,मालूम हो कि राष्ट्रीय सलाहकार परिषद की अध्यक्ष सोनिया गांधी भी हैं ।,[0] -> [2]
इससे पूर्व चर्चा में भाग लेते हुए कलराज मिश्र ने कहा कि घुसपैठियों की बढ़ती संख्या देश की आंतरिक सुरक्षा के लिए गंभीर खतरा बन चुकी है ।,इससे पूर्व चर्चा में भाग लेते हुए कहा कलराज मिश्र ने कि घुसपैठियों की बढ़ती संख्या देश की आंतरिक सुरक्षा के लिए गंभीर खतरा बन चुकी है ।,[0] -> [2]
पहले वह एक युवक के साथ अकेले काम करती थी ।,पहले एक युवक के साथ अकेले काम करती वह थी ।,[0] -> [2]
आचार सहिंता का उल्लंघन करने वालों को आयोग ने कानूनी कार्रवाई की चेतावनी दी है ।,आचार सहिंता का उल्लंघन करने वालों को कानूनी कार्रवाई की चेतावनी दी आयोग ने है ।,[0] -> [2]
"बच्चों को बताया जा रहा है कि उनके संग ऐसा हादसा पेश आने पर वह वहां से भाग जाएं , या फिर शोर मचाएं या अपहर्ता का हाथ काट लें आदि ।","बच्चों को बताया जा रहा है कि उनके संग पेश आने ऐसा हादसा पर वह वहां से भाग जाएं , या फिर शोर मचाएं या अपहर्ता का हाथ काट लें आदि ।",[0] -> [2]
गाड़ी में सवार यात्रियों ने बताया कि जब गाड़ी अंबाला से कुछ आगे निकली थी तभी से कुछ दुर्गंध आ रही थी ।,गाड़ी में सवार यात्रियों ने बताया कि जब गाड़ी अंबाला से कुछ आगे निकली थी तभी से आ कुछ दुर्गंध रही थी ।,[0] -> [2]
"इस बीच समाजवादी पार्टी के अमर सिंह ने संवाददाताओं से बातचीत में कहा कि उन्होंने विधेयक पर सरकार से कुछ स्पष्टीकरण मांगे थे , जिसके जवाब मिल गये हैं तथा पार्टी ने विधेयक का समर्थन करने का फैसला किया है ।","इस बीच समाजवादी पार्टी के अमर सिंह ने संवाददाताओं से बातचीत में कहा कि विधेयक पर सरकार से कुछ स्पष्टीकरण मांगे उन्होंने थे , जिसके जवाब मिल गये हैं तथा पार्टी ने विधेयक का समर्थन करने का फैसला किया है ।",[0] -> [2]
"इन खबरों के बीच कि संयुक्त राष्ट्र महासचिव कोफी अन्नान को श्रीलंका में सरकार ने लिट्टे आतंकियों के प्रभाव वाले क्षेत्रों में जाने से रोक दिया , अन्नान ने इच्छा जताई है कि वे श्रीलंका दोबारा आना चाहते हैं और यहां के सभी क्षेत्रों को देखना चाहते हैं ।","इन खबरों के बीच कि संयुक्त राष्ट्र महासचिव कोफी अन्नान को श्रीलंका में सरकार ने लिट्टे आतंकियों के प्रभाव वाले क्षेत्रों में जाने से रोक दिया , इच्छा जताई अन्नान ने है कि वे श्रीलंका दोबारा आना चाहते हैं और यहां के सभी क्षेत्रों को देखना चाहते हैं ।",[0] -> [2]
उत्तरांचल में ४१६ मिमी की तुलना में ३२५ मिमी बारिश हो पाई है जो औसत से २२ फीसदी कम है ।,उत्तरांचल में ४१६ मिमी की तुलना में ३२५ मिमी बारिश हो पाई है औसत से २२ फीसदी कम जो है ।,[0] -> [2]
इसके उलट नटवर सिंह ने पांडे से कहा कि राजा ज्ञानेंद्र के कदमों से नेपाल का संकट और गहरा गया है ।,इसके उलट पांडे से कहा नटवर सिंह ने कि राजा ज्ञानेंद्र के कदमों से नेपाल का संकट और गहरा गया है ।,[0] -> [2]
"प्रदर्शन में सपा की राष्ट्रीय सचिव व महिला मोर्चा की अध्यक्ष रंजना वाजपेयी , विधायक कोविद कुमार सिंह , कीर्ति वर्धन सिंह , ठाकुर सुनील सिंह और मोहन सिंह भी शामिल हुए ।","प्रदर्शन में शामिल हुए सपा की राष्ट्रीय सचिव व महिला मोर्चा की अध्यक्ष रंजना वाजपेयी , विधायक कोविद कुमार सिंह , कीर्ति वर्धन सिंह , ठाकुर सुनील सिंह और मोहन सिंह भी ।",[0] -> [2]
अकेले अप्रैल माह में इस मद में कंपनी को 2500 करोड़ रुपये का नुक़सान उठाना पड़ सकता है ।,अकेले अप्रैल माह में इस मद में 2500 करोड़ रुपये का नुक़सान उठाना कंपनी को पड़ सकता है ।,[0] -> [2]
सतलुज नदी में जलस्तर घटने से हिमाचल प्रदेश में बाढ़ का खतरा फिलहाल टल गया है और हजारों लोग अब सुरक्षित स्थानों से अपने घरों की ओर लौट रहे हैं ।,सतलुज नदी में जलस्तर घटने से हिमाचल प्रदेश में बाढ़ का खतरा फिलहाल टल गया है और अब सुरक्षित स्थानों से अपने घरों की ओर लौट हजारों लोग रहे हैं ।,[0] -> [2]
इस मौके पर स्थानीय नेताओं और पुलिस कर्मियों ने आतंकी हमले से जुड़े विभिन्न मुद्दों पर आडवाणी को जानकारी दी ।,इस मौके पर आतंकी हमले से जुड़े विभिन्न मुद्दों पर आडवाणी को जानकारी दी स्थानीय नेताओं और पुलिस कर्मियों ने ।,[0] -> [2]
गौरतलब है कि पश्चिम बंगाल विधान सभा चुनाव में एक साल से कम का समय बाकी है ।,गौरतलब है कि पश्चिम बंगाल विधान सभा चुनाव में बाकी एक साल से कम का समय है ।,[0] -> [2]
उन्होंने कहा कि एक ऐसा तरीका तैयार किया जाना चाहिए जो इस बात की जानकारी दे सके कि हम कहाँ गलत हैं और क्या सही उपाय किए जाने चाहिए ?,उन्होंने कहा कि एक ऐसा तरीका तैयार किया जाना चाहिए जो इस बात की जानकारी दे सके कि कहाँ गलत हैं हम और क्या सही उपाय किए जाने चाहिए ?,[0] -> [2]
"गांव मॉडल टाउन करेहड़ा के किसान धर्मपाल , नरेश , ऋषि , पीतांबर , घनश्याम व कृष्ण दत्त ने बताया कि बाढ़ के कारण फसलों को भारी क्षति हुई है ।","गांव मॉडल टाउन करेहड़ा के किसान धर्मपाल , नरेश , ऋषि , पीतांबर , घनश्याम व कृष्ण दत्त ने बताया कि बाढ़ के कारण भारी क्षति हुई फसलों को है ।",[0] -> [2]
यहाँ पहुँचने के लिए सबसे नजदीकी रेलवे स्‍टेशन गोरखपुर रेलवे जंक्‍शन है ।,यहाँ पहुँचने के लिए गोरखपुर रेलवे जंक्‍शन है सबसे नजदीकी रेलवे स्‍टेशन ।,[0] -> [2]
इसके लिए प्रदेश के भाजपा और इसके समर्थक विधायक दिल्ली पहुंच गए हैं .,इसके लिए दिल्ली पहुंच प्रदेश के भाजपा और इसके समर्थक विधायक गए हैं .,[0] -> [2]
बाबरी मस्जिद गिराए जाने के बाद मुंबई में जब श्रृंखलाबद्ध विस्फ़ोट हुए तो वहां दो बातें प्रमुख रूप से सामने आई थीं कि बसों में हुए विस्फ़ोटों में इलेक्ट्रॉनिक टाइमर लगाया गया था और जिन स्थानों पर आरडीएक्स विस्फ़ोट हुए वहां बिलकुल दिल्ली की तर्ज़ पर तबाही हुई थी ।,बाबरी मस्जिद गिराए जाने के बाद मुंबई में जब हुए श्रृंखलाबद्ध विस्फ़ोट तो वहां दो बातें प्रमुख रूप से सामने आई थीं कि बसों में हुए विस्फ़ोटों में इलेक्ट्रॉनिक टाइमर लगाया गया था और जिन स्थानों पर आरडीएक्स विस्फ़ोट हुए वहां बिलकुल दिल्ली की तर्ज़ पर तबाही हुई थी ।,[0] -> [2]
"यदि ऐसा है , तो पार्टी को यह स्पष्ट करना चाहिए ।","यदि ऐसा है , तो यह स्पष्ट करना पार्टी को चाहिए ।",[0] -> [2]
