sen_str,swapped_sen_str,leaf_rule
"गौरतलब है कि लंदन में जी - ४ के देशों के साथ हुई बैठक में अफ्रीकी संघ ने जी - ४ के साथ संयुक्त प्रस्ताव पेश करने पर सहमति व्यक्त की थी , लेकिन इथियोपिया की राजधानी आदिस अबाबा में हुई अफ्रीकी संघ की शिखर बैठक में संयुक्त प्रस्ताव पेश करने के विचार को सिरे से ही ठुकरा दिया गया ।","कि लंदन में जी - ४ के देशों के साथ हुई बैठक में अफ्रीकी संघ ने जी - ४ के साथ संयुक्त प्रस्ताव पेश करने पर सहमति व्यक्त की थी , लेकिन इथियोपिया की राजधानी आदिस अबाबा में हुई अफ्रीकी संघ की शिखर बैठक में संयुक्त प्रस्ताव पेश करने के विचार को सिरे से ही ठुकरा दिया गया गौरतलब है ।",[0] -> [1]
उल्लेखनीय है कि केंद्र सरकार ने बोडो क्षेत्र में दो साल पूर्व उग्रवादियों के आत्मसमर्पण करके बीटीसी बनाने के बाद गत फरवरी में बीएलटी के साथ सहमति पर दस्तखत किए थे ।,कि केंद्र सरकार ने बोडो क्षेत्र में दो साल पूर्व उग्रवादियों के आत्मसमर्पण करके बीटीसी बनाने के बाद गत फरवरी में बीएलटी के साथ सहमति पर दस्तखत किए थे उल्लेखनीय है ।,[0] -> [1]
हमें लगता है कि तटीय इलाकों की मिट्टी को समुद्र के खारे पानी से भारी नुकसान हुआ है और इस वजह से यहां दोबारा वनस्पति पैदा होना मुश्किल है ।,हमें कि तटीय इलाकों की मिट्टी को समुद्र के खारे पानी से भारी नुकसान हुआ है और इस वजह से यहां दोबारा वनस्पति पैदा होना मुश्किल है लगता है ।,[0] -> [1]
मालूम हो कि उसे रिहा करने के लिए सर्वसम्मति से सभी विधायकों ने केरल विधान सभा में एक प्रस्ताव पेश किया है ।,मालूम कि उसे रिहा करने के लिए सर्वसम्मति से सभी विधायकों ने केरल विधान सभा में एक प्रस्ताव पेश किया है हो ।,[0] -> [1]
गौरतलब है कि जाहिरा समय - समय पर अपने बयानों से पीछे हटी है और अपने अंतिम बयान में उसने आरोप लगाया है कि तीस्ता ने उस पर दबाव डाला और बेस्ट बेकरी मामले को विदेशों में बेचकर पैसे कमाए ।,कि जाहिरा समय - समय पर अपने बयानों से पीछे हटी है और अपने अंतिम बयान में उसने आरोप लगाया है कि तीस्ता ने उस पर दबाव डाला और बेस्ट बेकरी मामले को विदेशों में बेचकर पैसे कमाए गौरतलब है ।,[0] -> [1]
"गौरतलब है कि विजय प्रकाश को अपने निर्वाचन क्षेत्र जमुई में मतदान के दौरान उस समय गिरफ्तार किया गया था , जब वह हथियार , शराब की पेटियां और नकदी लेकर खुलेआम घूम रहे थे ।","कि विजय प्रकाश को अपने निर्वाचन क्षेत्र जमुई में मतदान के दौरान उस समय गिरफ्तार किया गया था , जब वह हथियार , शराब की पेटियां और नकदी लेकर खुलेआम घूम रहे थे गौरतलब है ।",[0] -> [1]
गौरतलब है कि समाज की दलित और वंचित महिलाओं के सशक्तिकरण के लिए किए गए प्रशंसनीय कार्यो के लिए उन्हें संयुक्त राष्ट्र ने यह अवसर प्रदान किया था ।,कि समाज की दलित और वंचित महिलाओं के सशक्तिकरण के लिए किए गए प्रशंसनीय कार्यो के लिए उन्हें संयुक्त राष्ट्र ने यह अवसर प्रदान किया था गौरतलब है ।,[0] -> [1]
उल्लेखनीय है कि हाल ही में जाहिरा शेख ने अदालत में एक हलफनामा दाखिल कर कहा था कि यह उसका पहला हलफनामा है व इससे पहले दाखिल हलफनामे में उसके हस्ताक्षर नहीं हैं ।,कि हाल ही में जाहिरा शेख ने अदालत में एक हलफनामा दाखिल कर कहा था कि यह उसका पहला हलफनामा है व इससे पहले दाखिल हलफनामे में उसके हस्ताक्षर नहीं हैं उल्लेखनीय है ।,[0] -> [1]
विशेषज्ञों का आकलन है कि इन गैर मानसूनी हवाओं के मिजाज से झलकता है कि दिल्ली में नियत समय २८ -JOIN २९ जून तक मानसून दस्तक दे देगा ।,विशेषज्ञों का आकलन है कि इन गैर मानसूनी हवाओं के मिजाज से कि दिल्ली में नियत समय २८ -JOIN २९ जून तक मानसून दस्तक दे देगा झलकता है ।,[0] -> [1]
गौरतलब है कि १९८८ में दार्जिलिंग संधि पर हस्ताक्षर के बाद घीसिंग गोरखालैंड की मांग से बचते रहे ।,कि १९८८ में दार्जिलिंग संधि पर हस्ताक्षर के बाद घीसिंग गोरखालैंड की मांग से बचते रहे गौरतलब है ।,[0] -> [1]
गौरतलब है कि खुराना ने सिर्फ एक माह पहले आडवाणी से इस्तीफे की मांग की थी ।,कि खुराना ने सिर्फ एक माह पहले आडवाणी से इस्तीफे की मांग की थी गौरतलब है ।,[0] -> [1]
उल्लेखीय है कि चंडीगढ़ के टैक्सी और ऑटो रिक्शा चालकों ने भी पाकिस्तानी दर्शकों को मोहाली स्टेडियम पहुंचाने के लिए विशेष व्यवस्था की है ।,कि चंडीगढ़ के टैक्सी और ऑटो रिक्शा चालकों ने भी पाकिस्तानी दर्शकों को मोहाली स्टेडियम पहुंचाने के लिए विशेष व्यवस्था की है उल्लेखीय है ।,[0] -> [1]
गौरतलब है कि नारायणन ने मीडिया के साथ साक्षात्कार में कहा था कि उन्होंने वाजपेयी को कई पत्र लिखे जिनमें दंगों के दौरान त्वरित कार्रवाई के लिए अनुरोध किया गया था और सेना की तैनाती के सुझाव भी दिए गए थे ।,कि नारायणन ने मीडिया के साथ साक्षात्कार में कहा था कि उन्होंने वाजपेयी को कई पत्र लिखे जिनमें दंगों के दौरान त्वरित कार्रवाई के लिए अनुरोध किया गया था और सेना की तैनाती के सुझाव भी दिए गए थे गौरतलब है ।,[0] -> [1]
गौरतलब है कि उत्तर रेलवे ने पाकिस्तानी मेहमानों के स्वागत के लिए चंडीगढ़ और अटारी रेलवे स्टेशनों पर खास इंतजाम किए थे ।,कि उत्तर रेलवे ने पाकिस्तानी मेहमानों के स्वागत के लिए चंडीगढ़ और अटारी रेलवे स्टेशनों पर खास इंतजाम किए थे गौरतलब है ।,[0] -> [1]
गौरतलब है कि मध्यप्रदेश पंचायत द्वारा शिक्षकों की भर्ती के लिए चयन सूची तैयार करने के बाद नियुक्तियां दे दी गई थीं ।,कि मध्यप्रदेश पंचायत द्वारा शिक्षकों की भर्ती के लिए चयन सूची तैयार करने के बाद नियुक्तियां दे दी गई थीं गौरतलब है ।,[0] -> [1]
गौरतलब है कि सुनामी के कहर से श्रीलंका का ७० फीसदी तटीय इलाका प्रभावित हुआ है ।,कि सुनामी के कहर से श्रीलंका का ७० फीसदी तटीय इलाका प्रभावित हुआ है गौरतलब है ।,[0] -> [1]
हो सकता है कि वीरप्पन की मदद करने वाले कुछ बाकी रह गए हों ।,कि वीरप्पन की मदद करने वाले कुछ बाकी रह गए हों हो सकता है ।,[0] -> [1]
"बैठक में तय हुआ कि पार्टी राज्यपालों को हटाए जाने के मुद्दे को जोर शोर से उठाएगी , लेकिन इस पर कोई आंदोलन की योजना नहीं है ।","बैठक में तय कि पार्टी राज्यपालों को हटाए जाने के मुद्दे को जोर शोर से उठाएगी , लेकिन इस पर कोई आंदोलन की योजना नहीं है हुआ ।",[0] -> [1]
मालूम हो कि सरबजीत के परिवार ने उसे पाकिस्तान द्वारा फांसी दिए जाने पर सामूहिक आत्महत्या की धमकी दी है .,मालूम कि सरबजीत के परिवार ने उसे पाकिस्तान द्वारा फांसी दिए जाने पर सामूहिक आत्महत्या की धमकी दी है हो .,[0] -> [1]
"फिलहाल मैं पुस्तक को अंतिम रूप देने में लगा हूं और लोगों को अंदाजा लगाने दीजिए कि वह व्यक्ति कौन है , जिसने १९६५ के युद्ध की भारतीय योजना २० हजार रुपये में उनके पिता को बेच दी थी ।","फिलहाल पुस्तक को अंतिम रूप देने में लगा मैं हूं और लोगों को अंदाजा लगाने दीजिए कि वह व्यक्ति कौन है , जिसने १९६५ के युद्ध की भारतीय योजना २० हजार रुपये में उनके पिता को बेच दी थी ।",[0] -> [2]
"उसने उसे एक "" उल्लेखनीय "" और "" प्यारी एवं अद्भुत "" महिला बताया जिसने अपनी कहानियों के माध्यम से साहित्य जगत में अपनी छाप छोड़ी थी ।","उसने उसे एक "" उल्लेखनीय "" और "" प्यारी एवं अद्भुत "" महिला बताया अपनी कहानियों के माध्यम से साहित्य जगत में अपनी छाप छोड़ी जिसने थी ।",[0] -> [2]
"नवंबर की अपनी नई दिल्ली यात्रा को उपयोगी और भारतीय नेताओं के साथ वार्ता को काफी रचनात्मक बताते हुए अज़ीज़ ने कहा कि रिश्तों में सुधार के लिए मजबूत फैसले लेने का हौसला हम में है और पुरानी मानसिकता से हटकर सोचना होगा , वर्ना वर्तमान मौका आसानी से चूक जाएगा ।","नवंबर की अपनी नई दिल्ली यात्रा को उपयोगी और भारतीय नेताओं के साथ वार्ता को काफी रचनात्मक बताते हुए अज़ीज़ ने कहा कि रिश्तों में सुधार के लिए मजबूत फैसले लेने का हौसला हम में है और पुरानी मानसिकता से हटकर सोचना होगा , वर्ना आसानी से चूक वर्तमान मौका जाएगा ।",[0] -> [2]
कुमार ने कहा कि राष्ट्रपति की बिहार यात्रा के मद्देनज़र वह राष्ट्रपति के काफ़िले के अन्य सुरक्षागार्डों के साथ ट्रेन से जबलपुर से पटना जा रहे थे .,कुमार ने कहा कि राष्ट्रपति की बिहार यात्रा के मद्देनज़र राष्ट्रपति के काफ़िले के अन्य सुरक्षागार्डों के साथ ट्रेन से जबलपुर से पटना जा वह रहे थे .,[0] -> [2]
अगर लोजपा भी राजद - कांग्रेस - माकपा गठबंधन में रहती तो आज नतीजे कुछ और होते ।,अगर राजद - कांग्रेस - माकपा गठबंधन में रहती लोजपा भी तो आज नतीजे कुछ और होते ।,[0] -> [2]
कुछ साल पहले तक गन्ने की उचित कीमत नहीं मिलने से किसानों को खेतों में ही गन्ना जलाना पड़ता था ।,कुछ साल पहले तक नहीं मिलने गन्ने की उचित कीमत से किसानों को खेतों में ही गन्ना जलाना पड़ता था ।,[0] -> [2]
यह कमाल बीते सप्ताह बाजार में आई एक साफ्टवेयर कंपनी ने किया है ।,यह कमाल बीते सप्ताह बाजार में आई किया एक साफ्टवेयर कंपनी ने है ।,[0] -> [2]
पिछले एक वर्ष में भारत - आसियान व्यापार में शानदार ४०.८ फीसदी की बढ़ोतरी हुई है ।,पिछले एक वर्ष में भारत - आसियान व्यापार में हुई शानदार ४०.८ फीसदी की बढ़ोतरी है ।,[0] -> [2]
तंगी के बावजूद पिता रमन वैद्यन ने उन्हें अच्छी प्राथमिक शिक्षा दिलाई ।,तंगी के बावजूद उन्हें अच्छी प्राथमिक शिक्षा दिलाई पिता रमन वैद्यन ने ।,[0] -> [2]
"रेफर्टी ने अपने हम्बलबम्स गीत "" हर फादर डिडन्ट लाइक मी एनीवे "" के नये संस्करण को एल्बम ओवर माई हेड ( 1994 ) में रिकॉर्ड किया ।","रेफर्टी ने अपने हम्बलबम्स गीत "" डिडन्ट लाइक हर फादर मी एनीवे "" के नये संस्करण को एल्बम ओवर माई हेड ( 1994 ) में रिकॉर्ड किया ।",[0] -> [2]
छात्रों का कहना है कि राजस्थान में बीजेपी की ही सरकार है और अगर धर्मेंद्र चाहते तो बीकानेर विश्वविद्यालय में फीस में कमी के साथ ही कुछ मदद दिला सकते थे ।,छात्रों का कहना है कि राजस्थान में बीजेपी की ही सरकार है और अगर चाहते धर्मेंद्र तो बीकानेर विश्वविद्यालय में फीस में कमी के साथ ही कुछ मदद दिला सकते थे ।,[0] -> [2]
लेकिन भारतीय विमान पत्तन के प्रवक्ता के अनुसार विमानों के उतरने व उड़ान भरने भर की रोशनी थी .,लेकिन भारतीय विमान पत्तन के प्रवक्ता के अनुसार उतरने विमानों के व उड़ान भरने भर की रोशनी थी .,[0] -> [2]
उन्होंने इस बात पर भी आपत्ति जताई कि सरकार इस मामले में अधिकारियों के जरिये अपनी स्थिति स्पष्ट करने की कोशिश कर रही है जबकि यह राजनीतिक फैसला है तथा प्रधानमंत्री या विदेश मंत्री को इस बारे में स्पष्टीकरण देना चाहिए ।,उन्होंने इस बात पर भी आपत्ति जताई कि सरकार इस मामले में अधिकारियों के जरिये अपनी स्थिति स्पष्ट करने की कोशिश कर रही है जबकि यह राजनीतिक फैसला है तथा इस बारे में स्पष्टीकरण देना प्रधानमंत्री या विदेश मंत्री को चाहिए ।,[0] -> [2]
भाजपा अध्यक्ष लाल कृष्ण आडवाणी के इस्तीफे की वापसी के बाद विश्व हिंदू परिषद के हाथ कुछ नहीं लगा है ।,भाजपा अध्यक्ष लाल कृष्ण आडवाणी के इस्तीफे की वापसी के बाद विश्व हिंदू परिषद के हाथ नहीं लगा कुछ है ।,[0] -> [2]
कुवैत का कहना है कि भारत अब इस समझौते से पीछे हट रहा है ।,कुवैत का कहना है कि अब इस समझौते से पीछे हट भारत रहा है ।,[0] -> [2]
"संवाददाताओं से बातचीत में जयसवाल ने कहा कि यदि कोई कहता है कि राज्यपालों को हटाया जाना संविधान के दायरे में नहीं आता , तो उसे नए सिरे से देश का कानून पढ़ना चाहिए ।","संवाददाताओं से बातचीत में जयसवाल ने कहा कि यदि कहता कोई है कि राज्यपालों को हटाया जाना संविधान के दायरे में नहीं आता , तो उसे नए सिरे से देश का कानून पढ़ना चाहिए ।",[0] -> [2]
दो अन्य घटनाओं में बीनागुड़ी के जंगलों में और कासंसुर में नक्सलियों ने पुलिस के गश्ती दल व पोलिंग पार्टी पर हमला कर दिया ।,दो अन्य घटनाओं में बीनागुड़ी के जंगलों में और कासंसुर में पुलिस के गश्ती दल व पोलिंग पार्टी पर हमला कर नक्सलियों ने दिया ।,[0] -> [2]
