sen_str,swapped_sen_str,leaf_rule
"심오한 인생 경험 , 그리고 예술적 진실에의 끊임 없는 탐구가 없고서는 예술 작품이 진가를 발휘하기란 아득한 일이다 .","심오한 인생 경험 , 그리고 예술적 진실에의 끊임 없는 탐구가 없고서는 진가를 발휘하기란 예술 작품이 아득한 일이다 .",[0] -> [1]
다양하고 재료의 제한이 없이 만드는 것이다 .,다양하고 없이 재료의 제한이 만드는 것이다 .,[0] -> [1]
""" 지금 일본의 수상이 누군 줄 아세요 ? "" 리에는 약간 당황한 표정을 짓고는 귀엽게 웃어 넘겼다 .",""" 지금 누군 일본의 수상이 줄 아세요 ? "" 리에는 약간 당황한 표정을 짓고는 귀엽게 웃어 넘겼다 .",[0] -> [1]
일반적으로 장거리 여행의 경우는 항공교통을 이용하는 것이 시간거리를 단축할 수 있는 장점을 가지고 있다 .,일반적으로 장거리 여행의 경우는 시간거리를 단축할 항공교통을 이용하는 것이 수 있는 장점을 가지고 있다 .,[0] -> [1]
"왜냐하면 예수 그리스도만이 인간이 구원 받을 수 있는 유일한 길이요 , 진리요 , 생명이기 때문이다 .","왜냐하면 인간이 구원 받을 수 있는 유일한 길이요 예수 그리스도만이 , 진리요 , 생명이기 때문이다 .",[0] -> [1]
결국 두 사람이 연인 발전한다 .,결국 연인 발전한다 두 사람이 .,[0] -> [1]
"한고조는 , 더 이상 무력을 통해 흉노를 정벌한다는 것이 어렵다는 결론에 도달했다 .","한고조는 , 더 이상 어렵다는 무력을 통해 흉노를 정벌한다는 것이 결론에 도달했다 .",[0] -> [1]
바닷가재 말고 다른 것도 좋아요,바닷가재 말고 좋아요 다른 것도,[0] -> [1]
이렇게 생각하니 앞서 말한 행동이 나온다 .,이렇게 생각하니 나온다 앞서 말한 행동이 .,[0] -> [1]
