sen_str,swapped_sen_str,leaf_rule
бꙑвьшѧ рано оу гроба ꙇ не обрѣтъшѧ тѣлесе его придѫ г҃лѭштѧ ꙇ авление а҃ньꙉлъ видѣвъшѧ ꙇже г҃лѭтъ і жива,бꙑвьшѧ рано оу гроба ꙇ не обрѣтъшѧ тѣлесе его придѫ г҃лѭштѧ ꙇ авление а҃ньꙉлъ видѣвъшѧ г҃лѭтъ ꙇже і жива,[0] -> [18] -> [19] -> [27]
и҅ вѣ беꙁ врѣда шъдъша придоховѣ къ старьцоу и҅же варивъ глагола къ нама,и҅ вѣ беꙁ врѣда шъдъша придоховѣ къ старьцоу варивъ глагола и҅же къ нама,[0] -> [18] -> [19] -> [27]
азъ же г҃л҄ѭ вамъ ѣко вьсѣкъ поуштаѩи женѫ своѭ развѣ словесе л҄юбодѣꙇнааго творитъ ѭ прѣл҄юбꙑ дѣати ꙇ иже подъпѣгѫ поемл҄етъ прѣл҄юбꙑ дѣетъ,азъ же г҃л҄ѭ вамъ ѣко вьсѣкъ поуштаѩи женѫ своѭ развѣ словесе л҄юбодѣꙇнааго творитъ ѭ прѣл҄юбꙑ дѣати ꙇ подъпѣгѫ поемл҄етъ иже прѣл҄юбꙑ дѣетъ,[0] -> [18] -> [19] -> [27]
придѣте и видите ч҃лка ꙇ҅же рече ми вьсѣ елико сътворихъ,придѣте и видите ч҃лка рече ꙇ҅же ми вьсѣ елико сътворихъ,[0] -> [18] -> [19] -> [27]
нъ въ е҅пискоупьствѣ а҅кꙑ въ манастꙑри троуждаа҅ше сꙙ дръжꙙ сꙙ паче по немьвениѥ стꙑдꙙ сꙙ не тъчьѭ̑ о҅тъ и҅ного видѣти сꙙ нъ и҅ самъ нагъ видѣти сꙙ помꙑшлꙗѧ а҅дамовѫ нагость и҅ ѥ҅же о҅ томь҆ и҅ полагааше ѥ҅динѫ бꙑти о҅тъ великꙑи҅хъ добротъ ѥ҅же не мꙑти сꙙ,нъ въ е҅пискоупьствѣ а҅кꙑ въ манастꙑри троуждаа҅ше сꙙ дръжꙙ сꙙ паче по немьвениѥ стꙑдꙙ сꙙ не тъчьѭ̑ о҅тъ и҅ного видѣти сꙙ нъ и҅ самъ нагъ видѣти сꙙ помꙑшлꙗѧ а҅дамовѫ нагость и҅ о҅ томь҆ ѥ҅же и҅ полагааше ѥ҅динѫ бꙑти о҅тъ великꙑи҅хъ добротъ ѥ҅же не мꙑти сꙙ,[0] -> [18] -> [19] -> [27]
ꙇ иже зълословитъ о҃тца ли матерь съмрътьѭ҄ оумьретъ,ꙇ зълословитъ иже о҃тца ли матерь съмрътьѭ҄ оумьретъ,[0] -> [18] -> [19] -> [27]
би оубо боꙗ҅ти сꙙ паче бога и҅ г꙯а нашего їсоу х꙯а паче сихъ рекомꙑи҅хъ богъ и҅же соуѥ҅ть҆ні сѫтъ,би оубо боꙗ҅ти сꙙ паче бога и҅ г꙯а нашего їсоу х꙯а паче сихъ рекомꙑи҅хъ богъ соуѥ҅ть҆ні и҅же сѫтъ,[0] -> [18] -> [19] -> [27]
с н҄имъ сь҆нидѣмъ Да о̑увѣмъ таи҅нꙑѧ҅ ѧ҅же тоу,с н҄имъ сь҆нидѣмъ Да о̑увѣмъ таи҅нꙑѧ҅ тоу ѧ҅же,[0] -> [18] -> [19] -> [27]
ꙇ блажена ѣже вѣрѫ ѩтъ ѣко бѫдетъ съвръшение г҃ланꙑмъ отъ г҃и,ꙇ блажена вѣрѫ ѩтъ ѣже ѣко бѫдетъ съвръшение г҃ланꙑмъ отъ г҃и,[0] -> [18] -> [19] -> [27]
д҃хъ естъ иже живлѣатъ,д҃хъ естъ живлѣатъ иже,[0] -> [18] -> [19] -> [27]
