sen_str,swapped_sen_str,leaf_rule
شهر ۾ 2 کان 3 فوٽ پاڻي داخل ٿي ويو ،,شهر ۾ داخل 2 کان 3 فوٽ پاڻي ٿي ويو ،,[0] -> [1] -> [2]
اسان ۾ سهپ جو مادو گھٽ آهي .,اسان ۾ گھٽ سهپ جو مادو آهي .,[0] -> [1] -> [2]
ئ اها خبر پئي ته هوءَ تمام گھڻي خوش آهي,ئ اها خبر پئي ته تمام گھڻي خوش هوءَ آهي,[0] -> [1] -> [2]
گدڙ ڪڙڪي مان چيس ته : مان آهيان مير خان پاٻوڙي ،,گدڙ ڪڙڪي مان چيس ته : آهيان مير مان خان پاٻوڙي ،,[0] -> [1] -> [2]
گدڙ کي سگهو ساهه پيٽ ۾ ڪونه هو ،,گدڙ کي سگهو پيٽ ساهه ۾ ڪونه هو ،,[0] -> [1] -> [2]
ملتان ( آن لائن / مانيٽرنگ ڊيسڪ ) وزيراعظم يوسف رضا گيلاني چيو آهي ته ڪالاباغ ڊيم سياسي مسئلو آهي ،,ملتان ( آن لائن / مانيٽرنگ ڊيسڪ ) وزيراعظم يوسف رضا گيلاني چيو آهي ته سياسي مسئلو ڪالاباغ ڊيم آهي ،,[0] -> [1] -> [2]
اهو ٻڌي گدڙ کي پيٽ ۾ ڪجهه ساهه پيو ،,اهو ٻڌي پيٽ ۾ ڪجهه ساهه گدڙ کي پيو ،,[0] -> [1] -> [2]
هن چيو ته 2005ع جي زلزلي ۾ جهڙي ريت عوام پنهنجن ڀائرن جي خدمت ڪئي ۽ مشڪل گهڙي ۾ شيهي جي ڀت وانگر مقابلو ڪيو اهڙي طرح ئي هن ٻوڏ واري آفت ۾ به قوم هڪ ٿي وڃي ته جيئن چئلينج کي آساني سان منهن ڏئي سگهجي ،,هن چيو ته 2005ع جي زلزلي ۾ جهڙي ريت عوام پنهنجن ڀائرن جي خدمت ڪئي ۽ مشڪل گهڙي ۾ شيهي جي ڀت وانگر مقابلو ڪيو اهڙي طرح ئي هن ٻوڏ واري آفت ۾ به هڪ قوم ٿي وڃي ته جيئن چئلينج کي آساني سان منهن ڏئي سگهجي ،,[0] -> [1] -> [2]
وهڪرن ۾ واڌ کانپوءِ ڪچي توڙي پڪي جي علائقن مان به لڏ پلاڻ جو سلسلو تيز ٿي ويو آهي ،,وهڪرن ۾ واڌ کانپوءِ ڪچي توڙي پڪي جي علائقن مان به تيز لڏ پلاڻ جو سلسلو ٿي ويو آهي ،,[0] -> [1] -> [2]
اچو ته گڏجي راند کيڏون ، راندروند سان صحت بهتر ٿئي ٿي .,اچو ته گڏجي راند کيڏون ، راندروند سان بهتر صحت ٿئي ٿي .,[0] -> [1] -> [2]
هن چيو ته ٻوڏ ايتري ته وڏي تباهي آندي آهي جو ان جو فوري ازالو ممڪن ناهي .,هن چيو ته ٻوڏ ايتري ته وڏي تباهي آندي آهي جو ممڪن ان جو فوري ازالو ناهي .,[0] -> [1] -> [2]
ٻارن کي ڪارٽون گھڻا پسند آهن .,ٻارن کي گھڻا پسند ڪارٽون آهن .,[0] -> [1] -> [2]
جيڪڏهن ائين ڪيو وڃي ها ته آرٽيڪل 238 ۽ 239 جو جواز ختم ٿي وڃي ٿو ،,جيڪڏهن ائين ڪيو وڃي ها ته ختم آرٽيڪل 238 ۽ 239 جو جواز ٿي وڃي ٿو ،,[0] -> [1] -> [2]
هڪڙي ڏينهن شينهڻ گدڙ کي چيو ته : منهنجي طبيعت ٺيڪ نه آهي ،,هڪڙي ڏينهن شينهڻ گدڙ کي چيو ته : ٺيڪ منهنجي طبيعت نه آهي ،,[0] -> [1] -> [2]
هاڻي ٻڌاءِ ته تون ڪير آهين ؟ ائين چئي ،,هاڻي ٻڌاءِ ته ڪير تون آهين ؟ ائين چئي ،,[0] -> [1] -> [2]
ڌڻي جي مهرباني سان ڪمپيوٽر تي سنڌي فونٽ بهتر مقدار ۾ موجود آهن .,ڌڻي جي مهرباني سان ڪمپيوٽر تي بهتر مقدار ۾ موجود سنڌي فونٽ آهن .,[0] -> [1] -> [2]
نه ته تنهنجو خير ڪونه هوندو .,نه ته خير تنهنجو ڪونه هوندو .,[0] -> [1] -> [2]
ڪي ڪي آغا چيو ته عدالت پارليامينٽ جي منظور ڪيل ترميم تي نظرثاني نٿي ڪري سگهي ،,ڪي ڪي آغا چيو ته پارليامينٽ جي منظور ڪيل ترميم تي نظرثاني عدالت نٿي ڪري سگهي ،,[0] -> [1] -> [2]
هر 3 ماهي لاءِ سيلنگ مقرر ،,هر 3 ماهي لاءِ مقرر سيلنگ ،,[0] -> [1] -> [2]
سو وايون بطال ٿي ويس .,سو بطال وايون ٿي ويس .,[0] -> [1] -> [2]
اصل ۾ اهو پاڻي 12 لک ڪيوسڪ جي لڳ ڀڳ هو ،,اصل ۾ 12 لک ڪيوسڪ جي لڳ ڀڳ اهو پاڻي هو ،,[0] -> [1] -> [2]
پر اوهان کي بچائڻ منهنجو فرض آهي ،,پر اوهان کي منهنجو فرض بچائڻ آهي ،,[0] -> [1] -> [2]
ڇا اهو سمجهيو وڃي ته ان کي به عوام جي تائيد حاصل هئي ،,ڇا اهو سمجهيو وڃي ته عوام جي تائيد حاصل ان کي به هئي ،,[0] -> [1] -> [2]
هن وڌيڪ چيو ته ڪالاباغ ڊيم جي تعمير جون خواهشون به ان وقت ئي پوريون ٿي سگهن ٿيون جڏهن اتحاد ٿيندو ،,هن وڌيڪ چيو ته ان وقت ئي پوريون ڪالاباغ ڊيم جي تعمير جون خواهشون به ٿي سگهن ٿيون جڏهن اتحاد ٿيندو ،,[0] -> [1] -> [2]
ڪو خريدوفروخت لاءِ هن وٽ سامان جي ڪونهي جنهن سان ڪي ڪجھ خوشي جا پل ڏسي سگھن ،,ڪو خريدوفروخت لاءِ سامان هن وٽ جي ڪونهي جنهن سان ڪي ڪجھ خوشي جا پل ڏسي سگھن ،,[0] -> [1] -> [2]
هن چيو ته ملڪ ۾ ماڻهو ٻوڏ تباهين ۾ آهن پر صدر زرداري کين اڪيلو ڇڏي پرڏيهه دورا ڪري رهيو آهي ،,هن چيو ته ملڪ ۾ ٻوڏ تباهين ماڻهو ۾ آهن پر صدر زرداري کين اڪيلو ڇڏي پرڏيهه دورا ڪري رهيو آهي ،,[0] -> [1] -> [2]
جو توهين اسان جا بادشاهه آهيو .,جو اسان جا بادشاهه توهين آهيو .,[0] -> [1] -> [2]
ملڪ سان محبت ايمان جي نشاني آهي .,ملڪ سان ايمان جي نشاني محبت آهي .,[0] -> [1] -> [2]
پر تون ڪير آهين ،,پر ڪير تون آهين ،,[0] -> [1] -> [2]
ان حساب سان پهرين ٻن 3 ماهي دوران هن منصوبن لاءِ وڌ ۾ وڌ 7 سيڪڙو ٽئين 3 ماهي دوران ماهوار 8 سيڪڙو ،,ان حساب سان پهرين ٻن 3 ماهي دوران هن منصوبن لاءِ ٽئين 3 ماهي دوران ماهوار 8 سيڪڙو وڌ ۾ وڌ 7 سيڪڙو ،,[0] -> [1] -> [2]
آخر مرد ۽ عورت ۾ ڪِن خاص عضون کانسواءِ ڪهڙو فرق آهي جو مرد پاڻ کي برتر ۽ عظيم سمجهي ٿو .,آخر مرد ۽ عورت ۾ ڪِن خاص عضون کانسواءِ فرق ڪهڙو آهي جو مرد پاڻ کي برتر ۽ عظيم سمجهي ٿو .,[0] -> [1] -> [2]
تو کي ڪهڙي خبر ته هُو منهنجي زندگي آهي .,تو کي ڪهڙي خبر ته منهنجي زندگي هُو آهي .,[0] -> [1] -> [2]
هن کي ڪهڙي خبر ته هُو منهنجي زندگي آهي .,هن کي ڪهڙي خبر ته منهنجي زندگي هُو آهي .,[0] -> [1] -> [2]
اڄ عيد ميلادالنبي آهي ۽ اسان سڀ تمام گھڻا خوش آهيون .,اڄ عيد ميلادالنبي آهي ۽ سڀ تمام گھڻا خوش اسان آهيون .,[0] -> [1] -> [2]
سچي رشتي کانسواءِ ڌرتي تي انسانن جو رهڻ مشڪل آهي .,سچي رشتي کانسواءِ ڌرتي تي مشڪل انسانن جو رهڻ آهي .,[0] -> [1] -> [2]
ڪجهه آزاد ذريعن جو چوڻ آهي ته پاڻي جي وهڪري بابت جاري ڪيل انگ اکر صحيح نه هئا ،,ڪجهه آزاد ذريعن جو چوڻ آهي ته صحيح پاڻي جي وهڪري بابت جاري ڪيل انگ اکر نه هئا ،,[0] -> [1] -> [2]
ٻوڏ کي منهن ڏيڻ هڪ وڏو اهم چئلينج آهي پر مون کي اميد آهي ته اسان ان چئلينج کي عوام جي مدد سان منهن ڏئي وينداسين ،,ٻوڏ کي منهن ڏيڻ هڪ وڏو اهم چئلينج آهي پر اميد مون کي آهي ته اسان ان چئلينج کي عوام جي مدد سان منهن ڏئي وينداسين ،,[0] -> [1] -> [2]
ڪـن وچ هيري مـوتي ،,ڪـن وچ مـوتي هيري ،,[0] -> [1] -> [2]
هن چيو ته مظفر ڳڙهه ۾ پارڪو جي تيل سپلاءِ بند ٿي وئي آهي ۽ اها 8 کان 10 ڏينهن تائين بند رهندي .,هن چيو ته بند مظفر ڳڙهه ۾ پارڪو جي تيل سپلاءِ ٿي وئي آهي ۽ اها 8 کان 10 ڏينهن تائين بند رهندي .,[0] -> [1] -> [2]
گدڙ جو شڪاري ڪتن کي ڏٺو ، سو وايون بطال ٿي ويس .,گدڙ جو شڪاري ڪتن کي ڏٺو ، سو بطال وايون ٿي ويس .,[0] -> [1] -> [2]
جڏهن ته اڳوڻي تعلقي ناظم علي نواز شهلياڻي شهر جي ٻڏڻ واري خطري جي ڪري ڪئنال کي مختلف جاين تي ڪٽ ڏيڻ جي به ڪوشش ڪئي پر ماڻهن کيس روڪي ورتو ،,جڏهن ته اڳوڻي تعلقي ناظم علي نواز شهلياڻي شهر جي ٻڏڻ واري خطري جي ڪري ڪئنال کي مختلف جاين تي ڪٽ ڏيڻ جي به ڪوشش ڪئي پر کيس روڪي ماڻهن ورتو ،,[0] -> [1] -> [2]
هن چيو ته 18 فيبروري 2008ع جون چونڊون ۽ ان جي نتيجي ۾ چونڊيل پارليامينٽ عوامي خواهشن جي مظهر آهي ،,هن چيو ته عوامي خواهشن جي مظهر 18 فيبروري 2008ع جون چونڊون ۽ ان جي نتيجي ۾ چونڊيل پارليامينٽ آهي ،,[0] -> [1] -> [2]
جيڪڏهن نيت صاف نه آهي ته وک وک تي ڏکيايون ۽ مشڪلاتون ملن ٿيون .,جيڪڏهن صاف نيت نه آهي ته وک وک تي ڏکيايون ۽ مشڪلاتون ملن ٿيون .,[0] -> [1] -> [2]
ڇاڪاڻ ته اسين جهنگلي جانورن جا بادشاهه آهيون ،,ڇاڪاڻ ته جهنگلي جانورن جا بادشاهه اسين آهيون ،,[0] -> [1] -> [2]
بت ڪانڊاري ڪڙڪيدار آواز ۾ پڇيائين ته : ڪير آهين ؟ شينهڻ جواب ڏنس ته : اسين شينهن ،,بت ڪانڊاري ڪڙڪيدار آواز ۾ پڇيائين ته : ڪير آهين ؟ شينهڻ جواب ڏنس ته : شينهن اسين ،,[0] -> [1] -> [2]
نينوا ، بابل ، سميري ، ايران ۽ مصر جي تهذيب کان آڳاٽي ۽ انوکي آهي انڪري سنڌ نه صرف سنڌين جي ماءُ آهي پر قديم يونان ۽ مصر جي ماءُ پڻ آهي .,نينوا ، بابل ، سميري ، ايران ۽ مصر جي تهذيب کان آڳاٽي ۽ انوکي آهي انڪري نه صرف سنڌين جي ماءُ سنڌ آهي پر قديم يونان ۽ مصر جي ماءُ پڻ آهي .,[0] -> [1] -> [2]
هوڏانهن ڪنڌرا لڳ آرمري بنگلو وٽ امڪاني ٻوڏ سبب لڏپلاڻ لاءِ گهر جي ڇت جو پکو لاهيندي هڪ ڄڻو ڪرنٽ لڳڻ سبب فوت ٿي ويو .,هوڏانهن ڪنڌرا لڳ آرمري بنگلو وٽ امڪاني ٻوڏ سبب لڏپلاڻ لاءِ گهر جي ڇت جو پکو لاهيندي ڪرنٽ لڳڻ سبب فوت هڪ ڄڻو ٿي ويو .,[0] -> [1] -> [2]
مِينهن جي مند ۾ کنڀيون جام ٿين .,مِينهن جي مند ۾ جام کنڀيون ٿين .,[0] -> [1] -> [2]
ڪميشن مطابق فنڊ جاري ڪرڻ واري پروفارما تي پرنسپل اڪائونٽنگ آفيسر يا سندس جاءِ تي ڪم ڪندڙ بااختيار عملدار جي صحيح لازمي هوندي ،,ڪميشن مطابق فنڊ جاري ڪرڻ واري پروفارما تي لازمي پرنسپل اڪائونٽنگ آفيسر يا سندس جاءِ تي ڪم ڪندڙ بااختيار عملدار جي صحيح هوندي ،,[0] -> [1] -> [2]
ڪو ڪيئن چوي ڪو ڪيئن چوي مان جوئي آهيان سوئي آهيان .,ڪو ڪيئن چوي ڪو ڪيئن چوي جوئي مان آهيان سوئي آهيان .,[0] -> [1] -> [2]
رات جو وڳڙو ، هن جو خيال سارو هو ڪڪڙين ۾ ،,رات جو وڳڙو ، سارو هو ڪڪڙين هن جو خيال ۾ ،,[0] -> [1] -> [2]
پاڻي کانسواءِ انسان جو وجود ناممڪن آهي .,پاڻي کانسواءِ ناممڪن انسان جو وجود آهي .,[0] -> [1] -> [2]
جو اهو پاڻي ايتري ئي زبردست پريشر ،,جو ايتري ئي زبردست پريشر اهو پاڻي ،,[0] -> [1] -> [2]
هالا ( ن ڪ ) هالا ڀرسان ايس ايم بچاءَ بند وٽان وهندڙ سنڌو درياءَ ۾ چاڙهه کانپوءِ حساس قرار ڏنل ڀاڻوٺ ، هالا پراڻا ، ماڙي محمد خان ، سيکاٽ ، بائوديرو ۽ ٻين هنڌن تي خوف واري صورتحال پيدا ٿي وئي آهي ،,هالا ( ن ڪ ) هالا ڀرسان ايس ايم بچاءَ بند وٽان وهندڙ سنڌو درياءَ ۾ چاڙهه کانپوءِ حساس قرار ڏنل ڀاڻوٺ ، هالا پراڻا ، ماڙي محمد خان ، سيکاٽ ، بائوديرو ۽ ٻين هنڌن تي پيدا خوف واري صورتحال ٿي وئي آهي ،,[0] -> [1] -> [2]
سومر تي اسان کي موڪل آهي .,سومر تي موڪل اسان کي آهي .,[0] -> [1] -> [2]
بريفنگ دوران وفاقي وزير سيد خورشيد احمد شاهه ۽ جي او سي پنوعاقل ڇانوڻي پڻ موجود هئا .,بريفنگ دوران موجود وفاقي وزير سيد خورشيد احمد شاهه ۽ جي او سي پنوعاقل ڇانوڻي پڻ هئا .,[0] -> [1] -> [2]
اتفاق سان ڳوٺ جي دائي جو به اُن ڏينهن ڪو گڏهه گم ٿي ويو هو ،,اتفاق سان ڳوٺ جي دائي جو به اُن ڏينهن گم ڪو گڏهه ٿي ويو هو ،,[0] -> [1] -> [2]
ڇا ( ر ) جنرل پرويز مشرف جي 3 نومبر وارن قدمن کي عوام جي حمايت حاصل هئي جو موجوده پارليامينٽ ان جي مذمت ناهي ڪئي ،,ڇا ( ر ) جنرل پرويز مشرف جي 3 نومبر وارن قدمن کي حاصل عوام جي حمايت هئي جو موجوده پارليامينٽ ان جي مذمت ناهي ڪئي ،,[0] -> [1] -> [2]
روشني ۽ پاڻي کانسواءِ زمين تي انسان جو وجود ناممڪن آهي .,روشني ۽ پاڻي کانسواءِ زمين تي ناممڪن انسان جو وجود آهي .,[0] -> [1] -> [2]
سو هنن کي چيائين : توهان جو ڪهڙو فيصلو آهي ؟ گداڙي ٻڌايو ته : اسان جا پنج ٻچا آهن ،,سو هنن کي چيائين : توهان جو فيصلو ڪهڙو آهي ؟ گداڙي ٻڌايو ته : اسان جا پنج ٻچا آهن ،,[0] -> [1] -> [2]
گھڻو ڪري ماڻهو لاتعلقي جو اظهار ڪري پنهنجي ذميواري نٿا نڀائين .,گھڻو ڪري لاتعلقي جو اظهار ڪري پنهنجي ذميواري ماڻهو نٿا نڀائين .,[0] -> [1] -> [2]
هن مهل تائين سميري تهذيب کي آڳاٽي تصور ڪيو وڃي ٿو پر سنڌ سمير کان نه رڳو آڳاٽي سرسبز ۽ خوشحال سرزمين آهي پر تمدني ۽ تهذيبي اعتبار کان به ڪيترائي درجا بلند آهي ۽ هر حالت ۾ دنيا جي قديم ترين علائقي سمير کان مٿاهين ۽ اوليت رکندڙ آهي .,هن مهل تائين سميري تهذيب کي آڳاٽي تصور ڪيو وڃي ٿو پر سنڌ سمير کان نه رڳو آڳاٽي سرسبز ۽ خوشحال سرزمين آهي پر تمدني ۽ تهذيبي اعتبار کان به بلند ڪيترائي درجا آهي ۽ هر حالت ۾ دنيا جي قديم ترين علائقي سمير کان مٿاهين ۽ اوليت رکندڙ آهي .,[0] -> [1] -> [2]
الاجي ڪير آهي شينهڻ چين ته : اهو اٿو ميرخان پاٻوڙي ،,الاجي ڪير آهي چين شينهڻ ته : اهو اٿو ميرخان پاٻوڙي ،,[0] -> [1] -> [2]
فوت ٿيل ٻارڙن ۾ علي حيدر ، سندس ڀيڻ عائشه ، ٻه ڀائر قربان ، معشوق ۽ زاهد پٽ صالح شامل آهن ،,فوت ٿيل ٻارڙن ۾ شامل علي حيدر ، سندس ڀيڻ عائشه ، ٻه ڀائر قربان ، معشوق ۽ زاهد پٽ صالح آهن ،,[0] -> [1] -> [2]
گدڙ پنهنجي ساراهه ٻڌي ڏاڍو خوش ٿيو ، ۽ ٻڪرين کي پاڻي پيئڻ جي موڪل ڏنائين .,گدڙ پنهنجي ساراهه ٻڌي ڏاڍو خوش ٿيو ، ۽ پاڻي پيئڻ جي موڪل ٻڪرين کي ڏنائين .,[0] -> [1] -> [2]
سا سڄي ڳالهه سمجهي ويئي ته هي سڀ بدمعاشي انهيءَ گدڙ جي آهي ،,سا سڄي ڳالهه سمجهي ويئي ته انهيءَ گدڙ هي سڀ بدمعاشي جي آهي ،,[0] -> [1] -> [2]
ڇا ( ر ) جنرل مشرف جي 3 نومبر جي قدمن کي عوام جي حمايت حاصل هئي ،,ڇا ( ر ) جنرل مشرف جي 3 نومبر جي قدمن کي حاصل عوام جي حمايت هئي ،,[0] -> [1] -> [2]
سنڌ صوفين جي ڌرتي آهي ۽ سنڌي پيار ڪندڙ قوم آهي .,سنڌ صوفين جي ڌرتي آهي ۽ پيار ڪندڙ قوم سنڌي آهي .,[0] -> [1] -> [2]
ڇا اهو سمجهيو وڃي ته 3 نومبر وارن قدمن بابت عوام جي تائيد حاصل هئي ،,ڇا اهو سمجهيو وڃي ته 3 نومبر وارن قدمن بابت حاصل عوام جي تائيد هئي ،,[0] -> [1] -> [2]
ڪي ڪي آغا چيو ته ججن جي مقرري جي طريقيڪار ۾ تبديلي جي لاءِ پارليامينٽ کي عوام جو واضح مينڊيٽ حاصل هو ۽ تبديلي ميثاق جمهوريت جو حصو هئي ،,ڪي ڪي آغا چيو ته ججن جي مقرري جي طريقيڪار ۾ تبديلي جي لاءِ عوام جو واضح مينڊيٽ حاصل پارليامينٽ کي هو ۽ تبديلي ميثاق جمهوريت جو حصو هئي ،,[0] -> [1] -> [2]
هن وقت اسان کي اتحاد جي ضرورت آهي ته جيئن پاڪستان هڪ مضبوط ملڪ بڻجي اڀري ،,هن وقت اتحاد جي ضرورت اسان کي آهي ته جيئن پاڪستان هڪ مضبوط ملڪ بڻجي اڀري ،,[0] -> [1] -> [2]
گدڙ کي ڀڄندو ڏسي شينهڻ هڪل ڪري چيس ته : مير خان ،,گدڙ کي ڀڄندو ڏسي شينهڻ هڪل ڪري چيس ته : خان مير ،,[0] -> [1] -> [2]
گدڙ چيو ته : مان آهيان ميرخان پاٻوڙي ،,گدڙ چيو ته : مان آهيان پاٻوڙي ميرخان ،,[0] -> [1] -> [2]
جن ۾ بچل ڀيو بچاءُ بند ، چڪ بچاءَ بند ، ممدا باغ وارو بچاءُ بند ، خانپور ڀرسان واقع بچاءُ بند ، منڊوديرو بچاءُ بند ، الف ڪچي وارو بچاءُ بند ، غلام بند ، سانگي بچاءُ بند ، دفر ڳوٺ ڀرسان واقع بچاءُ بند ، سومرا پنهواري وارو بچاءُ بند ، سرائي واري دمدمي جو بچاءَ بند ، ڪچو ٻنڊي بچاءُ بند ، گيمڙو بچاءُ بند ، قادرپور بچاءُ بند ، سندراڻي بچاءُ بند ، ٻيلو ميرپور بچاءُ بند ۽ گبلو بچاءُ بند شامل آهن ،,جن ۾ شامل بچل ڀيو بچاءُ بند ، چڪ بچاءَ بند ، ممدا باغ وارو بچاءُ بند ، خانپور ڀرسان واقع بچاءُ بند ، منڊوديرو بچاءُ بند ، الف ڪچي وارو بچاءُ بند ، غلام بند ، سانگي بچاءُ بند ، دفر ڳوٺ ڀرسان واقع بچاءُ بند ، سومرا پنهواري وارو بچاءُ بند ، سرائي واري دمدمي جو بچاءَ بند ، ڪچو ٻنڊي بچاءُ بند ، گيمڙو بچاءُ بند ، قادرپور بچاءُ بند ، سندراڻي بچاءُ بند ، ٻيلو ميرپور بچاءُ بند ۽ گبلو بچاءُ بند آهن ،,[0] -> [1] -> [2]
گهربل فنڊ جاري ڪرڻ لاءِ اڳ ۾ جاري ڪيل رقم جي استعمال جا تفصيل ڏيڻ ۽ منصوبي تي عمل درآمد جي حوالي سان پرنسپل اڪائونٽنگ آفيسر جو مطمئن هئڻ جو سرٽيفڪيٽ لازمي هوندو ،,گهربل فنڊ جاري ڪرڻ لاءِ اڳ ۾ جاري ڪيل رقم جي استعمال جا تفصيل ڏيڻ ۽ منصوبي تي عمل درآمد جي حوالي سان لازمي پرنسپل اڪائونٽنگ آفيسر جو مطمئن هئڻ جو سرٽيفڪيٽ هوندو ،,[0] -> [1] -> [2]
ڪي ڪي آغا چيو ته رضا رباني ڪاميٽي ۾ سڀني پارٽين جا ميمبر شامل هئا ،,ڪي ڪي آغا چيو ته رضا رباني ڪاميٽي ۾ شامل سڀني پارٽين جا ميمبر هئا ،,[0] -> [1] -> [2]
راند کيڏڻ سان صحت سٺي ٿئي ٿي .,راند کيڏڻ سان سٺي صحت ٿئي ٿي .,[0] -> [1] -> [2]
جنهن تحت منطور ٿيل ترقياتي منصوبن لاءِ مالي سال جي پهرين ۽ ٻئي 3 ماهي ۾ وڌ ۾ وڌ سيلنگ 20 سيڪڙو ،,جنهن تحت منطور ٿيل ترقياتي منصوبن لاءِ مالي سال جي پهرين ۽ ٻئي 3 ماهي ۾ 20 سيڪڙو وڌ ۾ وڌ سيلنگ ،,[0] -> [1] -> [2]
مونکي منهنجي سنڌ منهنجي جان کان وڌيڪ پياري آهي .,مونکي منهنجي جان کان وڌيڪ پياري منهنجي سنڌ آهي .,[0] -> [1] -> [2]
جنهن ڪري ريلوي ٽريڪ ۽ قومي شاهراهه تي ٽرئفڪ معطل ٿي وئي ،,جنهن ڪري ريلوي ٽريڪ ۽ قومي شاهراهه تي معطل ٽرئفڪ ٿي وئي ،,[0] -> [1] -> [2]
غلامي جي زندگي کان عزت جو موت بهتر آهي .,غلامي جي زندگي کان بهتر عزت جو موت آهي .,[0] -> [1] -> [2]
جسٽس رمدي چيو ته جوڊيشل ڪميشن ججن جي مقرري جي طريقيڪار ۾ اصلاح جي لاءِ قائم ڪرڻي هئي ۽ ججن جي مقرري لاءِ نه ،,جسٽس رمدي چيو ته ججن جي مقرري جي طريقيڪار ۾ اصلاح جي لاءِ قائم ڪرڻي جوڊيشل ڪميشن هئي ۽ ججن جي مقرري لاءِ نه ،,[0] -> [1] -> [2]
ڪڙميءَ پڇيس ته : تون ڪير آهين ؟,ڪڙميءَ پڇيس ته : ڪير تون آهين ؟,[0] -> [1] -> [2]
موجوده گورننس تي عوام کي اعتماد ناهي ،,موجوده گورننس تي اعتماد عوام کي ناهي ،,[0] -> [1] -> [2]
پنڌ ڪرڻ سان صحت بهتر ٿئي ٿي .,پنڌ ڪرڻ سان بهتر صحت ٿئي ٿي .,[0] -> [1] -> [2]
ٻڌڻي شروع ٿي ته حڪومت طرفان ڊپٽي اٽارني جنرل ڪي ڪي آغا دليل ڏيندي چيو ته 1973ع جي آئين ۾ ڪنهن به شق کي ناقابل ترميم قرار نٿو ڏئي سگهجي ،,ٻڌڻي شروع ٿي ته حڪومت طرفان ڊپٽي اٽارني جنرل ڪي ڪي آغا دليل ڏيندي چيو ته 1973ع جي آئين ۾ ڪنهن به شق کي قرار ناقابل ترميم نٿو ڏئي سگهجي ،,[0] -> [1] -> [2]
پر جيڪا تنهنجي مرضي .,پر تنهنجي مرضي جيڪا .,[0] -> [1] -> [2]
سنڌ پاڪستان جو صوبو آهي ۽ هتان جا ماڻهو سادا آهن .,سنڌ پاڪستان جو صوبو آهي ۽ سادا هتان جا ماڻهو آهن .,[0] -> [1] -> [2]
ان بعد مائيءَ کي چيائين ته : هاڻي منهنجي پڇ کي وٺي ٻٽي ڇڪيون ڏي ته منهنجي ماني هضم ٿئي ،,ان بعد مائيءَ کي چيائين ته : هاڻي منهنجي پڇ کي وٺي ٻٽي ڇڪيون ڏي ته هضم منهنجي ماني ٿئي ،,[0] -> [1] -> [2]
ٽڪار جو نالو ٻڌندي ئي هيٺيون شينهن تند ٿي ويو ،,ٽڪار جو نالو ٻڌندي ئي تند هيٺيون شينهن ٿي ويو ،,[0] -> [1] -> [2]
شينهن کي چيائين : هو دايو ،,شينهن کي چيائين : دايو هو ،,[0] -> [1] -> [2]
بيگاري ڪئنال ۾ گهارن پوڻ کان جڏهن دروازن کان پاڻي اوور فلو ٿيو ته ڊي پي او ۽ ڊي سي او جيڪب آباد پاران مولاداد ،,بيگاري ڪئنال ۾ گهارن پوڻ کان جڏهن دروازن کان پاڻي اوور فلو ٿيو ته مولاداد ڊي پي او ۽ ڊي سي او جيڪب آباد پاران ،,[0] -> [1] -> [2]
هن چيو ته عوام مايوس نه ٿئي ،,هن چيو ته مايوس عوام نه ٿئي ،,[0] -> [1] -> [2]
هن ملڪ ۾ جيڪو ڏاڍو سو گابو آ .,هن ملڪ ۾ گابو جيڪو ڏاڍو سو آ .,[0] -> [1] -> [2]
سو سمجهيائين ته ٽڪار ڪا مون کان به اهڙي زبردست آفت آهي ،,سو سمجهيائين ته ڪا مون کان به اهڙي زبردست آفت ٽڪار آهي ،,[0] -> [1] -> [2]
نوجوانن ۾ سهپ جو مادو گھٽ آهي .,نوجوانن ۾ گھٽ سهپ جو مادو آهي .,[0] -> [1] -> [2]
جن جي لاءِ شينهن جي کل گهربل هئي .,جن جي لاءِ گهربل شينهن جي کل هئي .,[0] -> [1] -> [2]
