sen_str,swapped_sen_str,leaf_rule
แต่ เมื่อ ฉัน บอก ให้ เธอ ติดต่อ แฟรงค์ ให้ ไป เป็น นาย แบบ ให้ เธอ เธอ ก็ หัวเราะ,แต่ เมื่อ ฉัน บอก ให้ เธอ ติดต่อ แฟรงค์ ให้ ไป เป็น นาย แบบ ให้ เธอ ก็ หัวเราะ เธอ,[0]
เขา ได้รับ เลื่อน ตำแหน่ง ให้ เป็น ประธาน ใน เดือน ตุลาคม 2015 ซึ่ง เป็น เดือน ถัดมา หลัง จาก ที่ เรื่อง อื้อฉาว ปรากฏ ขึ้น,เขา ได้รับ เลื่อน ตำแหน่ง ให้ เป็น ประธาน ใน เดือน ตุลาคม 2015 เป็น เดือน ซึ่ง ถัดมา หลัง จาก ที่ เรื่อง อื้อฉาว ปรากฏ ขึ้น,[0]
อย่าง ไร ก็ ตาม มี สมาชิก สภา นิติบัญญัติ ที่ มี ความเชื่อ ทาง ศาสนา อย่างแรงกล้า จำนวน มาก ที่ คัดค้าน การออก กฎหมาย ใหม่ ๆ,อย่าง ไร ก็ ตาม มี สมาชิก สภา นิติบัญญัติ ที่ มี ความเชื่อ ทาง ศาสนา อย่างแรงกล้า จำนวน มาก คัดค้าน ที่ การออก กฎหมาย ใหม่ ๆ,[0]
ราฟเฟอร์ตี้ ออก อีก สอง อัลบั้ม ใน ช่วง ทศวรรษ ที่ 1990 ที่ นัก ดนตรี ทอม โรบินสัน ได้ กล่าว ภาย หลัง ว่า เป็น “ การกลับ มา อย่างยิ่งใหญ่ เพื่อ สร้าง ”,ราฟเฟอร์ตี้ ออก อีก สอง อัลบั้ม ใน ช่วง ทศวรรษ ที่ 1990 ที่ ได้ กล่าว นัก ดนตรี ทอม โรบินสัน ภาย หลัง ว่า เป็น “ การกลับ มา อย่างยิ่งใหญ่ เพื่อ สร้าง ”,[0]
นี่ เป็น หายนะ สำหรับ ผู้ ป่วย ที่ มี อาการ เจ็บปวด เมลลิส กล่าว กับ ซีบีซี นิวส์ ใน การสัมภาษณ์ เมื่อ วัน พฤหัสบดี,นี่ เป็น หายนะ สำหรับ ผู้ ป่วย มี ที่ อาการ เจ็บปวด เมลลิส กล่าว กับ ซีบีซี นิวส์ ใน การสัมภาษณ์ เมื่อ วัน พฤหัสบดี,[0]
แต่ ผล การสแกน แสดง ว่า เนื้อ งอก ใน ปอด ขวา ของ นางสาว พุก กำลัง โต ขึ้น และ เธอ ต้อง ออก จาก การทดลอง,แต่ ผล การสแกน แสดง ว่า เนื้อ งอก ใน ปอด ขวา ของ นางสาว พุก กำลัง โต ขึ้น และ ต้อง ออก เธอ จาก การทดลอง,[0]
เมื่อ พวก เขา กลับ มา ก็ รู้สึก มี ความสุข กับ ความคิด ที่ จะ ได้ ใช้ ชีวิต ใน อเมริกาใต้ ห่างไกล จาก ปัญหา ของ เบลเยียม หลัง สงคราม,เมื่อ พวก เขา กลับ มา ก็ รู้สึก มี ความสุข กับ ความคิด จะ ได้ ใช้ ที่ ชีวิต ใน อเมริกาใต้ ห่างไกล จาก ปัญหา ของ เบลเยียม หลัง สงคราม,[0]
วิลค์ส ได้รับ เลือกตั้ง อีก ครั้ง และ ถูก ขับไล่ อีก สอง ครั้ง ก่อน ที่ สภา สามัญชน จะ ประกาศ ว่า การลง สมัคร ของ เขา เป็น โมฆะ และ ประกาศ ให้ รอง อันดับ หนึ่ง เป็น ผู้ ชนะ,วิลค์ส ได้รับ เลือกตั้ง อีก ครั้ง และ ถูก ขับไล่ อีก สอง ครั้ง ก่อน ที่ สภา สามัญชน จะ ประกาศ ว่า เป็น การลง สมัคร ของ เขา โมฆะ และ ประกาศ ให้ รอง อันดับ หนึ่ง เป็น ผู้ ชนะ,[0]
เขา บรรยาย ว่า เธอ เป็น ผู้หญิง ที่ “ พิเศษ ” และ “ เปี่ยม ด้วย รัก และ แสน มหัศจรรย์ ซึ่ง ได้ ทิ้ง ร่องรอย ไว้ ใน โลก วรรณกรรม ด้วย เรื่องราว ของ เธอ,เขา บรรยาย ว่า เธอ เป็น ผู้หญิง “ พิเศษ ที่ ” และ “ เปี่ยม ด้วย รัก และ แสน มหัศจรรย์ ซึ่ง ได้ ทิ้ง ร่องรอย ไว้ ใน โลก วรรณกรรม ด้วย เรื่องราว ของ เธอ,[0]
บาง ที นั่น อาจ เป็น เหตุผล ที่ ทำให้ น้ำตา เอ่อ จน ดวง ตา ของ เขา พร่ามัว เมื่อ ห้วง เวลา ทำให้ เห็น พืชผล งอกเงย ขึ้น มา และ ทำให้ ความลับ ของ เขา จำนน อยู่ ใน สาย น้ำ นิ่ง,บาง ที นั่น อาจ เป็น เหตุผล ที่ ทำให้ น้ำตา เอ่อ จน ดวง ตา ของ เขา พร่ามัว เมื่อ ทำให้ ห้วง เวลา เห็น พืชผล งอกเงย ขึ้น มา และ ทำให้ ความลับ ของ เขา จำนน อยู่ ใน สาย น้ำ นิ่ง,[0]
ตำรวจ ใน บริติชโคลัมเบีย แถลง ก่อนหน้า นี้ ว่า ไม่ ปรากฏ ว่า ไคลน์ มี ประวัติ อาชญากรรม และ ได้ เผยแพร่ ข้อมูล คร่าว ๆ เกี่ยว กับ สถานที่ ที่ พบเห็น เขา เมื่อ เร็ว ๆ นี้,ตำรวจ ใน บริติชโคลัมเบีย แถลง ก่อนหน้า นี้ ว่า ไม่ ปรากฏ ว่า มี ไคลน์ ประวัติ อาชญากรรม และ ได้ เผยแพร่ ข้อมูล คร่าว ๆ เกี่ยว กับ สถานที่ ที่ พบเห็น เขา เมื่อ เร็ว ๆ นี้,[0]
เนื่อง จาก สภาพ ภูมิอากาศ ธรณีวิทยา และ การเข้า ถึง ทะเล ที่ คล้าย ๆ กัน วัฒนธรรม ต่าง ๆ ที่ มี ศูนย์กลาง ใน เขต เมดิเตอร์เรเนียน มัก จะ มี แนว โน้ม ที่ จะ มี วัฒนธรรม และ ประวัติศาสตร์ ที่ เกี่ยวพัน กัน ใน ระดับ หนึ่ง,เนื่อง จาก สภาพ ภูมิอากาศ ธรณีวิทยา และ การเข้า ถึง ทะเล ที่ คล้าย ๆ กัน วัฒนธรรม ต่าง ๆ มี ที่ ศูนย์กลาง ใน เขต เมดิเตอร์เรเนียน มัก จะ มี แนว โน้ม ที่ จะ มี วัฒนธรรม และ ประวัติศาสตร์ ที่ เกี่ยวพัน กัน ใน ระดับ หนึ่ง,[0]
ตั้ง แต่ รัชสมัย จักรพรรดิ เมจิ ถือ เป็น ธรรมเนียม ที่ ต้อง ใช้ ชื่อ ยุคสมัย หนึ่ง ชื่อ ต่อ จักรพรรดิ หนึ่ง พระองค์ และ ต้อง เปลี่ยน พระนาม จักรพรรดิ แต่ละ พระองค์ ภาย หลัง การสวรรคต โดย ใช้ ชื่อ ยุค ที่ พระองค์ภายหลังการสวรรคตโดยใช้ชื่อยุคที่พระองค์ ทรง พระชนม์ อยู่,ตั้ง แต่ รัชสมัย จักรพรรดิ เมจิ ถือ เป็น ธรรมเนียม ที่ ต้อง ใช้ ชื่อ ยุคสมัย หนึ่ง ชื่อ ต่อ จักรพรรดิ หนึ่ง พระองค์ และ ต้อง เปลี่ยน พระนาม จักรพรรดิ แต่ละ พระองค์ ภาย หลัง การสวรรคต โดย ใช้ ชื่อ ยุค ที่ ทรง พระชนม์ อยู่ พระองค์ภายหลังการสวรรคตโดยใช้ชื่อยุคที่พระองค์,[0]
ช่วง แรก ใน ปี 1926 เมเยอร์ ได้ เขียน ถึง อิแรน โยเลียต-กูรี โดย แนะนำ ให้ โรนา มา ทำ งาน กับ เธอ ด้วย เพื่อ เรียนรู้ ว่า ห้อง ทดลอง เขา นั้น สามารถ สร้าง ตัวอย่าง พอโลเนียม ของ พวก เขา เอง ได้,ช่วง แรก ใน ปี 1926 เมเยอร์ ได้ เขียน ถึง อิแรน โยเลียต-กูรี โดย แนะนำ ให้ โรนา มา ทำ งาน กับ เธอ ด้วย เพื่อ เรียนรู้ ว่า สามารถ ห้อง ทดลอง เขา นั้น สร้าง ตัวอย่าง พอโลเนียม ของ พวก เขา เอง ได้,[0]
บทความ ของ ทอมป์สัน คาดคะเน ว่า เผ่า มายา เป็น คน “ รัก สงบ ” อย่างมาก เนื่อง จาก พวก เขา ขาด การป้องกัน ที่ ปรากฏ ชัดเจน,บทความ ของ ทอมป์สัน คาดคะเน ว่า เผ่า มายา เป็น คน “ รัก สงบ ” อย่างมาก เนื่อง จาก ขาด พวก เขา การป้องกัน ที่ ปรากฏ ชัดเจน,[0]
และ แน่นอน มี บ็อบ ซึ่ง เป็น แหล่ง ความฮา อย่างต่อเนื่อง,และ แน่นอน มี บ็อบ เป็น แหล่ง ซึ่ง ความฮา อย่างต่อเนื่อง,[0]
มี การศึกษา วิชา แพทย์ โดย เฉพาะ อย่าง ยิ่ง ใน อิตาลี ตอน ใต้ ซึ่ง วิชา การ แพทย์ แบบ อิสลาม มี อิทธิพล กับ โรง เรียน ใน ซาแลร์โน,มี การศึกษา วิชา แพทย์ โดย เฉพาะ อย่าง ยิ่ง ใน อิตาลี ตอน ใต้ ซึ่ง มี วิชา การ แพทย์ แบบ อิสลาม อิทธิพล กับ โรง เรียน ใน ซาแลร์โน,[0]
ภาพยนตร์ ได้ เปลี่ยน ไป อย่างมหาศาล จน ฮอลลีวูด ได้ ทิ้ง ผู้ ชม แบบ ครอบครัว ไป แล้ว,ภาพยนตร์ ได้ เปลี่ยน ไป อย่างมหาศาล จน ได้ ทิ้ง ฮอลลีวูด ผู้ ชม แบบ ครอบครัว ไป แล้ว,[0]
ผู้ เชี่ยวชาญ ชาว ออสเตรเลีย ได้ ข้อ สรุป ใหม่ ๆ จาก การตรวจสอบ ปีก ลง จอด ของ โบอิ้ง ที่ ไป เกย ฝั่ง ที่ แทนซาเนีย ใน แอฟริกาตะวันออก,ผู้ เชี่ยวชาญ ชาว ออสเตรเลีย ได้ ข้อ สรุป ใหม่ ๆ จาก การตรวจสอบ ปีก ลง จอด ของ โบอิ้ง ไป ที่ เกย ฝั่ง ที่ แทนซาเนีย ใน แอฟริกาตะวันออก,[0]
เนื้อ งอก วิรูป บริเวณ กระดูก ก้นกบ เป็น เนื้อ งอก ที่ ก่อ ตัว ก่อน เกิด และ โต ใน กระดูก ก้นกบ ของ ทารก,เนื้อ งอก วิรูป บริเวณ กระดูก ก้นกบ เป็น เนื้อ งอก ก่อ ที่ ตัว ก่อน เกิด และ โต ใน กระดูก ก้นกบ ของ ทารก,[0]
“ ผม ไม่ รู้ ว่า การเติบโต ของ จีดีพี สมัย ที่ วอชิงตัน และ ลินคอล์น เป็น รัฐบาล เป็น เท่าไร แต่ พัฒนาการ เชิง สถาบัน ใน ยุค นั้น มี ผล กระทบ ที่ ยิ่งใหญ่ และ คงอยู่ เป็น เวลา นาน ”,“ ไม่ รู้ ผม ว่า การเติบโต ของ จีดีพี สมัย ที่ วอชิงตัน และ ลินคอล์น เป็น รัฐบาล เป็น เท่าไร แต่ พัฒนาการ เชิง สถาบัน ใน ยุค นั้น มี ผล กระทบ ที่ ยิ่งใหญ่ และ คงอยู่ เป็น เวลา นาน ”,[0]
สิ่ง ประดิษฐ์ ใน ช่วง แรก ๆ ของ ลามาร์ รวม ถึง ไฟ สัญญาณ จราจร ที่ ปรับปรุง ให้ ดี ขึ้น และ เม็ด ที่ ละลาย ใน น้ำ ได้ เพื่อ ทำ เป็น น้ำ อัด ลม,สิ่ง ประดิษฐ์ ใน ช่วง แรก ๆ ของ ลามาร์ รวม ถึง ไฟ สัญญาณ จราจร ที่ ปรับปรุง ให้ ดี ขึ้น และ เม็ด ละลาย ที่ ใน น้ำ ได้ เพื่อ ทำ เป็น น้ำ อัด ลม,[0]
การเปลี่ยนแปลง นี้ เน้น ให้ เห็น ความต้องการ ของ บริษัท ที่ จะ ให้ ผู้ ใช้ เริ่ม นึก ถึง ผลิตภัณฑ์ ของ บริษัท ว่า เป็น มาก กว่า แค่ เครื่องมือ เพิ่ม ผล ผลิต,การเปลี่ยนแปลง นี้ เน้น ให้ เห็น ความต้องการ ของ บริษัท จะ ให้ ที่ ผู้ ใช้ เริ่ม นึก ถึง ผลิตภัณฑ์ ของ บริษัท ว่า เป็น มาก กว่า แค่ เครื่องมือ เพิ่ม ผล ผลิต,[0]
เกาะ ตั้ง อยู่ บน รอย เลื่อน อินโด-ออสเตรเลียน ซึ่ง รอย เลื่อน นี้ ยก สูง ขึ้น เนื่อง จาก การปะทะ กัน ระหว่าง แผ่น เปลือก โลก อินเดีย กับ ออสเตรเลีย,เกาะ ตั้ง อยู่ บน รอย เลื่อน อินโด-ออสเตรเลียน ซึ่ง ยก รอย เลื่อน นี้ สูง ขึ้น เนื่อง จาก การปะทะ กัน ระหว่าง แผ่น เปลือก โลก อินเดีย กับ ออสเตรเลีย,[0]
สหภาพ ฟอร์ซ อูฟริแยร์ เสียดาย ที่ คำ พูด ของ กลุ่ม เกี่ยว กับ เนื้อหา ของ คู่มือ ไม่ ได้ รวม อยู่ ด้วย “ จริง ๆ แล้ว ไม่ ได้ มี การปรึกษา อะไร กัน เลย ” นาง กิลลาร์ด พูด,สหภาพ ฟอร์ซ อูฟริแยร์ เสียดาย ที่ ไม่ ได้ รวม อยู่ คำ พูด ของ กลุ่ม เกี่ยว กับ เนื้อหา ของ คู่มือ ด้วย “ จริง ๆ แล้ว ไม่ ได้ มี การปรึกษา อะไร กัน เลย ” นาง กิลลาร์ด พูด,[0]
ช่วง ต้น ปี ซีกัล ได้ สัญชาติ เซอร์เบีย หลัง จาก เสนอ ที่ จะ เปิด โรง เรียน สอน ศิลปะ ป้องกัน ตัว ใน นคร หลวง เบลเกรด,ช่วง ต้น ปี ได้ ซีกัล สัญชาติ เซอร์เบีย หลัง จาก เสนอ ที่ จะ เปิด โรง เรียน สอน ศิลปะ ป้องกัน ตัว ใน นคร หลวง เบลเกรด,[0]
สมาร์ทโฟน รุ่น นี้ ได้ แอป ที่ เหมาะ กัน ซึ่ง ใน กรณี ที่ ดี ที่สุด นั้น สถานการณ์ ที่ โง่ ที่สุด ก็ จะ มี ผู้ ชม นับ ล้าน,สมาร์ทโฟน รุ่น นี้ ได้ แอป ที่ เหมาะ กัน ซึ่ง ใน กรณี ที่ ดี ที่สุด นั้น สถานการณ์ โง่ ที่ ที่สุด ก็ จะ มี ผู้ ชม นับ ล้าน,[0]
ผู้ มี สิทธิ เลือกตั้ง อยู่ ใน พื้นที่ สภา เมือง นอร์ทเคสเตเวน ซึ่ง 62 % ของ ผู้ ออก เสียง สนับสนุน ให้ ออก จาก สหภาพ ยุโรป,ผู้ มี สิทธิ เลือกตั้ง อยู่ ใน พื้นที่ สภา เมือง นอร์ทเคสเตเวน ซึ่ง สนับสนุน 62 % ของ ผู้ ออก เสียง ให้ ออก จาก สหภาพ ยุโรป,[0]
ซีกัล ผู้ มี ยาย ที่ มา จาก วลาดีวอสตอค ใน ตอน ตะวัน ออก ไกล ของ รัสเซีย ได้ เดินทาง ไป รัสเซีย หลาย ครั้ง ใน ช่วง ไม่ กี่ ปี ที่ ผ่าน มา นี้ และ ได้ ไป เยือน คัมชัตคา และ ซาฮาลิน ใน เดือน กันยายน,ซีกัล มี ผู้ ยาย ที่ มา จาก วลาดีวอสตอค ใน ตอน ตะวัน ออก ไกล ของ รัสเซีย ได้ เดินทาง ไป รัสเซีย หลาย ครั้ง ใน ช่วง ไม่ กี่ ปี ที่ ผ่าน มา นี้ และ ได้ ไป เยือน คัมชัตคา และ ซาฮาลิน ใน เดือน กันยายน,[0]
จักรพรรดิ นโปเลียน ทรง มั่นพระทัย ว่า ความสำเร็จ ของ ออสเตอร์ลิตซ์ จะ นำ มา ซึ่ง สนธิสัญญา สงบ ศึก แต่ ความหวัง ของ พระองค์ ก็ ทลาย ลง ใน เวลา ไม่ นาน เมื่อ ลอร์ด เกร็นวิลล์ นายก รัฐมนตรี คน ใหม่ ของ อังกฤษ ปฏิเสธ ข้อ ตกลง ทั้งหมด และ พระเจ้า อเล็กซานเดอร์ ก็ ทรง ทำ แบบ เดียว กัน,จักรพรรดิ นโปเลียน ทรง มั่นพระทัย ว่า ความสำเร็จ ของ ออสเตอร์ลิตซ์ จะ นำ มา ซึ่ง สนธิสัญญา สงบ ศึก แต่ ความหวัง ของ พระองค์ ก็ ทลาย ลง ใน เวลา ไม่ นาน เมื่อ ปฏิเสธ ลอร์ด เกร็นวิลล์ นายก รัฐมนตรี คน ใหม่ ของ อังกฤษ ข้อ ตกลง ทั้งหมด และ พระเจ้า อเล็กซานเดอร์ ก็ ทรง ทำ แบบ เดียว กัน,[0]
ช่วง แรก ใน ปี 1926 เมเยอร์ ได้ เขียน ถึง อิแรน โยเลียต-กูรี โดย แนะนำ ให้ โรนา มา ทำ งาน กับ เธอ ด้วย เพื่อ เรียนรู้ ว่า ห้อง ทดลอง เขา นั้น สามารถ สร้าง ตัวอย่าง พอโลเนียม ของ พวก เขา เอง ได้,ช่วง แรก ใน ปี 1926 ได้ เขียน เมเยอร์ ถึง อิแรน โยเลียต-กูรี โดย แนะนำ ให้ โรนา มา ทำ งาน กับ เธอ ด้วย เพื่อ เรียนรู้ ว่า ห้อง ทดลอง เขา นั้น สามารถ สร้าง ตัวอย่าง พอโลเนียม ของ พวก เขา เอง ได้,[0]
ขณะ ที่ ดั้งเดิม การระบุ มวล อากาศ เคย ใช้ เพื่อ พยากรณ์ อากาศ ใน ช่วง ทศวรรษ 1950 นัก ภูมิอากาศ เริ่ม ตั้ง วิชา ภูมิอากาศวิทยา ที่ สำคัญ ต่าง ๆ จาก แนว คิด นี้ ใน ปี 1973,ขณะ ที่ ดั้งเดิม การระบุ มวล อากาศ เคย ใช้ เพื่อ พยากรณ์ อากาศ ใน ช่วง ทศวรรษ 1950 นัก ภูมิอากาศ เริ่ม ตั้ง วิชา ภูมิอากาศวิทยา สำคัญ ที่ ต่าง ๆ จาก แนว คิด นี้ ใน ปี 1973,[0]
