sen_str,swapped_sen_str,leaf_rule
"เมื่อ กรีซ ออก เดินทาง ค้นหา อาณานิคม ทาง ตะวัน ตก ไป ทาง ซิซิลี และ อิตาลี ( ปิเธคูสซี , กูมี ) อิทธิพล ของ ตัว อักษร แบบ ใหม่ ก็ ขยาย ออก ไป อีก","เมื่อ ออก กรีซ เดินทาง ค้นหา อาณานิคม ทาง ตะวัน ตก ไป ทาง ซิซิลี และ อิตาลี ( ปิเธคูสซี , กูมี ) อิทธิพล ของ ตัว อักษร แบบ ใหม่ ก็ ขยาย ออก ไป อีก",[0]
“ เหตุการณ์ เมื่อ ไม่ นาน มา นี้ ” น่า จะ เป็น การโจมตี เมื่อ วันที่ 21 ตุลาคม ที่ ทำให้ เว็บไซต์ ยอด นิยม อย่าง เรดดิท ทวิตเตอร์ และ สปอตติฟาย รวม ถึง อีก หลาย เว็บไซต์ ล่ม เป็น ช่วง เวลา สั้น ๆ,“ เหตุการณ์ เมื่อ ไม่ นาน มา นี้ ” น่า จะ เป็น การโจมตี เมื่อ วันที่ 21 ตุลาคม ทำให้ ที่ เว็บไซต์ ยอด นิยม อย่าง เรดดิท ทวิตเตอร์ และ สปอตติฟาย รวม ถึง อีก หลาย เว็บไซต์ ล่ม เป็น ช่วง เวลา สั้น ๆ,[0]
ฮิตช์ค็อก ชอบ ร่วม งาน กับ ผู้ มี ความสามารถ ที่ เก่ง ที่สุด ใน ช่วง เวลา ของ เขา นัก ออกแบบ โปสเตอร์ ภาพยนตร์ อย่าง บิล โกลด์ และ ซาอูล เบส ผู้ ที่ สามารถ ทำ โปสเตอร์ ที่ นำเสนอ ภาพยนตร์ ของ เขา ได้ อย่างเที่ยงตรง,ฮิตช์ค็อก ชอบ ร่วม งาน กับ ผู้ มี ความสามารถ ที่ เก่ง ที่สุด ใน ช่วง เวลา ของ เขา นัก ออกแบบ โปสเตอร์ ภาพยนตร์ อย่าง บิล โกลด์ และ ซาอูล เบส ผู้ ที่ สามารถ ทำ โปสเตอร์ นำเสนอ ที่ ภาพยนตร์ ของ เขา ได้ อย่างเที่ยงตรง,[0]
บูชาร์ด ปวดใจ กับ การพ่ายแพ้ 3 เซ็ต ที่ น่าตกใจ,บูชาร์ด ปวดใจ กับ การพ่ายแพ้ 3 เซ็ต น่าตกใจ ที่,[0]
ใน วันที่ 1 มกราคม 49 ปี ก่อน คริสต์ศักราช มาร์โก อันโตนิโอ อ่าน คำ ประกาศ จาก ซีซาร์ ที่ บอก ว่า ข้าหลวง ได้ ประกาศ ตน ว่า เป็น มิตร กับ สันติภาพ,ใน วันที่ 1 มกราคม 49 ปี ก่อน คริสต์ศักราช มาร์โก อันโตนิโอ อ่าน คำ ประกาศ จาก ซีซาร์ ที่ บอก ว่า ได้ ประกาศ ข้าหลวง ตน ว่า เป็น มิตร กับ สันติภาพ,[0]
และ จาก การ ที่ จีน กำหนด เป้าหมาย ว่า จะ กลาย เป็น ตลาด การบิน ที่ ใหญ่ ที่สุด ใน ทศวรรษ หน้า การแสดง นี้ จึง เป็น โอกาส ที่ ปักกิ่ง จะ ได้ แสดง ให้ เห็น ความมุ่งมั่น ด้าน การบิน พลเรือน และ การป้องกัน ภัย ฝ่าย พลเรือน,และ จาก การ ที่ จีน กำหนด เป้าหมาย ว่า จะ กลาย เป็น ตลาด การบิน ใหญ่ ที่ ที่สุด ใน ทศวรรษ หน้า การแสดง นี้ จึง เป็น โอกาส ที่ ปักกิ่ง จะ ได้ แสดง ให้ เห็น ความมุ่งมั่น ด้าน การบิน พลเรือน และ การป้องกัน ภัย ฝ่าย พลเรือน,[0]
เขา กระตุ้น ประชาชน ให้ มี ความรับผิดชอบ กับ สุขภาพ ของ ตน มาก ขึ้น โดย เตือน ว่า ตอน นี้ เอ็นเอชเอส กำลัง อยู่ ใต้ “ ความกดดัน ใหญ่หลวง ”,เขา กระตุ้น ประชาชน ให้ มี ความรับผิดชอบ กับ สุขภาพ ของ ตน มาก ขึ้น โดย เตือน ว่า ตอน นี้ กำลัง อยู่ เอ็นเอชเอส ใต้ “ ความกดดัน ใหญ่หลวง ”,[0]
โมเดล แรมเบลอร์ ซึ่ง เป็น รถยนต์ อเมริกัน ขนาด เล็ก ที่ ประสบ ความสำเร็จ ได้ กระตุ้น ให้ จีเอ็ม และ ฟอร์ด ทำ รถยนต์ ขนาด เล็ก ออก มา เอง ใน ปี 1960,โมเดล แรมเบลอร์ ซึ่ง เป็น รถยนต์ อเมริกัน ขนาด เล็ก ประสบ ที่ ความสำเร็จ ได้ กระตุ้น ให้ จีเอ็ม และ ฟอร์ด ทำ รถยนต์ ขนาด เล็ก ออก มา เอง ใน ปี 1960,[0]
ที่ จริง แล้ว รายงาน เชิง วิชาการ เกี่ยว กับ การรบ ฉบับ แรก โดย เจมส์ เฮนรี่ เบรสเต็ด ใน ปี 1903 กล่าว ยกย่อง แหล่ง ข้อมูล ที่ ให้ มี การสร้าง การรบ ใหม่ ด้วย ความแน่ใจ,ที่ จริง แล้ว รายงาน เชิง วิชาการ เกี่ยว กับ การรบ ฉบับ แรก โดย เจมส์ เฮนรี่ เบรสเต็ด ใน ปี 1903 กล่าว ยกย่อง แหล่ง ข้อมูล ให้ ที่ มี การสร้าง การรบ ใหม่ ด้วย ความแน่ใจ,[0]
ใน ปี ปลูวิโอส ที่ สาม ( มกราคม - กุมภาพันธ์ 1794 ) ใน การลด ความกดดัน ใน ยุคสมัย แห่ง ความน่าสะพรึงกลัว เขา ใช้ มาตรการ ต่าง ๆ นานา ปล่อย ตัว ผู้ ต้อง สงสัย,ใน ปี ปลูวิโอส ที่ สาม ( มกราคม - กุมภาพันธ์ 1794 ) ใน การลด ความกดดัน ใน ยุคสมัย แห่ง ความน่าสะพรึงกลัว ใช้ เขา มาตรการ ต่าง ๆ นานา ปล่อย ตัว ผู้ ต้อง สงสัย,[0]
โบกด์ ข่าน กล่าว ว่า ทั้ง มองโกเลีย และ จีน ถูก ปกครอง โดย แมนจู ใน ยุค ราชวงศ์ ชิง และ หลัง จาก ที่ ราชวงศ์ ชิง ล่มสลาย ใน ปี 1911 สัญญา ที่ ชาว มองโกล ยอม จำนน ต่อ แมนจู ก็ เป็น โมฆะ ไป,โบกด์ ข่าน กล่าว ว่า ทั้ง มองโกเลีย และ จีน ถูก ปกครอง โดย แมนจู ใน ยุค ราชวงศ์ ชิง และ หลัง จาก ที่ ล่มสลาย ราชวงศ์ ชิง ใน ปี 1911 สัญญา ที่ ชาว มองโกล ยอม จำนน ต่อ แมนจู ก็ เป็น โมฆะ ไป,[0]
สำหรับ ตอน นี้ นัก วิเคราะห์ ต่าง ก็ ลังเล ว่า จะ ตัด บริการ นี้ ออก ดี หรือไม่,สำหรับ ตอน นี้ ต่าง ก็ ลังเล นัก วิเคราะห์ ว่า จะ ตัด บริการ นี้ ออก ดี หรือไม่,[0]
สำหรับ ใคร ก็ตาม ที่ ต้องการ เห็น นคร หลวง ใน ภาวะ ที่ เฉิดฉาย ที่สุด พฤศจิกายน คือ เวลา ดี ที่ ควร ไป,สำหรับ ใคร ก็ตาม ที่ ต้องการ เห็น นคร หลวง ใน ภาวะ เฉิดฉาย ที่ ที่สุด พฤศจิกายน คือ เวลา ดี ที่ ควร ไป,[0]
เรียลลี เรียลลี เลิฟ ยู ออก วาง จำหน่าย ใน เดือน สิงหาคม และ ไต่ ขึ้น ถึง ห้า สิบ อันดับ แรก ส่วน “ เชกกี้ กราวด์ ” ซิงเกิล ที่ เกี่ยวเนื่อง กัน ออก ใน เดือน กันยายน แต่ กีเยอร์ ก็ เข้า มา ใน สหรัฐ ฯ แล้ว,เรียลลี เรียลลี เลิฟ ยู ออก วาง จำหน่าย ใน เดือน สิงหาคม และ ไต่ ขึ้น ถึง ห้า สิบ อันดับ แรก ส่วน “ เชกกี้ กราวด์ ” ซิงเกิล เกี่ยวเนื่อง ที่ กัน ออก ใน เดือน กันยายน แต่ กีเยอร์ ก็ เข้า มา ใน สหรัฐ ฯ แล้ว,[0]
ใน เดือน กรกฎาคม ของ ปี 1918 สนธิสัญญา ฝรั่งเศส - โมนาโก ได้ รับ การลง นาม โดย ฝรั่งเศส ให้ ความคุ้มครอง แบบ จำกัด แก่ โมนาโก,ใน เดือน กรกฎาคม ของ ปี 1918 ได้ รับ สนธิสัญญา ฝรั่งเศส - โมนาโก การลง นาม โดย ฝรั่งเศส ให้ ความคุ้มครอง แบบ จำกัด แก่ โมนาโก,[0]
มี การเสนอ ว่า รายได้ ต่อ หัว ที่ ต่ำ เป็น สาเหตุ ของ ความเดือดร้อน ซึ่ง กระตุ้น ให้ เกิด การก่อ กบฏ ติด อาวุธ,มี การเสนอ ว่า รายได้ ต่อ หัว ที่ ต่ำ เป็น สาเหตุ ของ ความเดือดร้อน กระตุ้น ซึ่ง ให้ เกิด การก่อ กบฏ ติด อาวุธ,[0]
มัน เป็น งาน ที่ เม็กซิโก หวัง ว่า จะ แข่ง กับ งาน คาร์นิวัล ของ บราซิล ใน ที่สุด,มัน เป็น งาน ที่ หวัง เม็กซิโก ว่า จะ แข่ง กับ งาน คาร์นิวัล ของ บราซิล ใน ที่สุด,[0]
จาก มุมมอง นี้ โครงสร้าง ที่ ล้า สมัย และ ชน ชั้น สูง ที่ พึงพอใจ กับ ตัวเอง นั้น เป็น สาเหตุ ที่ ว่า ทำไม ระบบ สุขภาพ การศึกษา และ การค้า ต่าง ประเทศ ใน สหรัฐ อเมริกา อยู่ ใน สภาพ ย่ำแย่ เหลือเกิน,จาก มุมมอง นี้ โครงสร้าง ล้า ที่ สมัย และ ชน ชั้น สูง ที่ พึงพอใจ กับ ตัวเอง นั้น เป็น สาเหตุ ที่ ว่า ทำไม ระบบ สุขภาพ การศึกษา และ การค้า ต่าง ประเทศ ใน สหรัฐ อเมริกา อยู่ ใน สภาพ ย่ำแย่ เหลือเกิน,[0]
แต่ ผู้ เชี่ยวชาญ ด้าน การ คมนาคม ท่าน หนึ่ง เตือน ว่า อินเทอร์เน็ต บน เครื่อง บิน มัก ไม่ เสถียร และ ไม่ น่า จะ มี อิทธิพล ต่อ การเลือก ใช้ สาย การบิน ของ ผู้ เดินทาง,แต่ ผู้ เชี่ยวชาญ ด้าน การ คมนาคม ท่าน หนึ่ง เตือน ว่า มัก ไม่ เสถียร อินเทอร์เน็ต บน เครื่อง บิน และ ไม่ น่า จะ มี อิทธิพล ต่อ การเลือก ใช้ สาย การบิน ของ ผู้ เดินทาง,[0]
"อัตรา 3 % นี้ มี ผล กับ ผู้ ถือ บัตร เน็กทาร์ ที่ ต้องการ กู้ยืม เงิน ระหว่าง 15,001 - 19,999 ปอนด์ เป็น เวลา 2 - 3 ปี เช่น กัน","อัตรา 3 % นี้ มี ผล กับ ผู้ ถือ บัตร เน็กทาร์ ต้องการ ที่ กู้ยืม เงิน ระหว่าง 15,001 - 19,999 ปอนด์ เป็น เวลา 2 - 3 ปี เช่น กัน",[0]
ใน ตอน ล่าง นั้น มี ต้น ปาล์ม 3 ต้น ที่ หัน หน้า เข้า หา ทะเล ซึ่ง แสดง ถึง ความรัก ที่ ผู้คน บน เกาะ แห่ง นี้ มี ให้ กับ แผ่นดิน ของ พวก เขา,ใน ตอน ล่าง นั้น มี ต้น ปาล์ม 3 ต้น หัน ที่ หน้า เข้า หา ทะเล ซึ่ง แสดง ถึง ความรัก ที่ ผู้คน บน เกาะ แห่ง นี้ มี ให้ กับ แผ่นดิน ของ พวก เขา,[0]
แตกต่าง จาก ทาง ตะวัน ตก ของ ประเทศ ที่ ลักษณะ ทาง กายภาพ ที่ ชัดเจน ไม่ ได้ ขนาน ไป กับ ชาย ฝั่ง,แตกต่าง จาก ทาง ตะวัน ตก ของ ประเทศ ที่ ลักษณะ ทาง กายภาพ ชัดเจน ที่ ไม่ ได้ ขนาน ไป กับ ชาย ฝั่ง,[0]
“ ETA กำลัง จะ ออก ไป แล้ว ” ตัว แทน ชาว ฝรั่งเศส เผย,“ ETA กำลัง จะ ออก ไป แล้ว ” เผย ตัว แทน ชาว ฝรั่งเศส,[0]
ใจกลาง ของ ความขัดแย้ง คือ คำ ถาม ว่า แคนซัส จะ เข้า ร่วม สหภาพ ใน ฐานะ รัฐ เสรี หรือ รัฐ ทาส,ใจกลาง ของ ความขัดแย้ง คือ คำ ถาม ว่า จะ เข้า แคนซัส ร่วม สหภาพ ใน ฐานะ รัฐ เสรี หรือ รัฐ ทาส,[0]
ที่ หัว มุม มี หญิง สาว โพก หัว นุ่ง ยีนส์ ที่ ดู เงียบ ๆ เสีย จน ฉัน คิด ว่า เธอ น่า จะ เป็น ผู้ ช่วย อีก คน,ที่ หัว มุม มี หญิง สาว โพก หัว นุ่ง ยีนส์ ที่ ดู เงียบ ๆ เสีย จน ฉัน คิด ว่า น่า เธอ จะ เป็น ผู้ ช่วย อีก คน,[0]
“ เวลา ผม สวม บทบาท เป็น เขา ผม รู้สึก มี อำนาจ ” จอห์น ดี โดเมนิโค นัก แสดง ผู้ เลียน แบบ โดนัลด์ ทรัมป์ อธิบาย กับ นิตยสาร สเลท เมื่อ ปี ที่แล้ว,“ เวลา ผม สวม บทบาท เป็น เขา รู้สึก ผม มี อำนาจ ” จอห์น ดี โดเมนิโค นัก แสดง ผู้ เลียน แบบ โดนัลด์ ทรัมป์ อธิบาย กับ นิตยสาร สเลท เมื่อ ปี ที่แล้ว,[0]
ความต้องการ ไก่ ทอด ที่ ไม่ มี ที่ สิ้นสุด ของ จีน เคย เป็น เหตุผล ใหญ่ ที่ ว่า ทำไม นัก ลง ทุน จึง ชอบ ยัม แบรนด์ส บริษัท แม่ ของ เคเอฟซี,ความต้องการ ไก่ ทอด ที่ ไม่ มี ที่ สิ้นสุด ของ จีน เคย เป็น เหตุผล ใหญ่ ว่า ที่ ทำไม นัก ลง ทุน จึง ชอบ ยัม แบรนด์ส บริษัท แม่ ของ เคเอฟซี,[0]
"ใน ปี 1563 ประชากร เวนิส ลด จำนวน ลง เหลือ ประมาณ 168,000 คน","ใน ปี 1563 ลด ประชากร เวนิส จำนวน ลง เหลือ ประมาณ 168,000 คน",[0]
นอก จาก พวก เขา แล้ว ไม่ ใช่ ทุก คน ใน พรรค ที่ จะ เข้าใจ สาร ที่ หัวหน้า พรรค พยายาม สื่อ กับ พวก เขา เมื่อ วาน,นอก จาก พวก เขา แล้ว ไม่ ใช่ ทุก คน ใน พรรค จะ เข้าใจ ที่ สาร ที่ หัวหน้า พรรค พยายาม สื่อ กับ พวก เขา เมื่อ วาน,[0]
ตั้ง แต่ ทศวรรษ ที่ 1960 เศรษฐกิจ เกาหลีใต้ เติบโต อย่างมหาศาล และ โครงสร้าง ทาง เศรษฐกิจ ก็ เปลี่ยนแปลง ครั้ง ใหญ่,ตั้ง แต่ ทศวรรษ ที่ 1960 เติบโต เศรษฐกิจ เกาหลีใต้ อย่างมหาศาล และ โครงสร้าง ทาง เศรษฐกิจ ก็ เปลี่ยนแปลง ครั้ง ใหญ่,[0]
ธุรกิจ ต่าง ๆ คาดหวัง ว่า จะ เริ่ม มี การจัด จ้าง อีก ครั้ง ใน เดือน กรกฎาคม ทันที หลัง การลง คะแนน เบร็กซิต แต่ ที่ จริง การจัด จ้าง ก็ โต ขึ้น อย่างสม่ำเสมอ,ธุรกิจ ต่าง ๆ คาดหวัง ว่า จะ เริ่ม มี การจัด จ้าง อีก ครั้ง ใน เดือน กรกฎาคม ทันที หลัง การลง คะแนน เบร็กซิต แต่ ที่ จริง ก็ โต การจัด จ้าง ขึ้น อย่างสม่ำเสมอ,[0]
