sen_str,swapped_sen_str,leaf_rule
นี่ เป็น กรณี ที่ เกิด กับ แอนดี้ ตอน ที่ เขา แข่ง กับ เบอนัวต์ แปร์ ที่ มอนติคาร์โล เมื่อ เดือน เมษายน,นี่ เป็น กรณี เกิด ที่ กับ แอนดี้ ตอน ที่ เขา แข่ง กับ เบอนัวต์ แปร์ ที่ มอนติคาร์โล เมื่อ เดือน เมษายน,[0]
ใน ขณะ เดียว กัน ตำแหน่ง ของ เขา ใน องค์กร มี มาร์โค อันโตนิโอ อยู่ ซึ่ง จะ อยู่ ใน ตำแหน่ง จน ถึง เดือน ธันวาคม,ใน ขณะ เดียว กัน มี มาร์โค อันโตนิโอ อยู่ ตำแหน่ง ของ เขา ใน องค์กร ซึ่ง จะ อยู่ ใน ตำแหน่ง จน ถึง เดือน ธันวาคม,[0]
ตอน แรก หญิง ยาซีดี คน หนึ่ง เริ่ม ร้องไห้ แล้ว ตาม ด้วย เพื่อน คน หนึ่ง ของ เธอ,ตอน แรก เริ่ม หญิง ยาซีดี คน หนึ่ง ร้องไห้ แล้ว ตาม ด้วย เพื่อน คน หนึ่ง ของ เธอ,[0]
เมื่อ ลม เริ่ม พัด ต่อเนื่อง อนุภาค ละเอียด ที่ อยู่ บน พื้น เปิด โล่ง ก็ จะ สั่น ไหว,เมื่อ ลม เริ่ม พัด ต่อเนื่อง อนุภาค ละเอียด อยู่ ที่ บน พื้น เปิด โล่ง ก็ จะ สั่น ไหว,[0]
ตาม ที่ ผู้ กำกับ นับ เอง จน ถึง ปัจจุบัน เขา ทำ หนัง มา แล้ว 8 เรื่อง,ตาม ที่ นับ ผู้ กำกับ เอง จน ถึง ปัจจุบัน เขา ทำ หนัง มา แล้ว 8 เรื่อง,[0]
เห็น ได้ ชัด ว่า ผู้ชาย น่า จะ มี ความรับผิดชอบ ใน เรื่อง ของ การคุม กำเนิด ได้ มาก กว่า นี้,เห็น ได้ ชัด ว่า น่า ผู้ชาย จะ มี ความรับผิดชอบ ใน เรื่อง ของ การคุม กำเนิด ได้ มาก กว่า นี้,[0]
การลง คะแนน ล่วงหน้า ได้ ชี้ ให้ เห็น ว่า ใน เวลา นี้ ชาว ละตินอเมริกัน จะ ออก มา ลง คะแนน เสียง มาก ขึ้น แต่ ก็ ยัง ไม่ เป็น ที่ แน่ชัด ว่า การเพิ่ม ขึ้น นี้ จะ ส่ง ผล ใด ๆ หรือไม่,การลง คะแนน ล่วงหน้า ได้ ชี้ ให้ เห็น ว่า ใน เวลา นี้ จะ ออก ชาว ละตินอเมริกัน มา ลง คะแนน เสียง มาก ขึ้น แต่ ก็ ยัง ไม่ เป็น ที่ แน่ชัด ว่า การเพิ่ม ขึ้น นี้ จะ ส่ง ผล ใด ๆ หรือไม่,[0]
มัน วิเศษ มาก ลินด์เซย์ เกย์ ผู้ ใช้ บริการ ข้อมูล ไม่ จำกัด ของ ซาสค์เทล รายงาน เมื่อ เดือน ก่อน,มัน วิเศษ มาก รายงาน ลินด์เซย์ เกย์ ผู้ ใช้ บริการ ข้อมูล ไม่ จำกัด ของ ซาสค์เทล เมื่อ เดือน ก่อน,[0]
การเข้า มา ปิด ล้อม โดย กอง เรือ รบ วิลล์เนิฟ ส่ง ผล ให้ ต้อง ล้มเลิก แผนการ เข้า รุกราน เกาะ อังกฤษ ไป ทั้ง นี้ เพราะ การพัฒนา ใหม่ ๆ เกิด ขึ้น ใน ทวีป ด้วย,การเข้า มา ปิด ล้อม โดย กอง เรือ รบ วิลล์เนิฟ ส่ง ผล ให้ ต้อง ล้มเลิก แผนการ เข้า รุกราน เกาะ อังกฤษ ไป ทั้ง นี้ เพราะ เกิด การพัฒนา ใหม่ ๆ ขึ้น ใน ทวีป ด้วย,[0]
การจับกุม ตอน นี้ เป็น “ ความต่อเนื่อง ของ การหลอกลวง ต้าน พวก เรา ” ดุนดาร์ กล่าว,การจับกุม ตอน นี้ เป็น “ ความต่อเนื่อง ของ การหลอกลวง ต้าน พวก เรา ” กล่าว ดุนดาร์,[0]
เมื่อ ได้ ตัดสินใจ ที่ จะ มุ่ง งาน ด้าน ละคร วินสโตน สมัคร เข้า เรียน ที่ สถาบัน โคโรนา สเตจ ใน แฮมเมอร์สมิธ,เมื่อ ได้ ตัดสินใจ ที่ จะ มุ่ง งาน ด้าน ละคร สมัคร วินสโตน เข้า เรียน ที่ สถาบัน โคโรนา สเตจ ใน แฮมเมอร์สมิธ,[0]
พระเจ้า หลุยส์ ชาว เยอรมัน รุกราน โมราเวีย และ ทรง ปลด พระเจ้า มอจเมียร์ ที่ 1 ออก แล้ว ทรง แต่งตั้ง ราสทิซ ผู้ เป็น พระนัดดา ขึ้น แทน ซึ่ง ต่อมา เป็น นัก บุญ ราสทิสลาฟ,พระเจ้า หลุยส์ ชาว เยอรมัน รุกราน โมราเวีย และ ทรง ปลด พระเจ้า มอจเมียร์ ที่ 1 ออก แล้ว ทรง แต่งตั้ง ราสทิซ เป็น พระนัดดา ผู้ ขึ้น แทน ซึ่ง ต่อมา เป็น นัก บุญ ราสทิสลาฟ,[0]
สี มงคล ของ ไทย ตาม วัน กำหนด ไว้ ใน ตาราง ของ สัปดาห์ ตาม ด้วย ด้าน ล่าง เป็น ปาง พระ พุทธรูป ประจำ แต่ละ วัน ที่ สัมพันธ์ กัน,สี มงคล ของ ไทย ตาม วัน กำหนด ไว้ ใน ตาราง ของ สัปดาห์ ตาม ด้วย เป็น ปาง ด้าน ล่าง พระ พุทธรูป ประจำ แต่ละ วัน ที่ สัมพันธ์ กัน,[0]
ก่อน จะ เข้า รับ ตำแหน่ง โจโควี เรียกร้อง ให้ ประธานาธิบดี ยูโดโยโน ผู้ ชอบ เข้า สังคม รับผิดชอบ ใน การตัดสินใจ เพิ่ม ราคา เชื้อ เพลิง ขึ้น ไป อีก ด้วย การลด เงิน อุดหนุน ลง มา อีก,ก่อน จะ เข้า รับ ตำแหน่ง เรียกร้อง โจโควี ให้ ประธานาธิบดี ยูโดโยโน ผู้ ชอบ เข้า สังคม รับผิดชอบ ใน การตัดสินใจ เพิ่ม ราคา เชื้อ เพลิง ขึ้น ไป อีก ด้วย การลด เงิน อุดหนุน ลง มา อีก,[0]
เขา กล่าว ว่า สถาปัตยกรรม ไม่ ได้ ช่วย คน ตาย แต่ ช่วย ให้ ความทรงจำ ของ คน ตาย ยัง โลดแล่น ท่ามกลาง คน เป็น,เขา กล่าว ว่า ไม่ ได้ ช่วย สถาปัตยกรรม คน ตาย แต่ ช่วย ให้ ความทรงจำ ของ คน ตาย ยัง โลดแล่น ท่ามกลาง คน เป็น,[0]
วัน ที่ สาม ฉัน ก็ กลับ มา ใช้ อีไมโคร,วัน ที่ สาม ก็ กลับ ฉัน มา ใช้ อีไมโคร,[0]
ทีนา อันเซลมี เกิด เมื่อ วันที่ 25 มีนาคม 1927 ใน คาสเทลฟรังโกเวเนโต เธอ เติบโต มา ใน ครอบครัว คาทอลิก ต่อต้าน ลัทธิ ฟาสซิสม์ ที่ ถูก หมายหัว เนื่อง จาก พ่อ ของ เธอ เป็น นัก สังคมนิยม แบบ ทหาร,ทีนา อันเซลมี เกิด เมื่อ วันที่ 25 มีนาคม 1927 ใน คาสเทลฟรังโกเวเนโต เธอ เติบโต มา ใน ครอบครัว คาทอลิก ต่อต้าน ลัทธิ ฟาสซิสม์ ที่ ถูก หมายหัว เนื่อง จาก เป็น นัก พ่อ ของ เธอ สังคมนิยม แบบ ทหาร,[0]
ตึก ที่ ได้ รางวัล นี้ ซึ่ง ออกแบบ โดย ฮวน การ์ลอส ซาลาส มี ลักษณะ แบบ ประติมากรรม และ ทุก รายละเอียด มี ความหมาย,ตึก ได้ ที่ รางวัล นี้ ซึ่ง ออกแบบ โดย ฮวน การ์ลอส ซาลาส มี ลักษณะ แบบ ประติมากรรม และ ทุก รายละเอียด มี ความหมาย,[0]
ผล จาก การทดลอง นี้ ให้ ข้อ สนับสนุน เพิ่ม ขึ้น ว่า เมล็ด พันธุ์ ที่ ขึ้น ไป กับ จรวด นั้น นั้น สามารถ ส่ง ไป และ เก็บ ไว้ ใน สถานี อวกาศ นานา ชาติ ได้ เป็น เวลา หก เดือน โดย ไม่ มี ผล กระทบ ที่ มี นัย สำคัญ ต่อ ความสามารถ ใน การงอก และ เติบโต บน โลก,ผล จาก การทดลอง นี้ ให้ ข้อ สนับสนุน เพิ่ม ขึ้น ว่า เมล็ด พันธุ์ ขึ้น ที่ ไป กับ จรวด นั้น นั้น สามารถ ส่ง ไป และ เก็บ ไว้ ใน สถานี อวกาศ นานา ชาติ ได้ เป็น เวลา หก เดือน โดย ไม่ มี ผล กระทบ ที่ มี นัย สำคัญ ต่อ ความสามารถ ใน การงอก และ เติบโต บน โลก,[0]
ข่าว การล่าถอย กลาย เป็น ความตื่นตระหนก ใหญ่หลวง ของ มหาชน ชาว เดนมาร์ก ซึ่ง คิด ว่า เดนนีเวิร์ก นั้น ต้านทาน ได้ และ นาย พล เดอเมซา ก็ ถูก ปลด ออก จาก การบังคับ บัญชา ทันที,ข่าว การล่าถอย กลาย เป็น ความตื่นตระหนก ใหญ่หลวง ของ มหาชน ชาว เดนมาร์ก ซึ่ง คิด ว่า ต้านทาน เดนนีเวิร์ก นั้น ได้ และ นาย พล เดอเมซา ก็ ถูก ปลด ออก จาก การบังคับ บัญชา ทันที,[0]
นี่ เป็น สิ่ง ที่ มี การเขียน ใน บันทึก ถึง สมาชิก รัฐสภา ภาย หลัง จาก การตัดสินใจ ของ อดีต รัฐมนตรี ที่ จะ ออก จาก พรรค,นี่ เป็น สิ่ง ที่ มี การเขียน ใน บันทึก ถึง สมาชิก รัฐสภา ภาย หลัง จาก การตัดสินใจ ของ อดีต รัฐมนตรี จะ ออก ที่ จาก พรรค,[0]
แม้ จะ ไม่ มี ผู้ เข้า มา คลี่คลาย ปัญหา ความขัดแย้ง แต่ ชัยชนะ ของ ฝรั่งเศส ใน ศึก มาเรนโก ก็ บีบบังคับ ให้ ชาว ออสเตรีย ต้อง ยอม ทิ้ง อิตาลี ไป เป็น หน ที่ สอง,แม้ จะ ไม่ มี ผู้ เข้า มา คลี่คลาย ปัญหา ความขัดแย้ง แต่ ก็ บีบบังคับ ชัยชนะ ของ ฝรั่งเศส ใน ศึก มาเรนโก ให้ ชาว ออสเตรีย ต้อง ยอม ทิ้ง อิตาลี ไป เป็น หน ที่ สอง,[0]
การลง คะแนน ล่วงหน้า ได้ ชี้ ให้ เห็น ว่า ใน เวลา นี้ ชาว ละตินอเมริกัน จะ ออก มา ลง คะแนน เสียง มาก ขึ้น แต่ ก็ ยัง ไม่ เป็น ที่ แน่ชัด ว่า การเพิ่ม ขึ้น นี้ จะ ส่ง ผล ใด ๆ หรือไม่,การลง คะแนน ล่วงหน้า ได้ ชี้ ให้ เห็น ว่า ใน เวลา นี้ ชาว ละตินอเมริกัน จะ ออก มา ลง คะแนน เสียง มาก ขึ้น แต่ ก็ ยัง ไม่ เป็น ที่ แน่ชัด ว่า จะ ส่ง การเพิ่ม ขึ้น นี้ ผล ใด ๆ หรือไม่,[0]
เหตุการณ์ นี้ เป็น ที่ รู้ กัน ใน ปารีส และ เป็น เหตุ ที่ สร้าง ความไม่ พอใจ มาก ยิ่ง ขึ้น ไป อีก จาก เรื่อง ราคา ขนมปัง ที่ สูง ต่อเนื่อง และ การขาดแคลน อาหาร,เหตุการณ์ นี้ เป็น ที่ รู้ กัน ใน ปารีส และ เป็น เหตุ ที่ สร้าง ความไม่ พอใจ มาก ยิ่ง ขึ้น ไป อีก จาก เรื่อง ราคา ขนมปัง สูง ที่ ต่อเนื่อง และ การขาดแคลน อาหาร,[0]
ตรุษ จีน และ เทศกาล ฉลอง อื่น ๆ ของ ชาว ไทย เชื้อสาย จีน เปลี่ยนแปลง ไป ตาม ทั้ง สอง อย่าง เพราะ ทั้งหมด นี้ คำนวณ ตาม ปฏิทิน จีน,ตรุษ จีน และ เทศกาล ฉลอง อื่น ๆ ของ ชาว ไทย เชื้อสาย จีน เปลี่ยนแปลง ไป ตาม ทั้ง สอง อย่าง เพราะ คำนวณ ทั้งหมด นี้ ตาม ปฏิทิน จีน,[0]
ฝ่าย บริหาร ประกอบ ด้วย รัฐมนตรี เป็น ประมุข ของ รัฐบาล ซึ่ง เป็น ประธาน ของ สภา แห่ง รัฐ 5 คน,ฝ่าย บริหาร ประกอบ ด้วย รัฐมนตรี เป็น ประมุข ของ รัฐบาล เป็น ประธาน ซึ่ง ของ สภา แห่ง รัฐ 5 คน,[0]
ปาปัวนิวกินี ได้ รับ การขนาน นาม ว่า อาจ เป็น ที่ ที่ แย่ ที่สุด ใน โลก ด้าน ความรุนแรง ทาง เพศ,ปาปัวนิวกินี ได้ รับ การขนาน นาม ว่า อาจ เป็น ที่ แย่ ที่ ที่สุด ใน โลก ด้าน ความรุนแรง ทาง เพศ,[0]
เรา ไม่ คิด ว่า ผู้ ต้อง สงสัย มี ความเกี่ยวโยง กับ โรง เรียน นี้ หรือ กับ เด็ก สาว ทั้ง สอง หรือ กับ เขต แอบบอทส์ฟอร์ด โดยเฉพาะ เธอ กล่าว,เรา ไม่ คิด ว่า ผู้ ต้อง สงสัย มี ความเกี่ยวโยง กับ โรง เรียน นี้ หรือ กับ เด็ก สาว ทั้ง สอง หรือ กับ เขต แอบบอทส์ฟอร์ด โดยเฉพาะ กล่าว เธอ,[0]
ผู้ พิพากษา ใน การพิจารณา คดี การฉ้อฉล และ การทำ ผิด หน้าที่ ที่ ได้รับ มอบหมาย ของ ดัฟฟี่ ได้ พิพากษา ชี้ขาด ว่า สิ่ง เหล่า นั้น เป็นไป ตาม กฎ ของ วุฒิสภา ตอน ที่ เขา ทำให้ ดัฟฟี่ พ้น ข้อ กล่าวหา ทั้งหมด,ผู้ พิพากษา ใน การพิจารณา คดี การฉ้อฉล และ การทำ ผิด หน้าที่ ที่ ได้รับ มอบหมาย ของ ดัฟฟี่ ได้ พิพากษา ชี้ขาด ว่า เป็นไป สิ่ง เหล่า นั้น ตาม กฎ ของ วุฒิสภา ตอน ที่ เขา ทำให้ ดัฟฟี่ พ้น ข้อ กล่าวหา ทั้งหมด,[0]
เป็น วันที่ 30 สิงหาคม 2015 ตอน ที่ กอง ทัพ เป็ด ยึดครอง อินเทอร์เน็ต,เป็น วันที่ 30 สิงหาคม 2015 ตอน ที่ ยึดครอง กอง ทัพ เป็ด อินเทอร์เน็ต,[0]
หลัง จาก ที่ ฉัน พบ ว่า มี แหล่ง บน อินเทอร์เน็ต ที่ คุย กัน ใน ประเด็น นี้ ราย ชื่อ ของ ฉัน ก็ ขยาย ตัว ใหญ่โต และ ครอบคลุม เกือบ ทุก รัฐ ใน สหภาพ,หลัง จาก ที่ ฉัน พบ ว่า มี แหล่ง บน อินเทอร์เน็ต คุย ที่ กัน ใน ประเด็น นี้ ราย ชื่อ ของ ฉัน ก็ ขยาย ตัว ใหญ่โต และ ครอบคลุม เกือบ ทุก รัฐ ใน สหภาพ,[0]
“ ฉัน ไป ดู งาน สอบ จบ ที่ มหาวิทยาลัย นอร์ธแฮมป์ตัน เพื่อ หา คน รุ่น ใหม่ ที่ มี พรสวรรค์ ” เขา กล่าว,“ ฉัน ไป ดู งาน สอบ จบ ที่ มหาวิทยาลัย นอร์ธแฮมป์ตัน เพื่อ หา คน รุ่น ใหม่ ที่ มี พรสวรรค์ ” กล่าว เขา,[0]
ใน ปี 1839 จีน สู้รบ ใน สงคราม ฝิ่น ครั้ง แรก กับ บริเตนใหญ่ หลัง จาก ที่ หลิน เจ๋อสวี ข้าหลวง ใหญ่ มณฑล หูหนาน และ หูเป่ย สั่ง ห้าม การค้า ฝิ่น กับ ต่าง ประเทศ,ใน ปี 1839 จีน สู้รบ ใน สงคราม ฝิ่น ครั้ง แรก กับ บริเตนใหญ่ หลัง จาก ที่ สั่ง หลิน เจ๋อสวี ข้าหลวง ใหญ่ มณฑล หูหนาน และ หูเป่ย ห้าม การค้า ฝิ่น กับ ต่าง ประเทศ,[0]
มี การอ้าง ว่า เขา ได้ พูด ไว้ ว่า “ เรา กำลัง คิด จริงจัง ใน เชิง รุก เกี่ยว กับ วิธี ที่ เป็นไป ได้ ใน การจำกัด ขอบเขต การฟ้องร้อง คดี ไว้ ที่ ผู้ ที่ มี ความเกี่ยวข้อง จริง ๆ ใน แต่ละ โครงการ ”,มี การอ้าง ว่า เขา ได้ พูด ไว้ ว่า “ กำลัง คิด เรา จริงจัง ใน เชิง รุก เกี่ยว กับ วิธี ที่ เป็นไป ได้ ใน การจำกัด ขอบเขต การฟ้องร้อง คดี ไว้ ที่ ผู้ ที่ มี ความเกี่ยวข้อง จริง ๆ ใน แต่ละ โครงการ ”,[0]
เงิน ที่ ลง ทุน ใน หุ้น กู้ ที่ ขาย ใน ราคา สูง กว่า มูลค่า ที่ ตรา ไว้ และ ใน บัญชี ออม ทรัพย์ และ การลง ทุน แห่ง ชาติ บัญชี อื่น ๆ นำ ไป พยุง รายจ่าย ของ รัฐบาล,เงิน ที่ ลง ทุน ใน หุ้น กู้ ที่ ขาย ใน ราคา สูง กว่า มูลค่า ตรา ที่ ไว้ และ ใน บัญชี ออม ทรัพย์ และ การลง ทุน แห่ง ชาติ บัญชี อื่น ๆ นำ ไป พยุง รายจ่าย ของ รัฐบาล,[0]
“ คือ ผม ไม่ ได้ ชอบ กดดัน พวก คุณ หรอก นะ แต่ ชะตากรรม ของ สาธารณรัฐ อยู่ ใน กำมือ คุณ ” เขา กล่าว กับ กลุ่ม ผู้ ฟัง ที่ รวม ตัว อยู่ ที่ สนาม กีฬา มหาวิทยาลัย นอร์ทแคโรไลนา,“ คือ ผม ไม่ ได้ ชอบ กดดัน พวก คุณ หรอก นะ แต่ ชะตากรรม ของ สาธารณรัฐ อยู่ ใน กำมือ คุณ ” เขา กล่าว กับ กลุ่ม ผู้ ฟัง รวม ที่ ตัว อยู่ ที่ สนาม กีฬา มหาวิทยาลัย นอร์ทแคโรไลนา,[0]
“ ผม ชอบ พวก สี เขต ร้อน ” เขา กล่าว,“ ผม ชอบ พวก สี เขต ร้อน ” กล่าว เขา,[0]
