sen_str,swapped_sen_str,leaf_rule
"Toutefois , cette stratégie leur permet d' obtenir , pour Stéphane Nissant , le poste à le BN que Christophe Borgel leur avait refusé .","Toutefois , cette stratégie leur permet d' obtenir , pour Stéphane Nissant , le poste à le BN que Christophe Borgel avait refusé leur .",[0] -> [1] -> [5]
"J' y suis allé une bonne dizaine de fois avec des amis et nous y avons toujours passé un très agréable moment même si la cuisine n' est pas "" gastro "" .","J' suis allé y une bonne dizaine de fois avec des amis et nous y avons toujours passé un très agréable moment même si la cuisine n' est pas "" gastro "" .",[0] -> [1] -> [5]
Certains bâtiments sont munis de répulseurs anti-gravité leur permettant de flotter lentement au-dessus de le terrain .,Certains bâtiments sont munis de répulseurs anti-gravité permettant leur de flotter lentement au-dessus de le terrain .,[0] -> [1] -> [5]
Je déclare reprise la session de le Parlement européen qui avait été interrompue le vendredi 17 décembre dernier et je vous renouvelle tous mes voeux en espérant que vous avez passé de bonnes vacances .,Je déclare reprise la session de le Parlement européen qui avait été interrompue le vendredi 17 décembre dernier et je renouvelle vous tous mes voeux en espérant que vous avez passé de bonnes vacances .,[0] -> [1] -> [5]
"En 2002 , on lui a refusé un visa pour assister à le Festival international de le film de New York à la suite de les attentats de le 11 septembre 2001 .","En 2002 , on a refusé lui un visa pour assister à le Festival international de le film de New York à la suite de les attentats de le 11 septembre 2001 .",[0] -> [1] -> [5]
"Il y était installé par un Président à mortier qui lui disait : Je vous installe dans la Charge de Prévôt de Paris , pour l' exercer dignement , et à le consentement de le Roi et de le Public .","Il y était installé par un Président à mortier qui disait lui : Je vous installe dans la Charge de Prévôt de Paris , pour l' exercer dignement , et à le consentement de le Roi et de le Public .",[0] -> [1] -> [5]
"Ces mêmes blessures qui lui permettrons de décrocher cinq titularisations dans cette fin de saison , ce qui lui permettra de remporter le titre honorifique de meilleur jeune Hammer 2007-2008 .","Ces mêmes blessures qui lui permettrons de décrocher cinq titularisations dans cette fin de saison , ce qui permettra lui de remporter le titre honorifique de meilleur jeune Hammer 2007-2008 .",[0] -> [1] -> [5]
"Son successeur quadriplace , le Ka-18 s' en distinguait par la taille de son fuselage .","Son successeur quadriplace , le Ka-18 s' distinguait en par la taille de son fuselage .",[0] -> [1] -> [5]
"Quand nous avons demandé le remboursement de la chambre , il a été impossible de l' obtenir sur place et le directeur n' a même pas voulu nous parler à le téléphone !","Quand nous avons demandé le remboursement de la chambre , il a été impossible de l' obtenir sur place et le directeur n' a même pas voulu parler nous à le téléphone !",[0] -> [1] -> [5]
"En sortant de chez lui , je savais que je n' y retournerais pas .","En sortant de chez lui , je savais que je n' retournerais y pas .",[0] -> [1] -> [5]
"Ce n' est pas sur ce dernier qu' il se vengea , mais sur sœur Agostina qu' il insulta en lui affirmant qu' il allait la tuer .","Ce n' est pas sur ce dernier qu' il se vengea , mais sur sœur Agostina qu' il insulta en affirmant lui qu' il allait la tuer .",[0] -> [1] -> [5]
Leur évolution à la pêche sera la base de les terre-neuviers et l' allongement de leur coque avec l' implantation d' un troisième mât en fera des clippers .,Leur évolution à la pêche sera la base de les terre-neuviers et l' allongement de leur coque avec l' implantation d' un troisième mât fera en des clippers .,[0] -> [1] -> [5]
"Un jour où ses parents partent pour la ville , elle leur demande de lui rapporter de la viande .","Un jour où ses parents partent pour la ville , elle demande leur de lui rapporter de la viande .",[0] -> [1] -> [5]
"On calcule , à l' aide de la Théorie de la gravitation universelle , l' accélération de la gravité sur cet ellipsoïde théorique , puis on y ajoute l' accélération axifuge due à la rotation de la Terre autour de son axe .","On calcule , à l' aide de la Théorie de la gravitation universelle , l' accélération de la gravité sur cet ellipsoïde théorique , puis on ajoute y l' accélération axifuge due à la rotation de la Terre autour de son axe .",[0] -> [1] -> [5]
"Pour s' en délivrer , les gens de le Goiherri ( Gipuzkoa / Guipuzcoa ) se rendent dans certaines églises d' Olaberria , Arriarán et de Mutiloa afin que les prêtres de ces lieux fassent une prière à leur intention .","Pour s' délivrer en , les gens de le Goiherri ( Gipuzkoa / Guipuzcoa ) se rendent dans certaines églises d' Olaberria , Arriarán et de Mutiloa afin que les prêtres de ces lieux fassent une prière à leur intention .",[0] -> [1] -> [5]
"On a rendu les gens malheureux , et on leur a donné une mauvaise santé .","On a rendu les gens malheureux , et on a donné leur une mauvaise santé .",[0] -> [1] -> [5]
"Bugs en tombe rapidement amoureux , mais elle repousse ses avances , et d' autant plus fortement que Bugs l' accoste en l' appelant « poupée » .","Bugs tombe rapidement amoureux en , mais elle repousse ses avances , et d' autant plus fortement que Bugs l' accoste en l' appelant « poupée » .",[0] -> [1] -> [5]
Autrefois le pèlerin avait coutume de prélever sur cette croix un copeau qui lui portait bonheur pour le reste de son voyage .,Autrefois le pèlerin avait coutume de prélever sur cette croix un copeau qui portait lui bonheur pour le reste de son voyage .,[0] -> [1] -> [5]
« Tu n' aurais sur moi aucun pouvoir s' il ne t' avait été donné d' en haut » dit Jésus à Pilate .,« Tu n' aurais sur moi aucun pouvoir s' il ne avait été donné t' d' en haut » dit Jésus à Pilate .,[0] -> [1] -> [5]
"Les deux scientifiques sont conscients de l' importance de les guérisons obtenues , mais ont un préjugé défavorable , facilement compréhensible , vis-à-vis de l' appareillage que Priore leur décrit confusément dans son mauvais français .","Les deux scientifiques sont conscients de l' importance de les guérisons obtenues , mais ont un préjugé défavorable , facilement compréhensible , vis-à-vis de l' appareillage que Priore décrit leur confusément dans son mauvais français .",[0] -> [1] -> [5]
"Il ne se contente pas de remettre en cause et de dénoncer , comme cela devrait être , le mode de gouvernance de le pays , il appelle Tarzan à son secours , en lui faisant part de ses regrets : « Fallait -il décoloniser ?","Il ne se contente pas de remettre en cause et de dénoncer , comme cela devrait être , le mode de gouvernance de le pays , il appelle Tarzan à son secours , en faisant lui part de ses regrets : « Fallait -il décoloniser ?",[0] -> [1] -> [5]
"Quand on hésite , pas de panique , Michelle est là pour nous donner de précieux conseils .","Quand on hésite , pas de panique , Michelle est là pour donner nous de précieux conseils .",[0] -> [1] -> [5]
Superbe installation et le poêle me chauffe pratiquement toute la maison !,Superbe installation et le poêle chauffe me pratiquement toute la maison !,[0] -> [1] -> [5]
Définissez le budget quotidien qui vous convient .,Définissez le budget quotidien qui convient vous .,[0] -> [1] -> [5]
"On se demandera comment de tels objets peuvent être si rapprochés , et on échafaudera des hypothèses subtiles .","On demandera se comment de tels objets peuvent être si rapprochés , et on échafaudera des hypothèses subtiles .",[0] -> [1] -> [5]
"Malgré les guerres de religion , une communauté protestante se maintient à le XVIIe siècle , bien que l' édit de Nantes ( 1598 ) ne lui ait pas accordé de temple .","Malgré les guerres de religion , une communauté protestante se maintient à le XVIIe siècle , bien que l' édit de Nantes ( 1598 ) ne ait pas accordé lui de temple .",[0] -> [1] -> [5]
"Il en profite pour mettre la dernière main en prison à son autobiographie , Les Réprouvés , qui traite de la période 1918-1927 et qui est publiée par Ernst Rowohlt ( Rowohlt-Verlag ) .","Il profite en pour mettre la dernière main en prison à son autobiographie , Les Réprouvés , qui traite de la période 1918-1927 et qui est publiée par Ernst Rowohlt ( Rowohlt-Verlag ) .",[0] -> [1] -> [5]
"En ce qui concerne Robert Pandraud , qui avait déjà rencontré à plusieurs reprises Francis Poullain , les fonds lui auraient été transmis par Rémy Halbwax , ancien policier révoqué .","En ce qui concerne Robert Pandraud , qui avait déjà rencontré à plusieurs reprises Francis Poullain , les fonds auraient été transmis lui par Rémy Halbwax , ancien policier révoqué .",[0] -> [1] -> [5]
"Encore un peu plus introspectif , Souchon nous rappelle que la société ne lui va toujours pas ( Putain ça penche , En collant l' oreille sur l' appareil ) , et poursuit son questionnement métaphysique ( Et si en plus y' a personne ) .","Encore un peu plus introspectif , Souchon rappelle nous que la société ne lui va toujours pas ( Putain ça penche , En collant l' oreille sur l' appareil ) , et poursuit son questionnement métaphysique ( Et si en plus y' a personne ) .",[0] -> [1] -> [5]
"Le sujet de les voyages de Michèle Alliot-Marie est selon lui , une affaire de politique interne mais observe que la sortie de la Ministre de les Affaires Etrangères sur l' aide sécuritaire lui semblait déplacée .","Le sujet de les voyages de Michèle Alliot-Marie est selon lui , une affaire de politique interne mais observe que la sortie de la Ministre de les Affaires Etrangères sur l' aide sécuritaire semblait lui déplacée .",[0] -> [1] -> [5]
Une excellente adresse pour faire des cadeaux ou tout simplement se faire plaisir .,Une excellente adresse pour faire des cadeaux ou tout simplement faire se plaisir .,[0] -> [1] -> [5]
"L' expertise de les bijoux a été effectuée soigneusement , pour les débris d' or le prix m' a été proposé de manière objective après consultation de les divers cours de le jour par la patronne .","L' expertise de les bijoux a été effectuée soigneusement , pour les débris d' or le prix a été proposé m' de manière objective après consultation de les divers cours de le jour par la patronne .",[0] -> [1] -> [5]
Il lance également une collection pour homme : il retravaille le classique masculin et lui donne un style résolument moderne .,Il lance également une collection pour homme : il retravaille le classique masculin et donne lui un style résolument moderne .,[0] -> [1] -> [5]
"Après un long match , Jericho en sortit vainqueur .","Après un long match , Jericho sortit en vainqueur .",[0] -> [1] -> [5]
Votre médecin peut vous conseiller de prendre un apport supplémentaire de calcium et de vitamine D ( par exemple sous forme de comprimés ) pendant à le moins les 10 premiers jours qui suivent l' administration d' Aclasta .,Votre médecin peut conseiller vous de prendre un apport supplémentaire de calcium et de vitamine D ( par exemple sous forme de comprimés ) pendant à le moins les 10 premiers jours qui suivent l' administration d' Aclasta .,[0] -> [1] -> [5]
"Auguste le Fort , l' Électeur de Saxe , en fait la Florence de le Nord et invite architectes , compositeurs et musiciens , souvent venus d' Italie ou d' Autriche .","Auguste le Fort , l' Électeur de Saxe , fait en la Florence de le Nord et invite architectes , compositeurs et musiciens , souvent venus d' Italie ou d' Autriche .",[0] -> [1] -> [5]
Un coup de pied donné à un spectateur à le cours de le Druivencross d' Overijse le 18 décembre 2005 lui vaut une suspension de compétition durant le mois de septembre 2006 .,Un coup de pied donné à un spectateur à le cours de le Druivencross d' Overijse le 18 décembre 2005 vaut lui une suspension de compétition durant le mois de septembre 2006 .,[0] -> [1] -> [5]
"La police a indiqué qu' elle avait tué Andre Price III en lui enfonçant le visage dans un matelas pneumatique situé dans sa salle de séjour avant de tenter de faire la même chose à sa fille , Angel .","La police a indiqué qu' elle avait tué Andre Price III en enfonçant lui le visage dans un matelas pneumatique situé dans sa salle de séjour avant de tenter de faire la même chose à sa fille , Angel .",[0] -> [1] -> [5]
"Quelles conclusions je dois en tirer ? ""","Quelles conclusions je dois tirer en ? """,[0] -> [1] -> [5]
"Ses obsèques , retransmises à la télévision , sont l' occasion de lui rendre un dernier hommage .","Ses obsèques , retransmises à la télévision , sont l' occasion de rendre lui un dernier hommage .",[0] -> [1] -> [5]
"Il était à la fois aimé , détesté et redouté , alors qu' il ne se préoccupait pas de s' assurer une fortune personnelle , le seul luxe qu' il s' accordait étant une chemise de soie confectionnée par Alexandra , et une magnifique croix également offerte par l' impératrice qu' il portait autour de le cou .","Il était à la fois aimé , détesté et redouté , alors qu' il ne se préoccupait pas de s' assurer une fortune personnelle , le seul luxe qu' il accordait s' étant une chemise de soie confectionnée par Alexandra , et une magnifique croix également offerte par l' impératrice qu' il portait autour de le cou .",[0] -> [1] -> [5]
Mais le pape ne veut pas en entendre parler .,Mais le pape ne veut pas entendre parler en .,[0] -> [1] -> [5]
"Il demande à Monsieur de Congolin , d' embarquer avec lui sur la Royale , et lui donne la commission de capitaine en second .","Il demande à Monsieur de Congolin , d' embarquer avec lui sur la Royale , et donne lui la commission de capitaine en second .",[0] -> [1] -> [5]
"Il a la particularité d' avoir remporté les championnats nationaux de quatre pays différents , seul le championnat d' Uruguay lui fait défaut .","Il a la particularité d' avoir remporté les championnats nationaux de quatre pays différents , seul le championnat d' Uruguay fait lui défaut .",[0] -> [1] -> [5]
"De retour sur Dagobah , Luke voit Yoda très faible , qui lui dit qu' il va bientôt mourir et que sa formation est terminée .","De retour sur Dagobah , Luke voit Yoda très faible , qui dit lui qu' il va bientôt mourir et que sa formation est terminée .",[0] -> [1] -> [5]
"Dans un premier temps , le tribunal lui avait donné raison ( Le Soir de le 30 mai 2005 ) en lui reconnaissant un accès à la sécurité sociale , sur base de le droit belge .","Dans un premier temps , le tribunal avait donné lui raison ( Le Soir de le 30 mai 2005 ) en lui reconnaissant un accès à la sécurité sociale , sur base de le droit belge .",[0] -> [1] -> [5]
"Permettez -moi enfin de vous dire que notre Parlement s' est , je crois , très largement retrouvé dans les propos que vous avez tenus .","Permettez -moi enfin de dire vous que notre Parlement s' est , je crois , très largement retrouvé dans les propos que vous avez tenus .",[0] -> [1] -> [5]
"Tolomeo commence maintenant à se réveiller , et Alessandro lui amène alors Seleuce qu' il a libérée auparavant .","Tolomeo commence maintenant à se réveiller , et Alessandro amène lui alors Seleuce qu' il a libérée auparavant .",[0] -> [1] -> [5]
"Toutefois , cette stratégie leur permet d' obtenir , pour Stéphane Nissant , le poste à le BN que Christophe Borgel leur avait refusé .","Toutefois , cette stratégie permet leur d' obtenir , pour Stéphane Nissant , le poste à le BN que Christophe Borgel leur avait refusé .",[0] -> [1] -> [5]
"« Étant donné l' avancée de le projet , il me semble impossible que l'on n' obtienne pas l' autorisation » , lâche le maire gersois , Yvon Montané .","« Étant donné l' avancée de le projet , il semble me impossible que l'on n' obtienne pas l' autorisation » , lâche le maire gersois , Yvon Montané .",[0] -> [1] -> [5]
"À le printemps 1948 , l' artiste belge qui rêve d' adapter Tintin à le cinéma envoie une lettre à Walt Disney pour lui demander son appui , en vain .","À le printemps 1948 , l' artiste belge qui rêve d' adapter Tintin à le cinéma envoie une lettre à Walt Disney pour demander lui son appui , en vain .",[0] -> [1] -> [5]
Le résultat est incroyable : album magnifique et vidéo émouvante ... bref tout le monde en parle !,Le résultat est incroyable : album magnifique et vidéo émouvante ... bref tout le monde parle en !,[0] -> [1] -> [5]
"Selon Le Monde de le 25 janvier 2006 , on lui reproche d' avoir perçu près de 40 millions de francs en trois ans , en échange d' informations livrées à les entreprises sur les marchés de l' OPAC .","Selon Le Monde de le 25 janvier 2006 , on reproche lui d' avoir perçu près de 40 millions de francs en trois ans , en échange d' informations livrées à les entreprises sur les marchés de l' OPAC .",[0] -> [1] -> [5]
"Il me reste maintenant à souhaiter que , votes ou non , nous soyons très nombreux vendredi prochain .","Il reste me maintenant à souhaiter que , votes ou non , nous soyons très nombreux vendredi prochain .",[0] -> [1] -> [5]
Le Parlement s' est efforcé d' en tenir compte dans sa propre recommandation .,Le Parlement s' est efforcé d' tenir en compte dans sa propre recommandation .,[0] -> [1] -> [5]
"Néanmoins , un témoin leur assure qu' un de les protagonistes de la rixe a pris la fuite en voiture .","Néanmoins , un témoin assure leur qu' un de les protagonistes de la rixe a pris la fuite en voiture .",[0] -> [1] -> [5]
"Plusieurs groupes régionaux se sont constitués , proposant pour leurs membres et les analystes en formation qui leur sont proches géographiquement , un certain nombre d' activités scientifiques .","Plusieurs groupes régionaux se sont constitués , proposant pour leurs membres et les analystes en formation qui sont proches leur géographiquement , un certain nombre d' activités scientifiques .",[0] -> [6] -> [7]
"Comme dans Gran Turismo , le joueur doit gagner des courses pour débloquer des crédits qui lui permettront d' acheter des voitures et des pièces de tuning .","Comme dans Gran Turismo , le joueur doit gagner des courses pour débloquer des crédits qui permettront lui d' acheter des voitures et des pièces de tuning .",[0] -> [6] -> [7]
"Monsieur le Président , deux minutes me suffiront pour exposer l' avis de la commission de l' industrie .","Monsieur le Président , deux minutes suffiront me pour exposer l' avis de la commission de l' industrie .",[0] -> [6] -> [7]
Atteignez de 800 millions de clients potentiels là où ils se trouvent .,Atteignez de 800 millions de clients potentiels là ils se trouvent où .,[0] -> [6] -> [7]
"Vous pouvez désormais voir les mises à jour publiques de les personnes qui vous intéressent , sans pour autant les ajouter à votre liste d' amis .","Vous pouvez désormais voir les mises à jour publiques de les personnes qui intéressent vous , sans pour autant les ajouter à votre liste d' amis .",[0] -> [6] -> [7]
"Après que Bonner eut été privé de son siège , vers 1549 , Thomas Cranmer envoya Feckenham à la Tour de Londres , et là son savoir et son éloquence lui assurèrent un tel succès comme avocat qu' il fut temporairement libéré ( « emprunté à la prison » ) pour prendre part à sept discussions publiques contre * 1552-1554 : John Hooper , John Jewel et d' autres .","Après que Bonner eut été privé de son siège , vers 1549 , Thomas Cranmer envoya Feckenham à la Tour de Londres , et là son savoir et son éloquence assurèrent lui un tel succès comme avocat qu' il fut temporairement libéré ( « emprunté à la prison » ) pour prendre part à sept discussions publiques contre * 1552-1554 : John Hooper , John Jewel et d' autres .",[0] -> [6] -> [7]
Nous devons dessiner notre propre stratégie suivant nos objectifs et notre contexte qui nous sont spécifiques .,Nous devons dessiner notre propre stratégie suivant nos objectifs et notre contexte qui sont spécifiques nous .,[0] -> [6] -> [7]
"Monsieur le Président , je voudrais franchement poser la question à Loriot : où sont -ils donc ?","Monsieur le Président , je voudrais franchement poser la question à Loriot : sont où -ils donc ?",[0] -> [6] -> [7]
"La liste sera longue alors , mais les réfugiés ne survivraient pas une semaine dans le désert aride et inhospitalier où ils sont depuis 35 ans , sans l' assistance internationale de les agences de l' ONU , de l' UE et d' ONG internationales ou l' assistance de les pays qui accueillent les étudiants sahraouis ...","La liste sera longue alors , mais les réfugiés ne survivraient pas une semaine dans le désert aride et inhospitalier ils sont où depuis 35 ans , sans l' assistance internationale de les agences de l' ONU , de l' UE et d' ONG internationales ou l' assistance de les pays qui accueillent les étudiants sahraouis ...",[0] -> [6] -> [7]
"Partout où les Phéniciens se rendaient , ils élevaient des chapelles à leurs divinités , dont le dieu Melkart , associé à Hercule ou Héraclès par les Romains ou les Grecs .","Partout les Phéniciens se rendaient où , ils élevaient des chapelles à leurs divinités , dont le dieu Melkart , associé à Hercule ou Héraclès par les Romains ou les Grecs .",[0] -> [6] -> [7]
Il doit s' embarquer pour l' Europe avec la 19e division d' infanterie mais la pandémie de grippe espagnole puis l' armistice l' en empêchent .,Il doit s' embarquer pour l' Europe avec la 19e division d' infanterie mais la pandémie de grippe espagnole puis l' armistice l' empêchent en .,[0] -> [6] -> [7]
"Certains érudits chrétiens critiquent les enseignements d’ Eckhart Tolle , tandis que d' autres en font l' éloge .","Certains érudits chrétiens critiquent les enseignements d’ Eckhart Tolle , tandis que d' autres font en l' éloge .",[0] -> [6] -> [7]
Nous y reviendrons !,Nous reviendrons y !,[0] -> [6] -> [7]
"Lorsqu' ils n' y sont pas , leur plumage est plus variable , allant d' une petite tache dorée sans bande noire à un plumage presque de saison nuptiale .","Lorsqu' ils n' sont y pas , leur plumage est plus variable , allant d' une petite tache dorée sans bande noire à un plumage presque de saison nuptiale .",[0] -> [6] -> [7]
"La tradition mystique et extatique de Chu et la tradition alchimique individualiste , importante à le sud de le Chang Jiang , lui donnent un caractère original par rapport à les écoles taoïstes de le nord .","La tradition mystique et extatique de Chu et la tradition alchimique individualiste , importante à le sud de le Chang Jiang , donnent lui un caractère original par rapport à les écoles taoïstes de le nord .",[0] -> [6] -> [7]
Nous y étions depuis les premiers jours de son installation soit depuis le 20 octobre 2010 plus exactement .,Nous étions y depuis les premiers jours de son installation soit depuis le 20 octobre 2010 plus exactement .,[0] -> [6] -> [7]
"Je vous avouerai que , pour le moment , les choses me semblent un petit peu confuses .","Je vous avouerai que , pour le moment , les choses semblent me un petit peu confuses .",[0] -> [6] -> [7]
"Alors je retournes souvent à le Campuchea , son hote est toujours là pour vous aider à trouver votre bonheur , la cuisine est vraiment excellente et vous passez toujours un bon moment , essayez et vous y retournerez ...","Alors je retournes souvent à le Campuchea , son hote est toujours là pour vous aider à trouver votre bonheur , la cuisine est vraiment excellente et vous passez toujours un bon moment , essayez et vous retournerez y ...",[0] -> [6] -> [7]
C' est un site que nous n' oublierons jamais et nous y reviendrons .,C' est un site que nous n' oublierons jamais et nous reviendrons y .,[0] -> [6] -> [7]
"Nous sommes basés à Montpellier et répondons à vos besoins avec des solutions adaptées aussi bien à les particuliers qu' à les professionnels Nous vous proposons des formations tous niveaux , de l' initiation à l' expertise , sur les logiciels Photoshop , Illustrator et Flash !","Nous sommes basés à Montpellier et répondons à vos besoins avec des solutions adaptées aussi bien à les particuliers qu' à les professionnels Nous proposons vous des formations tous niveaux , de l' initiation à l' expertise , sur les logiciels Photoshop , Illustrator et Flash !",[0] -> [6] -> [7]
"Cette méthode est d' une grande force persuasive : les allégations faites à son encontre , qu' elles soient véridiques ou fausses , lui servent de prémisses à l' écriture de Recuerdos , en ce sens qu' elles le mettent en situation , s' il y a lieu , d' objecter et de tendre , en rectifiant ces informations , vers un exposé autobiographique vrai .","Cette méthode est d' une grande force persuasive : les allégations faites à son encontre , qu' elles soient véridiques ou fausses , servent lui de prémisses à l' écriture de Recuerdos , en ce sens qu' elles le mettent en situation , s' il y a lieu , d' objecter et de tendre , en rectifiant ces informations , vers un exposé autobiographique vrai .",[0] -> [6] -> [7]
"Les explorateurs non-autochtones n' y pénétrèrent pas avant les années 1820 , et c' est seulement à partir de la découverte d' or dans la ville actuelle d' Yreka en 1851 que le premier établissement euro-américain eut lieu .","Les explorateurs non-autochtones n' pénétrèrent y pas avant les années 1820 , et c' est seulement à partir de la découverte d' or dans la ville actuelle d' Yreka en 1851 que le premier établissement euro-américain eut lieu .",[0] -> [6] -> [7]
