sen_str,swapped_sen_str,leaf_rule
"La résolution de le Conseil de le 28 octobre 1999 sur le rôle de la normalisation en Europe ( 2 ) recommandait que la commission examine si le principe de la nouvelle approche pouvait être étendu à les secteurs qui ne sont pas encore couverts , en vue d' améliorer et de simplifier la législation dans tous les cas où cela est possible .","La résolution de le Conseil de le 28 octobre 1999 sur le rôle de la normalisation en Europe ( 2 ) recommandait que la commission examine si le principe de la nouvelle approche pouvait être étendu à les secteurs qui ne sont pas encore couverts , en vue d' améliorer et de simplifier la législation dans tous les cas cela est possible où .",[0] -> [1] -> [2] -> [3]
Une entreprise dont on reparlera et qui nécessite un budget important .,Une entreprise on reparlera dont et qui nécessite un budget important .,[0] -> [1] -> [2] -> [3]
"« Il y a , puisque vous me commandez de parler , Monsieur , lui dis -je avec feu en tenant mes regards fichés sur les siens qui ne les purent soutenir , que vous êtes en train de perdre auprès de tous le peu d' estime et de considération -- ce furent là les termes dont je me servis -- qu' a gardé pour vous le gros de le monde .","« Il y a , puisque vous me commandez de parler , Monsieur , lui dis -je avec feu en tenant mes regards fichés sur les siens qui ne les purent soutenir , que vous êtes en train de perdre auprès de tous le peu d' estime et de considération -- ce furent là les termes je me servis dont -- qu' a gardé pour vous le gros de le monde .",[0] -> [1] -> [2] -> [3]
"À cette époque là les travaux de restauration changèrent complètement le centre ville : la Piazza Saffi , en 1931 , le Piazzale della Vittoria et le Viale della Libertà , qui va de la gare jusqu' à la place où se trouve le monument à le soldat inconnu et la statue d' Icare , tous les deux typiques de l' architecture fasciste .","À cette époque là les travaux de restauration changèrent complètement le centre ville : la Piazza Saffi , en 1931 , le Piazzale della Vittoria et le Viale della Libertà , qui va de la gare jusqu' à la place se trouve où le monument à le soldat inconnu et la statue d' Icare , tous les deux typiques de l' architecture fasciste .",[0] -> [1] -> [2] -> [3]
"Madame la présidente , je voudrais attirer votre attention sur un cas dont s' est régulièrement occupé le parlement .","Madame la présidente , je voudrais attirer votre attention sur un cas s' est régulièrement occupé dont le parlement .",[0] -> [1] -> [2] -> [3]
"Son projet éducatif prône la "" continuité éducative "" c'est-à-dire la prise en compte de l' élève sur la totalité de sa scolarité et pas seulement en fonction de l' établissement où il se trouve .","Son projet éducatif prône la "" continuité éducative "" c'est-à-dire la prise en compte de l' élève sur la totalité de sa scolarité et pas seulement en fonction de l' établissement il se trouve où .",[0] -> [1] -> [2] -> [3]
"à le Congrès de janvier 2011 , il est nommé Président d' Honneur sans mandat de représentation de le mouvement pendant que la responsabilité de le MRAP et la fonction de porte-parole sont assurées par un Collège de quatre co-présidents dont il ne fait plus partie .","à le Congrès de janvier 2011 , il est nommé Président d' Honneur sans mandat de représentation de le mouvement pendant que la responsabilité de le MRAP et la fonction de porte-parole sont assurées par un Collège de quatre co-présidents il ne fait dont plus partie .",[0] -> [1] -> [2] -> [3]
"Un de les meilleurs Chercheurs de la Fondation Huntik , il est chef de le groupe de chercheurs dont fait partie Lok .","Un de les meilleurs Chercheurs de la Fondation Huntik , il est chef de le groupe de chercheurs fait dont partie Lok .",[0] -> [1] -> [2] -> [3]
"Cet engagement est important dans la mesure où la commission est un organisme qui détient , conformément à les traités , le monopole de l' initiative et qui , par conséquent , décide pour l' essentiel quelle sera l' activité politique et législative de ce parlement à le cours de les cinq prochaines années .","Cet engagement est important dans la mesure la commission est un organisme où qui détient , conformément à les traités , le monopole de l' initiative et qui , par conséquent , décide pour l' essentiel quelle sera l' activité politique et législative de ce parlement à le cours de les cinq prochaines années .",[0] -> [1] -> [2] -> [3]
"Le terme podkopaï , qui désigne l' endroit où se trouve l' église , est d' origine incertaine .","Le terme podkopaï , qui désigne l' endroit se trouve où l' église , est d' origine incertaine .",[0] -> [1] -> [2] -> [3]
Quel est le mois où est entré en vigueur l' embargo de l' ONU sur le pétrole visant Haïti ?,Quel est le mois est entré où en vigueur l' embargo de l' ONU sur le pétrole visant Haïti ?,[0] -> [1] -> [2] -> [3]
"La Croix publie aujourd'hui un article sur « la blogosphère catholique » , dont on apprend qu' elle « s' organise » et relève de la « Génération Jean-Paul II » .","La Croix publie aujourd'hui un article sur « la blogosphère catholique » , on apprend dont qu' elle « s' organise » et relève de la « Génération Jean-Paul II » .",[0] -> [1] -> [2] -> [3]
"Rolf Bolin , qui était professeur à la station marine de Hopkin où je travaille , a écrit dans les années 40 que , "" les gaz émanant de la crasse flottante dans les anses de le golfe étaient si mauvais qu' ils faisaient même noircir les peintures à le plomb "" .","Rolf Bolin , qui était professeur à la station marine de Hopkin je travaille où , a écrit dans les années 40 que , "" les gaz émanant de la crasse flottante dans les anses de le golfe étaient si mauvais qu' ils faisaient même noircir les peintures à le plomb "" .",[0] -> [1] -> [2] -> [3]
"Les douze membres de le Conseil d' administration de la Juve , dont faisait partie Moggi , démissionnent le 11 mai 2006 [ 2 ] .","Les douze membres de le Conseil d' administration de la Juve , faisait dont partie Moggi , démissionnent le 11 mai 2006 [ 2 ] .",[0] -> [1] -> [2] -> [3]
"A cette époque -là , Kipling rencontra également Florence Garrard , dont il tomba amoureux , qui vivait avec Trix à Southsea ( où cette dernière était revenue ) .","A cette époque -là , Kipling rencontra également Florence Garrard , dont il tomba amoureux , qui vivait avec Trix à Southsea ( cette dernière était revenue où ) .",[0] -> [1] -> [2] -> [3]
"Après avoir vécu 18 ans dans l' illusion de faire partie d' une grande famille , les salariés de Canal + découvrent que leur société , mise en difficulté par le groupe dont elle fait partie , est soumise à les mêmes lois que toutes les autres et craignent alors un possible rachat par le groupe TF1 ou Lagardère et la fin de leur singularité .","Après avoir vécu 18 ans dans l' illusion de faire partie d' une grande famille , les salariés de Canal + découvrent que leur société , mise en difficulté par le groupe elle fait dont partie , est soumise à les mêmes lois que toutes les autres et craignent alors un possible rachat par le groupe TF1 ou Lagardère et la fin de leur singularité .",[0] -> [1] -> [2] -> [3]
"Le film surprend par la justesse de son observation , son style novateur et son anticonformisme , parfaitement représentatifs de la génération de les « Jeunes gens en colère » dont le Free cinema est proche .","Le film surprend par la justesse de son observation , son style novateur et son anticonformisme , parfaitement représentatifs de la génération de les « Jeunes gens en colère » le Free cinema est proche dont .",[0] -> [1] -> [2] -> [3]
"Atteinte depuis peu d' une grave maladie , Suzanne Sequin s' est éteinte samedi à le centre hospitalier de Bar-le-Duc , où elle avait été admise il y a un mois .","Atteinte depuis peu d' une grave maladie , Suzanne Sequin s' est éteinte samedi à le centre hospitalier de Bar-le-Duc , elle avait été admise où il y a un mois .",[0] -> [1] -> [2] -> [3]
"Adam est le berceau de la tribu Al Bu Said , dont est issu l' actuel sultan Qabus ibn Said .","Adam est le berceau de la tribu Al Bu Said , est issu dont l' actuel sultan Qabus ibn Said .",[0] -> [1] -> [2] -> [3]
"- 1995 : l' enquête entrait alors dans une longue période d' incertitudes dont elle n' est jamais véritablement sortie , parasitée par les conséquences de l' affaire Schuller-Maréchal , à la fin de 1994 , puis par les fausses pistes distillées par un ou plusieurs "" corbeaux "" .","- 1995 : l' enquête entrait alors dans une longue période d' incertitudes elle n' est jamais véritablement sortie dont , parasitée par les conséquences de l' affaire Schuller-Maréchal , à la fin de 1994 , puis par les fausses pistes distillées par un ou plusieurs "" corbeaux "" .",[0] -> [1] -> [2] -> [3]
"Or , elle quitte par là le domaine de l' expérience dont elle ne tient plus compte .","Or , elle quitte par là le domaine de l' expérience elle ne tient dont plus compte .",[0] -> [1] -> [2] -> [3]
"Le Conseil constitutionnel s' est prononcé par décision ( DC n° 2010-626 ) de le 29 mars 2011 , sur la loi organique relative à le Défenseur de les droits dont il avait été saisi par le Premier ministre en application de les articles 46 et 61 de la Constitution .","Le Conseil constitutionnel s' est prononcé par décision ( DC n° 2010-626 ) de le 29 mars 2011 , sur la loi organique relative à le Défenseur de les droits il avait été saisi dont par le Premier ministre en application de les articles 46 et 61 de la Constitution .",[0] -> [1] -> [2] -> [3]
"Le témoignage de Mme Gaubert s' est avéré extrêmement compromettant pour son époux , dont elle est séparée , et pour d' autres protagonistes de le dossier , comme l' intermédiaire franco-libanais Ziad Takieddine et l' ancien directeur de cabinet d' Edouard Balladur à Matignon , Nicolas Bazire .","Le témoignage de Mme Gaubert s' est avéré extrêmement compromettant pour son époux , elle est séparée dont , et pour d' autres protagonistes de le dossier , comme l' intermédiaire franco-libanais Ziad Takieddine et l' ancien directeur de cabinet d' Edouard Balladur à Matignon , Nicolas Bazire .",[0] -> [1] -> [2] -> [3]
"Puis lui a succédé l' amidonnier , suivi de l' épeautre .","Puis a succédé lui l' amidonnier , suivi de l' épeautre .",[0] -> [1] -> [5]
Je vais vous dire comment ça affecte mon état d' esprit .,Je vais dire vous comment ça affecte mon état d' esprit .,[0] -> [1] -> [5]
Il suffit de regarder une classe de primaire lâchée dans l' espace de le musée pour s' en convaincre .,Il suffit de regarder une classe de primaire lâchée dans l' espace de le musée pour s' convaincre en .,[0] -> [1] -> [5]
"Certes , les paysages de le pays de les pierres ( Karastan en arménien ) brûlés par le soleil mettent en valeur l' attachement filial de ce peintre à son pays natal , mais il devient miroir vivifiant quand tout un peuple s' y reconnaît , à le travers de puissants accords chromatiques .","Certes , les paysages de le pays de les pierres ( Karastan en arménien ) brûlés par le soleil mettent en valeur l' attachement filial de ce peintre à son pays natal , mais il devient miroir vivifiant quand tout un peuple s' reconnaît y , à le travers de puissants accords chromatiques .",[0] -> [1] -> [5]
"Dans la pratique , la direction de le G.O. ( le Conseil de l' Ordre ) fait passer une circulaire à les vénérables maîtres ( présidents ) de chaque loge de cette obédience pour leur demander de rassembler à leur niveau le plus d' informations possibles sur les officiers de les garnisons de leurs villes ou départements .","Dans la pratique , la direction de le G.O. ( le Conseil de l' Ordre ) fait passer une circulaire à les vénérables maîtres ( présidents ) de chaque loge de cette obédience pour demander leur de rassembler à leur niveau le plus d' informations possibles sur les officiers de les garnisons de leurs villes ou départements .",[0] -> [1] -> [5]
"Toute personne a droit à ce que règne , sur le plan social et sur le plan international , un ordre tel que les droits et libertés énoncés dans la présente déclaration puissent y trouver plein effet .","Toute personne a droit à ce que règne , sur le plan social et sur le plan international , un ordre tel que les droits et libertés énoncés dans la présente déclaration puissent trouver y plein effet .",[0] -> [1] -> [5]
Cette agence immobilière VIDATI.fr m' a vendu mon appartement en 25 jours .,Cette agence immobilière VIDATI.fr a vendu m' mon appartement en 25 jours .,[0] -> [1] -> [5]
""" Dès qu' on tousse , il faut aller voir un pneumologue "" , conseille Martine B. , qui regrette d' avoir trop attendu et d' en être de ce fait très handicapée .",""" Dès qu' on tousse , il faut aller voir un pneumologue "" , conseille Martine B. , qui regrette d' avoir trop attendu et d' être de ce fait très handicapée en .",[0] -> [1] -> [5]
"Mark saute dans le véhicule et démarre en trombe , mais la direction lui échappe et la voiture finit par tomber à la mer","Mark saute dans le véhicule et démarre en trombe , mais la direction échappe lui et la voiture finit par tomber à la mer",[0] -> [1] -> [5]
"Cette note - qui est à l' origine d' une information judiciaire ouverte et confiée à la juge d' instruction Isabelle Prévost-Desprez - ne s' attarde pas réellement sur le paiement d' une hypothétique rançon , mais détaille plutôt un système de "" rétro-commissions "" qui y serait lié .","Cette note - qui est à l' origine d' une information judiciaire ouverte et confiée à la juge d' instruction Isabelle Prévost-Desprez - ne s' attarde pas réellement sur le paiement d' une hypothétique rançon , mais détaille plutôt un système de "" rétro-commissions "" qui serait lié y .",[0] -> [1] -> [5]
"Le rite comprend entre autres une aspersion d' eau bénite , diverses prières , l' imposition de les mains , la présentation d' un crucifix à le possédé , et une formule impérative qui s' adresse directement à le diable et lui ordonne de s' en aller .","Le rite comprend entre autres une aspersion d' eau bénite , diverses prières , l' imposition de les mains , la présentation d' un crucifix à le possédé , et une formule impérative qui s' adresse directement à le diable et ordonne lui de s' en aller .",[0] -> [1] -> [5]
Je crois même que je vais en profiter pour y retourner avec mon mari à la saint valentin .,Je crois même que je vais profiter en pour y retourner avec mon mari à la saint valentin .,[0] -> [1] -> [5]
"Mais sa carte de crédit est refusée et elle demande à le stand de hot-dog de lui avancer 20 dollars , disant qu' elle doit acheter un foulard pour sa tante malade , mais c' est un client qui lui offre ces 20 dollars .","Mais sa carte de crédit est refusée et elle demande à le stand de hot-dog de lui avancer 20 dollars , disant qu' elle doit acheter un foulard pour sa tante malade , mais c' est un client qui offre lui ces 20 dollars .",[0] -> [1] -> [5]
Je recommande à tout le monde d' y aller si vous voulez un dépaysement total .,Je recommande à tout le monde d' aller y si vous voulez un dépaysement total .,[0] -> [1] -> [5]
"Discrédité à les yeux de les Montagnards , qui le considèrent comme un renégat , comme de la droite , qui lui reproche son passé terroriste , il est également abandonné par Madame Tallien , qui devient la maîtresse de le financier Ouvrard .","Discrédité à les yeux de les Montagnards , qui le considèrent comme un renégat , comme de la droite , qui reproche lui son passé terroriste , il est également abandonné par Madame Tallien , qui devient la maîtresse de le financier Ouvrard .",[0] -> [1] -> [5]
On y va à le moins une fois tous les 15 jrs et jamais déçu :),On va y à le moins une fois tous les 15 jrs et jamais déçu :),[0] -> [1] -> [5]
Les hammams traditionnels syriens sont surtout remarquables par leur décoration raffinée qui leur donne l' aspect de palais .,Les hammams traditionnels syriens sont surtout remarquables par leur décoration raffinée qui donne leur l' aspect de palais .,[0] -> [1] -> [5]
Je vous recommande la soupe de raviolis et la soupe de nouille ainsi que les marmites .,Je recommande vous la soupe de raviolis et la soupe de nouille ainsi que les marmites .,[0] -> [1] -> [5]
Son correspondant lui indique qu' une transaction doit se dérouler à l' heure de le déjeuner à l' hôtel Mercure de Nogent-sur-Marne : une femme doit remettre 50 000 francs à un homme à les cheveux bruns qui arrivera en 4X4 .,Son correspondant indique lui qu' une transaction doit se dérouler à l' heure de le déjeuner à l' hôtel Mercure de Nogent-sur-Marne : une femme doit remettre 50 000 francs à un homme à les cheveux bruns qui arrivera en 4X4 .,[0] -> [1] -> [5]
"Lorsque Bonamy cesse ses activités en 1780 , c' est Armand Prudent Lemerle qui lui succède .","Lorsque Bonamy cesse ses activités en 1780 , c' est Armand Prudent Lemerle qui succède lui .",[0] -> [1] -> [5]
"Elle lui permet d' obtenir une sélection pour le WNBA All-Star Game , avec 15,7 pts , 4,9 rbds , 1,8 passes et 1,36 interceptions .","Elle permet lui d' obtenir une sélection pour le WNBA All-Star Game , avec 15,7 pts , 4,9 rbds , 1,8 passes et 1,36 interceptions .",[0] -> [1] -> [5]
"Son neveu Léonce Chagot lui succèdera puis , en 1893 , Lionel de Gournay .","Son neveu Léonce Chagot succèdera lui puis , en 1893 , Lionel de Gournay .",[0] -> [1] -> [5]
"Il y contient des chansons qui figuraient sur l' album d' origine , mais n' avaient pas été retenues pour la première édition en CD ( Tout petit monde , Il me restera )","Il y contient des chansons qui figuraient sur l' album d' origine , mais n' avaient pas été retenues pour la première édition en CD ( Tout petit monde , Il restera me )",[0] -> [1] -> [5]
"Elle est le fruit d' un enseignement qui a commencé à l' âge de 6 ans avec son professeur de père qui lui apprend à jouer le plus long possible pour briser le jeu de ses adversaires : un tennis solide , académique , sans faille , mécanisé , automatisé , et repoli chaque jour durant des heures .","Elle est le fruit d' un enseignement qui a commencé à l' âge de 6 ans avec son professeur de père qui apprend lui à jouer le plus long possible pour briser le jeu de ses adversaires : un tennis solide , académique , sans faille , mécanisé , automatisé , et repoli chaque jour durant des heures .",[0] -> [1] -> [5]
"Makari , un moine ascète à qui il en parle et qu' il considère comme son père spirituel , lui conseille alors d' abandonner son métier de fermier , de se plonger davantage dans la religion et de se rendre à le mont Athos , en Grèce .","Makari , un moine ascète à qui il en parle et qu' il considère comme son père spirituel , conseille lui alors d' abandonner son métier de fermier , de se plonger davantage dans la religion et de se rendre à le mont Athos , en Grèce .",[0] -> [1] -> [5]
"En effet , dans le cadre de la théorie néoclassique , l' agent économique cherche à maximiser son utilité et lorsqu' il est amené à faire un arbitrage entre consommation et épargne , il va considérer ce que lui rapportera l' épargne , autrement dit , il va considérer le taux d' intérêt .","En effet , dans le cadre de la théorie néoclassique , l' agent économique cherche à maximiser son utilité et lorsqu' il est amené à faire un arbitrage entre consommation et épargne , il va considérer ce que rapportera lui l' épargne , autrement dit , il va considérer le taux d' intérêt .",[0] -> [1] -> [5]
"Rob-Vel lui attribue un frère jumeau , tandis que Franquin lui offre un oncle dans L' héritage .","Rob-Vel attribue lui un frère jumeau , tandis que Franquin lui offre un oncle dans L' héritage .",[0] -> [1] -> [5]
"Le message , bien que feutré , est clair : « nous vous avons accueilli longtemps , il est temps de nous rendre nos bienfaits » .","Le message , bien que feutré , est clair : « nous vous avons accueilli longtemps , il est temps de rendre nous nos bienfaits » .",[0] -> [1] -> [5]
Un grand merci pour le site de commerce en ligne qui me permet de vendre mes produits directement à le consommateur .,Un grand merci pour le site de commerce en ligne qui permet me de vendre mes produits directement à le consommateur .,[0] -> [1] -> [5]
"Après des débuts comme apprenti , il ouvrit plus tard son propre magasin sur la place de le quartier puis s' y fit construire une maison .","Après des débuts comme apprenti , il ouvrit plus tard son propre magasin sur la place de le quartier puis y fit construire s' une maison .",[0] -> [1] -> [5]
Son interprétation lui vaudra une nomination à les Oscars .,Son interprétation vaudra lui une nomination à les Oscars .,[0] -> [1] -> [5]
"De toute façon , je vais en prison , j' espère que ça en valait la peine .","De toute façon , je vais en prison , j' espère que ça valait en la peine .",[0] -> [1] -> [5]
"Nous voulons protéger notre droit à avoir des idées , des sentiments , des émotions , contre l' invasion technologique de les grands frères , comme nous le laisse à penser le cas récent d' Échelon , sur lequel cette Assemblée se penchera sous peu .","Nous voulons protéger notre droit à avoir des idées , des sentiments , des émotions , contre l' invasion technologique de les grands frères , comme le laisse nous à penser le cas récent d' Échelon , sur lequel cette Assemblée se penchera sous peu .",[0] -> [1] -> [5]
Celui-ci abandonne le panarabisme à le profit d' un nationalisme syrien lui permettant de se dégager de les problématiques régionales .,Celui-ci abandonne le panarabisme à le profit d' un nationalisme syrien permettant lui de se dégager de les problématiques régionales .,[0] -> [1] -> [5]
"Les sept premières années , le groupe se réunit surtout pour voir des dissections et en discuter .","Les sept premières années , le groupe se réunit surtout pour voir des dissections et discuter en .",[0] -> [1] -> [5]
"Elle obtient le prix Jean-Valcourt qui lui permet de voyager en France , en Suisse et en Italie .","Elle obtient le prix Jean-Valcourt qui permet lui de voyager en France , en Suisse et en Italie .",[0] -> [1] -> [5]
"On lui a proposé plusieurs scénarios , des publicités télévisées , des projets de scène , mais rien ne l’ a intéressé .","On a proposé lui plusieurs scénarios , des publicités télévisées , des projets de scène , mais rien ne l’ a intéressé .",[0] -> [1] -> [5]
"Si vous aimez la bonne cuisine de le Sud Ouest , je vous conseille d' aller à le Chez Papa de le 13ième .","Si vous aimez la bonne cuisine de le Sud Ouest , je conseille vous d' aller à le Chez Papa de le 13ième .",[0] -> [1] -> [5]
"Le matériel est de bonne qualité , je pense même qu' il est changé régulièrement ( ça fait 4 ans que j' y vais ) .","Le matériel est de bonne qualité , je pense même qu' il est changé régulièrement ( ça fait 4 ans que j' vais y ) .",[0] -> [1] -> [5]
"Alors qu' elle débute son entraînement , Kel est constamment assaillie par des sceptiques et son maître lui impose une période d' essai car il pense qu' une fille ne pourra jamais réussir dans le métier de chevalier .","Alors qu' elle débute son entraînement , Kel est constamment assaillie par des sceptiques et son maître impose lui une période d' essai car il pense qu' une fille ne pourra jamais réussir dans le métier de chevalier .",[0] -> [1] -> [5]
"Il n' en reste actuellement que le plan à le sol , qui est constitué de deux grandes salles : la première est une sorte de vestibule à quatre piliers , la seconde contient un naos à le centre , entouré d' un couloir sur lequel ouvrent des pièces annexes .","Il n' reste en actuellement que le plan à le sol , qui est constitué de deux grandes salles : la première est une sorte de vestibule à quatre piliers , la seconde contient un naos à le centre , entouré d' un couloir sur lequel ouvrent des pièces annexes .",[0] -> [1] -> [5]
"Son caractère impulsif nuit également à sa santé puisqu' il s' emporte facilement , ce qui lui a valu quelques séjours à l' hôpital , notamment dans Papa furax , où son ire contre Bart lui sauve la vie .","Son caractère impulsif nuit également à sa santé puisqu' il s' emporte facilement , ce qui a valu lui quelques séjours à l' hôpital , notamment dans Papa furax , où son ire contre Bart lui sauve la vie .",[0] -> [1] -> [5]
"Il assiège et prend Saint-Tropez , le duc de Vendôme , qui commandait en Provence pour le roi , le nomme lieutenant de le roi de la ville et de le château , et lui donne une compagnie dans le régiment de Lion , et , peu après , une autre dans celui de Provence .","Il assiège et prend Saint-Tropez , le duc de Vendôme , qui commandait en Provence pour le roi , le nomme lieutenant de le roi de la ville et de le château , et donne lui une compagnie dans le régiment de Lion , et , peu après , une autre dans celui de Provence .",[0] -> [1] -> [5]
"Par exemple le récit de Caïn et Abel : en effet , le meurtre d' Abel a des conséquences pour la terre entière , pour tous les habitants qui peinent désormais à en tirer leur nourriture .","Par exemple le récit de Caïn et Abel : en effet , le meurtre d' Abel a des conséquences pour la terre entière , pour tous les habitants qui peinent désormais à tirer en leur nourriture .",[0] -> [1] -> [5]
