sen_str,swapped_sen_str,leaf_rule
तथा न ह वै एतस्मै अग्रे पशवः चक्षमिरे यत् हविः अभविष्यन् यथा एनान् इदम् हविः भूतान् अग्नौ जुह्वति,तथा न ह वै अग्रे पशवः चक्षमिरे एतस्मै यत् हविः अभविष्यन् यथा एनान् इदम् हविः भूतान् अग्नौ जुह्वति,[0] -> [1] -> [19] -> [20] -> [24] -> [25]
तत् यथा एव अदः मनुष्य राजे आगते अन्यस्मिन् वा अर्हति उक्षाणम् वा वेहतम् वा क्षदन्ते एवम् एव अस्मै एतत् क्षदन्ते यत् अग्निम् मन्थन्ति,तत् यथा एव अदः मनुष्य राजे आगते अन्यस्मिन् वा अर्हति उक्षाणम् वा वेहतम् वा क्षदन्ते एवम् एव एतत् क्षदन्ते अस्मै यत् अग्निम् मन्थन्ति,[0] -> [1] -> [19] -> [20] -> [24] -> [25]
सः एव अस्मै अन्नम् प्रयच्छति,सः एव अन्नम् प्रयच्छति अस्मै,[0] -> [1] -> [19] -> [20] -> [24] -> [25]
यत् वायवे वायुः एव अस्मै प्राणम् निनयति,यत् वायवे वायुः एव प्राणम् निनयति अस्मै,[0] -> [1] -> [19] -> [20] -> [24] -> [25]
यः एनम् तत्र ब्रूयात् यजमानम् अग्नौ प्रावार्क्षीः प्र अस्य अग्निः प्राणान् धक्ष्यति मरिष्यति यजमानः इति शश्वत् तथा स्यात्,यः तत्र ब्रूयात् एनम् यजमानम् अग्नौ प्रावार्क्षीः प्र अस्य अग्निः प्राणान् धक्ष्यति मरिष्यति यजमानः इति शश्वत् तथा स्यात्,[0] -> [1] -> [19] -> [20] -> [24] -> [25]
सः एव अस्मै वज्रम् प्रयच्छति,सः एव वज्रम् प्रयच्छति अस्मै,[0] -> [1] -> [19] -> [20] -> [24] -> [25]
अथ अस्यै _ _ छायायाम् दक्षिणायाम् नासिकायाम् अ जीताम् ओषधीम् नस्तस् करोति,अथ _ _ छायायाम् दक्षिणायाम् नासिकायाम् अ जीताम् ओषधीम् नस्तस् करोति अस्यै,[0] -> [1] -> [19] -> [20] -> [24] -> [25]
सः अस्मै पशून् प्रजनयति,सः पशून् प्रजनयति अस्मै,[0] -> [1] -> [19] -> [20] -> [24] -> [25]
अन्नाद्यम् अस्मै अवरुन्द्धे,अन्नाद्यम् अवरुन्द्धे अस्मै,[0] -> [1] -> [19] -> [20] -> [24] -> [25]
ओषधीः एव अस्मै स्वदयति,ओषधीः एव स्वदयति अस्मै,[0] -> [1] -> [19] -> [20] -> [24] -> [25]
यत् मैत्रः भवति मित्रेण एव अस्मै वरुणम् शमयति,यत् मैत्रः भवति मित्रेण एव वरुणम् शमयति अस्मै,[0] -> [1] -> [19] -> [20] -> [24] -> [25]
तत् यथा ग्रामम् भिक्षित्वा अ लब्ध्वा उपविशेत् न अहम् अतस् दत्तम् अश्नीयाम् इति ते एव एनम् उपमन्त्रयन्ते ये पुरस्तात् प्रत्याचक्षीरन्,तत् यथा ग्रामम् भिक्षित्वा अ लब्ध्वा उपविशेत् न अहम् अतस् दत्तम् अश्नीयाम् इति ते एव उपमन्त्रयन्ते एनम् ये पुरस्तात् प्रत्याचक्षीरन्,[0] -> [1] -> [19] -> [20] -> [24] -> [25]
द्विषन्तम् एव अस्मै तत् पाप्मानम् भ्रातृव्यम् अपबाधते अधरम् पादयति,द्विषन्तम् एव तत् पाप्मानम् भ्रातृव्यम् अपबाधते अस्मै अधरम् पादयति,[0] -> [1] -> [19] -> [20] -> [24] -> [25]
तौ एव अस्मै अहर् रात्राभ्याम् प्रजाम् प्रजनयतः,तौ एव अहर् रात्राभ्याम् प्रजाम् प्रजनयतः अस्मै,[0] -> [1] -> [19] -> [20] -> [24] -> [25]
यत्र वेत्थ वनस्पते इति एतया ऋचा द्वौ पिण्डौ कृत्वा वीवधे अभ्याधाय दूताय प्रयच्छेत् इमम् तस्मै बलिम् हर इति च एनम् ब्रूयात्,यत्र वेत्थ वनस्पते इति एतया ऋचा द्वौ पिण्डौ कृत्वा वीवधे अभ्याधाय दूताय प्रयच्छेत् इमम् तस्मै बलिम् हर इति च ब्रूयात् एनम्,[0] -> [1] -> [19] -> [20] -> [24] -> [25]
तत् अस्मै इयम् पृथिवी पुनर् ददाति,तत् इयम् पृथिवी पुनर् ददाति अस्मै,[0] -> [1] -> [19] -> [20] -> [24] -> [25]
सः एव अस्मै पशून् मिथुनान् प्रजनयति,सः एव पशून् मिथुनान् प्रजनयति अस्मै,[0] -> [1] -> [19] -> [20] -> [24] -> [25]
यदि उ वै स्वयम् पश्यति न बहूनाम् चन अन्येषाम् श्रद्दधाति,यदि उ वै स्वयम् पश्यति न श्रद्दधाति बहूनाम् चन अन्येषाम्,[0] -> [1] -> [19] -> [20] -> [24] -> [25]
स ह एभ्यः विहृतः न प्रबभूव,स ह विहृतः न प्रबभूव एभ्यः,[0] -> [1] -> [19] -> [20] -> [24] -> [25]
सः अस्मै अन्नाद्यम् प्रयच्छति,सः अन्नाद्यम् प्रयच्छति अस्मै,[0] -> [1] -> [19] -> [20] -> [24] -> [25]
गच्छन् इन्द्रस्य निष्कृतम् इति पूतम् एव एनम् यज्ञियम् इन्द्रस्य निष्कृतम् गमयति,गच्छन् इन्द्रस्य निष्कृतम् इति इन्द्रस्य निष्कृतम् गमयति पूतम् एव एनम् यज्ञियम्,[0] -> [1] -> [19] -> [20] -> [24] -> [25]
छन्दसाम् एव अस्मै रसेन पशून् धत्तः,छन्दसाम् एव रसेन पशून् धत्तः अस्मै,[0] -> [1] -> [19] -> [20] -> [24] -> [25]
यः उक्था केवला दधे यः सोमम् धृषिता अपिबत् यस्मै यस्मै विष्णुः विष्णुः त्रीणि त्रीणि पदा पदा विचक्रमे विचक्रमे उप उप मित्रस्य मित्रस्य धर्मभिः धर्मभिः यस्य त्वम् इन्द्र स्तोमेषु चाकनः वाजे वाजिन् शतक्रतो तम् त्वा वयम् सुदुघाम् इव गो दुहः जुहूमसि श्रवस्यवः,यः उक्था केवला दधे यः सोमम् धृषिता अपिबत् यस्मै विष्णुः विष्णुः त्रीणि त्रीणि पदा पदा विचक्रमे यस्मै विचक्रमे उप उप मित्रस्य मित्रस्य धर्मभिः धर्मभिः यस्य त्वम् इन्द्र स्तोमेषु चाकनः वाजे वाजिन् शतक्रतो तम् त्वा वयम् सुदुघाम् इव गो दुहः जुहूमसि श्रवस्यवः,[0] -> [1] -> [19] -> [20] -> [24] -> [25]
तत् अस्मै एतद् जीवातुम् एव परोक्षम् आशास्ते,तत् एतद् जीवातुम् एव परोक्षम् आशास्ते अस्मै,[0] -> [1] -> [19] -> [20] -> [24] -> [25]
यत् वज्रिणे वज्रम् एव अस्मै आधात्,यत् वज्रिणे वज्रम् एव आधात् अस्मै,[0] -> [1] -> [19] -> [20] -> [24] -> [25]
अग्निम् पुरीष्यम् अङ्गिरस्वत् भरामः इति येन द्वेष्येण संगच्छते तम् अभिमन्त्रयते,अग्निम् पुरीष्यम् अङ्गिरस्वत् भरामः इति अभिमन्त्रयते येन द्वेष्येण संगच्छते तम्,[0] -> [1] -> [19] -> [20] -> [24] -> [25]
ब्रह्म एव अस्मै एतत् एतत् पुरोगवम् अकः,ब्रह्म एव एतत् एतत् पुरोगवम् अकः अस्मै,[0] -> [1] -> [19] -> [20] -> [24] -> [25]
सः अस्मै पशून् प्रजनयति,सः पशून् प्रजनयति अस्मै,[0] -> [1] -> [19] -> [20] -> [24] -> [25]
तत् अस्मै एतत् पशून् एव परोक्षम् आशास्ते,तत् एतत् पशून् एव परोक्षम् आशास्ते अस्मै,[0] -> [1] -> [19] -> [20] -> [24] -> [25]
विश्वानि दधानः ओजसा इति ओजसा एव अस्मै वीर्येण विशम् पुरस्तात् परिगृह्णाति,विश्वानि दधानः ओजसा इति ओजसा एव वीर्येण विशम् पुरस्तात् परिगृह्णाति अस्मै,[0] -> [1] -> [19] -> [20] -> [24] -> [25]
अथ अस्मै अन्वारब्धाय करोति,अथ करोति अस्मै अन्वारब्धाय,[0] -> [1] -> [19] -> [20] -> [24] -> [25]
यत् द्वे समिधौ आदध्यात् भ्रातृव्यम् अस्मै जनयेत्,यत् द्वे समिधौ आदध्यात् भ्रातृव्यम् जनयेत् अस्मै,[0] -> [1] -> [19] -> [20] -> [24] -> [25]
अग्निम् उपसमाधाय परिसमुह्य परिस्तीर्य पर्युक्ष्य दक्षिणतस् अग्नेः ब्रह्मानम् उपवेश्य उत्तरतस् उद पात्रम् शमी शमकवत् अथ एनम् अभिमन्त्रयते _ वर्णाः शुचयः इति चतसृभिः,अग्निम् उपसमाधाय परिसमुह्य परिस्तीर्य पर्युक्ष्य दक्षिणतस् अग्नेः ब्रह्मानम् उपवेश्य उत्तरतस् उद पात्रम् शमी शमकवत् अथ अभिमन्त्रयते एनम् _ वर्णाः शुचयः इति चतसृभिः,[0] -> [1] -> [19] -> [20] -> [24] -> [25]
ताः एनम् अब्रुवन् आयतनम् नः प्रजानीहि यस्मिन् प्रतिष्ठिताः अन्नम् अदाम इति,ताः अब्रुवन् एनम् आयतनम् नः प्रजानीहि यस्मिन् प्रतिष्ठिताः अन्नम् अदाम इति,[0] -> [1] -> [19] -> [20] -> [24] -> [25]
_ दाः तु एव एनम् उपमन्त्रयन्ते ददाम ते इति,_ दाः तु एव उपमन्त्रयन्ते एनम् ददाम ते इति,[0] -> [1] -> [19] -> [20] -> [24] -> [25]
तत् एनाम् प्रत्यक्षम् उपह्वयते ततुरिः इति,तत् प्रत्यक्षम् उपह्वयते एनाम् ततुरिः इति,[0] -> [1] -> [19] -> [20] -> [24] -> [25]
सः आह यूपाय अज्यमानाय अनुब्रूहि इति,सः आह अनुब्रूहि यूपाय अज्यमानाय इति,[0] -> [1] -> [2] -> [3] -> [4] -> [14]
यूपाय अज्यमानाय अनुब्रूहि इति संप्रेष्यति अज्यमानाय अनुब्रूहि अञ्ज्मः यूपम् अनुब्रूहि इति वा,यूपाय अज्यमानाय अनुब्रूहि इति संप्रेष्यति अनुब्रूहि अज्यमानाय अञ्ज्मः यूपम् अनुब्रूहि इति वा,[0] -> [1] -> [2] -> [3] -> [4] -> [14]
अथ संप्रैषम् आह अग्नये प्रणीयमानाय अनुब्रूहि अग्नीध् एकस्फ्यया अनुसंधेहि इति,अथ संप्रैषम् आह अनुब्रूहि अग्नये प्रणीयमानाय अग्नीध् एकस्फ्यया अनुसंधेहि इति,[0] -> [1] -> [2] -> [3] -> [4] -> [14]
जाते आह जाताय अनुब्रूहि इति,जाते आह अनुब्रूहि जाताय इति,[0] -> [1] -> [2] -> [3] -> [4] -> [14]
ततस् संप्रेष्यति यूपाय अज्यमानाय अनुब्रूहि इति,ततस् संप्रेष्यति अनुब्रूहि यूपाय अज्यमानाय इति,[0] -> [1] -> [2] -> [3] -> [4] -> [14]
पर्यग्नये क्रियमाणाय अनुब्रूहि इति संप्रेष्यति पर्यग्नये अनुब्रूहि इति वा,पर्यग्नये क्रियमाणाय अनुब्रूहि इति संप्रेष्यति अनुब्रूहि पर्यग्नये इति वा,[0] -> [1] -> [2] -> [3] -> [4] -> [14]
प्रहरिष्यन् प्रह्रियमाणाय अनुब्रूहि इति,प्रहरिष्यन् अनुब्रूहि प्रह्रियमाणाय इति,[0] -> [1] -> [2] -> [3] -> [4] -> [14]
अ न्यूनम् अन् अतिरिक्तम् परिन्यस्य उद पात्रम् उपनिनीय अथ एताम् त्रिगुणाम् रशनाम् त्रिस् संभुज्य मध्यमेन गुणेन नाभि दघ्ने परिव्ययन् आह परिवीयमाणाय अनुब्रूहि इति,अ न्यूनम् अन् अतिरिक्तम् परिन्यस्य उद पात्रम् उपनिनीय अथ एताम् त्रिगुणाम् रशनाम् त्रिस् संभुज्य मध्यमेन गुणेन नाभि दघ्ने परिव्ययन् आह अनुब्रूहि परिवीयमाणाय इति,[0] -> [1] -> [2] -> [3] -> [4] -> [14]
आहवनीये इध्मम् आदीप्य संप्रेष्यति अग्नये प्रणीयमानाय अनुब्रूहि इति,आहवनीये इध्मम् आदीप्य संप्रेष्यति अनुब्रूहि अग्नये प्रणीयमानाय इति,[0] -> [1] -> [2] -> [3] -> [4] -> [14]
ततस् संप्रेष्यति पर्यग्नये क्रियमाणाय अनुब्रूहि इति,ततस् संप्रेष्यति अनुब्रूहि पर्यग्नये क्रियमाणाय इति,[0] -> [1] -> [2] -> [3] -> [4] -> [14]
ततस् संप्रेष्यति उच्छ्रीयमाणाय अनुब्रूहि इति,ततस् संप्रेष्यति अनुब्रूहि उच्छ्रीयमाणाय इति,[0] -> [1] -> [2] -> [3] -> [4] -> [14]
आहवनीये प्रणयनीयम् इध्मम् आदीप्य सिकताभिः उपयम्य अग्नये प्रणीयमानाय अनुब्रूहि इति संप्रेष्यति प्रणीयमानाय अनुब्रूहि इति वा,आहवनीये प्रणयनीयम् इध्मम् आदीप्य सिकताभिः उपयम्य अनुब्रूहि अग्नये प्रणीयमानाय इति संप्रेष्यति प्रणीयमानाय अनुब्रूहि इति वा,[0] -> [1] -> [2] -> [3] -> [4] -> [14]
ततस् संप्रेष्यति अग्नये समिध्यमानाय अनुब्रूहि इति,ततस् संप्रेष्यति अनुब्रूहि अग्नये समिध्यमानाय इति,[0] -> [1] -> [2] -> [3] -> [4] -> [14]
अथ आह उच्छ्रीयमाणाय अनुब्रूहि इति,अथ आह अनुब्रूहि उच्छ्रीयमाणाय इति,[0] -> [1] -> [2] -> [3] -> [4] -> [14]
यूपाय उच्छ्रीयमाणाय अनुब्रूहि इति संप्रेष्यति उच्छ्रीयमाणाय अनुब्रूहि इति वा,यूपाय उच्छ्रीयमाणाय अनुब्रूहि इति संप्रेष्यति अनुब्रूहि उच्छ्रीयमाणाय इति वा,[0] -> [1] -> [2] -> [3] -> [4] -> [14]
उच्छ्रयन् आह उच्छ्रीयमाणाय अनुब्रूहि इति,उच्छ्रयन् आह अनुब्रूहि उच्छ्रीयमाणाय इति,[0] -> [1] -> [2] -> [3] -> [4] -> [14]
आहवनीये प्रणयनीयम् इध्मम् आदीप्य सिकताभिः उपयम्य अग्नये प्रणीयमानाय अनुब्रूहि इति संप्रेष्यति प्रणीयमानाय अनुब्रूहि इति वा,आहवनीये प्रणयनीयम् इध्मम् आदीप्य सिकताभिः उपयम्य अग्नये प्रणीयमानाय अनुब्रूहि इति संप्रेष्यति अनुब्रूहि प्रणीयमानाय इति वा,[0] -> [1] -> [2] -> [3] -> [4] -> [14]
अग्नये मथ्यमानाय अनुब्रूहि इति संप्रेष्यति मथ्यमानाय अनुब्रूहि इति वा,अग्नये मथ्यमानाय अनुब्रूहि इति संप्रेष्यति अनुब्रूहि मथ्यमानाय इति वा,[0] -> [1] -> [2] -> [3] -> [4] -> [14]
स्रुवेण अग्निष्ठाम् अश्रिम् अभिघारयन् आह यूपाय अज्यमानाय अनुब्रूहि इति,स्रुवेण अग्निष्ठाम् अश्रिम् अभिघारयन् आह अनुब्रूहि यूपाय अज्यमानाय इति,[0] -> [1] -> [2] -> [3] -> [4] -> [14]
यूपाय परिवीयमाणाय अनुब्रूहि इति संप्रेष्यति परिवीयमाणाय अनुब्रूहि इति वा,यूपाय परिवीयमाणाय अनुब्रूहि इति संप्रेष्यति अनुब्रूहि परिवीयमाणाय इति वा,[0] -> [1] -> [2] -> [3] -> [4] -> [14]
ताम् अध्वर्युः स्रुवेण अभिघारयन् आह स्तोकेभ्यः अनुब्रूहि इति,ताम् अध्वर्युः स्रुवेण अभिघारयन् आह अनुब्रूहि स्तोकेभ्यः इति,[0] -> [1] -> [2] -> [3] -> [4] -> [14]
