sen_str,swapped_sen_str,leaf_rule
अथ _ एनम् ऊष्मसु उपालभेत प्रजापतिम् शरणम् प्रपन्नः अभूवम् सः त्वा प्रतिपेक्ष्यति इति एनम् ब्रूयात्,अथ _ एनम् ऊष्मसु उपालभेत प्रजापतिम् शरणम् प्रपन्नः अभूवम् सः त्वा प्रतिपेक्ष्यति इति ब्रूयात् एनम्,[0] -> [1] -> [19] -> [20] -> [24] -> [25]
याम् उ एनया काम् च आशिषम् आशास्त सा अस्मै सर्वा समार्ध्यत,याम् उ एनया काम् च आशिषम् आशास्त सा सर्वा समार्ध्यत अस्मै,[0] -> [1] -> [19] -> [20] -> [24] -> [25]
सा _ अस्मै दद्यात् इन्द्रियेण ते यशसा यशः आदधामि इति,सा _ दद्यात् अस्मै इन्द्रियेण ते यशसा यशः आदधामि इति,[0] -> [1] -> [19] -> [20] -> [24] -> [25]
तत् अस्मै एतत् प्रजाम् एव परोक्षम् आशास्ते,तत् एतत् प्रजाम् एव परोक्षम् आशास्ते अस्मै,[0] -> [1] -> [19] -> [20] -> [24] -> [25]
सः एव अस्मै प्रजाम् पशून् प्रजनयति,सः एव प्रजाम् पशून् प्रजनयति अस्मै,[0] -> [1] -> [19] -> [20] -> [24] -> [25]
ऊर्जा एव अस्मै ऊर्जम् पशून् आप्त्वा अवरुन्द्धे,ऊर्जा एव ऊर्जम् पशून् आप्त्वा अवरुन्द्धे अस्मै,[0] -> [1] -> [19] -> [20] -> [24] -> [25]
वज्रम् एव अस्मै प्रहरति,वज्रम् एव प्रहरति अस्मै,[0] -> [1] -> [19] -> [20] -> [24] -> [25]
ब्रह्म एव आभ्याम् एतत् पुरोगवम् अकः,ब्रह्म एव एतत् पुरोगवम् अकः आभ्याम्,[0] -> [1] -> [19] -> [20] -> [24] -> [25]
सः अस्मै ब्रह्मवर्चसम् प्रयच्छति,सः ब्रह्मवर्चसम् प्रयच्छति अस्मै,[0] -> [1] -> [19] -> [20] -> [24] -> [25]
तत् याभ्याम् देवताभ्याम् आरभते ताभ्याम् मेध्यम् करोति,तत् मेध्यम् करोति याभ्याम् देवताभ्याम् आरभते ताभ्याम्,[0] -> [1] -> [19] -> [20] -> [24] -> [25]
वज्रम् एव अस्मै प्रहरति,वज्रम् एव प्रहरति अस्मै,[0] -> [1] -> [19] -> [20] -> [24] -> [25]
तस्मात् एनत् परस्मै न शंसेत् न इद् सर्वेषाम् भूतानाम् आत्मानम् परस्मिन् दधानि इति,तस्मात् एनत् न शंसेत् परस्मै न इद् सर्वेषाम् भूतानाम् आत्मानम् परस्मिन् दधानि इति,[0] -> [1] -> [19] -> [20] -> [24] -> [25]
अनुकाम् अस्मै विशम् अ विवादिनीम् करोति,अनुकाम् विशम् अ विवादिनीम् करोति अस्मै,[0] -> [1] -> [19] -> [20] -> [24] -> [25]
यत् वृष्णः सुतस्य ओजसः इति आह ओजसा एव अस्मै वीर्येण दिवः वृष्टिम् प्रयच्छति,यत् वृष्णः सुतस्य ओजसः इति आह ओजसा एव वीर्येण दिवः वृष्टिम् प्रयच्छति अस्मै,[0] -> [1] -> [19] -> [20] -> [24] -> [25]
कदाचन स्तरीः असि इति एतेन च एनम् अभिश्रावयेत्,कदाचन स्तरीः असि इति एतेन च अभिश्रावयेत् एनम्,[0] -> [1] -> [19] -> [20] -> [24] -> [25]
सः जातः भूतानि अभिव्यैक्षत् किम् इह अन्यम् वावदिषत् इति,सः जातः भूतानि अभिव्यैक्षत् किम् इह वावदिषत् अन्यम् इति,[0] -> [1] -> [19] -> [20] -> [24] -> [25]
श्रेयान् श्रेयान् आत्मना भवति पापीयान् पापीयान् यः एनम् द्वेष्टि यः अस्मै अरातीयति यः एवम् विद्वान् अग्निम् उपतिष्ठते,श्रेयान् श्रेयान् आत्मना भवति पापीयान् पापीयान् यः एनम् द्वेष्टि यः अरातीयति अस्मै यः एवम् विद्वान् अग्निम् उपतिष्ठते,[0] -> [1] -> [19] -> [20] -> [24] -> [25]
यत् आदित्यः अमुम् एव अस्मै उन्नयति,यत् आदित्यः अमुम् एव उन्नयति अस्मै,[0] -> [1] -> [19] -> [20] -> [24] -> [25]
स यः वृषा नराम् न रोदस्योः श्रवोभिः अस्ति जीव पीत सर्गः प्र यः सस्राणः शिश्रीत योनौ आ यः पुरम् नार्मिणीम् अदीदेत् अत्यः कविः नभन्यः ना अर्वा सूरः न रुरुक्वान् शत आत्मा अयम् स होता यः द्विजन्मा विश्वा दधे वार्याणि श्रवस्या मर्तः यः अस्मै सुतुकः ददाश,स यः वृषा नराम् न रोदस्योः श्रवोभिः अस्ति जीव पीत सर्गः प्र यः सस्राणः शिश्रीत योनौ आ यः पुरम् नार्मिणीम् अदीदेत् अत्यः कविः नभन्यः ना अर्वा सूरः न रुरुक्वान् शत आत्मा अयम् स होता यः द्विजन्मा विश्वा दधे वार्याणि श्रवस्या मर्तः यः सुतुकः ददाश अस्मै,[0] -> [1] -> [19] -> [20] -> [24] -> [25]
सर्वान् एव एनान् एता पुनाति सर्वान् अभिवदति,सर्वान् एव एनान् एता पुनाति अभिवदति सर्वान्,[0] -> [1] -> [19] -> [20] -> [24] -> [25]
ते अस्मै वृष्टिम् प्रयच्छन्ति,ते वृष्टिम् प्रयच्छन्ति अस्मै,[0] -> [1] -> [19] -> [20] -> [24] -> [25]
पवस्व वाचः अग्रियः इति प्रतिपदम् कुर्यात् यम् कामयेत समानानाम् श्रेष्ठः स्यात् इति,पवस्व वाचः अग्रियः इति प्रतिपदम् कुर्यात् कामयेत यम् समानानाम् श्रेष्ठः स्यात् इति,[0] -> [1] -> [19] -> [20] -> [24] -> [25]
इन्द्रियेण एव अस्मै विशम् उपयुनक्ति,इन्द्रियेण एव विशम् उपयुनक्ति अस्मै,[0] -> [1] -> [19] -> [20] -> [24] -> [25]
कतरः मेनिम् प्रति तम् मुचाते यः ईम् वहाते यः ईम् वा वरेयात्,कतरः मेनिम् प्रति मुचाते तम् यः ईम् वहाते यः ईम् वा वरेयात्,[0] -> [1] -> [19] -> [20] -> [24] -> [25]
एव अस्मै वचः वेदयन्ते,एव वचः वेदयन्ते अस्मै,[0] -> [1] -> [19] -> [20] -> [24] -> [25]
सा अस्मै अन्नाद्यम् प्रयच्छति,सा अन्नाद्यम् प्रयच्छति अस्मै,[0] -> [1] -> [19] -> [20] -> [24] -> [25]
अथ एनम् वासः परिधापयति येन इन्द्राय बृहस्पतिः वासः पर्यदधात् तेन त्वा परिदधामि आयुषे दीर्घ आयु त्वाय बलाय वर्चसे इति,अथ वासः परिधापयति एनम् येन इन्द्राय बृहस्पतिः वासः पर्यदधात् तेन त्वा परिदधामि आयुषे दीर्घ आयु त्वाय बलाय वर्चसे इति,[0] -> [1] -> [19] -> [20] -> [24] -> [25]
पश्चात् अन्ववसायिनीम् एव अस्मै विशम् करोति,पश्चात् अन्ववसायिनीम् एव विशम् करोति अस्मै,[0] -> [1] -> [19] -> [20] -> [24] -> [25]
सः अस्मै ब्रह्मवर्चसम् प्रयच्छति,सः ब्रह्मवर्चसम् प्रयच्छति अस्मै,[0] -> [1] -> [19] -> [20] -> [24] -> [25]
अथ एनम् परिददाति परि इमम् इन्द्र ब्रह्मणे महे श्रोत्राय दध्मसि अथ एनम् जरिमा नयेत् ज्योक् श्रोत्रे अधिजागरत् इति ब्राह्मणम् परि इमम् इन्द्र ब्रह्मणे महे राष्ट्राय दध्मसि अथ एनम् जरिमा नयेत् ज्योक् राष्ट्रे अधिजागरत् इति राजन्यम् परि इमम् इन्द्र ब्रह्मणे महे पोषाय दध्मसि अथ एनम् जरिमा नयेत् ज्योक् पोषे अधिजागरत् इति वैश्यम्,अथ परिददाति एनम् परि इमम् इन्द्र ब्रह्मणे महे श्रोत्राय दध्मसि अथ एनम् जरिमा नयेत् ज्योक् श्रोत्रे अधिजागरत् इति ब्राह्मणम् परि इमम् इन्द्र ब्रह्मणे महे राष्ट्राय दध्मसि अथ एनम् जरिमा नयेत् ज्योक् राष्ट्रे अधिजागरत् इति राजन्यम् परि इमम् इन्द्र ब्रह्मणे महे पोषाय दध्मसि अथ एनम् जरिमा नयेत् ज्योक् पोषे अधिजागरत् इति वैश्यम्,[0] -> [1] -> [19] -> [20] -> [24] -> [25]
ताः अस्मै प्रजाम् खनन्ति,ताः प्रजाम् खनन्ति अस्मै,[0] -> [1] -> [19] -> [20] -> [24] -> [25]
तत् तस्मै परिजह्रुः,तत् परिजह्रुः तस्मै,[0] -> [1] -> [19] -> [20] -> [24] -> [25]
अथ एनम् अभिमन्त्रयते अश्मा भव इति,अथ अभिमन्त्रयते एनम् अश्मा भव इति,[0] -> [1] -> [19] -> [20] -> [24] -> [25]
सप्त होत्रा च वै इदम् संततम् त्रयस्त्रिंशेन च यत् इदम् देव मनुष्याः अन्यः अन्यस्मै सम्प्रयच्छते,सप्त होत्रा च वै इदम् संततम् त्रयस्त्रिंशेन च यत् इदम् देव मनुष्याः अन्यः सम्प्रयच्छते अन्यस्मै,[0] -> [1] -> [19] -> [20] -> [24] -> [25]
यदा वै एते एतस्मै अध्रियन्त यत् हविः अभविष्यन् तस्मात् आह हव्या ते स्वदन्ताम् इति,यदा वै एते अध्रियन्त एतस्मै यत् हविः अभविष्यन् तस्मात् आह हव्या ते स्वदन्ताम् इति,[0] -> [1] -> [19] -> [20] -> [24] -> [25]
अथ यत्र एनम् ब्रूयुः ब्रह्मन् प्रचरिष्यामः ब्रह्मन् प्रणेष्यामः ब्रह्मन् प्रस्थास्यामः ब्रह्मन् स्तोष्यामः इति वा ॐ इति एतावता प्रसुयात्,अथ यत्र ब्रूयुः एनम् ब्रह्मन् प्रचरिष्यामः ब्रह्मन् प्रणेष्यामः ब्रह्मन् प्रस्थास्यामः ब्रह्मन् स्तोष्यामः इति वा ॐ इति एतावता प्रसुयात्,[0] -> [1] -> [19] -> [20] -> [24] -> [25]
तत् उ ह उवाच शाट्यायनिः समया एव एतत् एनम् कः तत् वेद यदि एताः आपः वै अभितस् यत् वायुम् वै एषः उपह्वयते रश्मीन् वै एष तत् एतस्मै व्यूहति इति,तत् उ ह उवाच शाट्यायनिः समया एव एतत् एनम् कः तत् वेद यदि एताः आपः वै अभितस् यत् वायुम् वै एषः उपह्वयते रश्मीन् वै एष तत् व्यूहति एतस्मै इति,[0] -> [1] -> [19] -> [20] -> [24] -> [25]
तत् अस्मै प्रायच्छन्,तत् प्रायच्छन् अस्मै,[0] -> [1] -> [19] -> [20] -> [24] -> [25]
अथ एनाम् आज्यम् अवेक्षयति महीनाम् पयः असि ओषधीनाम् रसः त्वा चक्षुषा अवेक्षे सुप्रजास्त्वाय इति,अथ आज्यम् अवेक्षयति एनाम् महीनाम् पयः असि ओषधीनाम् रसः त्वा चक्षुषा अवेक्षे सुप्रजास्त्वाय इति,[0] -> [1] -> [19] -> [20] -> [24] -> [25]
तत् अस्मै अमृतम् देवाः पुनर् ददति,तत् अमृतम् देवाः पुनर् ददति अस्मै,[0] -> [1] -> [19] -> [20] -> [24] -> [25]
यत् वायवे वायुः एव अस्मै पशून् निनयति,यत् वायवे वायुः एव पशून् निनयति अस्मै,[0] -> [1] -> [19] -> [20] -> [24] -> [25]
अथ याम् एव अत्र ऋत्विजः यजमानाय आशिषम् आशासते ताम् अस्मै सर्वाम् अग्निः समर्धयति,अथ याम् एव अत्र ऋत्विजः यजमानाय आशिषम् आशासते ताम् सर्वाम् अग्निः समर्धयति अस्मै,[0] -> [1] -> [19] -> [20] -> [24] -> [25]
यत् एनम् उपेयात् तत् अस्मै दद्यात्,यत् एनम् उपेयात् तत् दद्यात् अस्मै,[0] -> [1] -> [19] -> [20] -> [24] -> [25]
तत् अस्मै एतत् पशून् एव परोक्षम् आशास्ते,तत् एतत् पशून् एव परोक्षम् आशास्ते अस्मै,[0] -> [1] -> [19] -> [20] -> [24] -> [25]
ते अस्मै अन्नाद्यम् प्रयच्छतः,ते अन्नाद्यम् प्रयच्छतः अस्मै,[0] -> [1] -> [19] -> [20] -> [24] -> [25]
माता च ते पिता च ते अग्रे वृक्षस्य क्रीडतः प्र तिडामि इति ते पिता गर्भे मुष्टिम् अतंसयत् इति एनाम् होता अभिमेथति,माता च ते पिता च ते अग्रे वृक्षस्य क्रीडतः प्र तिडामि इति ते पिता गर्भे मुष्टिम् अतंसयत् इति होता अभिमेथति एनाम्,[0] -> [1] -> [19] -> [20] -> [24] -> [25]
ते एव अस्मै अन्नम् प्रयच्छन्ति,ते एव अन्नम् प्रयच्छन्ति अस्मै,[0] -> [1] -> [19] -> [20] -> [24] -> [25]
तस्मात् एनत् परस्मै न शंसेत् न इद् सर्वेषाम् छन्दसाम् आत्मानम् परस्मिन् दधानि इति,तस्मात् एनत् न शंसेत् परस्मै न इद् सर्वेषाम् छन्दसाम् आत्मानम् परस्मिन् दधानि इति,[0] -> [1] -> [19] -> [20] -> [24] -> [25]
त्रिवृत् वाव अस्मै एतत् समृद्धम् ब्रह्मवर्चसम् दधाति,त्रिवृत् वाव एतत् समृद्धम् ब्रह्मवर्चसम् दधाति अस्मै,[0] -> [1] -> [19] -> [20] -> [24] -> [25]
यदा हि एव अस्मै न अपिदधति अथ एषः अनुगच्छति,यदा हि एव न अपिदधति अस्मै अथ एषः अनुगच्छति,[0] -> [1] -> [19] -> [20] -> [24] -> [25]
स्वे वाव अस्मै एतत् देवते स प्रस्थे अकः,स्वे वाव एतत् देवते स प्रस्थे अकः अस्मै,[0] -> [1] -> [19] -> [20] -> [24] -> [25]
तत् अस्मै अग्निः पुनर् ददाति,तत् अग्निः पुनर् ददाति अस्मै,[0] -> [1] -> [19] -> [20] -> [24] -> [25]
तत् यस्मै एवम् विदुषे अलाबुना अभिषिञ्चेत् प्रत्याहन्यात्,तत् अलाबुना अभिषिञ्चेत् यस्मै एवम् विदुषे प्रत्याहन्यात्,[0] -> [1] -> [19] -> [20] -> [24] -> [25]
सा अस्मै सर्वान् कामान् वशा प्रददुषे दुहे,सा सर्वान् कामान् वशा दुहे अस्मै प्रददुषे,[0] -> [1] -> [19] -> [20] -> [24] -> [25]
तत् आहुः यत् ब्राह्मणः राजन्यः वैश्यः दीक्षिष्यमाणम् क्षत्रियम् देवयजनम् याचति कम् क्षत्रियः याचेत् इति,तत् आहुः यत् ब्राह्मणः राजन्यः वैश्यः दीक्षिष्यमाणम् क्षत्रियम् देवयजनम् याचति क्षत्रियः याचेत् कम् इति,[0] -> [1] -> [19] -> [20] -> [24] -> [25]
स ह स्म आह सुचित्तः शैलनः यः यज्ञ कामः माम् एव स वृणीताम् ततस् एव एनम् यज्ञः उपनंस्यति एवंविदम् हि उद्गायन्तम् सर्वाः देवताः अनुसंतृप्यन्ति ताः अस्मै तृप्ताः तथा करिष्यन्ति यथा एनम् यज्ञः उपनंस्यति इति,स ह स्म आह सुचित्तः शैलनः यः यज्ञ कामः माम् एव स वृणीताम् ततस् एव एनम् यज्ञः उपनंस्यति एवंविदम् हि उद्गायन्तम् सर्वाः देवताः अनुसंतृप्यन्ति ताः तृप्ताः तथा करिष्यन्ति अस्मै यथा एनम् यज्ञः उपनंस्यति इति,[0] -> [1] -> [19] -> [20] -> [24] -> [25]
अथ _ एनम् स्पर्शेषु उपालभेत मृत्युम् शरणम् प्रपन्नः अभूवम् सः त्वा प्रतिधक्ष्यति इति एनम् ब्रूयात्,अथ _ एनम् स्पर्शेषु उपालभेत मृत्युम् शरणम् प्रपन्नः अभूवम् सः त्वा प्रतिधक्ष्यति इति ब्रूयात् एनम्,[0] -> [1] -> [19] -> [20] -> [24] -> [25]
तौ एव अस्मै अहर् रात्राभ्याम् पर्जन्यम् वर्षयतः,तौ एव अहर् रात्राभ्याम् पर्जन्यम् वर्षयतः अस्मै,[0] -> [1] -> [19] -> [20] -> [24] -> [25]
अथ याम् इच्छेत् दधीत इति तस्याम् अर्थम् निष्ठाय मुखेन मुखम् संधाय अपान्य अभिप्राण्यात् इन्द्रियेण ते रेतसा रेतः आदधामि इति,अथ इच्छेत् याम् दधीत इति तस्याम् अर्थम् निष्ठाय मुखेन मुखम् संधाय अपान्य अभिप्राण्यात् इन्द्रियेण ते रेतसा रेतः आदधामि इति,[0] -> [1] -> [19] -> [20] -> [24] -> [25]
ते एव अस्मै सजातान् प्रयच्छन्ति,ते एव सजातान् प्रयच्छन्ति अस्मै,[0] -> [1] -> [19] -> [20] -> [24] -> [25]
सः एव अस्मै एतत् द्वारम् विवृणोति,सः एव एतत् द्वारम् विवृणोति अस्मै,[0] -> [1] -> [19] -> [20] -> [24] -> [25]
यदा वै एषा सु स्पृष्टम् वर्षति अभिनिषद्य इव बत अवर्षीत् इति एनाम् आहुः,यदा वै एषा सु स्पृष्टम् वर्षति अभिनिषद्य इव बत अवर्षीत् इति आहुः एनाम्,[0] -> [1] -> [19] -> [20] -> [24] -> [25]
इन्द्रस्य भागः सुविते दधातन इति अध्वर्युः यदि रौति पशुः तम् अभिमन्त्रयते,इन्द्रस्य भागः सुविते दधातन इति अध्वर्युः यदि रौति पशुः अभिमन्त्रयते तम्,[0] -> [1] -> [19] -> [20] -> [24] -> [25]
भागधेयेन एव अस्मै सजातान् अवरुन्द्धे,भागधेयेन एव सजातान् अवरुन्द्धे अस्मै,[0] -> [1] -> [19] -> [20] -> [24] -> [25]
