sen_str,swapped_sen_str,leaf_rule
"Расказвае , што недзе а 5-й раніцы спэцназ штурмаваў корпус , дзе жылі тыя людзі , якіх сёньня па БТ назвалі « баевікамі - вагнэраўцамі » .","Расказвае , што недзе а 5-й раніцы спэцназ штурмаваў корпус , дзе жылі тыя людзі , сёньня па БТ назвалі якіх « баевікамі - вагнэраўцамі » .",[0] -> [1] -> [7]
"Гомельская блогерка Алена Германовіч пра праездку эскалятарам у кіеўскім мэтро ( <a_href=""https://goo.gl/0c3M02""> https://goo.gl/0c3M02 </a> ) : « Я як стала на той эскалятар , дык і здранцьвела — ня ведала , як на ім ехаць , ніхто нічога не гаворыць !","Гомельская блогерка Алена Германовіч пра праездку эскалятарам у кіеўскім мэтро ( <a_href=""https://goo.gl/0c3M02""> https://goo.gl/0c3M02 </a> ) : « Я як стала на той эскалятар , дык і здранцьвела — ня ведала , як на ім ехаць , ніхто не гаворыць нічога !",[0] -> [1] -> [7]
"Ды не глядзеў я , — расказвае галоўны бухгалтар ТАА « Пруднікі - Агра » Дзіма , якога знаходзім у « канторы » .","Ды не глядзеў я , — расказвае галоўны бухгалтар ТАА « Пруднікі - Агра » Дзіма , знаходзім якога у « канторы » .",[0] -> [1] -> [7]
"А на гэтым фота заходнебеларускія пісьменьнікі , жаўнеры Войска Польскага , якіх узялі ў палон немцы : Юліян Сергіевіч , Янка Брыль і Міхась Васілёк .","А на гэтым фота заходнебеларускія пісьменьнікі , жаўнеры Войска Польскага , узялі якіх ў палон немцы : Юліян Сергіевіч , Янка Брыль і Міхась Васілёк .",[0] -> [1] -> [7]
"У мяне ёсьць пэўны патэнцыял , у тым ліку палітычны » – гэтак Аляксандар Мілінкевіч пракамэнтаваў сваё рашэньне здаць кіраўніцтва « Руху за свабоду » , якім ён кіраваў ад часу яго заснаваньня ў 2006 годзе , у іншыя рукі ( <a_href=""https://goo.gl/pfFXxO""> https://goo.gl/pfFXxO </a> ) .","У мяне ёсьць пэўны патэнцыял , у тым ліку палітычны » – гэтак Аляксандар Мілінкевіч пракамэнтаваў сваё рашэньне здаць кіраўніцтва « Руху за свабоду » , ён кіраваў якім ад часу яго заснаваньня ў 2006 годзе , у іншыя рукі ( <a_href=""https://goo.gl/pfFXxO""> https://goo.gl/pfFXxO </a> ) .",[0] -> [1] -> [7]
"Спытаўся ў экс-прэзыдэнта Эстоніі пра ўсё , што вы хацелі .","Спытаўся ў экс-прэзыдэнта Эстоніі пра ўсё , вы хацелі што .",[0] -> [1] -> [7]
"« Людзям трэба піць , трэба шмат вады , а зь ёй праблема , у лягер нікога не пускаем , проста разварочваем людзей з прадуктамі і вадой .","« Людзям трэба піць , трэба шмат вады , а зь ёй праблема , у лягер не пускаем нікога , проста разварочваем людзей з прадуктамі і вадой .",[0] -> [1] -> [7]
"У эксклюзіўным інтэрвію Джон Болтан распавёў пра тое , што ён пасьпеў абмеркаваць з Лукашэнкам , а таксама , што ён думае пра стаўленьне да « апошняй дыктатуры ў Эўропе » і інтэграцыі Беларусі зь Расеяй .","У эксклюзіўным інтэрвію Джон Болтан распавёў пра тое , ён пасьпеў абмеркаваць што з Лукашэнкам , а таксама , што ён думае пра стаўленьне да « апошняй дыктатуры ў Эўропе » і інтэграцыі Беларусі зь Расеяй .",[0] -> [1] -> [7]
"— Сёння пра перамогу не думаю , я ўжо дасягнула ўсяго , чаго хацела .","— Сёння пра перамогу не думаю , я ўжо дасягнула ўсяго , хацела чаго .",[0] -> [1] -> [7]
"Наша калега Іна Студзінская высьвятляла , колькі цяпер каштуе пахаваньне ў Беларусі і ці можна ўкласьціся ў дапамогу , якую дзяржава выдзяляе ў выпадку сьмерці родзіча ( <a_href=""https://goo.gl/NRh5BU""> https://goo.gl/NRh5BU </a> ) .","Наша калега Іна Студзінская высьвятляла , колькі цяпер каштуе пахаваньне ў Беларусі і ці можна ўкласьціся ў дапамогу , дзяржава выдзяляе якую ў выпадку сьмерці родзіча ( <a_href=""https://goo.gl/NRh5BU""> https://goo.gl/NRh5BU </a> ) .",[0] -> [1] -> [7]
"Гэта голас , які ты пазнаеш з тысячы .","Гэта голас , ты пазнаеш які з тысячы .",[0] -> [1] -> [7]
"Вось , што кажуць людзі","Вось , кажуць што людзі",[0] -> [1] -> [7]
"Выпусьцілі маладзёна , якога затрымалі ў Горадні разам зь Ціханоўскім !","Выпусьцілі маладзёна , затрымалі якога ў Горадні разам зь Ціханоўскім !",[0] -> [1] -> [7]
"— У нас ёсць 2 квіткі , якія мы хочам разыграць .","— У нас ёсць 2 квіткі , мы хочам якія разыграць .",[0] -> [1] -> [7]
Калі вам вечарам няма што рабіць - пагуляйцеся ў нам беларусізатар імёнаў .,Калі вам вечарам няма рабіць што - пагуляйцеся ў нам беларусізатар імёнаў .,[0] -> [1] -> [7]
"Пачытайце , які нечаканы падарунак яна атрымала на дзень народзінаў , за што ваюе з мясцовымі ўладамі , якія сэрыялы раіць паглядзець і што зразумела пра жыцьцё за гэты час .","Пачытайце , які нечаканы падарунак яна атрымала на дзень народзінаў , за што ваюе з мясцовымі ўладамі , якія сэрыялы раіць паглядзець і зразумела што пра жыцьцё за гэты час .",[0] -> [1] -> [7]
"🍮 Будзем піць гарбатку , каву , размаўляць пра тое , як жывецца беларусу ў ЗША , ці не падаецца часам , што знаходзішся ў дэкарацыях фільмаў , якія бачыў у дзяцінстве , ці талератныя амерыканцы , і ці набыў Яўген сабе новы айфон ...","🍮 Будзем піць гарбатку , каву , размаўляць пра тое , як жывецца беларусу ў ЗША , ці не падаецца часам , што знаходзішся ў дэкарацыях фільмаў , бачыў якія у дзяцінстве , ці талератныя амерыканцы , і ці набыў Яўген сабе новы айфон ...",[0] -> [1] -> [7]
"Блогера з Магілёву Аляксандра Ірхо судзяць за апытаньне « Колькі грошай Вы давалі супрацоўнікам ДАІ ? » , якое ён паспрабаваў правесьці ў сацыяльных сетках .","Блогера з Магілёву Аляксандра Ірхо судзяць за апытаньне « Колькі грошай Вы давалі супрацоўнікам ДАІ ? » , ён паспрабаваў якое правесьці ў сацыяльных сетках .",[0] -> [1] -> [7]
"Усё , што мясцовыя ўлады лічылі « немілагучным » , было перайменавана ў Грушаўкі , Вішнёўкі , Першамайскі і Кастрычнікі …","Усё , мясцовыя ўлады лічылі што « немілагучным » , было перайменавана ў Грушаўкі , Вішнёўкі , Першамайскі і Кастрычнікі …",[0] -> [1] -> [7]
"У адным паданні Серада і Пятніца спрачаюцца , каго з іх больш любяць людзі .","У адным паданні Серада і Пятніца спрачаюцца , больш любяць каго з іх людзі .",[0] -> [1] -> [7]
"І трэцяе , што я заўважыла з вялікім здзіўленнем , было тое , як шмат у чым беларуская мова падобная да польскай !","І трэцяе , я заўважыла што з вялікім здзіўленнем , было тое , як шмат у чым беларуская мова падобная да польскай !",[0] -> [1] -> [7]
"Чыгуначнік , які займаецца рамонтам кабэляў , сказаў нам , што прычынай сыходу цыстэрнаў з рэек маглі стаць памылкі брыгады рамонтнікаў , якую ўчора выклікалі правяраць каляіны","Чыгуначнік , які займаецца рамонтам кабэляў , сказаў нам , што прычынай сыходу цыстэрнаў з рэек маглі стаць памылкі брыгады рамонтнікаў , ўчора выклікалі якую правяраць каляіны",[0] -> [1] -> [7]
"Для савецкай улады гэты быў удар і пачатак дэкамунізацыі , якую дагэтуль мы нажаль і не завершылі .","Для савецкай улады гэты быў удар і пачатак дэкамунізацыі , дагэтуль мы нажаль і не завершылі якую .",[0] -> [1] -> [7]
"« Хачу зрабіць альбом па творах расстраляных паэтаў , якіх закатавалі ў 1937 годзе » , — кажа музыка Лявон Вольскі , які цяпер знаходзіцца ў ЗША ( <a_href=""https://goo.gl/ieWIfO""> https://goo.gl/ieWIfO </a> ) .","« Хачу зрабіць альбом па творах расстраляных паэтаў , закатавалі якіх ў 1937 годзе » , — кажа музыка Лявон Вольскі , які цяпер знаходзіцца ў ЗША ( <a_href=""https://goo.gl/ieWIfO""> https://goo.gl/ieWIfO </a> ) .",[0] -> [1] -> [7]
"Падазраваныя ў атручэньні Скрыпалёў расказалі журналістам , што яны рабілі ў Солсбэры <a_href=""https://www.svaboda.org/a/29487753.html""> https://www.svaboda.org/a/29487753.html </a>","Падазраваныя ў атручэньні Скрыпалёў расказалі журналістам , яны рабілі што ў Солсбэры <a_href=""https://www.svaboda.org/a/29487753.html""> https://www.svaboda.org/a/29487753.html </a>",[0] -> [1] -> [7]
"« Я прачытаў адзін з ранейшых адказаў Мінкульту па гэтай тэматыцы : было напісана , што няма сьцяга , які можна было б паглядзець .","« Я прачытаў адзін з ранейшых адказаў Мінкульту па гэтай тэматыцы : было напісана , што няма сьцяга , можна было б паглядзець які .",[0] -> [1] -> [7]
"Сацыёляг Сяргей Нікалюк надрукаваў вялікі артыкул , у якім сьцьвярджае : « Рэсурс мабілізацыйнага эфэкту , які справакавала антыўкраінская прапаганда , у Беларусі вычарпаны ...","Сацыёляг Сяргей Нікалюк надрукаваў вялікі артыкул , у якім сьцьвярджае : « Рэсурс мабілізацыйнага эфэкту , справакавала які антыўкраінская прапаганда , у Беларусі вычарпаны ...",[0] -> [1] -> [7]
"У Слуцкім раённым судзе з апошнім словам выступіў Іван Барбашынскі , якога абвінавачваюць у супраціве міліцыянтам , спалучаным з гвалтам ( <a_href=""https://goo.gl/X3J7JG""> https://goo.gl/X3J7JG </a> ) .","У Слуцкім раённым судзе з апошнім словам выступіў Іван Барбашынскі , абвінавачваюць якога у супраціве міліцыянтам , спалучаным з гвалтам ( <a_href=""https://goo.gl/X3J7JG""> https://goo.gl/X3J7JG </a> ) .",[0] -> [1] -> [7]
"Што такое « прапісаць сабаку » , колькі каштуе зайсьці ва « Ўкантакце » і што абавязкова прынесьці сяржанту з крамы — салдаты <a_href=""https://www.svaboda.org/a/29433676.html""> распавядаюць пра дзедаўшчыну ў Печах </a>","Што такое « прапісаць сабаку » , колькі каштуе зайсьці ва « Ўкантакце » і абавязкова прынесьці што сяржанту з крамы — салдаты <a_href=""https://www.svaboda.org/a/29433676.html""> распавядаюць пра дзедаўшчыну ў Печах </a>",[0] -> [1] -> [7]
"Узоры авэрсаў і рэвэрсаў манэт якія плянавалася ўвесьці разам з <a_href=""https://citydog.by/post/old-new-money/""> банкнотамі </a>","Узоры авэрсаў і рэвэрсаў манэт плянавалася ўвесьці якія разам з <a_href=""https://citydog.by/post/old-new-money/""> банкнотамі </a>",[0] -> [1] -> [7]
"Амаль усё , што трэба было , ёй маглі даць у суседняй вёсцы , дзе быў сельсавет , — там яна магла купіць , што трэба , узяць даведку , схадзіць да доктара .","Амаль усё , што трэба было , ёй маглі даць у суседняй вёсцы , дзе быў сельсавет , — там яна магла купіць , трэба што , узяць даведку , схадзіць да доктара .",[0] -> [1] -> [7]
А што зрабіла ?,А зрабіла што ?,[0] -> [1] -> [7]
"Той дзень , які варта правесці на варце .","Той дзень , варта правесці які на варце .",[0] -> [1] -> [7]
"Гандлёвай была названая пазней , дзякуючы той ролі , якую іграла ў старым Мінску .","Гандлёвай была названая пазней , дзякуючы той ролі , іграла якую ў старым Мінску .",[0] -> [1] -> [7]
На камбінаце сярэдні заробак за тысячу рублёў — што тут казаць » .,На камбінаце сярэдні заробак за тысячу рублёў — тут казаць што » .,[0] -> [1] -> [7]
""" Што б ты ні зрабіў , цябе ўсе адно пакараюць .",""" б ты ні зрабіў Што , цябе ўсе адно пакараюць .",[0] -> [1] -> [7]
"Усе івэнты , якія мы ладзім , адбываюцца дзякуючы вам і народнаму фінансаванню на талацэ .","Усе івэнты , мы ладзім якія , адбываюцца дзякуючы вам і народнаму фінансаванню на талацэ .",[0] -> [1] -> [7]
"У Горадні выйшаў « Дыялектны слоўнік мэдыцынскіх тэрмінаў Беларусі » , які склаў Віктар Варанец ( <a_href=""https://goo.gl/QDf8TD""> https://goo.gl/QDf8TD </a> ) .","У Горадні выйшаў « Дыялектны слоўнік мэдыцынскіх тэрмінаў Беларусі » , склаў які Віктар Варанец ( <a_href=""https://goo.gl/QDf8TD""> https://goo.gl/QDf8TD </a> ) .",[0] -> [1] -> [7]
"Сёння ў 75-ю гадавіну заканчэння Вялікай Айчыннай вайны зрабілі падборку фільмаў , пазбаўленых рамантыкі і гераізму , а максімальна набліжаных да той рэчаіснасці , якую перажылі нашы продкі .","Сёння ў 75-ю гадавіну заканчэння Вялікай Айчыннай вайны зрабілі падборку фільмаў , пазбаўленых рамантыкі і гераізму , а максімальна набліжаных да той рэчаіснасці , перажылі якую нашы продкі .",[0] -> [1] -> [7]
"Зьміцер Бартосік паехаў на радзіму мытніка Алеся Юркойця , якога цяпер судзяць у справе за хабары на мытні , каб дазнацца , што пра Юркойця думаюць землякі ( <a_href=""https://goo.gl/jsDxr6""> https://goo.gl/jsDxr6 </a> ) .","Зьміцер Бартосік паехаў на радзіму мытніка Алеся Юркойця , якога цяпер судзяць у справе за хабары на мытні , каб дазнацца , пра Юркойця думаюць што землякі ( <a_href=""https://goo.gl/jsDxr6""> https://goo.gl/jsDxr6 </a> ) .",[0] -> [1] -> [7]
"А пакуль тут у нас цізер , з якога нічога не зразумела )","А пакуль тут у нас цізер , з якога не зразумела нічога )",[0] -> [1] -> [7]
