sen_str,swapped_sen_str,leaf_rule
"מ דיווח ש הגיע אתמול ל משרד ה תיירות ב ירושלים עולה , כי ב ה_ משלחת ה מתארגנת יקחו חלק כ מאה מ ראשי ה קהילה .","מ דיווח ש הגיע אתמול ל משרד ה תיירות ב ירושלים עולה , כי ב ה_ משלחת ה מתארגנת חלק יקחו כ מאה מ ראשי ה קהילה .",[0] -> [6] -> [8]
"לאחרונה , ב זיכרון_ _של_ _הוא , "" רומן מאת פולנסקי "" , משמיץ ה במאי - שחקן את ידיד_ _של_ _הוא מ נוער .","לאחרונה , ב זיכרון_ _של_ _הוא , "" רומן מאת פולנסקי "" , את ידיד_ _של_ _הוא מ נוער משמיץ ה במאי - שחקן .",[0] -> [6] -> [8]
"מ בחינה מסוימת עשה כהנא שירות טוב ל ה_ דמוקרטיה ה ישראלית : כל עוד נדמה היה ש יש ל_ _הוא מונופול על ה תביעה לגרש את ה ערבים , לא היה ה רעיון ראוי ל התייחסות רצינית יותר מ כל דבר אחר ש אנשים רושמים על צד_ _של_ _הן ה פנימי של ה דלתות ב בתי שימוש ציבוריים .","מ בחינה מסוימת שירות טוב עשה כהנא ל ה_ דמוקרטיה ה ישראלית : כל עוד נדמה היה ש יש ל_ _הוא מונופול על ה תביעה לגרש את ה ערבים , לא היה ה רעיון ראוי ל התייחסות רצינית יותר מ כל דבר אחר ש אנשים רושמים על צד_ _של_ _הן ה פנימי של ה דלתות ב בתי שימוש ציבוריים .",[0] -> [6] -> [8]
"בעקבות זאת , ב שנת 1988 , הגיש קמחי , באמצעות עו""ד חיים ברנזון , תביעה ל בית - ה דין ל ה_ עבודה נגד דיור ל ה_ עולה .","בעקבות זאת , ב שנת 1988 , תביעה ל בית - ה דין ל ה_ עבודה נגד דיור ל ה_ עולה הגיש קמחי , באמצעות עו""ד חיים ברנזון , .",[0] -> [6] -> [8]
"יחד עם ה מע""ם ישלמו ה מוכרים כ 905 אלף ד .","יחד עם ה מע""ם כ 905 אלף ד ישלמו ה מוכרים .",[0] -> [6] -> [8]
"ב 48 תיאר מנכ""ל אייפא""ק טום דאיין את הארקין כ אחד מ ששה או שבעה סנאטורים , ש נבחרו בזכות "" כסף יהודי "" .","ב 48 את הארקין תיאר מנכ""ל אייפא""ק טום דאיין כ אחד מ ששה או שבעה סנאטורים , ש נבחרו בזכות "" כסף יהודי "" .",[0] -> [6] -> [8]
"ב ה_ עיר בוטל , ש היתה מאז ו מתמיד מעוז של ה לייבור , הגדיל ה לייבור את ה רוב של_ _הוא על חשבון ה שמרנים , כש אלה ירדו עוד ב 10 % .","ב ה_ עיר בוטל , ש היתה מאז ו מתמיד מעוז של ה לייבור , את ה רוב של_ _הוא הגדיל ה לייבור על חשבון ה שמרנים , כש אלה ירדו עוד ב 10 % .",[0] -> [6] -> [8]
"ב הכנה_ _של_ _הוא ל שמירת ה סדר ב עת מסע הלוויית מאיר כהנא , העמיד בפני עצמו פיקוד ה משטרה , בין ה יעדים ה אחרים אך ב דרגה של עדיפות , את ה הגנה על ה עיתונאים ש היו אמורים לסקר את ה הלוויה .","ב הכנה_ _של_ _הוא ל שמירת ה סדר ב עת מסע הלוויית מאיר כהנא , את ה הגנה על ה עיתונאים ש היו אמורים לסקר את ה הלוויה העמיד בפני עצמו פיקוד ה משטרה , בין ה יעדים ה אחרים אך ב דרגה של עדיפות , .",[0] -> [6] -> [8]
ב שלב מסוים נשאר פנקייביץ ה פולני ה לא - יהודי ה יחיד ב ה_ גטו .,ב שלב מסוים ה פולני ה לא - יהודי ה יחיד ב ה_ גטו נשאר פנקייביץ .,[0] -> [6] -> [8]
"ל ה_ נשים מציעה ה חנות סניקרס צבעוניים זוהרים , החל ב 29.9 ש""ח ( במקום 33.90 ש""ח ) ; סניקרס מ בד ו מ דגם או - פי עולים 49.90 ש""ח ; נעלי בית משובצות ל גברים ו כן דגמים מעטים של נעלי - בית מ אריג קורדרוי נמכרים ב 27.40 ש""ח .","ל ה_ נשים סניקרס צבעוניים זוהרים , החל ב 29.9 ש""ח ( במקום 33.90 ש""ח ) מציעה ה חנות ; סניקרס מ בד ו מ דגם או - פי עולים 49.90 ש""ח ; נעלי בית משובצות ל גברים ו כן דגמים מעטים של נעלי - בית מ אריג קורדרוי נמכרים ב 27.40 ש""ח .",[0] -> [6] -> [8]
"ב נוסף ל הכרת ה סביבה , ילמדו ה משתתפים את סודות ה ניהול של ה מקום , ו יישמו את חלק_ _של_ _הם ב ה_ שטח .","ב נוסף ל הכרת ה סביבה , את סודות ה ניהול של ה מקום ילמדו ה משתתפים , ו יישמו את חלק_ _של_ _הם ב ה_ שטח .",[0] -> [6] -> [8]
"ב גיל 17 הוציא אב_ _של_ _היא את מליה מ בית - ה ספר , שכן לא רצה להסתכן עוד ב לימודים_ _של_ _היא ב כיתה מעורבת .","ב גיל 17 את מליה הוציא אב_ _של_ _היא מ בית - ה ספר , שכן לא רצה להסתכן עוד ב לימודים_ _של_ _היא ב כיתה מעורבת .",[0] -> [6] -> [8]
"כמו כן , תציב הצעת ה חוק עונשי מאסר ו הטלת קנסות כבדים ל מי ש יעסיק עובדים זרים בלא רשיון .","כמו כן , עונשי מאסר ו הטלת קנסות כבדים ל מי ש יעסיק עובדים זרים בלא רשיון תציב הצעת ה חוק .",[0] -> [6] -> [8]
"ב חצי ה גמר ניצח פרקיס את בועז מרנשטיין 6 4 , 6 7 , 6 4 .","ב חצי ה גמר את בועז מרנשטיין ניצח פרקיס 6 4 , 6 7 , 6 4 .",[0] -> [6] -> [8]
"בין_ _הם , ב שטח ש פנה , הקים ה אדריכל יצחק טולידנו מבנה מגושם ו חריג .","בין_ _הם , ב שטח ש פנה , מבנה מגושם ו חריג הקים ה אדריכל יצחק טולידנו .",[0] -> [6] -> [8]
"תופעה של אלימות מילולית נגד עיתונאים היתה ל שגרה ב אירועים ש ב_ _הם נוטל חלק ציבור ה מזוהה עם ה ימין , בעיקר על רקע אירועים ה נוגעים ל ה_ סכסוך ה יהודי - ערבי .","תופעה של אלימות מילולית נגד עיתונאים היתה ל שגרה ב אירועים ש ב_ _הם חלק נוטל ציבור ה מזוהה עם ה ימין , בעיקר על רקע אירועים ה נוגעים ל ה_ סכסוך ה יהודי - ערבי .",[0] -> [6] -> [8]
"ב נובמבר 88 רכשו סוחרים ו סוכנים יפאנים 11 תמונות ב שווי 10.3 מיליון ליש""ט , מ כלל מכירות של 35 מיליון ליש""ט 29 % מ היקף ה מכירות .","ב נובמבר 88 11 תמונות ב שווי 10.3 מיליון ליש""ט רכשו סוחרים ו סוכנים יפאנים , מ כלל מכירות של 35 מיליון ליש""ט 29 % מ היקף ה מכירות .",[0] -> [6] -> [8]
"כעבור זמן מה סיפרה ה בת ש ב גיל תשע תפרה ה אם את שפתות אבר ה מין של_ _היא , כיוון ש ה ילדה איחרה לחזור הביתה יום אחד .","כעבור זמן מה סיפרה ה בת ש ב גיל תשע את שפתות אבר ה מין של_ _היא תפרה ה אם , כיוון ש ה ילדה איחרה לחזור הביתה יום אחד .",[0] -> [6] -> [8]
"גם ה תביעה ה צבאית החליטה שלא לערער על קולת ה עונש , אך ב מקרה ש מישהו בקרב ה נאשמים ש הורשעו יגיש ערעור , תגיש גם ה תביעה ה צבאית ערעור נגדי .","גם ה תביעה ה צבאית החליטה שלא לערער על קולת ה עונש , אך ב מקרה ש מישהו בקרב ה נאשמים ש הורשעו יגיש ערעור , ערעור נגדי תגיש גם ה תביעה ה צבאית .",[0] -> [6] -> [8]
ב ה_ שבוע ש עבר לקח נוסייר חופשה של חמישה ימים מ עבודה_ _של_ _הוא .,ב ה_ שבוע ש עבר חופשה של חמישה ימים מ עבודה_ _של_ _הוא לקח נוסייר .,[0] -> [6] -> [8]
"לעומת זאת , עם מדינות ערביות , ו ב_ _הן כ ה_ אלו ש עד לפני כמה חודשים הוגדרו כ עוינות , מקיים ה ממשל דו שיח שוטף ב ה_ רמה ה אסטראטגית ו שיתוף פעולה צבאי הדוק ללא תקדים .","לעומת זאת , עם מדינות ערביות , ו ב_ _הן כ ה_ אלו ש עד לפני כמה חודשים הוגדרו כ עוינות , דו שיח שוטף ב ה_ רמה ה אסטראטגית ו שיתוף פעולה צבאי הדוק ללא תקדים מקיים ה ממשל .",[0] -> [6] -> [8]
למרות אופה_ _של_ _הוא ה ריכוזי איפשר ה שלטון ה עותמני ב ה_ ארץ מידה רבה של חופש פעולה ל ה_ הון ה פרטי ב ה_ ארץ ב ה_ תקופה ש לפני כ מאה שנה .,למרות אופה_ _של_ _הוא ה ריכוזי מידה רבה של חופש פעולה איפשר ה שלטון ה עותמני ב ה_ ארץ ל ה_ הון ה פרטי ב ה_ ארץ ב ה_ תקופה ש לפני כ מאה שנה .,[0] -> [6] -> [8]
"שר ה חוץ התחייב לחלק את ירושלים ל גבולות 5.6.67 ו שר ה משטרה נאחז ב הוראות ה פתיחה ב אש ה ישנות ו ה טובות , כ ב קש אחרון בפני מתקפה של מעשי לינץ , ב_ _הם תאבד ה משטרה את שארית אחיזה_ _של_ _היא ב אכיפת ה חוק .","שר ה חוץ התחייב לחלק את ירושלים ל גבולות 5.6.67 ו שר ה משטרה נאחז ב הוראות ה פתיחה ב אש ה ישנות ו ה טובות , כ ב קש אחרון בפני מתקפה של מעשי לינץ , ב_ _הם את שארית אחיזה_ _של_ _היא ב אכיפת ה חוק תאבד ה משטרה .",[0] -> [6] -> [8]
"בגלל תחושה של אוזלת יד מלעיטות עצמן נשים טורקיות רבות ב תרופות אספירין , ואליום , ליבריום , נובלגין .","בגלל תחושה של אוזלת יד עצמן מלעיטות נשים טורקיות רבות ב תרופות אספירין , ואליום , ליבריום , נובלגין .",[0] -> [6] -> [8]
"ל טענת רואי חשבון ו חוקרים על_ _הם מסתמך ה עיתון , הניבו רבות מ ה שותפויות ה סודיות של דרקסל החזרים בני מאות ו אף אלפי אחוזים מ ה השקעה ה מקורית .","ל טענת רואי חשבון ו חוקרים על_ _הם מסתמך ה עיתון , החזרים בני מאות ו אף אלפי אחוזים מ ה השקעה ה מקורית הניבו רבות מ ה שותפויות ה סודיות של דרקסל .",[0] -> [6] -> [8]
ב ה_ דקה ה - 9 הכשיל ב ה_ רחבה בלם נוריץ ריצארד הארווי את סטיב ניקול .,ב ה_ דקה ה - 9 את סטיב ניקול הכשיל ב ה_ רחבה בלם נוריץ ריצארד הארווי .,[0] -> [6] -> [8]
"ב ה_ יום ש שמעתי את ה תיאוריה ה זו מ פי סילבר פרסם ה עיתון "" בוסטון גלוב "" סקר , ש הראה לראשונה יתרון ל סילבר על פני יריב_ _של_ _הוא ה רפובליקאי , ויליאם וולד .","ב ה_ יום ש שמעתי את ה תיאוריה ה זו מ פי סילבר סקר , ש הראה לראשונה יתרון ל סילבר על פני יריב_ _של_ _הוא ה רפובליקאי , ויליאם וולד פרסם ה עיתון "" בוסטון גלוב "" .",[0] -> [6] -> [8]
עם תחילת ה משחק לא הותיר ה גליל ספק באשר ל כוונה_ _של_ _הוא .,עם תחילת ה משחק לא ספק באשר ל כוונה_ _של_ _הוא הותיר ה גליל .,[0] -> [6] -> [8]
"ה הסדרים הללו נקבעו ב תקופה קדומה , ש ב_ _היא הכתיבו ראשי מפא""י ל מקבלי ה החלטות ב ה_ ממשלה את ה הסדרים ה ממלכתיים ב התאם ל ה_ אינטרסים של ה הסתדרות .","ה הסדרים הללו נקבעו ב תקופה קדומה , ש ב_ _היא את ה הסדרים ה ממלכתיים הכתיבו ראשי מפא""י ל מקבלי ה החלטות ב ה_ ממשלה ב התאם ל ה_ אינטרסים של ה הסתדרות .",[0] -> [6] -> [8]
"הוא זעם על ה הדלפות ל ה_ עיתונות , לפי_ _הם הפסידה כתר 4.2 מיליון ש""ח , ו דרש מ כל חברי מועצת ה מנהלים להתפטר מ תפקיד_ _של_ _הם .","הוא זעם על ה הדלפות ל ה_ עיתונות , לפי_ _הם 4.2 מיליון ש""ח הפסידה כתר , ו דרש מ כל חברי מועצת ה מנהלים להתפטר מ תפקיד_ _של_ _הם .",[0] -> [6] -> [8]
"אנשי ה מערך הכריזו לפני כמה שבועות על פרישה_ _של_ _הם מ ה מרכז , לנוכח ה סכסוך בין לוי ל לנדאו , אולם הם חזרו ב_ _הם לאחר ש הגיעו ל הסכם עם לוי , ש לפי_ _הוא יתמכו ב_ _הוא ב הדחת לנדאו ו ב תמורה יקבל נציג ה מערך את תפקיד יו""ר ה מועצה .","אנשי ה מערך הכריזו לפני כמה שבועות על פרישה_ _של_ _הם מ ה מרכז , לנוכח ה סכסוך בין לוי ל לנדאו , אולם הם חזרו ב_ _הם לאחר ש הגיעו ל הסכם עם לוי , ש לפי_ _הוא יתמכו ב_ _הוא ב הדחת לנדאו ו ב תמורה את תפקיד יו""ר ה מועצה יקבל נציג ה מערך .",[0] -> [6] -> [8]
ב דרך זו יוצרת לש גם טבעות ו עגילים .,ב דרך זו גם טבעות ו עגילים יוצרת לש .,[0] -> [6] -> [8]
"גם מ סניף דיסקונט ב רמת - גן שדד ה נאשם , ב נוסף ל 31,590 שקלים , חותמת תאריך של ה סניף .","גם מ סניף דיסקונט ב רמת - גן חותמת תאריך של ה סניף שדד ה נאשם , ב נוסף ל 31,590 שקלים , .",[0] -> [6] -> [8]
"על פי ה מידע ה מצוי ב יד_ _של_ _היא מעכב שר ה בריאות העברת כספים ה מגיעים ל מד""א כדי ללחוץ על ועדת ה עבודה ו ה רווחה לאשר חוק ש הוצע על ידי שר ה בריאות ה מבטל את עצמאות מד""א כ ארגון וולונטארי .","על פי ה מידע ה מצוי ב יד_ _של_ _היא העברת כספים ה מגיעים ל מד""א מעכב שר ה בריאות כדי ללחוץ על ועדת ה עבודה ו ה רווחה לאשר חוק ש הוצע על ידי שר ה בריאות ה מבטל את עצמאות מד""א כ ארגון וולונטארי .",[0] -> [6] -> [8]
"ב גביע אופ""א ניצחה סוויליה ב ספרד את טורפדו מוסקווה 2 1 , אך ה רוסים ניצחה לפני כן ב מוסקווה 1 3 ו עלו .","ב גביע אופ""א את טורפדו מוסקווה ניצחה סוויליה ב ספרד 2 1 , אך ה רוסים ניצחה לפני כן ב מוסקווה 1 3 ו עלו .",[0] -> [6] -> [8]
"ה פרק ה ראשון של ה רומאן מעובד כ אקספוזיציה ל מופת , שכן ב_ _הוא מציג וייט לא רק את גיבור_ _של_ _הוא , ה ראשיים ו ה משניים , אלא גם את כל ה תימות ש הוא מבקש לחקור ב ספר_ _של_ _הוא .","ה פרק ה ראשון של ה רומאן מעובד כ אקספוזיציה ל מופת , שכן ב_ _הוא לא רק את גיבור_ _של_ _הוא , ה ראשיים ו ה משניים , אלא גם את כל ה תימות ש הוא מבקש לחקור ב ספר_ _של_ _הוא מציג וייט .",[0] -> [6] -> [8]
"ב מסגרת ה מעקב ה שוטף פגש נסים לפני שבועיים את ( ש""ס ) ב ה_ כנסת ו שאל את_ _הוא : מה קורה ?","ב מסגרת ה מעקב ה שוטף את ( ש""ס ) ב ה_ כנסת פגש נסים לפני שבועיים ו שאל את_ _הוא : מה קורה ?",[0] -> [6] -> [8]
"ב דבר_ _של_ _הוא על מצב ה תעסוקה מתח מודעי ביקורת חריפה על ה קולות ש הושמעו לאחר ש כוחות ה ביטחון סגרו את ה שטחים , בעוד ש ה העדרות של פועלי ה שטחים לרגל חגים או אירועים אחרים מתקבלת ב הבנה .","ב דבר_ _של_ _הוא על מצב ה תעסוקה ביקורת חריפה על ה קולות ש הושמעו לאחר ש כוחות ה ביטחון סגרו את ה שטחים מתח מודעי , בעוד ש ה העדרות של פועלי ה שטחים לרגל חגים או אירועים אחרים מתקבלת ב הבנה .",[0] -> [6] -> [8]
"ב קיץ 1989 פירסמו כמה היסטוריונים , ב כנס ש התקיים ב חסות ה ממשלה ב ווארשה , תעודות ה מצדיקות צעד כ ה_ זה .","ב קיץ 1989 תעודות ה מצדיקות צעד כ ה_ זה פירסמו כמה היסטוריונים , ב כנס ש התקיים ב חסות ה ממשלה ב ווארשה , .",[0] -> [6] -> [8]
"ב ה_ ספר "" רועה ה זאבים "" , מאת אלכסנדר דיומא ה אב , כורת ה סנדלר טיבו , אדם ש אב_ _של_ _הוא דאג להעניק ל_ _הוא חינוך "" למעלה מ מעמד_ _של_ _הוא "" , ברית עם ה שטן , ה מופיע ב דמות זאב שחור ו אימתני .","ב ה_ ספר "" רועה ה זאבים "" , מאת אלכסנדר דיומא ה אב , ברית עם ה שטן , ה מופיע ב דמות זאב שחור ו אימתני כורת ה סנדלר טיבו , אדם ש אב_ _של_ _הוא דאג להעניק ל_ _הוא חינוך "" למעלה מ מעמד_ _של_ _הוא "" , .",[0] -> [6] -> [8]
"ב מארס 1983 התקשרה ה עמותה עם חברת ה בנייה "" ש. י. ל. נ , אחים נחום "" ב הסכם קומבינציה , ש על פה_ _של_ _הוא תבנה ה חברה על חשבון_ _של_ _היא בניין של 24 דירות .","ב מארס 1983 התקשרה ה עמותה עם חברת ה בנייה "" ש. י. ל. נ , אחים נחום "" ב הסכם קומבינציה , ש על פה_ _של_ _הוא בניין של 24 דירות תבנה ה חברה על חשבון_ _של_ _היא .",[0] -> [6] -> [8]
"ה סיבוב ה שני של גביעי אירופה הושלם אמש , ב התמודדות ב גביע אופ""א , ב_ _היא ניצחה פרטיזן בלגראד את ריאל סוסיידאד 4 5 ב בעיטות הכרעה מ - 11 מטרים .","ה סיבוב ה שני של גביעי אירופה הושלם אמש , ב התמודדות ב גביע אופ""א , ב_ _היא את ריאל סוסיידאד ניצחה פרטיזן בלגראד 4 5 ב בעיטות הכרעה מ - 11 מטרים .",[0] -> [6] -> [8]
"לאחר סדרה לא קצרה של ישיבות , ש ב_ _הן פרשה ה תביעה את ראיה_ _של_ _היא , הגיעו שני ה צדדים ל הסכם : גיליון ה אישום תוקן הושמטה מן_ _הוא ה פסקה ש הזכירה את מוות_ _של_ _הוא של מובארק ו נקבע כי ה יריות ש ירו ה שניים לא גרמו ל סיכון חיי אדם .","לאחר סדרה לא קצרה של ישיבות , ש ב_ _הן את ראיה_ _של_ _היא פרשה ה תביעה , הגיעו שני ה צדדים ל הסכם : גיליון ה אישום תוקן הושמטה מן_ _הוא ה פסקה ש הזכירה את מוות_ _של_ _הוא של מובארק ו נקבע כי ה יריות ש ירו ה שניים לא גרמו ל סיכון חיי אדם .",[0] -> [6] -> [8]
"ב ה_ משחק ב_ _הוא קלט ויליאמס ריבאונדים , יותר מ כל שחקני בית""ר גם יחד ( 18 ) לא היה ל ה_ אורחים ל מה לצפות .","ב ה_ משחק ב_ _הוא ריבאונדים קלט ויליאמס , יותר מ כל שחקני בית""ר גם יחד ( 18 ) לא היה ל ה_ אורחים ל מה לצפות .",[0] -> [6] -> [8]
"בין ה מטרות של משרד ה משטרה מונה ה מנכ""ל את שיפור ה תפקוד של ה משטרה ו שירות בתי ה סוהר על ידי פיתוח ו יישום תהליכים שיטתיים של ניתוח מדיניות , עיצוב_ _של_ _היא ו בקרה על מימוש_ _של_ _היא .","בין ה מטרות של משרד ה משטרה את שיפור ה תפקוד של ה משטרה ו שירות בתי ה סוהר על ידי פיתוח ו יישום תהליכים שיטתיים של ניתוח מדיניות , עיצוב_ _של_ _היא ו בקרה על מימוש_ _של_ _היא מונה ה מנכ""ל .",[0] -> [6] -> [8]
"צבי קורן , מנכ""ל משרד ה תעשייה , ציין כי משרד_ _של_ _הוא נותן עדיפויות ל פרויקטים ב_ _הם משתפות פעולה חברות אמריקאיות חדשות , עם חברות ישראליות .","צבי קורן , מנכ""ל משרד ה תעשייה , ציין כי משרד_ _של_ _הוא נותן עדיפויות ל פרויקטים ב_ _הם פעולה משתפות חברות אמריקאיות חדשות , עם חברות ישראליות .",[0] -> [6] -> [8]
"ראש עיריית תל - אביב , שלמה להט , עומד על כך ש לשכת ה מהנדסים תפנה את ה בית ה משמש כיום כ משכן_ _של_ _היא ב תל - אביב "" בית ה מהנדס "" ב רחוב דיזנגוף ב תל - אביב , ו זאת ב טענה ש ה קרקע על_ _הוא עומד ה בית היא קרקע עירונית ו כי ה הסכם לפי_ _הוא החכירה ה עירייה את ה מגרש ש על_ _הוא הוקם ה בית פג עוד לפני שמונה שנים .","ראש עיריית תל - אביב , שלמה להט , עומד על כך ש לשכת ה מהנדסים תפנה את ה בית ה משמש כיום כ משכן_ _של_ _היא ב תל - אביב "" בית ה מהנדס "" ב רחוב דיזנגוף ב תל - אביב , ו זאת ב טענה ש ה קרקע על_ _הוא עומד ה בית היא קרקע עירונית ו כי ה הסכם לפי_ _הוא את ה מגרש ש על_ _הוא הוקם ה בית החכירה ה עירייה פג עוד לפני שמונה שנים .",[0] -> [6] -> [8]
"כאן מתוארים שוב ו שוב ו ב הדגשה משחקי ה אור ו ה צל , ה מתחוללים ב חדר ש ב_ _הוא נערכת ה פגישה ה ראשונה בין שני גיבורי ה רומאן , ה מהווים את שני ה קטבים ש בין_ _הם מטלטל וייט את ה שאלות ה מטאפיסיות ש הוא מעלה ב ספר זה , שאלות ב דבר קיום ה אל , עבודת ה אל , התגלות_ _של_ _הוא ו אפשרות ה אמונה ב_ _הוא .","כאן מתוארים שוב ו שוב ו ב הדגשה משחקי ה אור ו ה צל , ה מתחוללים ב חדר ש ב_ _הוא נערכת ה פגישה ה ראשונה בין שני גיבורי ה רומאן , ה מהווים את שני ה קטבים ש בין_ _הם את ה שאלות ה מטאפיסיות ש הוא מעלה ב ספר זה , שאלות ב דבר קיום ה אל , עבודת ה אל , התגלות_ _של_ _הוא ו אפשרות ה אמונה ב_ _הוא מטלטל וייט .",[0] -> [6] -> [8]
ב תקופה מסוימת העסיק דיומא צוות שלם של עוזרים ב ראשות_ _של_ _הוא של ה היסטוריון אוגוסט מיקא .,ב תקופה מסוימת צוות שלם של עוזרים ב ראשות_ _של_ _הוא של ה היסטוריון אוגוסט מיקא העסיק דיומא .,[0] -> [6] -> [8]
"כעבור שנה , כאשר נחתמו הסכמי קאמף - דייוויד , גרם ל_ _הוא גיבור_ _של_ _הוא אכזבה מרה .","כעבור שנה , כאשר נחתמו הסכמי קאמף - דייוויד , אכזבה מרה גרם ל_ _הוא גיבור_ _של_ _הוא .",[0] -> [6] -> [8]
"ה סרט מתאר כיצד , לאחר בוא_ _של_ _היא של טורנה ה צעירה ל המבורג , סוגר את_ _היא דורסון בעל_ _של_ _היא ב דירה_ _של_ _הם .","ה סרט מתאר כיצד , לאחר בוא_ _של_ _היא של טורנה ה צעירה ל המבורג , את_ _היא סוגר דורסון בעל_ _של_ _היא ב דירה_ _של_ _הם .",[0] -> [6] -> [8]
לפני כמה שבועות הזמינה להקת חובבים של ה מושבה ה אמריקאית ה קטנה ב ריאד קבוצת חיילים של צבא ארצות ה ברית ל הופעה ש נערכה ל כבוד_ _של_ _הם ב בניין ה שגרירות .,לפני כמה שבועות קבוצת חיילים של צבא ארצות ה ברית הזמינה להקת חובבים של ה מושבה ה אמריקאית ה קטנה ב ריאד ל הופעה ש נערכה ל כבוד_ _של_ _הם ב בניין ה שגרירות .,[0] -> [6] -> [8]
ב מהלך מערכת ה בחירות ה כללית העלה סילבר את ה הסבר ה בא ל אי - ה התאמות .,ב מהלך מערכת ה בחירות ה כללית את ה הסבר ה בא ל אי - ה התאמות העלה סילבר .,[0] -> [6] -> [8]
