sen_str,swapped_sen_str,leaf_rule
"אחרי שבועות אחדים ש ב_ _הם התנדנד כיסא_ _של_ _הוא של מפכ""ל ה משטרה , יעקב טרנר , ו גם שר ה משטרה , רוני מילוא , לא שבע נחת , ו מש חלפה ה סכנה ש יידרשו להסיק מסקנות אישיות , למעשה נתנו ל_ _הם מסקנות ועדת זמיר ו המלצה_ _של_ _היא אור ירוק לבצע שינויים , ש ה שניים מבקשים לחוללם את _הם זה זמן רב , איש ב תחום אחריות_ _של_ _הוא ו מ שיקול_ _של_ _הוא .","אחרי שבועות אחדים ש ב_ _הם התנדנד כיסא_ _של_ _הוא של מפכ""ל ה משטרה , יעקב טרנר , ו גם שר ה משטרה , רוני מילוא , לא שבע נחת , ו מש חלפה ה סכנה ש יידרשו להסיק מסקנות אישיות , למעשה אור ירוק לבצע שינויים , ש ה שניים מבקשים לחוללם את _הם זה זמן רב , איש ב תחום אחריות_ _של_ _הוא ו מ שיקול_ _של_ _הוא נתנו ל_ _הם מסקנות ועדת זמיר ו המלצה_ _של_ _היא .",[0] -> [6] -> [8]
"כ חלוף שבוע נחלו שתיהן הפסדי חוץ , ב ה_ מחזור ה שישי של ה ליגה , בלי ש הצליחו אפילו להבקיע שער כדי להחזיר את ה פיסגה ל קבוצת מכבי חיפה , ה נחשבת על ידי מומחים ו פרשנים , ו ב צדק , ל ה_ קבוצה ה טובה ביותר ב עונה זו .","כ חלוף שבוע הפסדי חוץ נחלו שתיהן , ב ה_ מחזור ה שישי של ה ליגה , בלי ש הצליחו אפילו להבקיע שער כדי להחזיר את ה פיסגה ל קבוצת מכבי חיפה , ה נחשבת על ידי מומחים ו פרשנים , ו ב צדק , ל ה_ קבוצה ה טובה ביותר ב עונה זו .",[0] -> [6] -> [8]
"בעקבות ה פגישה בין קוהל ו גורבצוב ב 1989 , הקימה מוסקווה ועדה ל פתרון בעיות ה מגורשים .","בעקבות ה פגישה בין קוהל ו גורבצוב ב 1989 , ועדה ל פתרון בעיות ה מגורשים הקימה מוסקווה .",[0] -> [6] -> [8]
"ב ה_ חוזר ש הופץ לפני ימים מספר בין כל עובדי ה בנק נאמר , בין ה שאר , כי ב "" מפעל סולתם שיסתה ה הנהלה כלבים ב ה_ עובדים , ו כאן היא משסה קבוצות עובדים אחת ב ה_ שנייה .","ב ה_ חוזר ש הופץ לפני ימים מספר בין כל עובדי ה בנק נאמר , בין ה שאר , כי ב "" מפעל סולתם כלבים שיסתה ה הנהלה ב ה_ עובדים , ו כאן היא משסה קבוצות עובדים אחת ב ה_ שנייה .",[0] -> [6] -> [8]
"כל ה קרוב אצל ה נושא יודע , ש מוסיקה היא אחד ה תחומים ש ב_ _הם מציפה את_ _אנחנו ה עלייה ה חדשה מ ברית - ה מועצות ב אנשי מקצוע מעולים , ו קליטה_ _של_ _הם ה יעילה היא אתגר קשה ו כדאי .","כל ה קרוב אצל ה נושא יודע , ש מוסיקה היא אחד ה תחומים ש ב_ _הם את_ _אנחנו מציפה ה עלייה ה חדשה מ ברית - ה מועצות ב אנשי מקצוע מעולים , ו קליטה_ _של_ _הם ה יעילה היא אתגר קשה ו כדאי .",[0] -> [6] -> [8]
"ב ה_ דקה ה - 6 העלה יובל נעים את ר""ג ל יתרון ב בעיטה מ - 20 מ .","ב ה_ דקה ה - 6 את ר""ג העלה יובל נעים ל יתרון ב בעיטה מ - 20 מ .",[0] -> [6] -> [8]
"ל טענת ה הנהלה , לקח פרוף מרין עם_ _הוא רופאים מרדימים מ בית ה חולים כרמל ל ניתוחים ב ה_ מרכז ה רפואי חורב .","ל טענת ה הנהלה , רופאים מרדימים מ בית ה חולים כרמל לקח פרוף מרין עם_ _הוא ל ניתוחים ב ה_ מרכז ה רפואי חורב .",[0] -> [6] -> [8]
"בעוד ח""כ לוי מחנה את רכב_ _של_ _הוא , ציטט ב אוזן_ _של_ _הוא בלובשטיין כותרת ש התפרסמה ב אותו יום ב ה_ עיתון , לפי_ _היא ש""ס נמצאת ב היכון ו מחכה ל ה_ עיתוי ה מתאים להפיל את ה ממשלה .","בעוד ח""כ לוי מחנה את רכב_ _של_ _הוא , כותרת ש התפרסמה ב אותו יום ב ה_ עיתון , לפי_ _היא ש""ס נמצאת ב היכון ו מחכה ל ה_ עיתוי ה מתאים להפיל את ה ממשלה ציטט ב אוזן_ _של_ _הוא בלובשטיין .",[0] -> [6] -> [8]
ב אשדוד הציע ה מינהל מגרש של 31.5 דונם ( ל בינוי 160 % ) ל הקמת מבנה ל ה_ תעשייה .,ב אשדוד מגרש של 31.5 דונם ( ל בינוי 160 % ) הציע ה מינהל ל הקמת מבנה ל ה_ תעשייה .,[0] -> [6] -> [8]
"ב מכירה פומבית של "" כריסטיס "" ב ה_ 16 ב אוקטובר שילם טאזימה , ה סוחר ה מוביל ב יצירות של אמנות בודהיסטית עתיקה מ טוקיו , 209,000 דולר סכום ה גבוה כמעט פי ארבעה מ ה אומדן ה מרבי תמורת ציור על משי מ ה מאה ה 12 או ה 13 .","ב מכירה פומבית של "" כריסטיס "" ב ה_ 16 ב אוקטובר 209,000 דולר סכום ה גבוה כמעט פי ארבעה מ ה אומדן ה מרבי שילם טאזימה , ה סוחר ה מוביל ב יצירות של אמנות בודהיסטית עתיקה מ טוקיו , תמורת ציור על משי מ ה מאה ה 12 או ה 13 .",[0] -> [6] -> [8]
"ל מ - ג - מ יש את "" פריים טיים קפה "" , ש ב_ _הוא מקבלת את ה מבקרים "" מאם "" , ה אם ה טיפוסית מ סרטי ה מערבונים .","ל מ - ג - מ יש את "" פריים טיים קפה "" , ש ב_ _הוא את ה מבקרים מקבלת "" מאם "" , ה אם ה טיפוסית מ סרטי ה מערבונים .",[0] -> [6] -> [8]
"ו מה ש עוד ברור : מצב קופת ה התאחדות ל ספורט בהחלט יהיה פחות טוב , אם למרות הכל יממש ללקין את נסיעה_ _של_ _הוא ל אוסטרליה .","ו מה ש עוד ברור : מצב קופת ה התאחדות ל ספורט בהחלט יהיה פחות טוב , אם למרות הכל את נסיעה_ _של_ _הוא ל אוסטרליה יממש ללקין .",[0] -> [6] -> [8]
""" איפה ה ילד "" , שאל ה שליח , סופר פולני ש הגיע מ ארצות - ה ברית , את אסתר שטיינבך .",""" איפה ה ילד "" , את אסתר שטיינבך שאל ה שליח , סופר פולני ש הגיע מ ארצות - ה ברית , .",[0] -> [6] -> [8]
"על אף ש ב רוב יצירה_ _של_ _הוא מ אותה תקופה לא תקף חלאסקו את ה סדר ה קיים ו את ה אורתודוקסיה של ה ריאליזם ה סוציאליסטי , ו העדיף להתרכז ב ה_ ניסיון ה אנושי , לא יכולה היתה ה מפלגה לשאת את אופה_ _של_ _הוא ה מרדני ו ה נון - קונפורמיסטי .","על אף ש ב רוב יצירה_ _של_ _הוא מ אותה תקופה לא את ה סדר ה קיים ו את ה אורתודוקסיה של ה ריאליזם ה סוציאליסטי תקף חלאסקו , ו העדיף להתרכז ב ה_ ניסיון ה אנושי , לא יכולה היתה ה מפלגה לשאת את אופה_ _של_ _הוא ה מרדני ו ה נון - קונפורמיסטי .",[0] -> [6] -> [8]
"ב סניף בנק ה פועלים ב רחוב פנקס ב תל - אביב שדד לייבוביץ , ב נוסף ל 34,028 שקל מ כספי ה בנק , גם סך של 2,734 שקל מ אחד מ לקוחות ה סניף , ש עמד ליד ה דלפק של ה כספרית ש נשדדה .","ב סניף בנק ה פועלים ב רחוב פנקס ב תל - אביב גם סך של 2,734 שקל שדד לייבוביץ , ב נוסף ל 34,028 שקל מ כספי ה בנק , מ אחד מ לקוחות ה סניף , ש עמד ליד ה דלפק של ה כספרית ש נשדדה .",[0] -> [6] -> [8]
"ל טענת ה תובע , כ תוצאה מ ה אילוץ של ה פנייה ל ה_ שוק ה אפור , ב_ _הוא שילם ה תובע ריבית דולרית של 39 % , הסתבכה ה חברה .","ל טענת ה תובע , כ תוצאה מ ה אילוץ של ה פנייה ל ה_ שוק ה אפור , ב_ _הוא ריבית דולרית של 39 % שילם ה תובע , הסתבכה ה חברה .",[0] -> [6] -> [8]
"ב שנה זו , הפקידו ארה""ב ו ישראל כל אחד 30 מיליון דולר ב ה_ קרן , כש ה ריבית על ה השקעה משמשת ל מימון פרויקטים משותפים ב תחום ה מחקר ו ה פיתוח .","ב שנה זו , 30 מיליון דולר הפקידו ארה""ב ו ישראל כל אחד ב ה_ קרן , כש ה ריבית על ה השקעה משמשת ל מימון פרויקטים משותפים ב תחום ה מחקר ו ה פיתוח .",[0] -> [6] -> [8]
ב ה_ 14 ב אוקטובר השנה ציינו ה טטרים יום זה ב עצרת המונית של אלפי אדם ב קזאן .,ב ה_ 14 ב אוקטובר השנה יום זה ציינו ה טטרים ב עצרת המונית של אלפי אדם ב קזאן .,[0] -> [6] -> [8]
"ב יום רביעי לפני שבועיים ו חצי השעתה הנהלת בנק לאומי ארבעה חברי ועד , בין_ _הם איש - שלום , משום ש מנעו הוצאת ציוד ל צורך הקמת גיבוי ל ה_ מחשב ה מרכזי .","ב יום רביעי לפני שבועיים ו חצי ארבעה חברי ועד , בין_ _הם איש - שלום השעתה הנהלת בנק לאומי , משום ש מנעו הוצאת ציוד ל צורך הקמת גיבוי ל ה_ מחשב ה מרכזי .",[0] -> [6] -> [8]
"ב מהלך מערכת ה בחירות הקרין מטה_ _של_ _הוא של טוקי תשדיר טלוויזיה , ש אחד מ סעיף_ _של_ _הוא היה התנגדות ל סיוע חוץ .","ב מהלך מערכת ה בחירות תשדיר טלוויזיה , ש אחד מ סעיף_ _של_ _הוא היה התנגדות ל סיוע חוץ הקרין מטה_ _של_ _הוא של טוקי .",[0] -> [6] -> [8]
"ב ווריאציה זו עושה וייט שימוש חופשי ב אלמנטים של מחזה ה פאסיון ה מסורתי , עד כדי החלפת ה גיבור ישו ב אנטיריסט .","ב ווריאציה זו שימוש חופשי ב אלמנטים של מחזה ה פאסיון ה מסורתי עושה וייט , עד כדי החלפת ה גיבור ישו ב אנטיריסט .",[0] -> [6] -> [8]
"ה דוברים התייחסו ל שני ה הפסדים ב מישחקי ה חוץ , 2 6 ב ברית ה מועצות ו - 1 5 ב צכיה ו ל ה_ מבחן ה אחרון ב יום ד ש עבר , ב_ _הוא ניצחה ישראל 1 3 את פולין ב אשדוד .","ה דוברים התייחסו ל שני ה הפסדים ב מישחקי ה חוץ , 2 6 ב ברית ה מועצות ו - 1 5 ב צכיה ו ל ה_ מבחן ה אחרון ב יום ד ש עבר , ב_ _הוא את פולין ניצחה ישראל 1 3 ב אשדוד .",[0] -> [6] -> [8]
"ב בית ה חולים רוטשילד ב חיפה צבעה רוטנברג מסדרון ארוך , ה מקשר בין שני חלקי בית ה חולים , ב גונים של כתום מ צהוב חמנייה ו עד כתום עז .","ב בית ה חולים רוטשילד ב חיפה מסדרון ארוך , ה מקשר בין שני חלקי בית ה חולים צבעה רוטנברג , ב גונים של כתום מ צהוב חמנייה ו עד כתום עז .",[0] -> [6] -> [8]
עובדי ה מחלקה סיפרו כי ב ה_ שבוע ש לפני ה רצח לקח א - נוסייר חמישה ימי מחלה .,עובדי ה מחלקה סיפרו כי ב ה_ שבוע ש לפני ה רצח חמישה ימי מחלה לקח א - נוסייר .,[0] -> [6] -> [8]
"ב בית ה כנסת ה רפורמי ב מיניאפוליס , ש בושוויץ הוא אחד מ חבר_ _של_ _הוא , נשא ב ליל שבת ה רב ה מקומי דרשה ארוכה בגנות ה התקפה .","ב בית ה כנסת ה רפורמי ב מיניאפוליס , ש בושוויץ הוא אחד מ חבר_ _של_ _הוא , דרשה ארוכה נשא ב ליל שבת ה רב ה מקומי בגנות ה התקפה .",[0] -> [6] -> [8]
"ב ה_ תחרות ל זוגות ניצחו ויידנפלד ו עמית נאור את מרנשטיין ו אורן מוטווסל 6-2 , 6-4 .","ב ה_ תחרות ל זוגות את מרנשטיין ו אורן מוטווסל ניצחו ויידנפלד ו עמית נאור 6-2 , 6-4 .",[0] -> [6] -> [8]
"ב כפר בלעא ב נפת טול כרם תקפו שלושה רעולי פנים ב סכינים רופא מקומי ד""ר עפיף ברברח , בן 30 , ש אושפז ב מצב קשה ב בית ה חולים אל איתיחאד ב שכם .","ב כפר בלעא ב נפת טול כרם רופא מקומי ד""ר עפיף ברברח , בן 30 , ש אושפז ב מצב קשה ב בית ה חולים אל איתיחאד ב שכם תקפו שלושה רעולי פנים ב סכינים .",[0] -> [6] -> [8]
"ב בית ה ספר מכה ה מורה את ה תלמידים , ב ה_ צבא מכים את ה טירונים , אסירים פוליטיים ו פליליים עוברים עינויים דרך קבע .","ב בית ה ספר את ה תלמידים מכה ה מורה , ב ה_ צבא מכים את ה טירונים , אסירים פוליטיים ו פליליים עוברים עינויים דרך קבע .",[0] -> [6] -> [8]
""" , על - פי תסריט של חנוך לוין , שרה תיקי דיין את "" אני חיה ל_ _אני מ יום ל יום "" , ה שיר ש נודע ב גרסה_ _של_ _היא ה קצבית של ריטה .",""" , על - פי תסריט של חנוך לוין , את "" אני חיה ל_ _אני מ יום ל יום "" , ה שיר ש נודע ב גרסה_ _של_ _היא ה קצבית של ריטה שרה תיקי דיין .",[0] -> [6] -> [8]
ב ה_ תליון משלבת לש אבנים ה נפרסות ל פרוסות דקיקות .,ב ה_ תליון אבנים ה נפרסות ל פרוסות דקיקות משלבת לש .,[0] -> [6] -> [8]
לצד ה אותיות ה אדומות הציב ה עיתון את סמל תנועת ה התנגדות ל מלחמת וייטנאם .,לצד ה אותיות ה אדומות את סמל תנועת ה התנגדות ל מלחמת וייטנאם הציב ה עיתון .,[0] -> [6] -> [8]
"לפני עשר שנים הגישה ה וועדה , ש מינה שר ה משפטים ל בדיקת ה מבנה ו ה סמכויות של בתי - ה משפט , את מסקנה_ _של_ _היא .","לפני עשר שנים את מסקנה_ _של_ _היא הגישה ה וועדה , ש מינה שר ה משפטים ל בדיקת ה מבנה ו ה סמכויות של בתי - ה משפט , .",[0] -> [6] -> [8]
גם ב ה_ רבע ה שני קבעו ה סאנס שיא : 57 נקודות .,גם ב ה_ רבע ה שני שיא : 57 נקודות קבעו ה סאנס .,[0] -> [6] -> [8]
"בין חלוצי יבנה , ש הרבו להחמיץ , ניצל אנריקה ורון הזדמנות אחת בלבד , כדי להעניק ל קבוצה_ _של_ _הוא פרס של 3 נקודות בעד נצחון ש היתה ראויה ל_ _הוא .","בין חלוצי יבנה , ש הרבו להחמיץ , הזדמנות אחת בלבד ניצל אנריקה ורון , כדי להעניק ל קבוצה_ _של_ _הוא פרס של 3 נקודות בעד נצחון ש היתה ראויה ל_ _הוא .",[0] -> [6] -> [8]
ב אותו יום ערך טאטסואו היראנו מכירה פומבית של תמונות יפאניות מ ה מאה ה 20 .,ב אותו יום מכירה פומבית של תמונות יפאניות מ ה מאה ה 20 ערך טאטסואו היראנו .,[0] -> [6] -> [8]
"עוד אמר , כי ב מקרים אחרים , כמו של מכבי תל - אביב , אישרה ה עירייה ל ה_ אגודה תמורת הסכמה_ _של_ _היא להתפנות מ נכס ב מרכז ה עיר , 18 דונם מעבר ל ה_ ירקון ו עוד שלושה מיליון דולר .","עוד אמר , כי ב מקרים אחרים , כמו של מכבי תל - אביב , 18 דונם מעבר ל ה_ ירקון ו עוד שלושה מיליון דולר אישרה ה עירייה ל ה_ אגודה תמורת הסכמה_ _של_ _היא להתפנות מ נכס ב מרכז ה עיר , .",[0] -> [6] -> [8]
"ה שאלה היא ב איזו מידה יכול אדם להשתנות "" , ו ב איזו מידה ישרטט ה עתיד מחדש את מפת רוסיה .","ה שאלה היא ב איזו מידה יכול אדם להשתנות "" , ו ב איזו מידה את מפת רוסיה ישרטט ה עתיד מחדש .",[0] -> [6] -> [8]
"ב חוברת ש כותרת_ _של_ _היא : "" משרד ה משטרה תפיסת ה יעוד , ה ארגון ו ה ניהול "" , מדגיש ה מנכ""ל , בין ה שאר , גם את ה עקרונות ש על פה_ _של_ _הם המליצה ועדת זמיר להקים את צוות ה מטה ה מקצועי ליד שר ה משטרה .","ב חוברת ש כותרת_ _של_ _היא : "" משרד ה משטרה תפיסת ה יעוד , ה ארגון ו ה ניהול "" , גם את ה עקרונות ש על פה_ _של_ _הם המליצה ועדת זמיר להקים את צוות ה מטה ה מקצועי ליד שר ה משטרה מדגיש ה מנכ""ל , בין ה שאר , .",[0] -> [6] -> [8]
