sen_str,swapped_sen_str,leaf_rule
이튿날 모세는 다시 밖에 나갔다가 이번에는 히브리 인 두사람이 서로 맞붙어 싸우는 것을 보고 잘못한 자를 나무랐다 .,이튿날 모세는 다시 밖에 나갔다가 이번에는 보고 히브리 인 두사람이 서로 맞붙어 싸우는 것을 잘못한 자를 나무랐다 .,[0] -> [1] -> [3]
"이러한 집착은 종종 흉노를 문화적으로 예속시키려는 후한에 대항한 , 반라노가 충돌로 나타나곤 하였다 .","이러한 집착은 종종 문화적으로 예속시키려는 흉노를 후한에 대항한 , 반라노가 충돌로 나타나곤 하였다 .",[0] -> [1] -> [3]
돈의 입금과 출금이 매월 균형을 유지한다면 생활은 언제까지나 안정될 것이다 .,돈의 입금과 출금이 매월 유지한다면 균형을 생활은 언제까지나 안정될 것이다 .,[0] -> [1] -> [3]
일부 국민문학파가 시조를 택한 것은 그것이 우리 전래의 고유양식이라는 이유에서였다 .,일부 국민문학파가 택한 시조를 것은 그것이 우리 전래의 고유양식이라는 이유에서였다 .,[0] -> [1] -> [3]
도시 속에서 매일 바쁜 생활을 하다 보면 훌쩍 집을 떠나 어디론가 여행을 했으면 하는 생각이 듭니다 .,도시 속에서 매일 바쁜 생활을 하다 보면 훌쩍 떠나 집을 어디론가 여행을 했으면 하는 생각이 듭니다 .,[0] -> [1] -> [3]
따라서 기층민중운동이 처한 조건과 그 운동을 활성화시키는 운동의 형태 등은 부단히 탐구되고 연구되어야 한다 .,따라서 기층민중운동이 처한 조건과 활성화시키는 그 운동을 운동의 형태 등은 부단히 탐구되고 연구되어야 한다 .,[0] -> [1] -> [3]
일행은 고리끼가의 외무성빌딩 앞에 있는 벨고그라드호텔에 묵으며 얼마 전까지 철저히 폐쇄됐던 사회주의 나라의 풍물을 호기심 있게 살폈다 .,일행은 고리끼가의 외무성빌딩 앞에 있는 벨고그라드호텔에 묵으며 호기심 있게 살폈다 얼마 전까지 철저히 폐쇄됐던 사회주의 나라의 풍물을 .,[0] -> [1] -> [3]
한국어를 한국에서 배우면 발음과 문법도 더 정확하고 자세하게 배울 수 있다 .,한국어를 한국에서 배우면 더 정확하고 자세하게 배울 발음과 문법도 수 있다 .,[0] -> [1] -> [3]
최근까지의 고고학적 발굴은 이들이 물 밑으로 서로 연결되어 있음을 확인시켜 주었다 .,최근까지의 고고학적 발굴은 확인시켜 이들이 물 밑으로 서로 연결되어 있음을 주었다 .,[0] -> [1] -> [3]
난공불락의 낙동강은 이로부터 대구를 지켜주고 나라를 구한 명예스런 강으로 불리게 되었다 .,난공불락의 낙동강은 이로부터 지켜주고 대구를 나라를 구한 명예스런 강으로 불리게 되었다 .,[0] -> [1] -> [3]
"따라서 과학성의 기치를 든 이러한 흐름의 비평은 그 강조하는 경향에 따라 구조주의 비평 , 문체 비평 또는 비평이란 이름으로 다양하게 불리운다 .","따라서 든 과학성의 기치를 이러한 흐름의 비평은 그 강조하는 경향에 따라 구조주의 비평 , 문체 비평 또는 비평이란 이름으로 다양하게 불리운다 .",[0] -> [1] -> [3]
당초 궁예가 현재의 구철원에서 송악으로 도읍을 옮긴 이유는 왕건 세력의 도움을 받기 위해서였다 .,당초 궁예가 현재의 구철원에서 송악으로 도읍을 옮긴 이유는 받기 왕건 세력의 도움을 위해서였다 .,[0] -> [1] -> [3]
"이에 대해 그 동안 축제 준비를 맡아온 인사들은 "" 일부단체에서 축제 조정 필요성이 제기되기도 했으나 전반적인 분위기는 폐지보다 보완쪽에 무게를 둬 금년에는 더욱더 다양한 볼거리와 함께 시민참여무대 , 가장행렬경연대회 등 보다 내실 있는 축제를 만들기 위해 많은 준비를 해왔다 "" 고 말했다 .","이에 대해 그 동안 축제 준비를 맡아온 인사들은 "" 일부단체에서 축제 조정 필요성이 제기되기도 했으나 전반적인 분위기는 폐지보다 보완쪽에 무게를 둬 금년에는 더욱더 다양한 볼거리와 함께 위해 시민참여무대 , 가장행렬경연대회 등 보다 내실 있는 축제를 만들기 많은 준비를 해왔다 "" 고 말했다 .",[0] -> [1] -> [3]
