sen_str,swapped_sen_str,leaf_rule
"ഭൂപരിഷ്‌കരണം , വിദ്യാഭ്യാസത്തിന്റെ ഉം ആരോഗ്യ സംരക്ഷണത്തിന്റെ ഉം വ്യാപനം , വികേന്ദ്രീകൃതാസൂത്രണം , പെൻഷൻ പദ്ധതികൾ , പൊതുവിതരണ സമ്പ്രദായം , കുടുംബശ്രീ , ആസൂത്രണ പദ്ധതികൾ എന്നിവ കേരളത്തിലെ ഗ്രാമനഗര പ്രദേശങ്ങളിലെ ദാരിദ്ര്യത്തിന്റെ തോത് കുറക്കുന്നതിൽ ഫലപ്രദമായ പങ്ക് വഹിച്ചിട്ടുണ്ട് .","ഭൂപരിഷ്‌കരണം , വിദ്യാഭ്യാസത്തിന്റെ ഉം ആരോഗ്യ സംരക്ഷണത്തിന്റെ ഉം വ്യാപനം , വികേന്ദ്രീകൃതാസൂത്രണം , പെൻഷൻ പദ്ധതികൾ , പൊതുവിതരണ സമ്പ്രദായം , കുടുംബശ്രീ , ആസൂത്രണ പദ്ധതികൾ എന്നിവ കേരളത്തിലെ ഗ്രാമനഗര പ്രദേശങ്ങളിലെ കുറക്കുന്നതിൽ ദാരിദ്ര്യത്തിന്റെ തോത് ഫലപ്രദമായ പങ്ക് വഹിച്ചിട്ടുണ്ട് .",[0] -> [1]
വനിതാ മതിൽ ' നിർമ്മാണത്തിന് സംസ്ഥാന ഗവൺമെന്റ് നേതൃത്വം നൽകുന്നത് ഭരണഘടനയുടെ ...,വനിതാ മതിൽ ' നിർമ്മാണത്തിന് സംസ്ഥാന ഗവൺമെന്റ് നൽകുന്നത് നേതൃത്വം ഭരണഘടനയുടെ ...,[0] -> [1]
"അവൻ ഒരു കാർ വാങ്ങി , പക്ഷേ അവന്റെ സഹോദരൻ ഒരു ബൈക്ക് മാത്രം വാങ്ങി .","അവൻ ഒരു കാർ വാങ്ങി , പക്ഷേ അവന്റെ സഹോദരൻ മാത്രം വാങ്ങി ഒരു ബൈക്ക് .",[0] -> [1]
നിങ്ങള് എന്ത് ആണ് നോക്കുന്നത് ?,നിങ്ങള് ആണ് നോക്കുന്നത് എന്ത് ?,[0] -> [1]
ടെക്‌നോപാർക്കിനുള്ളിലെ ഹോട്ടലുകൾ ഒന്നും പ്രവർത്തിച്ചില്ലെങ്കിൽ ഉം കഴക്കൂട്ടത്തെ പല ഭക്ഷണശാലകള ഉം തുറന്നു .,ടെക്‌നോപാർക്കിനുള്ളിലെ ഹോട്ടലുകൾ ഒന്നും പ്രവർത്തിച്ചില്ലെങ്കിൽ ഉം പല ഭക്ഷണശാലകള ഉം തുറന്നു കഴക്കൂട്ടത്തെ .,[0] -> [1]
ഇന്ന് ഇരുവര ഉം ഒന്നിച്ചുള്ള ആദ്യ ചിത്രമ് ആണ് നസ്രിയ പങ്കു വച്ചിരിക്കുന്നത് .,ഇന്ന് നസ്രിയ പങ്കു വച്ചിരിക്കുന്നത് ഇരുവര ഉം ഒന്നിച്ചുള്ള ആദ്യ ചിത്രമ് ആണ് .,[0] -> [1]
പതിവുപോലെ ബ്ലാസ്റ്റഴ്‌സ് മുന്നേറ്റത്തോടെ ആണ് കളി തുടങ്ങിയത് .,പതിവുപോലെ ബ്ലാസ്റ്റഴ്‌സ് മുന്നേറ്റത്തോടെ ആണ് തുടങ്ങിയത് കളി .,[0] -> [1]
തുടർന്നു ദിവസങ്ങളായി സംഘത്തെ നിരീക്ഷിച്ചുവരികയായിരുന്നു .,തുടർന്നു ദിവസങ്ങളായി നിരീക്ഷിച്ചുവരികയായിരുന്നു സംഘത്തെ .,[0] -> [1]
അഭയാർഥികളെ സംരക്ഷിക്കുന്നതിൽ ഇയു തികഞ്ഞ പരാജയം ആണ് എന്ന് ഉം കുർദ് തീവ്രവാദികളെ ഇയു പിന്തുണക്കുകയാണ് എന്ന് ഉം ഉർദുഗാൻ ആരോപിച്ചു .,അഭയാർഥികളെ സംരക്ഷിക്കുന്നതിൽ ഇയു തികഞ്ഞ പരാജയം ആണ് എന്ന് ഉം ഇയു പിന്തുണക്കുകയാണ് കുർദ് തീവ്രവാദികളെ എന്ന് ഉം ഉർദുഗാൻ ആരോപിച്ചു .,[0] -> [1]
"ബദിയടുക്ക റേഞ്ച് ഇൻസ്‌പെക്ടർ രഞ്ജിത് ബാബു , പ്രിവന്റീവ് ഓഫീസർമാരായ എം രാജീവൻ , സുരേഷ് , സിവിൽ എക്‌സൈസ് ഓഫീസർമാരായ ബോസ് കുമാർ , അരുൺ , ഡ്രൈവർ രാധാകൃഷ്ണൻ എന്നിവരുടെ നേതൃത്വത്തിൽ ആണ് ഈ ആളെ തൊണ്ടി സഹിതം പിടികൂടിയത് .","ബദിയടുക്ക റേഞ്ച് ഇൻസ്‌പെക്ടർ രഞ്ജിത് ബാബു , പ്രിവന്റീവ് ഓഫീസർമാരായ എം രാജീവൻ , സുരേഷ് , സിവിൽ എക്‌സൈസ് ഓഫീസർമാരായ ബോസ് കുമാർ , അരുൺ , ഡ്രൈവർ രാധാകൃഷ്ണൻ എന്നിവരുടെ നേതൃത്വത്തിൽ ആണ് തൊണ്ടി സഹിതം പിടികൂടിയത് ഈ ആളെ .",[0] -> [1]
രുചികരമായ ഭവനങ്ങളിൽ അരകപ്പ് കുക്കികൾ പാചകം ചെയ്യുന്നത് വളരെ നല്ലത് ആണ് - ഇത് വളരെ ബുദ്ധിമുട്ടുള്ള കാര്യം അല്ല .,രുചികരമായ ഭവനങ്ങളിൽ പാചകം ചെയ്യുന്നത് അരകപ്പ് കുക്കികൾ വളരെ നല്ലത് ആണ് - ഇത് വളരെ ബുദ്ധിമുട്ടുള്ള കാര്യം അല്ല .,[0] -> [1]
ഇന്ന് നീ എന്ത് ആണ് ചെയ്യുന്നത് ?,ഇന്ന് നീ ആണ് ചെയ്യുന്നത് എന്ത് ?,[0] -> [1]
കഴിഞ്ഞ തിരഞ്ഞെടുപ്പുകളിൽ ദേശീയ പാർട്ടികൾ ദുർബലമാവുക ഉം പ്രാദേശിക പാർട്ടികൾ ശക്തരാവുക ഉം ചെയ്തതിനാൽ ഭരണത്തിൽ പങ്കാളിത്തമുള്ള പ്രാദേശിക പാർട്ടികളുടെ അഴിമതികള ഉം സ്വാർത്ഥത ഉം രാജ്യത്തിന് വലിയ നഷ്ടങ്ങൾ ഉണ്ടാക്കിയിട്ടുണ്ട് .,കഴിഞ്ഞ തിരഞ്ഞെടുപ്പുകളിൽ ദേശീയ പാർട്ടികൾ ദുർബലമാവുക ഉം പ്രാദേശിക പാർട്ടികൾ ശക്തരാവുക ഉം ചെയ്തതിനാൽ ഭരണത്തിൽ പങ്കാളിത്തമുള്ള പ്രാദേശിക പാർട്ടികളുടെ അഴിമതികള ഉം സ്വാർത്ഥത ഉം രാജ്യത്തിന് ഉണ്ടാക്കിയിട്ടുണ്ട് വലിയ നഷ്ടങ്ങൾ .,[0] -> [1]
നിങ്ങൾക്ക് മലയാളം അറിയാമോ ?,നിങ്ങൾക്ക് അറിയാമോ മലയാളം ?,[0] -> [1]
72 മണിക്കൂർ വെടിനിർത്തൽ നിലവിൽ വന്നതിനു തൊട്ടുപിന്നാലെ ഇസ്രയേൽ സേന നടത്തിയ ആക്രമണത്തിൽ നാല് പലസ്തീൻകാർ കൊല്ലപ്പെട്ടു .,72 മണിക്കൂർ വെടിനിർത്തൽ നിലവിൽ വന്നതിനു തൊട്ടുപിന്നാലെ ഇസ്രയേൽ സേന നടത്തിയ ആക്രമണത്തിൽ കൊല്ലപ്പെട്ടു നാല് പലസ്തീൻകാർ .,[0] -> [1]
