sen_str,swapped_sen_str,leaf_rule
പെൺകുട്ടി തന്റെ സുഹൃത്തിന് കത്ത് എഴുതി .,പെൺകുട്ടി തന്റെ സുഹൃത്തിന് എഴുതി കത്ത് .,[0] -> [1]
ടിപി ചന്ദ്രശേഖരൻ വധക്കേസ് പ്രതി കുഞ്ഞനന്തന് നിരന്തരം പരോൾ അനുവദിക്കുന്നതിൽ പ്രതിഷേധം .,ടിപി ചന്ദ്രശേഖരൻ വധക്കേസ് പ്രതി കുഞ്ഞനന്തന് അനുവദിക്കുന്നതിൽ നിരന്തരം പരോൾ പ്രതിഷേധം .,[0] -> [1]
സമൂഹത്തിൽ മാന്യത നിലനിർത്തി പ്രൊഫഷണൽ വൈദഗ്ധ്യത്തോടെ മനസ്സാന്നിധ്യം കൈവിടാതെ ആണ് ഓരോ കൊലപാതകം ഉം നടത്തിയത് .,സമൂഹത്തിൽ മാന്യത നിലനിർത്തി പ്രൊഫഷണൽ വൈദഗ്ധ്യത്തോടെ മനസ്സാന്നിധ്യം കൈവിടാതെ ആണ് നടത്തിയത് ഓരോ കൊലപാതകം ഉം .,[0] -> [1]
കഴിഞ്ഞ വർഷം ജൂലൈ 24 ന് ആണ് കൊളീജിയം ശുപാർശ നൽകുന്നത് .,കഴിഞ്ഞ വർഷം ജൂലൈ 24 ന് ആണ് കൊളീജിയം നൽകുന്നത് ശുപാർശ .,[0] -> [1]
"ഭൂപരിഷ്‌കരണം , വിദ്യാഭ്യാസത്തിന്റെ ഉം ആരോഗ്യ സംരക്ഷണത്തിന്റെ ഉം വ്യാപനം , വികേന്ദ്രീകൃതാസൂത്രണം , പെൻഷൻ പദ്ധതികൾ , പൊതുവിതരണ സമ്പ്രദായം , കുടുംബശ്രീ , ആസൂത്രണ പദ്ധതികൾ എന്നിവ കേരളത്തിലെ ഗ്രാമനഗര പ്രദേശങ്ങളിലെ ദാരിദ്ര്യത്തിന്റെ തോത് കുറക്കുന്നതിൽ ഫലപ്രദമായ പങ്ക് വഹിച്ചിട്ടുണ്ട് .","ഭൂപരിഷ്‌കരണം , വിദ്യാഭ്യാസത്തിന്റെ ഉം ആരോഗ്യ സംരക്ഷണത്തിന്റെ ഉം വ്യാപനം , വികേന്ദ്രീകൃതാസൂത്രണം , പെൻഷൻ പദ്ധതികൾ , പൊതുവിതരണ സമ്പ്രദായം , കുടുംബശ്രീ , ആസൂത്രണ പദ്ധതികൾ എന്നിവ വഹിച്ചിട്ടുണ്ട് കേരളത്തിലെ ഗ്രാമനഗര പ്രദേശങ്ങളിലെ ദാരിദ്ര്യത്തിന്റെ തോത് കുറക്കുന്നതിൽ ഫലപ്രദമായ പങ്ക് .",[0] -> [1]
മനോജിന്റെ മൊഴികളിൽ വൈരുദ്ധ്യം നിറയുന്നു ; വാസുവിനെ കൊന്ന് കെട്ടി തൂകിയത് ആണ് എന്ന നിഗമനത്തിലേക്ക് അന്വേഷണ സംഘം ; ആന വേട്ട കേസില്‍ പിഴവ് പറ്റിയിട്ടില്ലാ എന്ന ഉറച്ച് വനംവകുപ്പിന്റെ നീക്കങ്ങൾ,മനോജിന്റെ മൊഴികളിൽ വൈരുദ്ധ്യം നിറയുന്നു ; കൊന്ന് കെട്ടി തൂകിയത് വാസുവിനെ ആണ് എന്ന നിഗമനത്തിലേക്ക് അന്വേഷണ സംഘം ; ആന വേട്ട കേസില്‍ പിഴവ് പറ്റിയിട്ടില്ലാ എന്ന ഉറച്ച് വനംവകുപ്പിന്റെ നീക്കങ്ങൾ,[0] -> [1]
സമൂഹത്തിൽ മാന്യത നിലനിർത്തി പ്രൊഫഷണൽ വൈദഗ്ധ്യത്തോടെ മനസ്സാന്നിധ്യം കൈവിടാതെ ആണ് ഓരോ കൊലപാതകം ഉം നടത്തിയത് .,സമൂഹത്തിൽ നിലനിർത്തി മാന്യത പ്രൊഫഷണൽ വൈദഗ്ധ്യത്തോടെ മനസ്സാന്നിധ്യം കൈവിടാതെ ആണ് ഓരോ കൊലപാതകം ഉം നടത്തിയത് .,[0] -> [1]
"നിങ്ങളുടെ വാസസ്ഥലത്ത് ആയിരിക്കുമ്പോൾ , നിങ്ങളുടെ വീട്ടിലെ പോളിസിയുടെ ബിസിനസ്സ് ഉപകരണങ്ങളെ മാത്രമേ ഇത് ബാധിക്കുകയുള്ളൂ .","നിങ്ങളുടെ വാസസ്ഥലത്ത് ആയിരിക്കുമ്പോൾ , നിങ്ങളുടെ വീട്ടിലെ മാത്രമേ ഇത് ബാധിക്കുകയുള്ളൂ പോളിസിയുടെ ബിസിനസ്സ് ഉപകരണങ്ങളെ .",[0] -> [1]
അതിനാൽ ഈ തിരഞ്ഞെടുപ്പുഫലം ദൈവ കരങ്ങളിൽ നിന്ന ഉം സ്വീകരിച്ച് പുതിയ സർക്കാരിന് കൂടുതൽ ദൈവകൃപ ലഭിക്കുവാൻ നാം പ്രാർത്ഥിക്കണം .,അതിനാൽ ദൈവ കരങ്ങളിൽ നിന്ന ഉം സ്വീകരിച്ച് ഈ തിരഞ്ഞെടുപ്പുഫലം പുതിയ സർക്കാരിന് കൂടുതൽ ദൈവകൃപ ലഭിക്കുവാൻ നാം പ്രാർത്ഥിക്കണം .,[0] -> [1]
തങ്ങളുടെ പ്ലാറ്റ്‌ഫോമിൽ നിന്ന് വ്യാജവാർത്തകളെ പരമാവധി ഒഴിവാക്കി നിർത്തും എന്ന് ഉം കമ്പനി പറഞ്ഞു .,തങ്ങളുടെ പ്ലാറ്റ്‌ഫോമിൽ നിന്ന് പരമാവധി ഒഴിവാക്കി നിർത്തും വ്യാജവാർത്തകളെ എന്ന് ഉം കമ്പനി പറഞ്ഞു .,[0] -> [1]
അവൾ ഭർത്താവിനെ കൊണ്ട് കാർ കഴികിച്ചു .,അവൾ ഭർത്താവിനെ കൊണ്ട് കഴികിച്ചു കാർ .,[0] -> [1]
ഈ ആളെ പോക്‌സോ കേസ് ചുമത്തി ആണ് പോലീസ് അറസ്റ്റു ചെയ്തത് .,ഈ ആളെ ചുമത്തി പോക്‌സോ കേസ് ആണ് പോലീസ് അറസ്റ്റു ചെയ്തത് .,[0] -> [1]
പീറ്ററിന്റെ അയൽക്കാരൻ വേലിക്ക് ചുവപ്പ് നിറം അടിച്ചു .,പീറ്ററിന്റെ അയൽക്കാരൻ വേലിക്ക് അടിച്ചു ചുവപ്പ് നിറം .,[0] -> [1]
ഗൗതം ഉം വെങ്കട്ട് പ്രഭു ഉം നേതൃത്വം നൽകുന്ന ഒൺട്രംഗ എന്റർടെയിൻമെന്ർ ഉം എസ്‌കേപ് ആർട്ടിസ്റ് ഉം ചേർന് ആണ് സിനിമ നിർമിക്കുന്നത് .,ഗൗതം ഉം വെങ്കട്ട് പ്രഭു ഉം നേതൃത്വം നൽകുന്ന ഒൺട്രംഗ എന്റർടെയിൻമെന്ർ ഉം എസ്‌കേപ് ആർട്ടിസ്റ് ഉം ചേർന് ആണ് നിർമിക്കുന്നത് സിനിമ .,[0] -> [1]
കലാമൂല്യമുള്ളതാക്കി മാറ്റാമായിരുന്ന ഒരു വിഷയത്തെ പക്കാ കച്ചവടച്ചരക്കാക്കി മാറ്റിയെങ്കിലും പത്മകുമാർ സംവിധാനം ചെയ്‌ത ഈ ചിത്രത്തെ മോഹൻലാൽ ഫാൻസ്‌ ഒരാഘോഷമാക്കി മാറ്റി .,കലാമൂല്യമുള്ളതാക്കി മാറ്റാമായിരുന്ന ഒരു വിഷയത്തെ പക്കാ കച്ചവടച്ചരക്കാക്കി മാറ്റിയെങ്കിലും പത്മകുമാർ ചെയ്‌ത സംവിധാനം ഈ ചിത്രത്തെ മോഹൻലാൽ ഫാൻസ്‌ ഒരാഘോഷമാക്കി മാറ്റി .,[0] -> [1]
ഇതിന് പുറമേ ധനമന്ത്രാലയത്തിന് കീഴിലുളള സാമ്പത്തികകാര്യ വകുപ്പ് അധികമായി ചെലവഴിച്ച തുകയ്ക്ക് പാർലമെന്റിന്റെ അനുമതി നേടി എടുക്കുന്നതിൽ പരാജയപ്പേട്ടതായി ഉം റിപ്പോർട്ട് കുറ്റപ്പെടുത്തുന്നു .,ഇതിന് പുറമേ ധനമന്ത്രാലയത്തിന് കീഴിലുളള സാമ്പത്തികകാര്യ വകുപ്പ് അധികമായി ചെലവഴിച്ച തുകയ്ക്ക് നേടി പാർലമെന്റിന്റെ അനുമതി എടുക്കുന്നതിൽ പരാജയപ്പേട്ടതായി ഉം റിപ്പോർട്ട് കുറ്റപ്പെടുത്തുന്നു .,[0] -> [1]
പഠനങ്ങൾ അനുസരിച്ച് ബിയർ കഴിയ്ക്കുന്നത് കിഡ്‌നി സ്റ്റോൺ പോലുള്ള അസുഖങ്ങളെ ഇല്ലാതാക്കുന്നു എന്ന് ഉം വൃക്കയുടെ ആരോഗ്യത്തെ സംരക്ഷിക്കുന്നു എന്ന് ഉം പറയുന്നു .,പഠനങ്ങൾ അനുസരിച്ച് ബിയർ കഴിയ്ക്കുന്നത് ഇല്ലാതാക്കുന്നു കിഡ്‌നി സ്റ്റോൺ പോലുള്ള അസുഖങ്ങളെ എന്ന് ഉം വൃക്കയുടെ ആരോഗ്യത്തെ സംരക്ഷിക്കുന്നു എന്ന് ഉം പറയുന്നു .,[0] -> [1]
എന്നാൽ പ്രശ്‌നത്തിന് പൂർണമായ പരിഹാരം ഉണ്ടാകാൻ ഇനിയും സമയം എടുക്കും എന്ന് ആണ് ഇപ്പോൾ ലഭിക്കുന്ന വിവരം .,എന്നാൽ പ്രശ്‌നത്തിന് പൂർണമായ പരിഹാരം ഉണ്ടാകാൻ ഇനിയും എടുക്കും സമയം എന്ന് ആണ് ഇപ്പോൾ ലഭിക്കുന്ന വിവരം .,[0] -> [1]
എന്നാൽ റിലീസിങ്ങ് ദിനത്തിൽ പരമാവധി തിയേറ്ററുകളിലേക്ക് ചിത്രം എത്തിക്കണം എന്ന മെഗാസ്റ്റാറിന്റെ ആഗ്രഹത്തിന് വേണ്ടി ആണ് റിലീസ് മാറ്റിയത് എന്ന് പിന്നീട് പാപ്പരാസികൾ കണ്ടെത്തികയായിരുന്നു .,എന്നാൽ റിലീസിങ്ങ് ദിനത്തിൽ പരമാവധി തിയേറ്ററുകളിലേക്ക് ചിത്രം എത്തിക്കണം എന്ന മെഗാസ്റ്റാറിന്റെ ആഗ്രഹത്തിന് വേണ്ടി ആണ് മാറ്റിയത് റിലീസ് എന്ന് പിന്നീട് പാപ്പരാസികൾ കണ്ടെത്തികയായിരുന്നു .,[0] -> [1]
പഠനങ്ങൾ അനുസരിച്ച് ബിയർ കഴിയ്ക്കുന്നത് കിഡ്‌നി സ്റ്റോൺ പോലുള്ള അസുഖങ്ങളെ ഇല്ലാതാക്കുന്നു എന്ന് ഉം വൃക്കയുടെ ആരോഗ്യത്തെ സംരക്ഷിക്കുന്നു എന്ന് ഉം പറയുന്നു .,പഠനങ്ങൾ അനുസരിച്ച് കഴിയ്ക്കുന്നത് ബിയർ കിഡ്‌നി സ്റ്റോൺ പോലുള്ള അസുഖങ്ങളെ ഇല്ലാതാക്കുന്നു എന്ന് ഉം വൃക്കയുടെ ആരോഗ്യത്തെ സംരക്ഷിക്കുന്നു എന്ന് ഉം പറയുന്നു .,[0] -> [1]
പ്രളയം : ഹംപി ഹെറിറ്റേജ് സൈറ്റിൽ കുടുങ്ങിയ വിനോദസഞ്ചാരികളെ രക്ഷപ്പെടുത്തി .,പ്രളയം : ഹംപി ഹെറിറ്റേജ് സൈറ്റിൽ രക്ഷപ്പെടുത്തി കുടുങ്ങിയ വിനോദസഞ്ചാരികളെ .,[0] -> [1]
മാലി അധികൃതര് ആണ് ഈ കാര്യം വ്യക്തം ആക്കിയിട്ടുള്ളത് .,മാലി അധികൃതര് ആണ് വ്യക്തം ആക്കിയിട്ടുള്ളത് ഈ കാര്യം .,[0] -> [1]
രോഗികൾക്ക്‌ രോഗശാന്തി കൈ വരും .,രോഗികൾക്ക്‌ കൈ വരും രോഗശാന്തി .,[0] -> [1]
പീറ്റർ ഉം മേരി ഉം പരസ്പരം ആലിംഗനം ചെയ്ത ശേഷം മുറി വിട്ടു .,പീറ്റർ ഉം മേരി ഉം പരസ്പരം ചെയ്ത ആലിംഗനം ശേഷം മുറി വിട്ടു .,[0] -> [1]
പ്രഫ . ഷീലാ സ്റ്റീഫൻ സെമിനാർ നയിച്ചു .,പ്രഫ . ഷീലാ സ്റ്റീഫൻ നയിച്ചു സെമിനാർ .,[0] -> [1]
"എന്നാൽ , ഇത് കണ്ട് മടങ്ങി പോകാതെ ഇടികൂടുന്ന വിദ്യാർഥികൾക്ക് ഇടയിലൂടെ ഇത് ഒക്കെ എന്ത് എന്ന മുഖഭാവത്തോടെയ് ആണ് ഷറഫുദ്ദീൻ നടന്ന് പോയത് .","എന്നാൽ , കണ്ട് ഇത് മടങ്ങി പോകാതെ ഇടികൂടുന്ന വിദ്യാർഥികൾക്ക് ഇടയിലൂടെ ഇത് ഒക്കെ എന്ത് എന്ന മുഖഭാവത്തോടെയ് ആണ് ഷറഫുദ്ദീൻ നടന്ന് പോയത് .",[0] -> [1]
ഇപ്രാവശ്യം കേവല ഭൂരിപക്ഷം ഒറ്റയ്ക്കുള്ള ഒരു പാർട്ടി ഭരിക്കുന്നതിനാൽ കൂടുതൽ കാര്യക്ഷമത ഉം ഊർജസ്വലത ഉം ഭരണത്തിന് ഉണ്ടാകാൻ സാധ്യത ഏറെ ആണ് .,ഇപ്രാവശ്യം കേവല ഭൂരിപക്ഷം ഒറ്റയ്ക്കുള്ള ഭരിക്കുന്നതിനാൽ ഒരു പാർട്ടി കൂടുതൽ കാര്യക്ഷമത ഉം ഊർജസ്വലത ഉം ഭരണത്തിന് ഉണ്ടാകാൻ സാധ്യത ഏറെ ആണ് .,[0] -> [1]
ചൈനീസ് പ്രസിഡന്റ് ഷി ജിൻപിങ് ബംഗ്ലാദേശ് സന്ദർശിക്കുന്നതിനിടെയ് ആണ് രാജ്യത്തിന് ഇത്ര ഉം തുകയുടെ വായ്പ കരാർ പ്രഖ്യാപിച്ചിരിക്കുന്നത് .,ചൈനീസ് പ്രസിഡന്റ് ഷി ജിൻപിങ് സന്ദർശിക്കുന്നതിനിടെയ് ബംഗ്ലാദേശ് ആണ് രാജ്യത്തിന് ഇത്ര ഉം തുകയുടെ വായ്പ കരാർ പ്രഖ്യാപിച്ചിരിക്കുന്നത് .,[0] -> [1]
മലപ്പുറം : പ്രസവാവധിക്ക് പോയ അധ്യാപികയെ ജോലിയിൽ നിന്ന ഉം പുറത്താക്കി .,മലപ്പുറം : ജോലിയിൽ നിന്ന ഉം പുറത്താക്കി പ്രസവാവധിക്ക് പോയ അധ്യാപികയെ .,[0] -> [1]
പഠനങ്ങൾ അനുസരിച്ച് ബിയർ കഴിയ്ക്കുന്നത് കിഡ്‌നി സ്റ്റോൺ പോലുള്ള അസുഖങ്ങളെ ഇല്ലാതാക്കുന്നു എന്ന് ഉം വൃക്കയുടെ ആരോഗ്യത്തെ സംരക്ഷിക്കുന്നു എന്ന് ഉം പറയുന്നു .,പഠനങ്ങൾ അനുസരിച്ച് ബിയർ കഴിയ്ക്കുന്നത് കിഡ്‌നി സ്റ്റോൺ പോലുള്ള അസുഖങ്ങളെ ഇല്ലാതാക്കുന്നു എന്ന് ഉം സംരക്ഷിക്കുന്നു വൃക്കയുടെ ആരോഗ്യത്തെ എന്ന് ഉം പറയുന്നു .,[0] -> [1]
ഒരേ പാർട്ടി തന്നെ തുടർച്ചയായി അധികാരം കൈയാളുമ്പോൾ അധികാര ദല്ലാളന്മാര ഉം ഉദ്യോഗസ്ഥര ഉം പ്രബലര് ആവുക ഉം ഭരണം ജീർണിക്കുക ഉം ചെയ്യുക സ്വാഭാവികമ് ആണ് .,ഒരേ പാർട്ടി തന്നെ തുടർച്ചയായി കൈയാളുമ്പോൾ അധികാരം അധികാര ദല്ലാളന്മാര ഉം ഉദ്യോഗസ്ഥര ഉം പ്രബലര് ആവുക ഉം ഭരണം ജീർണിക്കുക ഉം ചെയ്യുക സ്വാഭാവികമ് ആണ് .,[0] -> [1]
"അവൻ ഒരു കാർ വാങ്ങി , പക്ഷേ അവന്റെ സഹോദരൻ ഒരു ബൈക്ക് മാത്രം വാങ്ങി .","അവൻ വാങ്ങി ഒരു കാർ , പക്ഷേ അവന്റെ സഹോദരൻ ഒരു ബൈക്ക് മാത്രം വാങ്ങി .",[0] -> [1]
ഇനിയും ഈ പ്രഹസനം അവസാനിപ്പിക്കാനുള്ള കാലം ആയിട്ടില്ല എന്ന് തോന്നുന്നെങ്കിൽ ദയവ് ചെയ്ത് പ്രബുദ്ധരായ മലയാളികൾ എന്ന് ഊറ്റം കൊള്ളരുത് .,ഇനിയും അവസാനിപ്പിക്കാനുള്ള കാലം ആയിട്ടില്ല ഈ പ്രഹസനം എന്ന് തോന്നുന്നെങ്കിൽ ദയവ് ചെയ്ത് പ്രബുദ്ധരായ മലയാളികൾ എന്ന് ഊറ്റം കൊള്ളരുത് .,[0] -> [1]
തറ ടൈൽസ് പാകും .,തറ പാകും ടൈൽസ് .,[0] -> [1]
പിന്നീട് രാമൻ പിള്ളയ്ക്ക് വക്കാലത്ത് നൽകുകയായിരുന്നു .,പിന്നീട് രാമൻ പിള്ളയ്ക്ക് നൽകുകയായിരുന്നു വക്കാലത്ത് .,[0] -> [1]
പത്തരയോടെ ഇവരെ ആശുപത്രിയിൽ എത്തിച്ചെങ്കിൽ ഉം രണ്ടു പേർ ഉം മരണപെട്ടു .,പത്തരയോടെ ആശുപത്രിയിൽ എത്തിച്ചെങ്കിൽ ഇവരെ ഉം രണ്ടു പേർ ഉം മരണപെട്ടു .,[0] -> [1]
"അവളുടെ പേജിലെ "" രഹസ്യ "" ഫോട്ടോമേറ്റിൽ നിന്ന് ഏതാനും ഫോട്ടോകൾ അവൾ പകർത്തി .","അവളുടെ പേജിലെ "" രഹസ്യ "" ഫോട്ടോമേറ്റിൽ നിന്ന് അവൾ പകർത്തി ഏതാനും ഫോട്ടോകൾ .",[0] -> [1]
'' റോമാ സാമ്രാജ്യത്തിലെ അഫ്‌യൂസ് പട്ടണത്തിലെ ഏതാനും ചെറുപ്പക്കാർ ക്രിസ്തുമതം സ്വീകരിച്ചു .,'' റോമാ സാമ്രാജ്യത്തിലെ അഫ്‌യൂസ് പട്ടണത്തിലെ ഏതാനും ചെറുപ്പക്കാർ സ്വീകരിച്ചു ക്രിസ്തുമതം .,[0] -> [1]
കലാമൂല്യമുള്ളതാക്കി മാറ്റാമായിരുന്ന ഒരു വിഷയത്തെ പക്കാ കച്ചവടച്ചരക്കാക്കി മാറ്റിയെങ്കിലും പത്മകുമാർ സംവിധാനം ചെയ്‌ത ഈ ചിത്രത്തെ മോഹൻലാൽ ഫാൻസ്‌ ഒരാഘോഷമാക്കി മാറ്റി .,കലാമൂല്യമുള്ളതാക്കി മാറ്റാമായിരുന്ന ഒരു വിഷയത്തെ പക്കാ കച്ചവടച്ചരക്കാക്കി മാറ്റിയെങ്കിലും മോഹൻലാൽ ഫാൻസ്‌ ഒരാഘോഷമാക്കി മാറ്റി പത്മകുമാർ സംവിധാനം ചെയ്‌ത ഈ ചിത്രത്തെ .,[0] -> [1]
തൊണ്ണൂറു ശതമാനം വലകൾക്ക ഉം നഷ്ടപരിഹാരം അനുവദിച്ചത് ആണ് .,തൊണ്ണൂറു ശതമാനം വലകൾക്ക ഉം അനുവദിച്ചത് നഷ്ടപരിഹാരം ആണ് .,[0] -> [1]
ബിഹാറിനു പിന്നാലെ യുപിയിൽ ഉം വിശാലസഖ്യം ; അഖിലേഷ് യാദവ് കോൺഗ്രസുമായി ചർച്ച നടത്തി,ബിഹാറിനു പിന്നാലെ യുപിയിൽ ഉം വിശാലസഖ്യം ; അഖിലേഷ് യാദവ് കോൺഗ്രസുമായി നടത്തി ചർച്ച,[0] -> [1]
മേരി വെങ്കലം ഉം പീറ്റർ വെള്ളി ഉം ജെയിൻ സ്വർണം ഉം നേടി .,മേരി വെങ്കലം ഉം പീറ്റർ വെള്ളി ഉം ജെയിൻ ഉം നേടി സ്വർണം .,[0] -> [1]
കേസ് മൂന്ന് വർഷം നടന്നു .,കേസ് നടന്നു മൂന്ന് വർഷം .,[0] -> [1]
പാകിസ്ഥാൻ നിയമപ്രകാരം കാനഡയിലുള്ള തൻറെ ട്വിറ്റര് സെൻസർ ചെയ്തതിൽ പ്രകോപിതനായ എസ്രാ കടുത്ത ഭാഷയിൽ ആണ് മന്ത്രിയെ വിമർശിച്ചത് .,പാകിസ്ഥാൻ നിയമപ്രകാരം കാനഡയിലുള്ള തൻറെ ട്വിറ്റര് സെൻസർ ചെയ്തതിൽ പ്രകോപിതനായ എസ്രാ കടുത്ത ഭാഷയിൽ ആണ് വിമർശിച്ചത് മന്ത്രിയെ .,[0] -> [1]
