sen_str,swapped_sen_str,leaf_rule
"Også FNs barnefond , UNICEF , har HIV / AIDS-katastrofen høyt på dagsordenen .","Også FNs barnefond , UNICEF , HIV / AIDS-katastrofen har høyt på dagsordenen .",[0] -> [1] -> [2] -> [3]
"For dere som ikke har mac , eller ikke klarte å få maskinen til å overarbeide , så ber jeg dere lukke øynene selv og se for dere hvor urkomisk det var for meg da jeg satt i photoshop for å fikse bildet - og dette skjedde uten av jeg tenkte over det selv .","For dere som ikke har mac , eller ikke klarte å få maskinen til å overarbeide , så ber jeg dere lukke øynene selv og se for dere hvor urkomisk det var for meg da jeg satt i photoshop for å bildet fikse - og dette skjedde uten av jeg tenkte over det selv .",[0] -> [1] -> [2] -> [3]
Han bekrefter også TV2s avsløringer denne helga om at listekandidater fra fem politiske partier er tilknyttet deres organisasjon .,Han TV2s avsløringer om at listekandidater fra fem politiske partier er tilknyttet deres organisasjon bekrefter også denne helga .,[0] -> [1] -> [2] -> [3]
"I de neste åtte ukene av rettssaken vil volumet variere noe , men en skal hele tiden huske på den store interessen som er rundt saken , sier programdirektør i NRK , Per Arne Kalbakk .","I de neste åtte ukene av rettssaken vil volumet noe variere , men en skal hele tiden huske på den store interessen som er rundt saken , sier programdirektør i NRK , Per Arne Kalbakk .",[0] -> [1] -> [2] -> [3]
Gunnar Sunde holder seg i form ved å oppsøke Nordmarka som ligger like utenfor stuedøren på Slemdal .,Gunnar Sunde holder seg i form ved å Nordmarka som ligger like utenfor stuedøren på Slemdal oppsøke .,[0] -> [1] -> [2] -> [3]
"Men en gang sier han til Rune og Ståle at han skal ut , og ber dem hente jakken hans ...","Men en gang sier han til Rune og Ståle at han skal ut , og ber dem jakken hans hente ...",[0] -> [1] -> [2] -> [3]
"Det må tas nødvendige hensyn til ivaretakelse av religionsfriheten , uten at det dermed forutsettes at utvalget utreder religionspolitiske spørsmål generelt .","Det må nødvendige hensyn til ivaretakelse av religionsfriheten tas , uten at det dermed forutsettes at utvalget utreder religionspolitiske spørsmål generelt .",[0] -> [1] -> [2] -> [3]
Morten Traavik spiller rollen som konferansier .,Morten Traavik rollen som konferansier spiller .,[0] -> [1] -> [2] -> [3]
Han har intervjuet sine venner med homofil orientering på en distansert måte .,Han har sine venner med homofil orientering intervjuet på en distansert måte .,[0] -> [1] -> [2] -> [3]
"Og burde få lov til det , uten å konstant bli fortalt at de ikke er "" hele "" , at de mangler noe .","Og burde lov til det få , uten å konstant bli fortalt at de ikke er "" hele "" , at de mangler noe .",[0] -> [1] -> [2] -> [3]
"- Leah Isadora har bra klang , og jeg tror folk vil like det .","- Leah Isadora bra klang har , og jeg tror folk vil like det .",[0] -> [1] -> [2] -> [3]
"Etter at han gradvis droppet kontakten med meg , tror jeg ikke at han hadde mange virkelige venner .","Etter at han gradvis kontakten med meg droppet , tror jeg ikke at han hadde mange virkelige venner .",[0] -> [1] -> [2] -> [3]
Underlaget i Tromsø får hard medfart verbalt fra uventet hold .,Underlaget i Tromsø hard medfart får verbalt fra uventet hold .,[0] -> [1] -> [2] -> [3]
"- Hun sa hun ville komme , hun hadde allerede bestilt billett og ordnet seg fri fra jobben .","- Hun sa hun ville komme , hun hadde allerede bestilt billett og fri fra jobben ordnet seg .",[0] -> [1] -> [2] -> [3]
Hold brød utenfor !,brød Hold utenfor !,[0] -> [1] -> [2] -> [3]
Heldigvis visste vi ikke da at det skulle ta enda et døgn før vi fikk møte henne .,Heldigvis visste vi ikke da at det skulle ta enda et døgn før vi fikk henne møte .,[0] -> [1] -> [2] -> [3]
Microsoft prøver seg med « Lips » på Xbox 360 .,Microsoft seg prøver med « Lips » på Xbox 360 .,[0] -> [1] -> [2] -> [3]
Rus gir ro i sinnet og bedøver sjelen .,Rus gir ro i sinnet og sjelen bedøver .,[0] -> [1] -> [2] -> [3]
"Men Høyre og andre som måtte ha planer om å overrumple regjeringsmedlemmer med uforberedte møter i medienes søkelys , bør vurdere konsekvensene nøye .","Men Høyre og andre som måtte ha planer om å regjeringsmedlemmer overrumple med uforberedte møter i medienes søkelys , bør vurdere konsekvensene nøye .",[0] -> [1] -> [2] -> [3]
Det går rykter om at han har mottatt bestikkelser .,Det går rykter om at han har bestikkelser mottatt .,[0] -> [1] -> [2] -> [3]
"Apenes er liberal i ordets beste mening , velartikulert så det holder , knapt noen som hører ham eller leser ham kan unngå å være enig i de fleste av hans synspunkter .","Apenes er liberal i ordets beste mening , velartikulert så det holder , knapt noen som ham hører eller leser ham kan unngå å være enig i de fleste av hans synspunkter .",[0] -> [1] -> [2] -> [3]
"Rektor påsto at Bønna hadde trykket på brannalarmen med vilje , men Bønna sier at han bare skulle hjelpe en god venn og dermed kom han helt tilfeldig borti alarmen .","Rektor påsto at Bønna hadde trykket på brannalarmen med vilje , men Bønna sier at han bare skulle en god venn hjelpe og dermed kom han helt tilfeldig borti alarmen .",[0] -> [1] -> [2] -> [3]
"Du skulle ha snakket med mange i teamene rundt meg her , de skjønner det ikke .","Du skulle ha snakket med mange i teamene rundt meg her , de det skjønner ikke .",[0] -> [1] -> [2] -> [3]
Trøster meg med at jeg ikke kjører så mye bil .,Trøster meg med at jeg ikke bil kjører så mye .,[0] -> [1] -> [2] -> [3]
Dessuten skal man aldri undervurdere franskmennenes komiske timing når det kommer til å tømme en vits for ethvert snev av humor .,Dessuten skal man aldri undervurdere franskmennenes komiske timing når det kommer til å en vits tømme for ethvert snev av humor .,[0] -> [1] -> [2] -> [3]
På vegne av bestemora og barnets foreldre har han brakt saken inn for rettsapparatet med begjæring om at vedtaket fra fylkesnemnda i Møre og Romsdal blir omgjort .,På vegne av bestemora og barnets foreldre har han saken brakt inn for rettsapparatet med begjæring om at vedtaket fra fylkesnemnda i Møre og Romsdal blir omgjort .,[0] -> [1] -> [2] -> [3]
"Det er tidligere prosjekter om onkelen med glassøyet , sønnen som leker krig med en kamerat og dattera som krangler om å få lese Donald .","Det er tidligere prosjekter om onkelen med glassøyet , sønnen som leker krig med en kamerat og dattera som krangler om å få Donald lese .",[0] -> [1] -> [2] -> [3]
"Fem år etter at han sendte den første mailen til moren dro han med filmteamet tilbake til Kina , til den lille landsbyen Zhang Jia Jie der han trolig mistet hukommelsen .","Fem år etter at han sendte den første mailen til moren dro han med filmteamet tilbake til Kina , til den lille landsbyen Zhang Jia Jie der han trolig hukommelsen mistet .",[0] -> [1] -> [2] -> [3]
Hun klarte seg i kaoset tross alt .,Hun seg klarte i kaoset tross alt .,[0] -> [1] -> [2] -> [3]
"Han var to minutter bak Koivuranta , men gikk et sterkt langrenn og endte til slutt som nummer seks .","Han var to minutter bak Koivuranta , men et sterkt langrenn gikk og endte til slutt som nummer seks .",[0] -> [1] -> [2] -> [3]
Samarbeidsregjeringen vil aktivt følge opp den inngåtte avtale med partene i arbeidslivet om tiltak for å redusere sykefraværet .,Samarbeidsregjeringen vil aktivt den inngåtte avtale med partene i arbeidslivet om tiltak for å redusere sykefraværet følge opp .,[0] -> [1] -> [2] -> [3]
"Hadde jeg visst det hadde jeg tatt en prat med andre familiemedlemmer , for å komme til gode avtaler .","Hadde jeg det visst hadde jeg tatt en prat med andre familiemedlemmer , for å komme til gode avtaler .",[0] -> [1] -> [2] -> [3]
"Koreanere tar seg gjerne en drink og er nesten inne på topp-ti listen over årlig alkoholkonsum i verden , hvor Norge er nr. 74 , og du kan banne på at Gangnam fremdeles holder det gående når munkene begynner å spille trommer , for det er også "" Gangnam Style "" .","Koreanere en drink tar seg gjerne og er nesten inne på topp-ti listen over årlig alkoholkonsum i verden , hvor Norge er nr. 74 , og du kan banne på at Gangnam fremdeles holder det gående når munkene begynner å spille trommer , for det er også "" Gangnam Style "" .",[0] -> [1] -> [2] -> [3]
"Andre stemmer som er kritiske mot UDs satsing på kulturfeltet , spør seg om vellykket kunst , som ofte er tvetydig og utfordrende i sitt uttrykk , egner seg til å gi inntrykk av et fredselskende og progressivt folkeferd .","Andre stemmer som er kritiske mot UDs satsing på kulturfeltet , spør seg om vellykket kunst , som ofte er tvetydig og utfordrende i sitt uttrykk , egner seg til å inntrykk av et fredselskende og progressivt folkeferd gi .",[0] -> [1] -> [2] -> [3]
"I tider da Høyre maktet å overføre honnørordene valgfrihet , mangfold og ansvarlighet til en praktisk politikk som folk flest opplevde som forbedringer i egen hverdag , var partiet samfunnsledende .","I tider da Høyre maktet å honnørordene valgfrihet , mangfold og ansvarlighet overføre til en praktisk politikk som folk flest opplevde som forbedringer i egen hverdag , var partiet samfunnsledende .",[0] -> [1] -> [2] -> [3]
En stor andel av dem som er blitt tatt med GHB i Os er folk som ikke tilhører de vanlige rusbelastede miljøene .,En stor andel av dem som er blitt tatt med GHB i Os er folk som ikke de vanlige rusbelastede miljøene tilhører .,[0] -> [1] -> [2] -> [3]
Regjeringen vil videreføre arbeidet med å åpne for at Norge i framtiden kan dekke noe av sitt kraftbehov ved å produsere strøm av norsk gass .,Regjeringen vil videreføre arbeidet med å åpne for at Norge i framtiden kan dekke noe av sitt kraftbehov ved å strøm produsere av norsk gass .,[0] -> [1] -> [2] -> [3]
Tomheten og meningsløsheten fikk ham til å prøve å begå selvmord .,Tomheten og meningsløsheten ham fikk til å prøve å begå selvmord .,[0] -> [1] -> [2] -> [3]
Ap. får også lederverv i forsvarskomitéen og næringskomitéen .,Ap. lederverv i forsvarskomitéen og næringskomitéen får også .,[0] -> [1] -> [2] -> [3]
Det har også en enorm moralsk betydning hva kirken mener .,Det en enorm moralsk betydning har også hva kirken mener .,[0] -> [1] -> [2] -> [3]
Bedrifter og befolkning i alle deler av landet må få tilgang til bredbånd og de nye kommunikasjonskanalene .,Bedrifter og befolkning i alle deler av landet må tilgang til bredbånd og de nye kommunikasjonskanalene få .,[0] -> [1] -> [2] -> [3]
Eide gikk langt i å kritisere valget .,Eide gikk langt i å valget kritisere .,[0] -> [1] -> [2] -> [3]
- Faren er å skape noe likegyldig .,- Faren er å noe likegyldig skape .,[0] -> [1] -> [2] -> [3]
"Det virker relativt lite trolig at noe kan være en ekte kopi , at man kan tjene en liten formue eller at det kan ha en avkjølende effekt , for strupen , å drikke ildvann .","Det virker relativt lite trolig at noe kan være en ekte kopi , at man kan en liten formue tjene eller at det kan ha en avkjølende effekt , for strupen , å drikke ildvann .",[0] -> [1] -> [2] -> [3]
"I Gaza , som i Sri Lanka , ønsker folkevalgte regjeringer å knuse motstandsbevegelser som har brukt avskyelig terror , men som også har folkelig støtte .","I Gaza , som i Sri Lanka , ønsker folkevalgte regjeringer å motstandsbevegelser som har brukt avskyelig terror , men som også har folkelig støtte knuse .",[0] -> [1] -> [2] -> [3]
"Kombinasjonen av et tilnærmet urørt naturmiljø og naturlige økosystemer som samtidig er godt kartlagt , samt moderne infrastruktur , lett adgang og nærhet til sentrale deler av Europa gjør Svalbard spesielt godt egnet som referanseområde for forskning og miljøovervåking .","Kombinasjonen av et tilnærmet urørt naturmiljø og naturlige økosystemer som samtidig er godt kartlagt , samt moderne infrastruktur , lett adgang og nærhet til sentrale deler av Europa Svalbard gjør spesielt godt egnet som referanseområde for forskning og miljøovervåking .",[0] -> [1] -> [2] -> [3]
"- Kunstnere har også barn og hus og lån og bil , og trenger en god grunnøkonomi .","- Kunstnere barn og hus og lån og bil har også , og trenger en god grunnøkonomi .",[0] -> [1] -> [2] -> [3]
Enkelte ganger reiste han også inn til Bystasjonen og hentet ungdommer tilbake til Loddefjord .,Enkelte ganger reiste han også inn til Bystasjonen og ungdommer hentet tilbake til Loddefjord .,[0] -> [1] -> [2] -> [3]
- « Yttis » driblet seg innover langs 16-meteren og scoret med et hardt skudd .,- « Yttis » seg driblet innover langs 16-meteren og scoret med et hardt skudd .,[0] -> [1] -> [2] -> [3]
Det fikk ham til tilby dem historien på sine betingelser .,Det ham fikk til tilby dem historien på sine betingelser .,[0] -> [1] -> [2] -> [3]
"De kjøper jo også kvinnene , sier hun til avisa , og utdyper :","De kvinnene kjøper jo også , sier hun til avisa , og utdyper :",[0] -> [1] -> [2] -> [3]
"- Det er som om de lever i sin egen boble , og har framdyrket sitt eget svært feminine uttrykk .","- Det er som om de lever i sin egen boble , og har sitt eget svært feminine uttrykk framdyrket .",[0] -> [1] -> [2] -> [3]
- For å si det veldig enkelt .,- For å det si veldig enkelt .,[0] -> [1] -> [2] -> [3]
"Jeg har ikke dokumentasjon på at tallet stemmer , men at ganske mange av oss lever på en løgn , eller har blitt skapt på en annen måte enn det som er betraktet som normalt og innafor , det er jeg sikker på .","Jeg dokumentasjon på at tallet stemmer har ikke , men at ganske mange av oss lever på en løgn , eller har blitt skapt på en annen måte enn det som er betraktet som normalt og innafor , det er jeg sikker på .",[0] -> [1] -> [2] -> [3]
Og ingen politiske partier ser noen gevinst i å tvinge dem til å gjøre det .,Og ingen politiske partier ser noen gevinst i å tvinge dem til å det gjøre .,[0] -> [1] -> [2] -> [3]
"Men vi skal tydeligvis ha disse flyene , koste hva det koste vil .","Men vi skal tydeligvis disse flyene ha , koste hva det koste vil .",[0] -> [1] -> [2] -> [3]
Regjeringen vil føre en aktiv og positiv storbypolitikk .,Regjeringen vil en aktiv og positiv storbypolitikk føre .,[0] -> [1] -> [2] -> [3]
Han var raskest i semifinalen og tok sølv bak Dale Oen i VM i Shanghai .,Han var raskest i semifinalen og sølv tok bak Dale Oen i VM i Shanghai .,[0] -> [1] -> [2] -> [3]
Dere andre kan gjerne fortelle meg en vits eller en historie som inneholder MINST en hund og en høne ( hane er godkjent ) .,Dere andre kan gjerne fortelle meg en vits eller en historie som MINST en hund og en høne inneholder ( hane er godkjent ) .,[0] -> [1] -> [2] -> [3]
"Det er dette firmaet , som i likhet med Bringwell Norge er et datterselskap under Bringwell AB , som har importert Fortodol til Sverige .","Det er dette firmaet , som i likhet med Bringwell Norge er et datterselskap under Bringwell AB , som har Fortodol importert til Sverige .",[0] -> [1] -> [2] -> [3]
Kristin Halvorsen og undertegnede er enige om en ting ; klimaproblemet er alvorlig og vi trenger drastiske utslippsreduksjoner raskt .,Kristin Halvorsen og undertegnede er enige om en ting ; klimaproblemet er alvorlig og vi drastiske utslippsreduksjoner trenger raskt .,[0] -> [1] -> [2] -> [3]
Grunnen til at kunstinstitusjoner ikke klarer å skaffe mer private penger er fordi de ikke jobber hardt nok med det .,Grunnen til at kunstinstitusjoner ikke klarer å mer private penger skaffe er fordi de ikke jobber hardt nok med det .,[0] -> [1] -> [2] -> [3]
"Eidos gir fortsatt ut spill ved navn « Championship Manager » , men har aldri oppnådd samme suksess som Sports Interactives spillserie .","Eidos spill ved navn « Championship Manager » gir fortsatt ut , men har aldri oppnådd samme suksess som Sports Interactives spillserie .",[0] -> [1] -> [2] -> [3]
"Fremgangsmåten er enkel , det er bare å legge plata i sekken før du sender den gjennom røntgenmaskinen .","Fremgangsmåten er enkel , det er bare å plata legge i sekken før du sender den gjennom røntgenmaskinen .",[0] -> [1] -> [2] -> [3]
"Mitt hovedfokus er å ha en riksalarm som fungerer , som er forstått og som blir testet ut jevnlig , svarer ministeren .","Mitt hovedfokus er å en riksalarm som fungerer , som er forstått og som blir testet ut jevnlig ha , svarer ministeren .",[0] -> [1] -> [2] -> [3]
"- Dette er første gang Telenor har hatt en slik dramatisk hendelse , og derfor tror jeg konsumentene bare vil se på det som en hump i veien .","- Dette er første gang Telenor har en slik dramatisk hendelse hatt , og derfor tror jeg konsumentene bare vil se på det som en hump i veien .",[0] -> [1] -> [2] -> [3]
Hurum ble kritisert for å overselge funnet og for å gi uttalelser til mediene som det ikke var forskningsmessig dekning for .,Hurum ble kritisert for å overselge funnet og for å uttalelser som det ikke var forskningsmessig dekning for gi til mediene .,[0] -> [1] -> [2] -> [3]
Det suger krefter og tar veldig mye tid å leite etter alle disse tingene .,Det suger krefter og veldig mye tid tar å leite etter alle disse tingene .,[0] -> [1] -> [2] -> [3]
Vi mottar ikke et øre i statlig støtte .,Vi et øre mottar ikke i statlig støtte .,[0] -> [1] -> [2] -> [3]
"For andre kveld på rad skal 14 000 svensker stues sammen i kjempekula for å høre nasjonalsanger , bli pumpet fulle av reklame og se to av verdens beste hockeylag .","For andre kveld på rad skal 14 000 svensker stues sammen i kjempekula for å nasjonalsanger høre , bli pumpet fulle av reklame og se to av verdens beste hockeylag .",[0] -> [1] -> [2] -> [3]
"På disse områdene , til tross for at de beste nettavisene har skaffet seg egne sine kommentatorer ( nylig også tegnere ) , hersker fortsatt avisene suverent .","På disse områdene , til tross for at de beste nettavisene har egne sine kommentatorer skaffet seg ( nylig også tegnere ) , hersker fortsatt avisene suverent .",[0] -> [1] -> [2] -> [3]
Derfor vil han ikke uttale seg noe om aksjekursen .,Derfor vil han ikke seg uttale noe om aksjekursen .,[0] -> [1] -> [2] -> [3]
"Vedtaket har også nådd arbeidsminister Hanne Bjurstrøms bord , som varsler at departementet vil utrede muligheten for å lage en lov som sikrer deltidsansatte som systematisk jobber mye overtid rett på større stillinger .","Vedtaket har også nådd arbeidsminister Hanne Bjurstrøms bord , som varsler at departementet vil muligheten for å lage en lov som sikrer deltidsansatte som systematisk jobber mye overtid rett på større stillinger utrede .",[0] -> [1] -> [2] -> [3]
Utvalget fikk følgende mandat :,Utvalget følgende mandat fikk :,[0] -> [1] -> [2] -> [3]
Troms Kraft politianmeldte sitt svenske datterselskap Kraft & Kultur for manipulering med regnskapet .,Troms Kraft sitt svenske datterselskap Kraft & Kultur politianmeldte for manipulering med regnskapet .,[0] -> [1] -> [2] -> [3]
"Sannsynligvis finner du nærområdet ditt , du sjekker om huset ditt har riktig adresse , om veien går der den skal og om gangstien ligger riktig .","Sannsynligvis finner du nærområdet ditt , du sjekker om huset ditt riktig adresse har , om veien går der den skal og om gangstien ligger riktig .",[0] -> [1] -> [2] -> [3]
"Danmark , Sverige og Finland har alle tatt mangemilliardersløft i for sine kunnskapssektorer .","Danmark , Sverige og Finland har alle mangemilliardersløft tatt i for sine kunnskapssektorer .",[0] -> [1] -> [2] -> [3]
FA har gjort fint lite for å sparke ut homofobien .,FA har gjort fint lite for å homofobien sparke ut .,[0] -> [1] -> [2] -> [3]
- De færreste sønner ønsker sin egen far som fotballtrener .,- De færreste sønner sin egen far ønsker som fotballtrener .,[0] -> [1] -> [2] -> [3]
En av de fineste og mest interessante menneskene jeg har fått gleden av å møte .,En av de fineste og mest interessante menneskene jeg har gleden av å møte fått .,[0] -> [1] -> [2] -> [3]
I Nordland IV skal det ikke igangsettes petroleumsvirksomhet i perioden .,I Nordland IV skal det ikke petroleumsvirksomhet igangsettes i perioden .,[0] -> [1] -> [2] -> [3]
"Ut fra Riksantikvarens beregninger bevilges det i dag 3 mrd. kroner for lite til istandsetting , og vel 100 mill. kroner mangler til årlig vedlikehold .","Ut fra Riksantikvarens beregninger 3 mrd. kroner for lite bevilges det i dag til istandsetting , og vel 100 mill. kroner mangler til årlig vedlikehold .",[0] -> [1] -> [2] -> [3]
"Normene for prosatekster har selvsagt også endret seg , men på en måte som ikke har fjernet seg like mye fra leserne .","Normene for prosatekster har selvsagt også seg endret , men på en måte som ikke har fjernet seg like mye fra leserne .",[0] -> [1] -> [2] -> [3]
"1. desember var det 85 år siden Lars Christensen og den første "" Norvegia "" -ekspedisjonen plantet det norske flagget og erklærte øya for norsk territorium .","1. desember var det 85 år siden Lars Christensen og den første "" Norvegia "" -ekspedisjonen plantet det norske flagget og øya erklærte for norsk territorium .",[0] -> [1] -> [2] -> [3]
"Både Marokko , som okkuperer Vest Sahara , og frigjøringsbevegelsen Polisario ønsket megleren velkommen .","Både Marokko , som Vest Sahara okkuperer , og frigjøringsbevegelsen Polisario ønsket megleren velkommen .",[0] -> [1] -> [2] -> [3]
"Etter å ha fått laget i stand noe , kjørte vi seks mil til neste prøve .","Etter å ha fått noe laget i stand , kjørte vi seks mil til neste prøve .",[0] -> [1] -> [2] -> [3]
"3D-kampmotor i managerspill er på ingen måte en stor nyhet , både « Championship Manager » serien til Eidos og Fifa Manager har hatt slike spillmotorer .","3D-kampmotor i managerspill er på ingen måte en stor nyhet , både « Championship Manager » serien til Eidos og Fifa Manager har slike spillmotorer hatt .",[0] -> [1] -> [2] -> [3]
"Disse må foreligge på et tidspunkt som gjør det mulig at det , i Stortinget , kan fremsettes grunnlovsforslag innenfor den fristen som gjelder for slike forslag inneværende stortingsperiode .","Disse må foreligge på et tidspunkt som gjør det mulig at det , i Stortinget , kan grunnlovsforslag fremsettes innenfor den fristen som gjelder for slike forslag inneværende stortingsperiode .",[0] -> [1] -> [2] -> [3]
"CNN mener det er for tidlig å kåre en vinner i Wisconsin , mens NBC og CBS allerede har erklært Obama som sannsynlig vinner av midtveststaten .","CNN mener det er for tidlig å en vinner i Wisconsin kåre , mens NBC og CBS allerede har erklært Obama som sannsynlig vinner av midtveststaten .",[0] -> [1] -> [2] -> [3]
Solveig Garnæs tok hånd om formidlingsarbeidet og hadde mye den samme rollen som Djuvik .,Solveig Garnæs hånd om formidlingsarbeidet tok og hadde mye den samme rollen som Djuvik .,[0] -> [1] -> [2] -> [3]
"Tajik er naturligvis intelligent nok til ikke å følge i Khans fotspor , og da bør hun strekke seg noe mer for å markere seg i minoritetsmiljøene - selv om hun har et vesentlig poeng når hun i VG sier at hun skal være en politiker for alle .","Tajik er naturligvis intelligent nok til ikke å følge i Khans fotspor , og da bør hun strekke seg noe mer for å seg markere i minoritetsmiljøene - selv om hun har et vesentlig poeng når hun i VG sier at hun skal være en politiker for alle .",[0] -> [1] -> [2] -> [3]
"Men tanken på å bruke kunst og kulturuttrykk til å selge noe som helst , for eksempel et land , vekker skepsis hos mange .","Men tanken på å bruke kunst og kulturuttrykk til å noe som helst , for eksempel et land selge , vekker skepsis hos mange .",[0] -> [1] -> [2] -> [3]
I tillegg til ytre etater under Miljøverndepartementet har ytre etater underlagt andre departementer også ansvar for visse spørsmål som har betydning for natur- og kulturmiljøet .,I tillegg til ytre etater under Miljøverndepartementet har ytre etater underlagt andre departementer også ansvar for visse spørsmål som betydning for natur- og kulturmiljøet har .,[0] -> [1] -> [2] -> [3]
Den berører cirka to prosent av elevene .,Den cirka to prosent av elevene berører .,[0] -> [1] -> [2] -> [3]
Jeg som politiker må legge forholdene til rette for en voksende næring .,Jeg som politiker må forholdene legge til rette for en voksende næring .,[0] -> [1] -> [2] -> [3]
Med den kjennelsen i hånd kan Obama-administrasjonen begynne å gi pålegg til store utslippere som ikke bruker best mulig teknologi .,Med den kjennelsen i hånd kan Obama-administrasjonen begynne å pålegg gi til store utslippere som ikke bruker best mulig teknologi .,[0] -> [1] -> [2] -> [3]
- Forsvaret i både inn- og utland bruker datasimulerte kampscenarioer nettopp for å trene opp kamprefleksene og for å slipe ned den naturlige motviljen mot å ta liv .,- Forsvaret i både inn- og utland bruker datasimulerte kampscenarioer nettopp for å trene opp kamprefleksene og for å slipe ned den naturlige motviljen mot å liv ta .,[0] -> [1] -> [2] -> [3]
"Jeg trenger å reise bort , ta en langhelg på fjellet , hvor jeg kan skape en ny tradisjon , sette meg på en liten høyde , og nyte en saftig vegetarburger , lese gamle nyheter og drikke tørr vin fra et plastglass .","Jeg trenger å reise bort , ta en langhelg på fjellet , hvor jeg kan skape en ny tradisjon , meg sette på en liten høyde , og nyte en saftig vegetarburger , lese gamle nyheter og drikke tørr vin fra et plastglass .",[0] -> [1] -> [2] -> [3]
Men kuppet skapte et vakuum som gjorde at tuaregene og deres islamistiske allierte kunne ta kontrollen over de nordligste to tredelene av landet .,Men kuppet skapte et vakuum som gjorde at tuaregene og deres islamistiske allierte kunne kontrollen over de nordligste to tredelene av landet ta .,[0] -> [1] -> [2] -> [3]
