sen_str,swapped_sen_str,leaf_rule
"Det er noe helt nytt at et relativt fattig land som Kina - inntekt pr. hode er en tiendedel av Norges - iverksetter strenge klimatiltak uten å vente på internasjonale krav , eller utsetter kravene til de kan brukes til en forhandlingsposisjon .","Det er noe helt nytt at et relativt fattig land som Kina - inntekt pr. hode er en tiendedel av Norges - iverksetter strenge klimatiltak uten å vente på internasjonale krav , eller kravene utsetter til de kan brukes til en forhandlingsposisjon .",[0] -> [1] -> [2] -> [3]
"- Det kunne hun , men anonyme meldinger må inneholde mer alvorlig informasjon før vi begynner med undersøkelser .","- kunne Det hun , men anonyme meldinger må inneholde mer alvorlig informasjon før vi begynner med undersøkelser .",[0] -> [1] -> [5]
- Det burde de .,- burde Det de .,[0] -> [1] -> [5]
"- Det kan jeg ikke kommentere , men det jeg kan si er at promillen var over det som er lovlig på sjøen .","- kan jeg ikke kommentere Det , men det jeg kan si er at promillen var over det som er lovlig på sjøen .",[0] -> [1] -> [5]
"- Det jeg vet ikke , sier Johansen .","- jeg vet Det ikke , sier Johansen .",[0] -> [1] -> [5]
"- Det gjør jeg , og ja , jeg har dårlig samvittighet når jeg flyr .","- gjør Det jeg , og ja , jeg har dårlig samvittighet når jeg flyr .",[0] -> [1] -> [5]
"- Det vet jeg ikke , sier finnen med et skuldertrekk .","- vet Det jeg ikke , sier finnen med et skuldertrekk .",[0] -> [1] -> [5]
"- Det gjør det , og vi må bare fortsette med det .","- gjør Det det , og vi må bare fortsette med det .",[0] -> [1] -> [5]
- Det vil jeg sterkt avvise .,- vil jeg sterkt avvise Det .,[0] -> [1] -> [5]
