sen_str,swapped_sen_str,leaf_rule
"Oczywiście , jeśli komisje i Wysoka Izba zaproponują lepsze rozwiązania niż minister finansów i rząd pana premiera Millera , to będziemy się z tego cieszyć , natomiast z pewnością będziemy argumentować przeciwko temu , żeby wdrażać gorsze rozwiązania niż te , które zaproponowali śmy .","Oczywiście , jeśli komisje i Wysoka Izba zaproponują lepsze rozwiązania niż minister finansów i rząd pana premiera Millera , to będziemy się z tego cieszyć , natomiast z pewnością będziemy argumentować przeciwko temu , żeby wdrażać gorsze rozwiązania niż te , zaproponowali które śmy .",[0] -> [1] -> [2] -> [8]
"Podczas imprezy plenerowej będzie można zobaczyć pokaz tresury psów policyjnych oraz przedstawienie dla dzieci , które wystawi teatr z Krakowa .","Podczas imprezy plenerowej będzie można zobaczyć pokaz tresury psów policyjnych oraz przedstawienie dla dzieci , wystawi które teatr z Krakowa .",[0] -> [1] -> [2] -> [8]
"Nieznajomy nazywał się Marek Czerwiński , historyk , podał Zofii wizytówkę , którą niezdarnie schowała do kieszeni fartucha , bo nie nawykła , żeby jej kto tak poważnie jak mężczyźnie tu ściskał rękę , a tam dawał wizytówkę , że czort wie , jak się zachować i co z tym papierkiem zrobić .","Nieznajomy nazywał się Marek Czerwiński , historyk , podał Zofii wizytówkę , niezdarnie schowała którą do kieszeni fartucha , bo nie nawykła , żeby jej kto tak poważnie jak mężczyźnie tu ściskał rękę , a tam dawał wizytówkę , że czort wie , jak się zachować i co z tym papierkiem zrobić .",[0] -> [1] -> [2] -> [8]
"Bądź kpiąca jak chcesz , ale Tony usłyszy każde słowo , które powiesz .","Bądź kpiąca jak chcesz , ale Tony usłyszy każde słowo , powiesz które .",[0] -> [1] -> [2] -> [8]
"A co do powtarzających się zarzutów kontynuacji i niedostatku zmian , powtórzę to , co już niejednokrotnie mówili śmy : Przyznajemy , że chcemy kontynuować stabilizowanie gospodarki , ograniczanie inflacji i przekształcanie niesprawnych struktur .","A co do powtarzających się zarzutów kontynuacji i niedostatku zmian , powtórzę to , już niejednokrotnie mówili co śmy : Przyznajemy , że chcemy kontynuować stabilizowanie gospodarki , ograniczanie inflacji i przekształcanie niesprawnych struktur .",[0] -> [1] -> [2] -> [8]
"Nieźle tam zarabia , ale niejednokrotnie chwali się drogimi rzeczami kupionymi za pieniądze , które syn tego pana zostawia na utrzymanie ojca .","Nieźle tam zarabia , ale niejednokrotnie chwali się drogimi rzeczami kupionymi za pieniądze , syn tego pana zostawia które na utrzymanie ojca .",[0] -> [1] -> [2] -> [8]
"Prezydent był zainteresowany ocenami , które przedstawiał Wojciech Olejniczak - relacjonuje spotkanie Szmajdziński .","Prezydent był zainteresowany ocenami , przedstawiał które Wojciech Olejniczak - relacjonuje spotkanie Szmajdziński .",[0] -> [1] -> [2] -> [8]
"Mówił mu o rzeczach , których Zygmunt nie rozumiał .","Mówił mu o rzeczach , Zygmunt nie rozumiał których .",[0] -> [1] -> [2] -> [8]
"Popieram wnioski sprawozdawcy dotyczące reorganizacji Parlamentu Europejskiego i mam nadzieję , że ustalenia grupy roboczej do spraw reformy parlamentarnej odzwierciedlą rozszerzoną rolę Parlamentu , jaką przewidziano w traktacie .","Popieram wnioski sprawozdawcy dotyczące reorganizacji Parlamentu Europejskiego i mam nadzieję , że ustalenia grupy roboczej do spraw reformy parlamentarnej odzwierciedlą rozszerzoną rolę Parlamentu , przewidziano jaką w traktacie .",[0] -> [1] -> [2] -> [8]
"W czasach Demokryta panował jeszcze inny pogląd na nicość materialną , który nazwę potocznym .","W czasach Demokryta panował jeszcze inny pogląd na nicość materialną , nazwę który potocznym .",[0] -> [1] -> [2] -> [8]
"Po pierwsze - to co stworzył em jest wynikiem spisywania tego , co posiadam ( wykaz nie jest więc kompletny ) , po drugie - wchodząc na sajta tego uważającego , że plagiatuję , widać , że części utworów , które zawarł on nie mam ja i wielu zawartych przeze mnie nie ma on .","Po pierwsze - to co stworzył em jest wynikiem spisywania tego , posiadam co ( wykaz nie jest więc kompletny ) , po drugie - wchodząc na sajta tego uważającego , że plagiatuję , widać , że części utworów , które zawarł on nie mam ja i wielu zawartych przeze mnie nie ma on .",[0] -> [1] -> [2] -> [8]
"Wymień jedną rzecz , którą republikanie uczynili dla czarnych .","Wymień jedną rzecz , republikanie uczynili którą dla czarnych .",[0] -> [1] -> [2] -> [8]
"Pracownik nie może wyrażać w pracy , którą wykonuje , swoich możliwości , możliwości i swojej osobowości .","Pracownik nie może wyrażać w pracy , wykonuje którą , swoich możliwości , możliwości i swojej osobowości .",[0] -> [1] -> [2] -> [8]
"Nie jest to zaleta , którą można by w dniu jubileuszu pominąć .","Nie jest to zaleta , można by w dniu jubileuszu pominąć którą .",[0] -> [1] -> [2] -> [8]
"Program zaktualizuje swoje ustawienia , sprawdzi dysk pod względem zgodności udostępnionych danych , które wcześniej zaznaczyli śmy , co może zająć trochę czasu .","Program zaktualizuje swoje ustawienia , sprawdzi dysk pod względem zgodności udostępnionych danych , wcześniej zaznaczyli które śmy , co może zająć trochę czasu .",[0] -> [1] -> [2] -> [8]
"Ksiądz Suryn nie pijał nigdy gorącego wina , ale miał zasadę ewangeliczną , aby pić i jeść wszystko , co przed nim postawią , chlipnął więc nieco polewki ze dzbanka i złamawszy placek podpłomykowy , ostrożnie podniósł do drżących ust kawałek .","Ksiądz Suryn nie pijał nigdy gorącego wina , ale miał zasadę ewangeliczną , aby pić i jeść wszystko , przed nim postawią co , chlipnął więc nieco polewki ze dzbanka i złamawszy placek podpłomykowy , ostrożnie podniósł do drżących ust kawałek .",[0] -> [1] -> [2] -> [8]
"Dla nas jednakże to odkrycie jest fascynującym dowodem na poparcie niekonwencjonalnej teorii ewolucji komórek , którą opublikowano po raz pierwszy 16 lat temu . ""","Dla nas jednakże to odkrycie jest fascynującym dowodem na poparcie niekonwencjonalnej teorii ewolucji komórek , opublikowano którą po raz pierwszy 16 lat temu . """,[0] -> [1] -> [2] -> [8]
"Prawo określa kilka warunków , których spełnienie mogło by przywrócić porozumienie : USA musiały by wycofać wszystkie swoje oddziały z krajów , które weszły do NATO po 2000 r . , wycofać wszelkie sankcje przeciwko Rosji oraz zwrócić koszty poniesione w wyniku sankcji .","Prawo określa kilka warunków , spełnienie których mogło by przywrócić porozumienie : USA musiały by wycofać wszystkie swoje oddziały z krajów , które weszły do NATO po 2000 r . , wycofać wszelkie sankcje przeciwko Rosji oraz zwrócić koszty poniesione w wyniku sankcji .",[0] -> [1] -> [2] -> [8]
"Doktor zauważył je i spojrzawszy na córkę przelotnie , sięgnął po pismo , które przed chwilą przeglądał , widocznie uznał rozmowę za skończoną .","Doktor zauważył je i spojrzawszy na córkę przelotnie , sięgnął po pismo , przed chwilą przeglądał które , widocznie uznał rozmowę za skończoną .",[0] -> [1] -> [2] -> [8]
"Sztuką nie była natomiast poezja , którą uważano nie za dziedzinę umiejętności , ale natchnienia .","Sztuką nie była natomiast poezja , uważano którą nie za dziedzinę umiejętności , ale natchnienia .",[0] -> [1] -> [2] -> [8]
"To , co ona mówi i robi – to jest właściwie niewiarygodne .","To , ona mówi co i robi – to jest właściwie niewiarygodne .",[0] -> [1] -> [2] -> [8]
"Po wpadce w Oświęcimiu widać było , że piłkarze Janiny chcą zmazać plamę na piłkarskim honorze , jaką pozostawił ich występ w meczu z Sołą .","Po wpadce w Oświęcimiu widać było , że piłkarze Janiny chcą zmazać plamę na piłkarskim honorze , pozostawił jaką ich występ w meczu z Sołą .",[0] -> [1] -> [2] -> [8]
"W ciągu następnych czterech lat konsulowie europejscy depeszowali z Kairu niedokładne wiadomości o rzeziach , jakich oddziały muzułmańskie dokonywały na ciemnoskórej ludności Sudanu .","W ciągu następnych czterech lat konsulowie europejscy depeszowali z Kairu niedokładne wiadomości o rzeziach , oddziały muzułmańskie dokonywały jakich na ciemnoskórej ludności Sudanu .",[0] -> [1] -> [2] -> [8]
"Ta antynomia uprzytamnia trudności , jakie znajdujemy , starając się zrekonstruować zamysł skryty w tradycji wielokulturowego pogranicza .","Ta antynomia uprzytamnia trudności , znajdujemy jakie , starając się zrekonstruować zamysł skryty w tradycji wielokulturowego pogranicza .",[0] -> [1] -> [2] -> [8]
"- Czy da pan również swoje słowo , iż wszystko to , co naopowiadał pan o duchach , jest prawdą ?","- Czy da pan również swoje słowo , iż wszystko to , naopowiadał co pan o duchach , jest prawdą ?",[0] -> [1] -> [2] -> [8]
"Odkrycie , którego dokonała , nie powinno było jej do tego stopnia porazić , a jednak tak się stało : czuła , że coś się zawala , zapada , że do jej wszystkich ciężarów na sercu dokłada się jeszcze jeden , wcale nie mniejszy , ciężar jakiegoś zawodu i smutku , i świadomości , że z jej przyjaźni z Teresą także będą nici .","Odkrycie , dokonała którego , nie powinno było jej do tego stopnia porazić , a jednak tak się stało : czuła , że coś się zawala , zapada , że do jej wszystkich ciężarów na sercu dokłada się jeszcze jeden , wcale nie mniejszy , ciężar jakiegoś zawodu i smutku , i świadomości , że z jej przyjaźni z Teresą także będą nici .",[0] -> [1] -> [2] -> [8]
"– To nie jest prawo , to jest obowiązek uczciwego autora , sztuki nie można kodyfikować , jest ona aktem zbrodni i kary , którą wymierza każdy z odbiorców z osobna .","– To nie jest prawo , to jest obowiązek uczciwego autora , sztuki nie można kodyfikować , jest ona aktem zbrodni i kary , wymierza którą każdy z odbiorców z osobna .",[0] -> [1] -> [2] -> [8]
"Taksówka pojechała do magazynu w pobliżu doków , który Brasi na ten cel przygotował .","Taksówka pojechała do magazynu w pobliżu doków , Brasi na ten cel przygotował który .",[0] -> [1] -> [2] -> [8]
"Niemcy rzeczywiście go uwięzili podczas wojny , ale za kradzież świni , którą buchnął sąsiadowi .","Niemcy rzeczywiście go uwięzili podczas wojny , ale za kradzież świni , buchnął którą sąsiadowi .",[0] -> [1] -> [2] -> [8]
"Okazało się , że radiowego reportera wprowadził na salę socjalistyczny polityk József Sipos , którego natychmiast wyrzucono z partii .","Okazało się , że radiowego reportera wprowadził na salę socjalistyczny polityk József Sipos , natychmiast wyrzucono którego z partii .",[0] -> [1] -> [2] -> [8]
"Najlepiej jak umiesz , oddajesz się licznym i trochę nudnym obowiązkom , jakie nakłada na ciebie ta sytuacja , ale czasem czujesz się zmęczona swą rolą .","Najlepiej jak umiesz , oddajesz się licznym i trochę nudnym obowiązkom , nakłada jakie na ciebie ta sytuacja , ale czasem czujesz się zmęczona swą rolą .",[0] -> [1] -> [2] -> [8]
Nie wyglądasz jak ludzie których Griggs przysyłał tu wcześniej,Nie wyglądasz jak ludzie Griggs przysyłał których tu wcześniej,[0] -> [1] -> [2] -> [8]
"Jako pierwsza w lipcu zeszłego roku wystartowała witryna windykacja.pl , którą prowadzi wrocławska spółka Narodowa Centrala Windykacji .","Jako pierwsza w lipcu zeszłego roku wystartowała witryna windykacja.pl , prowadzi którą wrocławska spółka Narodowa Centrala Windykacji .",[0] -> [1] -> [2] -> [8]
"Hemmings zdjął okulary , które służyły mu do patrzenia na dalsze odległości , i umiejętnie dozując napięcie dramatyczne , zamienił je w futerale z tymi do czytania , które nasadził na nos .","Hemmings zdjął okulary , które służyły mu do patrzenia na dalsze odległości , i umiejętnie dozując napięcie dramatyczne , zamienił je w futerale z tymi do czytania , nasadził które na nos .",[0] -> [1] -> [2] -> [8]
"To pierwszy ptak , jakiego tu widzę .","To pierwszy ptak , tu widzę jakiego .",[0] -> [1] -> [2] -> [8]
"Nie musi znać tekstu , bo na kredensie , na stole , na krześle ma przypięte kartki z dialogami , których kamera nie widzi .","Nie musi znać tekstu , bo na kredensie , na stole , na krześle ma przypięte kartki z dialogami , kamera nie widzi których .",[0] -> [1] -> [2] -> [8]
"Teraz Jasienica będzie musiała usunąć część wodociągu , który bezprawnie postawiła na prywatnej ziemi Pałuchy .","Teraz Jasienica będzie musiała usunąć część wodociągu , bezprawnie postawiła który na prywatnej ziemi Pałuchy .",[0] -> [1] -> [2] -> [8]
"Grzegorza oburzało to , co postrzegał jako ich słabą moralność .","Grzegorza oburzało to , postrzegał co jako ich słabą moralność .",[0] -> [1] -> [2] -> [8]
"To alibi , które wymyślili dla siebie kurwiarze !","To alibi , wymyślili które dla siebie kurwiarze !",[0] -> [1] -> [2] -> [8]
"W takich przypadkach państwo bandery przekazuje Komisji dane szczegółowe dotyczące działań , jakie podjęło w tej sprawie .","W takich przypadkach państwo bandery przekazuje Komisji dane szczegółowe dotyczące działań , podjęło jakie w tej sprawie .",[0] -> [1] -> [2] -> [8]
"Bez pokojowego i efektywnego wykorzystania kosmosu niemożliwe by były nasze gospodarki , systemy transportowe i metrologiczne oraz styl życia , jakie wiedziemy .","Bez pokojowego i efektywnego wykorzystania kosmosu niemożliwe by były nasze gospodarki , systemy transportowe i metrologiczne oraz styl życia , wiedziemy jakie .",[0] -> [1] -> [2] -> [8]
"Zdecydował o tym z pewnością splot wielu elementów : mojej lirycznej stylistyki , specyficznego "" brzmienia powyżej ciszy "" , jakie w ECM kreował producent Manfred Eicher , ale także dość zgodnej - jak na jazz - akceptacji słuchaczy .","Zdecydował o tym z pewnością splot wielu elementów : mojej lirycznej stylistyki , specyficznego "" brzmienia powyżej ciszy "" , w ECM kreował jakie producent Manfred Eicher , ale także dość zgodnej - jak na jazz - akceptacji słuchaczy .",[0] -> [1] -> [2] -> [8]
"Produkty na bieżąco sortują się według tych parametrów , jakie wybrał klient – dlatego tak ważne jest szczegółowe sprecyzowanie własnych potrzeb .","Produkty na bieżąco sortują się według tych parametrów , wybrał jakie klient – dlatego tak ważne jest szczegółowe sprecyzowanie własnych potrzeb .",[0] -> [1] -> [2] -> [8]
"Sąd potwierdził wszystkie priorytety , jakie przyjęli śmy .","Sąd potwierdził wszystkie priorytety , przyjęli jakie śmy .",[0] -> [1] -> [2] -> [8]
"- Od postawy , jaką wykaże w tym czasie ksiądz Jankowski , będzie zależało , czy nadal pozostanie proboszczem tego kościoła - powiedział arcybiskup .","- Od postawy , wykaże jaką w tym czasie ksiądz Jankowski , będzie zależało , czy nadal pozostanie proboszczem tego kościoła - powiedział arcybiskup .",[0] -> [1] -> [2] -> [8]
"W wersji Procesu , którą prawie dwadzieścia lat po śmierci Franza Kafki ogłosił Albert Camus , rzeczywistość wydaje się bardziej wiarygodna , mniej oniryczna , ale równie absurdalna .","W wersji Procesu , prawie dwadzieścia lat po śmierci Franza Kafki ogłosił którą Albert Camus , rzeczywistość wydaje się bardziej wiarygodna , mniej oniryczna , ale równie absurdalna .",[0] -> [1] -> [2] -> [8]
"Fundacja dla Zwierząt "" Animalia "" została założona w 2005 r . w Poznaniu przez kilkoro ludzi , których połączyła chęć pomocy bezdomnym zwierzętom .","Fundacja dla Zwierząt "" Animalia "" została założona w 2005 r . w Poznaniu przez kilkoro ludzi , połączyła których chęć pomocy bezdomnym zwierzętom .",[0] -> [1] -> [2] -> [8]
"Dzisiaj również debatuje się o tym , aby z uwagi na bardzo trudny rok 2003 , jaki przewiduje się dla polskiego rolnictwa , można było wystąpić o zaliczkowanie wypłat bezpośrednich .","Dzisiaj również debatuje się o tym , aby z uwagi na bardzo trudny rok 2003 , przewiduje jaki się dla polskiego rolnictwa , można było wystąpić o zaliczkowanie wypłat bezpośrednich .",[0] -> [1] -> [2] -> [8]
"Całą sobą obrażać zasady , które wyznaje prosty tutejszy lud .","Całą sobą obrażać zasady , wyznaje które prosty tutejszy lud .",[0] -> [1] -> [2] -> [8]
"Szczególnie kobiety wylegają wtedy z domów , spotykają się i debatują na temat nowinek , które usłyszały .","Szczególnie kobiety wylegają wtedy z domów , spotykają się i debatują na temat nowinek , usłyszały które .",[0] -> [1] -> [2] -> [8]
"W świetle takiego stanu rzeczy prezydencja uważa , że Rada powinna przyjąć konkluzje w sprawie przedmiotowej inicjatywy dotyczącej wspólnego planowania w oparciu o tekst , który przedłożyła Komisja .","W świetle takiego stanu rzeczy prezydencja uważa , że Rada powinna przyjąć konkluzje w sprawie przedmiotowej inicjatywy dotyczącej wspólnego planowania w oparciu o tekst , przedłożyła który Komisja .",[0] -> [1] -> [2] -> [8]
"Nie zawsze mamy możliwość dokonania takiego eksperymentu w całości , ale nawet ograniczenie się do gry wyobraźni i zadanie sobie pytania : co by m zrobił , gdyby m miał przed sobą rok życia , a następnie zapisanie tego , co serce dyktuje , mogło by się stać okazją do sprawdzenia , czy potrzebne są nam jakieś zmiany w bieżącym życiu .","Nie zawsze mamy możliwość dokonania takiego eksperymentu w całości , ale nawet ograniczenie się do gry wyobraźni i zadanie sobie pytania : co by m zrobił , gdyby m miał przed sobą rok życia , a następnie zapisanie tego , serce dyktuje co , mogło by się stać okazją do sprawdzenia , czy potrzebne są nam jakieś zmiany w bieżącym życiu .",[0] -> [1] -> [2] -> [8]
"Dożywiają się tym , co przynoszą im rodziny .","Dożywiają się tym , przynoszą co im rodziny .",[0] -> [1] -> [2] -> [8]
"Spojrzała na niego z ulotnym zainteresowaniem , właściwie bez zainteresowania , jakby był ciemną , romantyczną zjawą wynurzającą się z odmętów tej letniej nocy , że zapomniał języka w gębie i bezmyślnie gapił się na jej słynny biust , na słynne blond włosy rozpłomienione warszawskim splinem , na tę estradową panterę opiętą kolorowo zawrotną spódnicą i kolorowymi tekstami jeszcze bardziej zawrotnych piosenek Agnieszki Osieckiej , choć Lakis już coś tam bajerował o międzyludzkich fluidach , które wydzielają te cudowne piosenki przy słuchaniu i śpiewaniu .","Spojrzała na niego z ulotnym zainteresowaniem , właściwie bez zainteresowania , jakby był ciemną , romantyczną zjawą wynurzającą się z odmętów tej letniej nocy , że zapomniał języka w gębie i bezmyślnie gapił się na jej słynny biust , na słynne blond włosy rozpłomienione warszawskim splinem , na tę estradową panterę opiętą kolorowo zawrotną spódnicą i kolorowymi tekstami jeszcze bardziej zawrotnych piosenek Agnieszki Osieckiej , choć Lakis już coś tam bajerował o międzyludzkich fluidach , wydzielają które te cudowne piosenki przy słuchaniu i śpiewaniu .",[0] -> [1] -> [2] -> [8]
Uświadomił em go czym jest atak osobisty i że kończy się on blokadą niezależnie od tego kogo dotyka i kto ma rację w sporze .,Uświadomił em go czym jest atak osobisty i że kończy się on blokadą niezależnie od tego dotyka kogo i kto ma rację w sporze .,[0] -> [1] -> [2] -> [8]
"Dratewkę pani Joasia wyrwała z bestialskich łap pewnego szewca , którego niech piekło pochłonie .","Dratewkę pani Joasia wyrwała z bestialskich łap pewnego szewca , niech piekło pochłonie którego .",[0] -> [1] -> [2] -> [8]
"W 2010 r . fundacja wydała złożoną zecersko wersję „ Zettel’s Traum ” , bardziej przystępną dla tych , których zniechęcała przypominająca brudnopis kopia offsetowa .","W 2010 r . fundacja wydała złożoną zecersko wersję „ Zettel’s Traum ” , bardziej przystępną dla tych , zniechęcała których przypominająca brudnopis kopia offsetowa .",[0] -> [1] -> [2] -> [8]
"H . S . : Prezydent powinien podpisać te nominacje , których do tej pory nie podpisał ?","H . S . : Prezydent powinien podpisać te nominacje , do tej pory nie podpisał których ?",[0] -> [1] -> [2] -> [8]
"Jednakże tym , czego nadal nie uzyskano jest rzeczywista zmiana postawy wszystkich zainteresowanych stron : twórców polityki , przedsiębiorstw oraz ogółu społeczeństwa .","Jednakże tym , nadal nie uzyskano czego jest rzeczywista zmiana postawy wszystkich zainteresowanych stron : twórców polityki , przedsiębiorstw oraz ogółu społeczeństwa .",[0] -> [1] -> [2] -> [8]
"I dziękuję za to , co zrobił eś dla mojego synka .","I dziękuję za to , zrobił co eś dla mojego synka .",[0] -> [1] -> [2] -> [8]
"Cezury te są szalenie płynne – zależą od tego , kto , jak i ile razy książkę czytał i czego w niej szukał – toteż upierać się nie będę , sam ciekaw tego , co następnym razem odczytam .","Cezury te są szalenie płynne – zależą od tego , kto , jak i ile razy książkę czytał i w niej szukał czego – toteż upierać się nie będę , sam ciekaw tego , co następnym razem odczytam .",[0] -> [1] -> [2] -> [8]
"Hall o tej godzinie był pusty - jedynie portier , gruby , majestatyczny pan w brązowym uniformie ze złoconymi naszywkami , siedział w swej loży i pił czarną kawę , którą mu Roman przed kwadransem przyniósł .","Hall o tej godzinie był pusty - jedynie portier , gruby , majestatyczny pan w brązowym uniformie ze złoconymi naszywkami , siedział w swej loży i pił czarną kawę , mu Roman przed kwadransem przyniósł którą .",[0] -> [1] -> [2] -> [8]
"Produkty nawet niezłe , system pracy sieciowy - zarabiasz na tym co sprzedał eś plus procent z zarobków ludzi których zwerbował eś .","Produkty nawet niezłe , system pracy sieciowy - zarabiasz na tym co sprzedał eś plus procent z zarobków ludzi zwerbował których eś .",[0] -> [1] -> [2] -> [8]
"Sobotnie zawody rozpoczną się treningami , które zaplanowano na godzinę 9.00 .","Sobotnie zawody rozpoczną się treningami , zaplanowano które na godzinę 9.00 .",[0] -> [1] -> [2] -> [8]
"- I to wszystko , co pan odnalazł ? - zapytał Stelmach .","- I to wszystko , pan odnalazł co ? - zapytał Stelmach .",[0] -> [1] -> [2] -> [8]
"Teraz ona udusiła inne dziecko - Madzię , którą najprawdopodobniej porwała spod szkoły .","Teraz ona udusiła inne dziecko - Madzię , najprawdopodobniej porwała którą spod szkoły .",[0] -> [1] -> [2] -> [8]
"Zaczyna opowiadać o swoim synu , którego też wychowują same kobiety : - Widać , że brak mu chłopa , ale to ode mnie zależy , jakiego tatuśka mu wybiorę .","Zaczyna opowiadać o swoim synu , wychowują którego też same kobiety : - Widać , że brak mu chłopa , ale to ode mnie zależy , jakiego tatuśka mu wybiorę .",[0] -> [1] -> [2] -> [8]
"Dyrektor wymienia imprezy , które zorganizował .","Dyrektor wymienia imprezy , zorganizował które .",[0] -> [1] -> [2] -> [8]
"Ma to związek z jednym z nielicznych budynków w centrum miasta , które ominęło zniszczenie pod koniec II wojny światowej .","Ma to związek z jednym z nielicznych budynków w centrum miasta , ominęło które zniszczenie pod koniec II wojny światowej .",[0] -> [1] -> [2] -> [8]
"Jego zachowanie zupełnie nie przystaje do pięknego i kolorowego planu waszego związku i wspólnej przyszłości , jaki pieściła ś w głowie w trakcie podróży służbowych i długich kąpieli w wannie pełnej pachnącej fiołkami piany .","Jego zachowanie zupełnie nie przystaje do pięknego i kolorowego planu waszego związku i wspólnej przyszłości , pieściła jaki ś w głowie w trakcie podróży służbowych i długich kąpieli w wannie pełnej pachnącej fiołkami piany .",[0] -> [1] -> [2] -> [8]
"Drzemała w nim wielka pasja społecznikowska , którą realizował , ucząc wiejskie dzieci matematyki .","Drzemała w nim wielka pasja społecznikowska , realizował którą , ucząc wiejskie dzieci matematyki .",[0] -> [1] -> [2] -> [8]
"To , że muzyka nie potrafi sprecyzować i skonkretyzować konotacji , jakie wzbudza [ . . . ] umożliwia [ . . . ] wyrażenie tego , co można by było nazwać bezcielesną istotą mitu , esencją przeżyć centralnych i niezbędnych dla egzystencji ludzkiej .","To , że muzyka nie potrafi sprecyzować i skonkretyzować konotacji , wzbudza jakie [ . . . ] umożliwia [ . . . ] wyrażenie tego , co można by było nazwać bezcielesną istotą mitu , esencją przeżyć centralnych i niezbędnych dla egzystencji ludzkiej .",[0] -> [1] -> [2] -> [8]
"Nurkowa zapewniała , że leki , które zlecił , są podawane .","Nurkowa zapewniała , że leki , zlecił które , są podawane .",[0] -> [1] -> [2] -> [8]
"Ile w tym , co robimy , jest z nas , a ile z wydumanego , nieosiągalnego ideału ?","Ile w tym , robimy co , jest z nas , a ile z wydumanego , nieosiągalnego ideału ?",[0] -> [1] -> [2] -> [8]
"- Każdy pracuje z ludźmi , których zna i do których ma zaufanie - uważa minister Borowski .","- Każdy pracuje z ludźmi , zna których i do których ma zaufanie - uważa minister Borowski .",[0] -> [1] -> [2] -> [8]
"Ponadto wdrażanie zostało opóźnione o rok w porównaniu z tym , co zdecydowała Komisja Ochrony Środowiska Naturalnego Parlamentu .","Ponadto wdrażanie zostało opóźnione o rok w porównaniu z tym , zdecydowała co Komisja Ochrony Środowiska Naturalnego Parlamentu .",[0] -> [1] -> [2] -> [8]
