sen_str,swapped_sen_str,leaf_rule
"Ciągano jakiegoś nieszczęśnika po mrocznych pomieszczeniach , chcąc mu wytoczyć proces za czyny , których nie popełnił .","Ciągano jakiegoś nieszczęśnika po mrocznych pomieszczeniach , chcąc mu wytoczyć proces za czyny , nie popełnił których .",[0] -> [1] -> [2] -> [8]
"Zupełnie tak , jakby śmy oprowadzani przez przewodnika w obcym mieście usłyszeli nagle : "" Oto , proszę państwa , najpiękniejsze więzienie , jakie kiedykolwiek zbudowano w naszym mieście , a być może nawet w całej Europie "" .","Zupełnie tak , jakby śmy oprowadzani przez przewodnika w obcym mieście usłyszeli nagle : "" Oto , proszę państwa , najpiękniejsze więzienie , kiedykolwiek zbudowano jakie w naszym mieście , a być może nawet w całej Europie "" .",[0] -> [1] -> [2] -> [8]
"Najlepszym tego dowodem zdjęcie młodego rowerzysty , którego w obiektywie aparatu uchwycili śmy w ubiegły piątek .","Najlepszym tego dowodem zdjęcie młodego rowerzysty , w obiektywie aparatu uchwycili którego śmy w ubiegły piątek .",[0] -> [1] -> [2] -> [8]
"Ryszard Kalisz ( 49 l . ) kreślił wczoraj czarny scenariusz funkcjonowania instytucji , którą określał mianem "" policji politycznej "" , "" zbrojnej formacji "" , posuwając się nawet do stwierdzeń , że może ona zagrażać demokracji .","Ryszard Kalisz ( 49 l . ) kreślił wczoraj czarny scenariusz funkcjonowania instytucji , określał którą mianem "" policji politycznej "" , "" zbrojnej formacji "" , posuwając się nawet do stwierdzeń , że może ona zagrażać demokracji .",[0] -> [1] -> [2] -> [8]
"W fotelu ubrany w zieloną bonżurkę , tę samą , co kiedyś kupiła mu Marta - siedzi ON wpatrzony w kolorowy ekran .","W fotelu ubrany w zieloną bonżurkę , tę samą , kiedyś kupiła co mu Marta - siedzi ON wpatrzony w kolorowy ekran .",[0] -> [1] -> [2] -> [8]
"Dyrektor wymienia imprezy , które zorganizował .","Dyrektor wymienia imprezy , zorganizował które .",[0] -> [1] -> [2] -> [8]
"Robić to , co robię na scenie .","Robić to , robię co na scenie .",[0] -> [1] -> [2] -> [8]
"Każdy członek jest uprawniony do oddania liczby głosów , jaką posiada i nie może dzielić swych głosów .","Każdy członek jest uprawniony do oddania liczby głosów , posiada jaką i nie może dzielić swych głosów .",[0] -> [1] -> [2] -> [8]
"- Nie rozumiem przychodni , które biadolą , że nie mogą się utrzymać z pieniędzy , jakie daje im Fundusz - mówi dr Jakub Mowiński , właściciel sieci firmy Medical z Tczewa , która prowadzi w rejonie trzy przychodnie i Centrum Rehabilitacji .","- Nie rozumiem przychodni , które biadolą , że nie mogą się utrzymać z pieniędzy , daje jakie im Fundusz - mówi dr Jakub Mowiński , właściciel sieci firmy Medical z Tczewa , która prowadzi w rejonie trzy przychodnie i Centrum Rehabilitacji .",[0] -> [1] -> [2] -> [8]
"Jasnowłosa dziewczynka wydmuchuje bańki mydlane przez kółko , które podstawia jej chłopiec .","Jasnowłosa dziewczynka wydmuchuje bańki mydlane przez kółko , podstawia które jej chłopiec .",[0] -> [1] -> [2] -> [8]
"Szczepan sam na ogół froterował podłogi , używając szczotek , które wsuwało się pod buty i jeździło później na nich po podłodze metr za metrem , klepka za klepką , aż stała się błyszcząca jak lustro .","Szczepan sam na ogół froterował podłogi , używając szczotek , wsuwało które się pod buty i jeździło później na nich po podłodze metr za metrem , klepka za klepką , aż stała się błyszcząca jak lustro .",[0] -> [1] -> [2] -> [8]
"W jego armii służyli teraz synowie śmiałków , którymi dowodził przed laty .","W jego armii służyli teraz synowie śmiałków , dowodził którymi przed laty .",[0] -> [1] -> [2] -> [8]
"Bydlęta ciamkały , mlaskały , chlipało tam miękko i ciepło , i raptem tamta kobieta , jedna z nich , zaczęła wyć głosem , którego wcześniej nikt tutaj nie słyszał .","Bydlęta ciamkały , mlaskały , chlipało tam miękko i ciepło , i raptem tamta kobieta , jedna z nich , zaczęła wyć głosem , wcześniej nikt tutaj nie słyszał którego .",[0] -> [1] -> [2] -> [8]
"Bo jeśli patrzeć tylko przez pryzmat głównych bohaterów , to wszystkie te straszne rzeczy , z którymi muszą się zmierzyć , mogą być tylko metaforą „ zwykłych ” , codziennych problemów , jakie napotykamy na drodze przez życie , na drodze ku dorosłości i wtedy to rzeczywiście nie jest „ grożenie paluchem ” na serio itp . itd .","Bo jeśli patrzeć tylko przez pryzmat głównych bohaterów , to wszystkie te straszne rzeczy , z którymi muszą się zmierzyć , mogą być tylko metaforą „ zwykłych ” , codziennych problemów , napotykamy jakie na drodze przez życie , na drodze ku dorosłości i wtedy to rzeczywiście nie jest „ grożenie paluchem ” na serio itp . itd .",[0] -> [1] -> [2] -> [8]
"Na szczęście pościel , którą na nich położono , była miękka i ciepła .","Na szczęście pościel , na nich położono którą , była miękka i ciepła .",[0] -> [1] -> [2] -> [8]
"Takie podejście odpowiada szczególnemu charakterowi kredytów konsumenckich i nie powinno stanowić przeszkody dla przyjęcia ewentualnych odmiennych rozwiązań w przypadku innych produktów , takich jak kredyty hipoteczne o stałej stopie oprocentowania , które finansuje się przy użyciu długoterminowych mechanizmów finansowania .","Takie podejście odpowiada szczególnemu charakterowi kredytów konsumenckich i nie powinno stanowić przeszkody dla przyjęcia ewentualnych odmiennych rozwiązań w przypadku innych produktów , takich jak kredyty hipoteczne o stałej stopie oprocentowania , finansuje które się przy użyciu długoterminowych mechanizmów finansowania .",[0] -> [1] -> [2] -> [8]
"Za czyny , które zarzuca się Lepperowi , czyli za znieważenie organu konstytucyjnego , grozi kara do 2 lat pozbawienia wolności , a za znieważenie funkcjonariusza publicznego - do roku więzienia .","Za czyny , zarzuca które się Lepperowi , czyli za znieważenie organu konstytucyjnego , grozi kara do 2 lat pozbawienia wolności , a za znieważenie funkcjonariusza publicznego - do roku więzienia .",[0] -> [1] -> [2] -> [8]
"Ślady krwi na ubraniach miały kształt zgodny z tym , co opisywały doniesienia z dnia morderstwa .","Ślady krwi na ubraniach miały kształt zgodny z tym , opisywały co doniesienia z dnia morderstwa .",[0] -> [1] -> [2] -> [8]
"Że ja znam jednego architekta , co teraz buduje domy na tej ziemi , co ciotka Tośka sprzedała .","Że ja znam jednego architekta , co teraz buduje domy na tej ziemi , ciotka Tośka sprzedała co .",[0] -> [1] -> [2] -> [8]
"Jeden syn , którego odnalazła , zginął na froncie , a drugiego nie odnalazła .","Jeden syn , odnalazła którego , zginął na froncie , a drugiego nie odnalazła .",[0] -> [1] -> [2] -> [8]
