sen_str,swapped_sen_str,leaf_rule
मेखला धारण भैक्ष चर्य दण्ड समिध् आधान उपस्पर्शन प्रातरभिवादाः नित्यम्,मेखला धारण भैक्ष चर्य दण्ड आधान समिध् उपस्पर्शन प्रातरभिवादाः नित्यम्,[0] -> [1] -> [2] -> [3] -> [9]
ते _ _ अनुगताः अपश्यन् _ _ शक्तिम् _ गुणैः निगूढाम्,ते अनुगताः _ _ अपश्यन् _ _ शक्तिम् _ गुणैः निगूढाम्,[0] -> [1] -> [2] -> [3] -> [9]
अभिजित् असि अभिजय्यासम् लोक जित् असि लोकम् जय्यासम् अत्तिः असि अन्नम् अद्यासम् अन्न आदः भवति यः त्वा एवम् वेद संभूः देवः असि सम् अहम् भूयासम् आभूतिः असि आभूयासम् भूतिः असि भूयासम् याः ते प्रजाः उपदिष्टाः न अहम् तव ताः पर्येमि उप ते ताः दिशामि तपः मे तेजः मे अन्नम् मे वाच् मे तत् मे त्वयि तत् मे मा उपहृथाः इति अग्निम् अवोचत्,अभिजित् असि अभिजय्यासम् जित् लोक असि लोकम् जय्यासम् अत्तिः असि अन्नम् अद्यासम् अन्न आदः भवति यः त्वा एवम् वेद संभूः देवः असि सम् अहम् भूयासम् आभूतिः असि आभूयासम् भूतिः असि भूयासम् याः ते प्रजाः उपदिष्टाः न अहम् तव ताः पर्येमि उप ते ताः दिशामि तपः मे तेजः मे अन्नम् मे वाच् मे तत् मे त्वयि तत् मे मा उपहृथाः इति अग्निम् अवोचत्,[0] -> [1] -> [2] -> [3] -> [9]
द्वे विद्ये वेदितव्ये इति ह स्म यत् ब्रह्म विदः वदन्ति परा च एव अपरा च,द्वे विद्ये वेदितव्ये इति ह स्म यत् विदः ब्रह्म वदन्ति परा च एव अपरा च,[0] -> [1] -> [2] -> [3] -> [9]
स्वयम्भुवे ब्रह्मणे विश्व गोप्त्रे नमस्कृत्वा मन्त्र दृग्भ्यः तथा एव विवक्षुः अस्मि ऋग्विधानम् पुराणम् पुरा दृष्टम् ऋषिभिः मन्त्र दृग्भिः,स्वयम्भुवे ब्रह्मणे गोप्त्रे विश्व नमस्कृत्वा मन्त्र दृग्भ्यः तथा एव विवक्षुः अस्मि ऋग्विधानम् पुराणम् पुरा दृष्टम् ऋषिभिः मन्त्र दृग्भिः,[0] -> [1] -> [2] -> [3] -> [9]
बन्धम् इव अवक्रामी गच्छ कृत्ये कृत्या कृतम् पुनर्,बन्धम् इव अवक्रामी गच्छ कृत्ये कृतम् कृत्या पुनर्,[0] -> [1] -> [2] -> [3] -> [9]
ब्रह्मणा अन्न आदेन अन्नम् अत्ति यः एवम् वेद,ब्रह्मणा आदेन अन्न अन्नम् अत्ति यः एवम् वेद,[0] -> [1] -> [2] -> [3] -> [9]
कुतस् त्वा कश्मलम् इदम् विषमे समुपस्थितम् अन् आर्य जुष्टम् अ स्वर्ग्यम् अ कीर्ति करम् अर्जुन,कुतस् त्वा कश्मलम् इदम् विषमे समुपस्थितम् अन् आर्य जुष्टम् अ स्वर्ग्यम् अ करम् कीर्ति अर्जुन,[0] -> [1] -> [2] -> [3] -> [9]
ददृशे पार्थिवः रेणुः जनितः तेन सर्पता _ प्रणाशः भूतानाम् _ _ _ सत्तमैः,ददृशे पार्थिवः रेणुः जनितः तेन सर्पता _ प्रणाशः भूतानाम् _ _ _ सत्तमैः,[0] -> [1] -> [2] -> [3] -> [9]
सव्यौ पादौ गृहपतेः भार्यायै व्रत प्रदस्य,सव्यौ पादौ गृहपतेः भार्यायै प्रदस्य व्रत,[0] -> [1] -> [2] -> [3] -> [9]
गुरोः _ उपसंग्रहणम् प्रातर् _ अनुवचने च _ अन्तयोः,गुरोः _ उपसंग्रहणम् प्रातर् अनुवचने _ च _ अन्तयोः,[0] -> [1] -> [2] -> [3] -> [9]
बैल्वम् यूपम् कुर्वीत अन्नाद्य कामः पुष्टि कामः,बैल्वम् यूपम् कुर्वीत अन्नाद्य कामः कामः पुष्टि,[0] -> [1] -> [2] -> [3] -> [9]
विदुः हि तक्म नाशनम्,विदुः हि नाशनम् तक्म,[0] -> [1] -> [2] -> [3] -> [9]
सर्वमेधः सर्व कामस्य,सर्वमेधः कामस्य सर्व,[0] -> [1] -> [2] -> [3] -> [9]
अग्निः च यत् मरुतः विश्व वेदसः दिवः वहध्वे उत्तरात् अधि स्नुभिः ते मन्दसानाः धुनयः रिशादसः वामम् धत्त यजमानाय सुन्वते,अग्निः च यत् मरुतः वेदसः विश्व दिवः वहध्वे उत्तरात् अधि स्नुभिः ते मन्दसानाः धुनयः रिशादसः वामम् धत्त यजमानाय सुन्वते,[0] -> [1] -> [2] -> [3] -> [9]
सप्त अरत्निम् पशु कामस्य,सप्त अरत्निम् कामस्य पशु,[0] -> [1] -> [2] -> [3] -> [9]
अर्वाञ्चम् इन्द्रम् अमुतस् हवामहे यः गो जित् धन जित् अश्व जित् यः,अर्वाञ्चम् इन्द्रम् अमुतस् हवामहे यः गो जित् जित् धन अश्व जित् यः,[0] -> [1] -> [2] -> [3] -> [9]
नित्यः चाकन्यात् स्व पतिः दमूनाः यस्मै उ देवः सविता जजान भगः वा गोभिः अर्यमा ईम् अनज्यात्,नित्यः चाकन्यात् स्व पतिः दमूनाः यस्मै उ देवः सविता जजान भगः वा गोभिः अर्यमा अनज्यात् ईम्,[0] -> [1] -> [2] -> [3] -> [9]
इमम् मणिम् विश्व जितम् सु वीरम् अस्मात् अश्वत्थात् परि उद् भरामि येन विश्वाः पृतनाः संजयानि,इमम् मणिम् जितम् विश्व सु वीरम् अस्मात् अश्वत्थात् परि उद् भरामि येन विश्वाः पृतनाः संजयानि,[0] -> [1] -> [2] -> [3] -> [9]
वैश्वदेव वत् आज्य सादन अन्तम् कृत्वा देवस्य त्वा इति अभ्रिम् आदाय अर्धम् अन्तर्वेदि अर्धम् बहिर्वेदि सर्वतस् प्रादेश संमितम् यूप अवटम् त्रिस् प्रदक्षिणम् परिलिखितम् इति परिलिखति,वैश्वदेव वत् सादन आज्य अन्तम् कृत्वा देवस्य त्वा इति अभ्रिम् आदाय अर्धम् अन्तर्वेदि अर्धम् बहिर्वेदि सर्वतस् प्रादेश संमितम् यूप अवटम् त्रिस् प्रदक्षिणम् परिलिखितम् इति परिलिखति,[0] -> [1] -> [2] -> [3] -> [9]
यत्र इन्द्रम् देवताः पर्यवृञ्जन् विश्वरूपम् त्वाष्ट्रम् अभ्यमंस्त वृत्रम् अस्तृत यतीन् सालावृकेभ्यः प्रादात् अरुर्मघान् अवधीत् बृहस्पतेः प्रत्यवधीत् इति तत्र इन्द्रः सोम पीथेन व्यार्ध्यत इन्द्रस्य अनु व्यृद्धिम् क्षत्रम् सोम पीथेन व्यार्ध्यत अपि इन्द्रः सोम पीथे अभवत् त्वष्टुः आमुष्य सोमम् तत् व्यृद्धम् अद्य अपि क्षत्रम् सोम पीथेन स यः तम् भक्षम् विद्यात् यः क्षत्रस्य सोम पीथेन व्यृद्धस्य येन क्षत्रम् समृध्यते कथम् तम् वेदेः उत्थापयन्ति इति,यत्र इन्द्रम् देवताः पर्यवृञ्जन् विश्वरूपम् त्वाष्ट्रम् अभ्यमंस्त वृत्रम् अस्तृत यतीन् सालावृकेभ्यः प्रादात् अरुर्मघान् अवधीत् बृहस्पतेः प्रत्यवधीत् इति तत्र इन्द्रः पीथेन सोम व्यार्ध्यत इन्द्रस्य अनु व्यृद्धिम् क्षत्रम् सोम पीथेन व्यार्ध्यत अपि इन्द्रः सोम पीथे अभवत् त्वष्टुः आमुष्य सोमम् तत् व्यृद्धम् अद्य अपि क्षत्रम् सोम पीथेन स यः तम् भक्षम् विद्यात् यः क्षत्रस्य सोम पीथेन व्यृद्धस्य येन क्षत्रम् समृध्यते कथम् तम् वेदेः उत्थापयन्ति इति,[0] -> [1] -> [2] -> [3] -> [9]
पवस्व वाज सातये अभि विश्वानि काव्या,पवस्व सातये वाज अभि विश्वानि काव्या,[0] -> [1] -> [2] -> [3] -> [9]
तस्मात् एताम् रात्रिम् _ भृतः प्राणम् न विच्छिन्द्यात् अपि कृकलासस्य एतस्याः एव देवतायाः अपचितये,तस्मात् एताम् रात्रिम् भृतः _ प्राणम् न विच्छिन्द्यात् अपि कृकलासस्य एतस्याः एव देवतायाः अपचितये,[0] -> [1] -> [2] -> [3] -> [9]
सः _ कृत् _ विद् आत्म योनिः ज्ञः काल कारः गुणी _ विद्यः _ _ पतिः _ ईशः _ _ _ _ हेतुः,सः _ कृत् विद् _ आत्म योनिः ज्ञः काल कारः गुणी _ विद्यः _ _ पतिः _ ईशः _ _ _ _ हेतुः,[0] -> [1] -> [2] -> [3] -> [9]
त्वाष्ट्रम् वडबम् आलभेत पशु कामः,त्वाष्ट्रम् वडबम् आलभेत कामः पशु,[0] -> [1] -> [2] -> [3] -> [9]
ब्रह्मचारी सुचरिती मेधावी कर्म कृत् धन दः प्रियः विद्यया वा विद्याम् अन्विच्छन् तानि तीर्थानि ब्रह्मणः,ब्रह्मचारी सुचरिती मेधावी कर्म कृत् दः धन प्रियः विद्यया वा विद्याम् अन्विच्छन् तानि तीर्थानि ब्रह्मणः,[0] -> [1] -> [2] -> [3] -> [9]
प्रातराहुत्याम् हुतायाम् पूर्णाहुति अन्ते वर दानम् ब्रह्मणे,प्रातराहुत्याम् हुतायाम् पूर्णाहुति अन्ते दानम् वर ब्रह्मणे,[0] -> [1] -> [2] -> [3] -> [9]
मेखला धारण भैक्ष चर्य दण्ड धारण समिध् आधान उदक उपस्पर्शन प्रातरभिवादाः इति एते नित्य धर्माः,मेखला धारण भैक्ष चर्य धारण दण्ड समिध् आधान उदक उपस्पर्शन प्रातरभिवादाः इति एते नित्य धर्माः,[0] -> [1] -> [2] -> [3] -> [9]
अत्यः न अज्मन् सर्ग प्रतक्तः सिन्धुः न कः ईम् वराते,अत्यः न अज्मन् सर्ग प्रतक्तः सिन्धुः न कः वराते ईम्,[0] -> [1] -> [2] -> [3] -> [9]
उदक्रमीत् द्रविणः दाः वाजी अर्वा,उदक्रमीत् दाः द्रविणः वाजी अर्वा,[0] -> [1] -> [2] -> [3] -> [9]
त्वम् अग्ने द्रविणः दाः अरङ्कृते,त्वम् अग्ने दाः द्रविणः अरङ्कृते,[0] -> [1] -> [2] -> [3] -> [9]
यदि एयथ द्विपदी चतुष्पदी कृत्या कृता संभृता विश्व रूपा सा इतस् अष्टापदी भूत्वा पुनर् परेहि दुच्छुने,यदि एयथ द्विपदी चतुष्पदी कृता कृत्या संभृता विश्व रूपा सा इतस् अष्टापदी भूत्वा पुनर् परेहि दुच्छुने,[0] -> [1] -> [2] -> [3] -> [9]
वृक्षान् _ कारी इव मा एनान् धाक्षीः स मूलकान्,वृक्षान् कारी _ इव मा एनान् धाक्षीः स मूलकान्,[0] -> [1] -> [2] -> [3] -> [9]
वृषा वै एष रेतः धाः यत् अभीवर्तः,वृषा वै एष धाः रेतः यत् अभीवर्तः,[0] -> [1] -> [2] -> [3] -> [9]
तस्मात् _ _ त्यागेन _ जयम् कुर्वीत _ संयोगेन प्रज्ञाम् चारेण चक्षुः उत्थानेन _ साधनम् _ अनुशासनेन _ स्थापनम् विनयम् _ उपदेशेन _ _ त्वम् _ संयोगेन हितेन वृत्तिम्,तस्मात् त्यागेन _ _ _ जयम् कुर्वीत _ संयोगेन प्रज्ञाम् चारेण चक्षुः उत्थानेन _ साधनम् _ अनुशासनेन _ स्थापनम् विनयम् _ उपदेशेन _ _ त्वम् _ संयोगेन हितेन वृत्तिम्,[0] -> [1] -> [2] -> [3] -> [9]
सहस्र साः शत साः भूरि दावा शश्वत्तमम् बर्हिः आ वाजी अस्थात्,सहस्र साः शत साः दावा भूरि शश्वत्तमम् बर्हिः आ वाजी अस्थात्,[0] -> [1] -> [2] -> [3] -> [9]
प्रत्यक् प्रतिप्रहिण्मः यथा कृत्या कृतम् हनत्,प्रत्यक् प्रतिप्रहिण्मः यथा कृतम् कृत्या हनत्,[0] -> [1] -> [2] -> [3] -> [9]
स ह स्म आह सुचित्तः शैलनः यः यज्ञ कामः माम् एव स वृणीताम् ततस् एव एनम् यज्ञः उपनंस्यति एवंविदम् हि उद्गायन्तम् सर्वाः देवताः अनुसंतृप्यन्ति ताः अस्मै तृप्ताः तथा करिष्यन्ति यथा एनम् यज्ञः उपनंस्यति इति,स ह स्म आह सुचित्तः शैलनः यः कामः यज्ञ माम् एव स वृणीताम् ततस् एव एनम् यज्ञः उपनंस्यति एवंविदम् हि उद्गायन्तम् सर्वाः देवताः अनुसंतृप्यन्ति ताः अस्मै तृप्ताः तथा करिष्यन्ति यथा एनम् यज्ञः उपनंस्यति इति,[0] -> [1] -> [2] -> [3] -> [9]
ब्रह्मचर्यम् _ वचनम् सवनेषु _ उपस्पर्शनम् _ _ ता अधस् _ ता अनाशकः इति तपांसि,ब्रह्मचर्यम् _ वचनम् सवनेषु उपस्पर्शनम् _ _ _ ता अधस् _ ता अनाशकः इति तपांसि,[0] -> [1] -> [2] -> [3] -> [9]
प्रक्षाल्य पाणी _ पात्रम् पूरयित्वा तेन एनाम् त्रिस् अभ्युक्षति उत्तिष्ठ अतस् विश्वावसो अन्याम् इच्छ प्रपूर्व्याम् _ जायाम् पत्या सह इति,प्रक्षाल्य पाणी _ पात्रम् पूरयित्वा तेन एनाम् अभ्युक्षति त्रिस् उत्तिष्ठ अतस् विश्वावसो अन्याम् इच्छ प्रपूर्व्याम् _ जायाम् पत्या सह इति,[0] -> [1] -> [2] -> [3] -> [9]
सः _ कृत् _ विद् आत्म योनिः ज्ञः काल कारः गुणी _ विद्यः _ _ पतिः _ ईशः _ _ _ _ हेतुः,सः कृत् _ _ विद् आत्म योनिः ज्ञः काल कारः गुणी _ विद्यः _ _ पतिः _ ईशः _ _ _ _ हेतुः,[0] -> [1] -> [2] -> [3] -> [9]
विद्म हि अस्य वीरस्य भूरि दावरीम् सुमतिम् त्रिषु जातस्य मनांसि,विद्म हि अस्य वीरस्य दावरीम् भूरि सुमतिम् त्रिषु जातस्य मनांसि,[0] -> [1] -> [2] -> [3] -> [9]
उद् त्वा वहन्तु मरुतः उद वाहाः उद प्रुतः,उद् त्वा वहन्तु मरुतः उद वाहाः प्रुतः उद,[0] -> [1] -> [2] -> [3] -> [9]
अनुप्रहरेत् स्वर्ग कामस्य,अनुप्रहरेत् कामस्य स्वर्ग,[0] -> [1] -> [2] -> [3] -> [9]
त्वम् इन्द्र असि विश्व जित् सर्व विद्,त्वम् इन्द्र असि विश्व जित् विद् सर्व,[0] -> [1] -> [2] -> [3] -> [9]
प्रतिष्ठितम् वृश्चेत् प्रतिष्ठा कामस्य,प्रतिष्ठितम् वृश्चेत् कामस्य प्रतिष्ठा,[0] -> [1] -> [2] -> [3] -> [9]
इन्द्रस्य हार्दि सोम धानम् आ विश समुद्रम् इव सिन्धवः जुष्टः मित्राय वरुणाय वायवे दिवः विष्टम्भः उत्तमः,इन्द्रस्य हार्दि धानम् सोम आ विश समुद्रम् इव सिन्धवः जुष्टः मित्राय वरुणाय वायवे दिवः विष्टम्भः उत्तमः,[0] -> [1] -> [2] -> [3] -> [9]
त्यजेत् पितरम् _ घातकम् _ याजकम् शूद्र अर्थ याजकम् _ विप्लावकम् _ हानम् यः च अन्त्यावसायिभिः सह संवसेत् अन्त्यावसायिन्याम् च,त्यजेत् पितरम् _ घातकम् _ याजकम् शूद्र अर्थ याजकम् _ विप्लावकम् हानम् _ यः च अन्त्यावसायिभिः सह संवसेत् अन्त्यावसायिन्याम् च,[0] -> [1] -> [2] -> [3] -> [9]
अथ एताः यजमानः एव स्वयम् जुहोति अग्निः अन्न आदः अन्न पतिः अन्नस्य ईशे स मे अन्नम् ददातु स्वाहा वायुः प्राण दाः प्राणस्य ईशे स मे प्राणम् ददातु स्वाहा आदित्यः भूरि दाः भूयिष्ठानाम् पशूनाम् ईशे स मे भूयिष्ठान् पशून् ददातु स्वाहा इति,अथ एताः यजमानः एव स्वयम् जुहोति अग्निः अन्न आदः अन्न पतिः अन्नस्य ईशे स मे अन्नम् ददातु स्वाहा वायुः प्राण दाः प्राणस्य ईशे स मे प्राणम् ददातु स्वाहा आदित्यः दाः भूरि भूयिष्ठानाम् पशूनाम् ईशे स मे भूयिष्ठान् पशून् ददातु स्वाहा इति,[0] -> [1] -> [2] -> [3] -> [9]
वायो उक्थेभिः जरन्ते त्वाम् अच्छा जरितारः सुत सोमाः अहर् विदः,वायो उक्थेभिः जरन्ते त्वाम् अच्छा जरितारः सुत सोमाः विदः अहर्,[0] -> [1] -> [2] -> [3] -> [9]
कथम् भीष्मम् अहम् संख्ये द्रोणम् च मधुसूदन इषुभिः प्रतियोत्स्यामि पूजा अर्हौ अरि सूदन,कथम् भीष्मम् अहम् संख्ये द्रोणम् च मधुसूदन इषुभिः प्रतियोत्स्यामि पूजा अर्हौ सूदन अरि,[0] -> [1] -> [2] -> [3] -> [9]
