sen_str,swapped_sen_str,leaf_rule
शम् अद्भ्यः शम् ओषधीभ्यः इति अवशिष्टाः अनु पृष्ठम् निनीय दक्षिणेन नाभिम् प्राच् अग्रम् बर्हिः निदधाति ओषधे त्रायस्व एनम् इति,शम् अद्भ्यः शम् ओषधीभ्यः इति अवशिष्टाः अनु पृष्ठम् निनीय दक्षिणेन नाभिम् निदधाति प्राच् अग्रम् बर्हिः ओषधे त्रायस्व एनम् इति,[0] -> [1] -> [2] -> [3] -> [4] -> [5] -> [6]
यदि अभिचरेत् दारुम् स्तम्बम् वा अभिदध्यात् अरातीयन्तम् अधरम् कृणोमि इति,यदि अभिचरेत् अभिदध्यात् दारुम् स्तम्बम् वा अरातीयन्तम् अधरम् कृणोमि इति,[0] -> [1] -> [2] -> [3] -> [4] -> [5] -> [6]
उदूह्य प्रोक्षणी धानम् बर्हिः विस्रस्य पुरस्तात् प्रस्तरम् गृह्णाति विष्णो स्तूपः असि इति,उदूह्य प्रोक्षणी धानम् बर्हिः विस्रस्य पुरस्तात् गृह्णाति प्रस्तरम् विष्णो स्तूपः असि इति,[0] -> [1] -> [2] -> [3] -> [4] -> [5] -> [6]
न च अस्मै श्रुति विप्रतिषिद्धम् उच्छिष्टम् दद्यात् यथा क्षार लवण मधु मांसानि इति,न च अस्मै दद्यात् श्रुति विप्रतिषिद्धम् उच्छिष्टम् यथा क्षार लवण मधु मांसानि इति,[0] -> [1] -> [2] -> [3] -> [4] -> [5] -> [6]
अथ स्रुचम् अभिमृशति हृदयम् प्रेतिः मनः संततिः चक्षुः आनतिः श्रोत्रम् उपनतिः वाच् आगतिः प्रतीतम् देवेभ्यः जुष्टम् हव्यम् अस्थात् अमृते माम् अधात् आ माम् प्राणाः विशन्तु भूयसे सुकृताय इति,अथ अभिमृशति स्रुचम् हृदयम् प्रेतिः मनः संततिः चक्षुः आनतिः श्रोत्रम् उपनतिः वाच् आगतिः प्रतीतम् देवेभ्यः जुष्टम् हव्यम् अस्थात् अमृते माम् अधात् आ माम् प्राणाः विशन्तु भूयसे सुकृताय इति,[0] -> [1] -> [2] -> [3] -> [4] -> [5] -> [6]
शम् ओषधीभ्यः शम् पृथिव्यै इति भूम्याम् शेषम् निनीय ओषधे त्रायस्व एनम् इति उपाकरणयोः अवशिष्टम् दक्षिणेन नाभिम् अन्तर्धाय स्वधिते मा एनम् हिंसीः इति स्वधितिना पार्श्वतः तिर्यक् आछ्यति,शम् ओषधीभ्यः शम् पृथिव्यै इति भूम्याम् निनीय शेषम् ओषधे त्रायस्व एनम् इति उपाकरणयोः अवशिष्टम् दक्षिणेन नाभिम् अन्तर्धाय स्वधिते मा एनम् हिंसीः इति स्वधितिना पार्श्वतः तिर्यक् आछ्यति,[0] -> [1] -> [2] -> [3] -> [4] -> [5] -> [6]
स पुरस्तात् दीक्षायाः आहुतिम् हुत्वा आहवनीयम् उपतिष्ठेत न इन्द्रात् देवतायाः एमि न त्रिष्टुभः छन्दसः न पञ्चदशात् स्तोमात् न सोमात् राज्ञः न पित्र्यात् बन्धोः मा मे इन्द्रः इन्द्रियम् आदित मा त्रिष्टुभ् वीर्यम् मा पञ्चदशः स्तोमः आयुः मा सोमः राज्यम् मा पितरः यशः कीर्तिम् सह इन्द्रियेण वीर्येण आयुषा राज्येन यशसा बन्धुना अग्निम् उपैमि गायत्रीम् छन्दः त्रिवृतम् स्तोमम् सोमम् राजानम् ब्रह्म प्रपद्ये ब्राह्मणः भवामि इति,स पुरस्तात् दीक्षायाः आहुतिम् हुत्वा उपतिष्ठेत आहवनीयम् न इन्द्रात् देवतायाः एमि न त्रिष्टुभः छन्दसः न पञ्चदशात् स्तोमात् न सोमात् राज्ञः न पित्र्यात् बन्धोः मा मे इन्द्रः इन्द्रियम् आदित मा त्रिष्टुभ् वीर्यम् मा पञ्चदशः स्तोमः आयुः मा सोमः राज्यम् मा पितरः यशः कीर्तिम् सह इन्द्रियेण वीर्येण आयुषा राज्येन यशसा बन्धुना अग्निम् उपैमि गायत्रीम् छन्दः त्रिवृतम् स्तोमम् सोमम् राजानम् ब्रह्म प्रपद्ये ब्राह्मणः भवामि इति,[0] -> [1] -> [2] -> [3] -> [4] -> [5] -> [6]
द्यौः ते पृष्ठम् इति छत्रम् धारयेत् इमम् अग्ने इति हिरण्यम्,द्यौः ते पृष्ठम् इति धारयेत् छत्रम् इमम् अग्ने इति हिरण्यम्,[0] -> [1] -> [2] -> [3] -> [4] -> [5] -> [6]
तस्याम् प्राचीन अग्रम् शाखापवित्रम् निदधाति वसूनाम् पवित्रम् असि शत धारम् वसूनाम् पवित्रम् असि सहस्र धारम् इति,तस्याम् निदधाति प्राचीन अग्रम् शाखापवित्रम् वसूनाम् पवित्रम् असि शत धारम् वसूनाम् पवित्रम् असि सहस्र धारम् इति,[0] -> [1] -> [2] -> [3] -> [4] -> [5] -> [6]
दक्षिण जानु अक्तः दक्षिणेन अग्निम् अदिते अनुमन्यस्व इति उदक अञ्जलिम् प्रसिञ्चेत् अनुमते अनुमन्यस्व इति पश्चात् सरस्वति अनुमन्यस्व इति उत्तरतस्,दक्षिण जानु अक्तः दक्षिणेन अग्निम् अदिते अनुमन्यस्व इति प्रसिञ्चेत् उदक अञ्जलिम् अनुमते अनुमन्यस्व इति पश्चात् सरस्वति अनुमन्यस्व इति उत्तरतस्,[0] -> [1] -> [2] -> [3] -> [4] -> [5] -> [6]
बर्हिषि निधाय समिधम् आदधाति अग्नि ज्योतिषम् त्वा वायुमतीम् प्राणवतीम् स्वर्ग्याम् स्वर्गाय उपदधामि भास्वतीम् इति सूर्य ज्योतिषम् इति प्रातर्,बर्हिषि निधाय आदधाति समिधम् अग्नि ज्योतिषम् त्वा वायुमतीम् प्राणवतीम् स्वर्ग्याम् स्वर्गाय उपदधामि भास्वतीम् इति सूर्य ज्योतिषम् इति प्रातर्,[0] -> [1] -> [2] -> [3] -> [4] -> [5] -> [6]
अथ अस्मै अजिनम् उत्तरीयम् करोति मित्रस्य चक्षुः धरुणम् धरीयः तेजः यशस्वि स्थविरम् समिद्धम् अन् आहनस्यम् वसनम् जरिष्णु परि इदम् वाजी अजिनम् धत्स्व असौ अदितिः ते कक्षाम् बध्नातु वेदस्य अनुवक्तवै मेधायै श्रद्धायै अनूक्तस्य अ निराकरणाय ब्रह्मणे ब्रह्मवर्चसाय इति,अथ अस्मै अजिनम् करोति उत्तरीयम् मित्रस्य चक्षुः धरुणम् धरीयः तेजः यशस्वि स्थविरम् समिद्धम् अन् आहनस्यम् वसनम् जरिष्णु परि इदम् वाजी अजिनम् धत्स्व असौ अदितिः ते कक्षाम् बध्नातु वेदस्य अनुवक्तवै मेधायै श्रद्धायै अनूक्तस्य अ निराकरणाय ब्रह्मणे ब्रह्मवर्चसाय इति,[0] -> [1] -> [2] -> [3] -> [4] -> [5] -> [6]
उन्नम्भय पृथिवीम् इति अपः परिषिञ्चति,उन्नम्भय पृथिवीम् इति परिषिञ्चति अपः,[0] -> [1] -> [2] -> [3] -> [4] -> [5] -> [6]
ब्रह्म जज्ञानम् इति सूतिका अरिष्टकौ प्रपादयति,ब्रह्म जज्ञानम् इति प्रपादयति सूतिका अरिष्टकौ,[0] -> [1] -> [2] -> [3] -> [4] -> [5] -> [6]
इमम् स्तनम् मधुमन्तम् धय अपाम् प्रपीनम् अग्ने सलिलस्य मध्ये उत्सम् जुषस्व मधुमन्तम् ऊर्मिम् समुद्र्यम् सदनम् आविशस्व _ इति _ विमोकम् अभिजुहोति,इमम् स्तनम् मधुमन्तम् धय अपाम् प्रपीनम् अग्ने सलिलस्य मध्ये उत्सम् जुषस्व मधुमन्तम् ऊर्मिम् समुद्र्यम् सदनम् आविशस्व _ इति अभिजुहोति _ विमोकम्,[0] -> [1] -> [2] -> [3] -> [4] -> [5] -> [6]
आग्नीध्रः षडवत्तम् प्राश्नाति पृथिव्याः त्वा दात्रा प्राश्नामि अन्तरिक्षस्य त्वा दिवः त्वा इति,आग्नीध्रः प्राश्नाति षडवत्तम् पृथिव्याः त्वा दात्रा प्राश्नामि अन्तरिक्षस्य त्वा दिवः त्वा इति,[0] -> [1] -> [2] -> [3] -> [4] -> [5] -> [6]
त्रिस् अनूक्तायाम् प्रथमायाम् इध्मम् आदाय सिकताः उपयमनीः कृत्वा उद्यत होमम् जुहोति यत् ते पावक चकृम कच्चित् आगः पूर्वः सन् अपरः यत् भवासि घृतेन त्वम् तनुवः वर्धयस्व मा मा हिंसीः अधिगतम् पुरस्तात् स्वाहा इति,त्रिस् अनूक्तायाम् प्रथमायाम् इध्मम् आदाय सिकताः उपयमनीः कृत्वा जुहोति उद्यत होमम् यत् ते पावक चकृम कच्चित् आगः पूर्वः सन् अपरः यत् भवासि घृतेन त्वम् तनुवः वर्धयस्व मा मा हिंसीः अधिगतम् पुरस्तात् स्वाहा इति,[0] -> [1] -> [2] -> [3] -> [4] -> [5] -> [6]
_ वाज पतिः इति आज्यम् हविः च त्रिस् पर्यग्निकरोति,_ वाज पतिः इति त्रिस् पर्यग्निकरोति आज्यम् हविः च,[0] -> [1] -> [2] -> [3] -> [4] -> [5] -> [6]
ततस् श्वस् अग्नये तपस्वते जनद्वते पावकवते इष्टिम् निर्वपेत्,ततस् श्वस् अग्नये तपस्वते जनद्वते पावकवते निर्वपेत् इष्टिम्,[0] -> [1] -> [2] -> [3] -> [4] -> [5] -> [6]
निः क्रव्य अदम् सेध इति दक्षिणा अङ्गारम् निरस्यति,निः क्रव्य अदम् सेध इति दक्षिणा निरस्यति अङ्गारम्,[0] -> [1] -> [2] -> [3] -> [4] -> [5] -> [6]
औदुम्बर्या आर्द्रया शाखया स पलाशया मूल देशेन वाणम् त्रिस् ऊर्ध्वम् उल्लिखति प्राणाय त्वा अपानाय त्वा व्यानाय त्वा उल्लिखामि इति,औदुम्बर्या आर्द्रया शाखया स पलाशया मूल देशेन त्रिस् ऊर्ध्वम् उल्लिखति वाणम् प्राणाय त्वा अपानाय त्वा व्यानाय त्वा उल्लिखामि इति,[0] -> [1] -> [2] -> [3] -> [4] -> [5] -> [6]
यम् कामयेत पुमान् अस्य जायेत इति आ अन्तम् तस्य प्रवेष्ट्य अणिमति स्थविमत् प्रवीय दिवः सूनुः असि इति स्वरुम् आदाय अन्तरिक्षस्य त्वा सानौ अवगूहामि इति उत्तरेण अग्निष्ठाम् मध्यमे रशना गुणे अवगूहति उत्तमे सर्वेषु वा,यम् कामयेत पुमान् अस्य जायेत इति आ अन्तम् तस्य प्रवेष्ट्य अणिमति स्थविमत् प्रवीय दिवः सूनुः असि इति आदाय स्वरुम् अन्तरिक्षस्य त्वा सानौ अवगूहामि इति उत्तरेण अग्निष्ठाम् मध्यमे रशना गुणे अवगूहति उत्तमे सर्वेषु वा,[0] -> [1] -> [2] -> [3] -> [4] -> [5] -> [6]
प्रज्ञाते बर्हिषी निधाय अधिमन्थनम् शकलम् निदधाति अग्नेः जनित्रम् असि इति वृषणौ अन्वञ्चौ वृषणौ स्थः इति,प्रज्ञाते बर्हिषी निधाय निदधाति अधिमन्थनम् शकलम् अग्नेः जनित्रम् असि इति वृषणौ अन्वञ्चौ वृषणौ स्थः इति,[0] -> [1] -> [2] -> [3] -> [4] -> [5] -> [6]
सत्य सद् असि इति _ अर्धात् उदञ्चम् लेखाम् लिखति ऋत सद् असि इति _ अर्धात् प्राञ्चम् घर्म सद् असि इति उत्तरार्धात् प्राञ्चम् मध्ये द्वे तिस्रः _ प्राञ्चः ऊर्जस्वती इति दक्षिणाम् पयस्वती इति उत्तराम् इन्द्राय त्वा इति मध्यात् _,सत्य सद् असि इति _ अर्धात् लिखति उदञ्चम् लेखाम् ऋत सद् असि इति _ अर्धात् प्राञ्चम् घर्म सद् असि इति उत्तरार्धात् प्राञ्चम् मध्ये द्वे तिस्रः _ प्राञ्चः ऊर्जस्वती इति दक्षिणाम् पयस्वती इति उत्तराम् इन्द्राय त्वा इति मध्यात् _,[0] -> [1] -> [2] -> [3] -> [4] -> [5] -> [6]
त्रयोदश्याम् आग्नावैष्णवम् एकादश कपालम् निर्वपेत् दर्श पूर्णमासौ आरिप्समानः अग्नाविष्णू इति पूर्वम् पौर्णमासम् आरभमाणः सरस्वत्यै च चरुम् सरस्वते द्वादश कपालम् सरस्वति व्रतेषु यस्य व्रतम् इति,त्रयोदश्याम् आग्नावैष्णवम् एकादश कपालम् निर्वपेत् दर्श पूर्णमासौ आरिप्समानः अग्नाविष्णू इति पूर्वम् आरभमाणः पौर्णमासम् सरस्वत्यै च चरुम् सरस्वते द्वादश कपालम् सरस्वति व्रतेषु यस्य व्रतम् इति,[0] -> [1] -> [2] -> [3] -> [4] -> [5] -> [6]
अ छिन्नः रायः सु वीरः इति पञ्च अरत्नौ अग्रम् परिवृश्चति चतुर् अरत्नौ त्रि अरत्नौ वा,अ छिन्नः रायः सु वीरः इति पञ्च अरत्नौ परिवृश्चति अग्रम् चतुर् अरत्नौ त्रि अरत्नौ वा,[0] -> [1] -> [2] -> [3] -> [4] -> [5] -> [6]
अवटे शेषम् अवनयति शुन्धताम् लोकः पितृषदनः इति,अवटे अवनयति शेषम् शुन्धताम् लोकः पितृषदनः इति,[0] -> [1] -> [2] -> [3] -> [4] -> [5] -> [6]
अथ अस्याः ऊरू विहापयति विजिहीथाम् द्यावापृथिवी इति,अथ विहापयति अस्याः ऊरू विजिहीथाम् द्यावापृथिवी इति,[0] -> [1] -> [2] -> [3] -> [4] -> [5] -> [6]
नमः सनिस्रस अक्षेभ्यः इति शून्य शालायाम् अप्सु संपातान् आनयति उत्तरम् जरत् खाते स शाला तृणे,नमः सनिस्रस अक्षेभ्यः इति शून्य शालायाम् अप्सु आनयति संपातान् उत्तरम् जरत् खाते स शाला तृणे,[0] -> [1] -> [2] -> [3] -> [4] -> [5] -> [6]
विषासहिम् सहमानम् सासहानम् सहीयांसम् सहमानम् सहः जितम् स्वर् जितम् गो जितम् संधनाजितम् ईड्यम् नाम ह्वे इन्द्रम्,विषासहिम् सहमानम् सासहानम् सहीयांसम् सहमानम् जितम् सहः स्वर् जितम् गो जितम् संधनाजितम् ईड्यम् नाम ह्वे इन्द्रम्,[0] -> [1] -> [2] -> [3] -> [9]
अथ एनम् विस्रस्य आहुति साहम् कृत्वा अध्वर आहुतिभिः अभिजुहोति अग्निः यज्ञम् नयतु प्रजानन् मा एनम् यज्ञ हनः विदन् देवेभ्यः प्रब्रूतात् यज्ञम् प्र प्र यज्ञपतिम् तिर स्वाहा वायुः यज्ञम् नयतु प्रजानन् मा एनम् यज्ञ हनः विदन् देवेभ्यः प्रब्रूतात् यज्ञम् प्र प्र यज्ञपतिम् तिर स्वाहा सूर्यः यज्ञम् नयतु प्रजानन् मा एनम् यज्ञ हनः विदन् देवेभ्यः प्रब्रूतात् यज्ञम् प्र प्र यज्ञपतिम् तिर स्वाहा यज्ञः यज्ञम् नयतु प्रजानन् मा एनम् यज्ञ हनः विदन् देवेभ्यः प्रब्रूतात् यज्ञम् प्र प्र यज्ञपतिम् तिर स्वाहा इति,अथ एनम् विस्रस्य आहुति साहम् कृत्वा अध्वर आहुतिभिः अभिजुहोति अग्निः यज्ञम् नयतु प्रजानन् मा एनम् हनः यज्ञ विदन् देवेभ्यः प्रब्रूतात् यज्ञम् प्र प्र यज्ञपतिम् तिर स्वाहा वायुः यज्ञम् नयतु प्रजानन् मा एनम् यज्ञ हनः विदन् देवेभ्यः प्रब्रूतात् यज्ञम् प्र प्र यज्ञपतिम् तिर स्वाहा सूर्यः यज्ञम् नयतु प्रजानन् मा एनम् यज्ञ हनः विदन् देवेभ्यः प्रब्रूतात् यज्ञम् प्र प्र यज्ञपतिम् तिर स्वाहा यज्ञः यज्ञम् नयतु प्रजानन् मा एनम् यज्ञ हनः विदन् देवेभ्यः प्रब्रूतात् यज्ञम् प्र प्र यज्ञपतिम् तिर स्वाहा इति,[0] -> [1] -> [2] -> [3] -> [9]
अतस् उ त्वा पितु भृतः जनित्रीः अन्नावृधम् प्रति चरन्ति अन्नैः,अतस् उ त्वा भृतः पितु जनित्रीः अन्नावृधम् प्रति चरन्ति अन्नैः,[0] -> [1] -> [2] -> [3] -> [9]
अध अकृणोः पृथिवीम् संदृशे दिवे यः धौतीनाम् अहि हन् आरिणक् पथः,अध अकृणोः पृथिवीम् संदृशे दिवे यः धौतीनाम् हन् अहि आरिणक् पथः,[0] -> [1] -> [2] -> [3] -> [9]
कः यज्ञ कामः कः उ पूर्ति कामः,कः यज्ञ कामः कः उ कामः पूर्ति,[0] -> [1] -> [2] -> [3] -> [9]
न प्रतिषिञ्चेत् ब्रह्मवर्चस कामस्य,न प्रतिषिञ्चेत् कामस्य ब्रह्मवर्चस,[0] -> [1] -> [2] -> [3] -> [9]
उत स्थ केश दृंहणीः अथ उ ह केश वर्धनीः,उत स्थ दृंहणीः केश अथ उ ह केश वर्धनीः,[0] -> [1] -> [2] -> [3] -> [9]
