sen_str,swapped_sen_str,leaf_rule
इमाम् अगृभ्णन् रशनाम् ऋतस्य इति अश्वाभिधानीम् रशनाम् आदाय प्रतूर्तम् वाजिन् आ द्रव इति अश्वम् अभिदधाति तूष्णीम् गर्दभस्य आदाय युञ्जाथाम् रासभम् युवम् इति गर्दभम्,इमाम् अगृभ्णन् रशनाम् ऋतस्य इति आदाय अश्वाभिधानीम् रशनाम् प्रतूर्तम् वाजिन् आ द्रव इति अश्वम् अभिदधाति तूष्णीम् गर्दभस्य आदाय युञ्जाथाम् रासभम् युवम् इति गर्दभम्,[0] -> [1] -> [2] -> [3] -> [4] -> [5] -> [6]
अग्नौ अग्निः इति प्रहृत्य अभिहुत्य देवस्य त्वा इति द्विगुणाम् रशनाम् आदाय तद् अग्रेण पशोः दक्षिणम् बाहुम् उन्मृज्य ऋतस्य त्वा देव हविः पाशेन आरभे इति दक्षिणे पूर्व पादे अर्ध शिरसि च प्रतिमुच्य धर्ष मानुषान् इति पुरस्तात् प्रत्यक् मुखम् उदक् मुखम् वा यूपे पशुम् नियुनक्ति,अग्नौ अग्निः इति प्रहृत्य अभिहुत्य देवस्य त्वा इति आदाय द्विगुणाम् रशनाम् तद् अग्रेण पशोः दक्षिणम् बाहुम् उन्मृज्य ऋतस्य त्वा देव हविः पाशेन आरभे इति दक्षिणे पूर्व पादे अर्ध शिरसि च प्रतिमुच्य धर्ष मानुषान् इति पुरस्तात् प्रत्यक् मुखम् उदक् मुखम् वा यूपे पशुम् नियुनक्ति,[0] -> [1] -> [2] -> [3] -> [4] -> [5] -> [6]
अथ प्रतीचीम् स्फ्येन वेदिम् योयुप्यते धाः असि स्व धाः असि उर्वी च असि वस्वी च असि पुरा क्रूरस्य विसृपः विरप्शिन् उदादाय पृथिवीम् जीर दानुः याम् ऐरयन् चन्द्रमसि स्वधाभिः ताम् धीरासः अनुदृश्य यजन्ते इति,अथ स्फ्येन योयुप्यते प्रतीचीम् वेदिम् धाः असि स्व धाः असि उर्वी च असि वस्वी च असि पुरा क्रूरस्य विसृपः विरप्शिन् उदादाय पृथिवीम् जीर दानुः याम् ऐरयन् चन्द्रमसि स्वधाभिः ताम् धीरासः अनुदृश्य यजन्ते इति,[0] -> [1] -> [2] -> [3] -> [4] -> [5] -> [6]
प्रत्युष्टम् रक्षः प्रत्युष्टाः अरातयः इति शामित्रे वपाम् प्रतितप्य नमः सूर्यस्य संदृशे इति आदित्यम् उपस्थाय उरु अन्तरिक्षम् अनु इहि इति अभिप्रव्रजति,प्रत्युष्टम् रक्षः प्रत्युष्टाः अरातयः इति शामित्रे प्रतितप्य वपाम् नमः सूर्यस्य संदृशे इति आदित्यम् उपस्थाय उरु अन्तरिक्षम् अनु इहि इति अभिप्रव्रजति,[0] -> [1] -> [2] -> [3] -> [4] -> [5] -> [6]
अथ धृष्टिम् आदाय दक्षिणस्य पुरोडाशस्य अङ्गारान् अपोहति इदम् अहम् सेनायै _ मुखम् अपोहामि इति,अथ धृष्टिम् आदाय दक्षिणस्य पुरोडाशस्य अपोहति अङ्गारान् इदम् अहम् सेनायै _ मुखम् अपोहामि इति,[0] -> [1] -> [2] -> [3] -> [4] -> [5] -> [6]
अन् आर्ता असि अन् आर्तः अहम् भूयासम् इति स्रजम् अपिबध्नीत,अन् आर्ता असि अन् आर्तः अहम् भूयासम् इति अपिबध्नीत स्रजम्,[0] -> [1] -> [2] -> [3] -> [4] -> [5] -> [6]
शूर्पेण शेषम् अग्नौ ओप्य प्राच् उदीचीम् अभ्युत्क्रामयन्ति एकम् इषे इति,शूर्पेण शेषम् अग्नौ ओप्य अभ्युत्क्रामयन्ति प्राच् उदीचीम् एकम् इषे इति,[0] -> [1] -> [2] -> [3] -> [4] -> [5] -> [6]
उरो अन्तरिक्ष इति अन्तरा चात्वाल उत्करौ उदञ्चम् पशुम् नयन्ति,उरो अन्तरिक्ष इति अन्तरा चात्वाल उत्करौ नयन्ति उदञ्चम् पशुम्,[0] -> [1] -> [2] -> [3] -> [4] -> [5] -> [6]
सः जातः भूतानि अभिव्यैक्षत् किम् इह अन्यम् वावदिषत् इति,सः जातः अभिव्यैक्षत् भूतानि किम् इह अन्यम् वावदिषत् इति,[0] -> [1] -> [2] -> [3] -> [4] -> [5] -> [6]
अनर्वा प्रेहि इति प्रतिप्रस्थाता पूर्णपात्रेण सह पत्नीम् उदानयति,अनर्वा प्रेहि इति प्रतिप्रस्थाता पूर्णपात्रेण सह उदानयति पत्नीम्,[0] -> [1] -> [2] -> [3] -> [4] -> [5] -> [6]
देवस्य वः सवितुः प्रसवे इति अभ्रीः आदत्ते,देवस्य वः सवितुः प्रसवे इति आदत्ते अभ्रीः,[0] -> [1] -> [2] -> [3] -> [4] -> [5] -> [6]
रुद्राः संभृत्य पृथिवीम् इति मृदम् संक्षिप्य संसृष्टाम् वसुभिः इति तिसृभिः कर्त्रे प्रयच्छति,रुद्राः संभृत्य पृथिवीम् इति संक्षिप्य मृदम् संसृष्टाम् वसुभिः इति तिसृभिः कर्त्रे प्रयच्छति,[0] -> [1] -> [2] -> [3] -> [4] -> [5] -> [6]
प्रातराहुतिम् हुत्वा हविः निर्वपेत् अमुष्मै त्वा जुष्टम् निर्वपामि इति,प्रातराहुतिम् हुत्वा निर्वपेत् हविः अमुष्मै त्वा जुष्टम् निर्वपामि इति,[0] -> [1] -> [2] -> [3] -> [4] -> [5] -> [6]
चरुम् वः चरामः इति एवम् सर्व भयेषु अहोरात्रम् चरेयुः,चरुम् वः चरामः इति एवम् सर्व भयेषु चरेयुः अहोरात्रम्,[0] -> [1] -> [2] -> [3] -> [4] -> [5] -> [6]
अथ प्राचीम् स्फ्येन वेदिम् उद्धन्ति देवस्य सवितुः सवे कर्म कृण्वन्ति वेधसः इति,अथ स्फ्येन उद्धन्ति प्राचीम् वेदिम् देवस्य सवितुः सवे कर्म कृण्वन्ति वेधसः इति,[0] -> [1] -> [2] -> [3] -> [4] -> [5] -> [6]
अथ ध्रुवाम् संमार्ष्टि प्रजाम् योनिम् मा निर्मृक्षम् वाजिनीम् त्वा सपत्न साहीम् संमार्ज्मि इति,अथ संमार्ष्टि ध्रुवाम् प्रजाम् योनिम् मा निर्मृक्षम् वाजिनीम् त्वा सपत्न साहीम् संमार्ज्मि इति,[0] -> [1] -> [2] -> [3] -> [4] -> [5] -> [6]
तस्याम् प्राचीम् दृषदम् अध्यूहति धिषणा असि पर्वत्या प्रति त्वा दिवः स्कम्भनिः वेत्तु इति,तस्याम् अध्यूहति प्राचीम् दृषदम् धिषणा असि पर्वत्या प्रति त्वा दिवः स्कम्भनिः वेत्तु इति,[0] -> [1] -> [2] -> [3] -> [4] -> [5] -> [6]
यत् आग्नीध्रः त्रिस् हरति अथ अध्वर्युः उत्तरवेद्यै पुरीषम् संप्रयौति सिंहीः असि महिषीः असि इति,यत् आग्नीध्रः त्रिस् हरति अथ अध्वर्युः संप्रयौति उत्तरवेद्यै पुरीषम् सिंहीः असि महिषीः असि इति,[0] -> [1] -> [2] -> [3] -> [4] -> [5] -> [6]
उत्क्राम उदक्रमीत् इति द्वाभ्याम् मृत्खनात् उदञ्चम् अश्वम् उत्क्रमय्य अपः देवीः उपसृज इति अश्वस्य पदे अपः उपसृज्य पदे हिरण्यम् निधाय,उत्क्राम उदक्रमीत् इति द्वाभ्याम् मृत्खनात् उदञ्चम् अश्वम् उत्क्रमय्य अपः देवीः उपसृज इति अश्वस्य पदे उपसृज्य अपः पदे हिरण्यम् निधाय,[0] -> [1] -> [2] -> [3] -> [4] -> [5] -> [6]
इमाम् उच्छ्रयामि भुवनस्य नाभिम् वसोः धाराम् प्रतरणीम् वसूनाम् इह एव ध्रुवाम् निमिनोमि शालाम् क्षेमे तिष्ठतु घृतम् उक्षमाणा अश्वावती गोमती सूनृतावती उच्छ्रयस्व महते सौभगाय आ त्वा शिशुः आक्रन्दतु आ गावः धेनवः वाश्यमानाः आ त्वा कुमारः तरुणः आ वत्सः जगदैः सह आ त्वा परिस्रुतः कुम्भः आ दध्नः कलशैः उप क्षेमस्य पत्नी बृहती सु वासाः रयिम् नः धेहि सुभगे सु वीर्यम् अश्वावत् गोमत् ऊर्जस्वत् पर्णम् वनस्पतेः इव अभि नः पूर्यताम् रयिः इदम् अनु श्रेयः वसानः इति चतुरः प्रपद्यते,इमाम् उच्छ्रयामि भुवनस्य नाभिम् वसोः धाराम् प्रतरणीम् वसूनाम् इह एव ध्रुवाम् निमिनोमि शालाम् क्षेमे तिष्ठतु घृतम् उक्षमाणा अश्वावती गोमती सूनृतावती उच्छ्रयस्व महते सौभगाय आ त्वा शिशुः आक्रन्दतु आ गावः धेनवः वाश्यमानाः आ त्वा कुमारः तरुणः आ वत्सः जगदैः सह आ त्वा परिस्रुतः कुम्भः आ दध्नः कलशैः उप क्षेमस्य पत्नी बृहती सु वासाः रयिम् नः धेहि सुभगे सु वीर्यम् अश्वावत् गोमत् ऊर्जस्वत् पर्णम् वनस्पतेः इव अभि नः पूर्यताम् रयिः इदम् अनु श्रेयः वसानः इति प्रपद्यते चतुरः,[0] -> [1] -> [2] -> [3] -> [4] -> [5] -> [6]
उपस्थाः ते इति त्रीणि ओप्य अतिक्रामति,उपस्थाः ते इति ओप्य त्रीणि अतिक्रामति,[0] -> [1] -> [2] -> [3] -> [4] -> [5] -> [6]
अपरम् चतुर्गृहीतम् गृहीत्वा यूप आहुतिम् जुहोति उरु विष्णो विक्रमस्व उरु क्षयाय नः कृधि,अपरम् चतुर्गृहीतम् गृहीत्वा जुहोति यूप आहुतिम् उरु विष्णो विक्रमस्व उरु क्षयाय नः कृधि,[0] -> [1] -> [2] -> [3] -> [4] -> [5] -> [6]
सः हुत्वा आहुतिम् आहवनीयम् उपतिष्ठेत न अग्नेः देवतायाः एमि न गायत्र्याः छन्दसः न त्रिवृतः स्तोमात् न ब्रह्मणः बन्धोः मा मे अग्निः तेजः आदित मा गायत्री वीर्यम् मा त्रिवृत् स्तोमः आयुः मा ब्राह्मणाः ब्रह्म यशः कीर्तिम् सह तेजसा वीर्येण आयुषा ब्रह्मणा यशसा कीर्त्या इन्द्रम् देवताम् उपैमि त्रिष्टुभम् छन्दः पञ्चदशम् स्तोमम् सोमम् राजानम् क्षत्रम् प्रपद्ये क्षत्रियः भवामि देवाः पितरः पितरः देवाः यः अस्मि स सन् यजे स्वम् मे इदम् इष्टम् स्वम् पूर्तम् स्वम् श्रान्तम् स्वम् हुतम् तस्य मे अयम् अग्निः उपद्रष्टा अयम् वायुः उपश्रोता असौ आदित्यः अनुख्याता इदम् अहम् यः एव अस्मि सः अस्मि इति,सः हुत्वा आहुतिम् उपतिष्ठेत आहवनीयम् न अग्नेः देवतायाः एमि न गायत्र्याः छन्दसः न त्रिवृतः स्तोमात् न ब्रह्मणः बन्धोः मा मे अग्निः तेजः आदित मा गायत्री वीर्यम् मा त्रिवृत् स्तोमः आयुः मा ब्राह्मणाः ब्रह्म यशः कीर्तिम् सह तेजसा वीर्येण आयुषा ब्रह्मणा यशसा कीर्त्या इन्द्रम् देवताम् उपैमि त्रिष्टुभम् छन्दः पञ्चदशम् स्तोमम् सोमम् राजानम् क्षत्रम् प्रपद्ये क्षत्रियः भवामि देवाः पितरः पितरः देवाः यः अस्मि स सन् यजे स्वम् मे इदम् इष्टम् स्वम् पूर्तम् स्वम् श्रान्तम् स्वम् हुतम् तस्य मे अयम् अग्निः उपद्रष्टा अयम् वायुः उपश्रोता असौ आदित्यः अनुख्याता इदम् अहम् यः एव अस्मि सः अस्मि इति,[0] -> [1] -> [2] -> [3] -> [4] -> [5] -> [6]
प्राच् अग्रे धारयन् वैष्णवे इति अभ्युक्ष्य कुश तरुणाभ्याम् प्रदक्षिणम् अग्निम् त्रिस् पर्युक्ष्य महीनाम् पयः असि इति _ स्थालीम् आदाय इषे त्वा इति अधिश्रित्य ऊर्जे त्वा इति उदञ्चम् उद्वास्य _ अग्रे पवित्रे धारयन् अङ्गुष्ठाभ्याम् च उपकनिष्ठिकाभ्याम् च उभयतस् प्रतिगृह्य _ अग्रे प्रह्वे कृत्वा आज्ये प्रत्यस्यति सवितुः त्वा प्रसवे उत्पुनामि अच्छिद्रेण पवित्रेण वसोः सूर्यस्य रश्मिभिः इति,प्राच् अग्रे धारयन् वैष्णवे इति अभ्युक्ष्य कुश तरुणाभ्याम् प्रदक्षिणम् अग्निम् त्रिस् पर्युक्ष्य महीनाम् पयः असि इति आदाय _ स्थालीम् इषे त्वा इति अधिश्रित्य ऊर्जे त्वा इति उदञ्चम् उद्वास्य _ अग्रे पवित्रे धारयन् अङ्गुष्ठाभ्याम् च उपकनिष्ठिकाभ्याम् च उभयतस् प्रतिगृह्य _ अग्रे प्रह्वे कृत्वा आज्ये प्रत्यस्यति सवितुः त्वा प्रसवे उत्पुनामि अच्छिद्रेण पवित्रेण वसोः सूर्यस्य रश्मिभिः इति,[0] -> [1] -> [2] -> [3] -> [4] -> [5] -> [6]
अस्मिन् वसु यत् आबध्नन् नव प्राणान् इति युग्म कृष्णलम् वासितम् बध्नाति,अस्मिन् वसु यत् आबध्नन् नव प्राणान् इति बध्नाति युग्म कृष्णलम् वासितम्,[0] -> [1] -> [2] -> [3] -> [4] -> [5] -> [6]
यत्र अभिजानाति सीद होतर् स्वे लोके इति तत् संभारेषु अग्निम् प्रतिष्ठापयति यज्ञ प्रतितिष्ठ सुमतौ सुशेवाः त्वा वसूनि पुरुधा विशन्तु दीर्घम् आयुः यजमानाय कृण्वन् अध अमृतेन जरितारम् अङ्धि इति,यत्र अभिजानाति सीद होतर् स्वे लोके इति तत् संभारेषु प्रतिष्ठापयति अग्निम् यज्ञ प्रतितिष्ठ सुमतौ सुशेवाः त्वा वसूनि पुरुधा विशन्तु दीर्घम् आयुः यजमानाय कृण्वन् अध अमृतेन जरितारम् अङ्धि इति,[0] -> [1] -> [2] -> [3] -> [4] -> [5] -> [6]
यशसः यशः असि इति मधुपर्कम् प्रतिगृह्णीयात्,यशसः यशः असि इति प्रतिगृह्णीयात् मधुपर्कम्,[0] -> [1] -> [2] -> [3] -> [4] -> [5] -> [6]
आघारौ आघार्य आज्य भागौ जुहोति अग्नये स्वाहा इति उत्तर अर्ध पूर्व अर्धे सोमाय स्वाहा इति दक्षिण अर्ध पूर्व अर्धे,आघारौ आघार्य जुहोति आज्य भागौ अग्नये स्वाहा इति उत्तर अर्ध पूर्व अर्धे सोमाय स्वाहा इति दक्षिण अर्ध पूर्व अर्धे,[0] -> [1] -> [2] -> [3] -> [4] -> [5] -> [6]
आज्येन दध्ना उदेहि इति संप्रैष अन्तम् नमति,आज्येन दध्ना उदेहि इति नमति संप्रैष अन्तम्,[0] -> [1] -> [2] -> [3] -> [4] -> [5] -> [6]
इन्द्रस्य ओजः मरुताम् अनीकम् इति रथम् अभि हुत्वा वनस्पते वीडु अङ्गः इति आतिष्ठति,इन्द्रस्य ओजः मरुताम् अनीकम् इति अभि हुत्वा रथम् वनस्पते वीडु अङ्गः इति आतिष्ठति,[0] -> [1] -> [2] -> [3] -> [4] -> [5] -> [6]
अथ पितृ देवत्येषु पशुषु वह वपाम् जातवेदः पितृभ्यः इति वपाम् जुहुयात् देव देवत्येषु जातवेदः वपया गच्छ देवान् इति,अथ पितृ देवत्येषु पशुषु वह वपाम् जातवेदः पितृभ्यः इति जुहुयात् वपाम् देव देवत्येषु जातवेदः वपया गच्छ देवान् इति,[0] -> [1] -> [2] -> [3] -> [4] -> [5] -> [6]
स्रुच्यम् आघार्य उदङ् अतिक्रम्य सम् ते प्राणः इति पशोः दक्षिणे अर्ध शिरसि जुह्वा समज्य सम् यजत्रैः अङ्गानि इति ककुदि सम् यज्ञपतिः आशिषा इति भसदि मखस्य शिरः असि इति प्रतिपद्य होतारम् वृत्वा आश्राव्य प्रत्याश्राविते मित्रावरुणौ प्रशास्तारौ प्रशास्त्रात् इति मैत्रावरुणम् वृणीते,स्रुच्यम् आघार्य उदङ् अतिक्रम्य सम् ते प्राणः इति पशोः दक्षिणे अर्ध शिरसि जुह्वा समज्य सम् यजत्रैः अङ्गानि इति ककुदि सम् यज्ञपतिः आशिषा इति भसदि मखस्य शिरः असि इति प्रतिपद्य होतारम् वृत्वा आश्राव्य प्रत्याश्राविते मित्रावरुणौ प्रशास्तारौ प्रशास्त्रात् इति वृणीते मैत्रावरुणम्,[0] -> [1] -> [2] -> [3] -> [4] -> [5] -> [6]
