sen_str,swapped_sen_str,leaf_rule
अद्भिः एव अपः प्रोक्षति प्रोक्षिताः स्थ प्रोक्षिताः स्थ इति त्रिस्,अद्भिः एव प्रोक्षति अपः प्रोक्षिताः स्थ प्रोक्षिताः स्थ इति त्रिस्,[0] -> [1] -> [2] -> [3] -> [4] -> [5] -> [6]
नवम् स्थालीपाकम् श्रपयित्वा आज्यभागौ इष्ट्वा आज्य आहुती जुहोति शत आयुधाय शत वीर्याय शत ऊतये अभिमातिषाहे शतम् यः नः शरदः इन्द्रः नेषत् अति दुरितानि विश्वा स्वाहा ये चत्वारः पथयः देव यानाः अन्तरा द्यावापृथिवी वियन्ति तेषाम् यः अ ज्यानिम् अजीजिम् आवहात् तस्मै नः देवाः परिधत्त इह सर्वे स्वाहा इति,नवम् स्थालीपाकम् श्रपयित्वा आज्यभागौ इष्ट्वा जुहोति आज्य आहुती शत आयुधाय शत वीर्याय शत ऊतये अभिमातिषाहे शतम् यः नः शरदः इन्द्रः नेषत् अति दुरितानि विश्वा स्वाहा ये चत्वारः पथयः देव यानाः अन्तरा द्यावापृथिवी वियन्ति तेषाम् यः अ ज्यानिम् अजीजिम् आवहात् तस्मै नः देवाः परिधत्त इह सर्वे स्वाहा इति,[0] -> [1] -> [2] -> [3] -> [4] -> [5] -> [6]
प्रातर् अग्निम् गिरौ अरगराटेषु दिवस्पृथिव्याः इति दधि मधु आशयति,प्रातर् अग्निम् गिरौ अरगराटेषु दिवस्पृथिव्याः इति आशयति दधि मधु,[0] -> [1] -> [2] -> [3] -> [4] -> [5] -> [6]
शेषम् कृत्वा अवस्थाप्य आहवनीयम् उरु विष्णो विक्रमस्व इति आहवनीये स्रुवेण आहुतिम् जुहोति,शेषम् कृत्वा अवस्थाप्य आहवनीयम् उरु विष्णो विक्रमस्व इति आहवनीये स्रुवेण जुहोति आहुतिम्,[0] -> [1] -> [2] -> [3] -> [4] -> [5] -> [6]
अशना पिपासे एव एषा यजमानस्य संप्रख्याय वाश्यति इति ताम् तृणम् अपि आदयेत् सूयवसात् भगवती इति एतया ऋचा,अशना पिपासे एव एषा यजमानस्य संप्रख्याय वाश्यति इति ताम् आदयेत् तृणम् अपि सूयवसात् भगवती इति एतया ऋचा,[0] -> [1] -> [2] -> [3] -> [4] -> [5] -> [6]
अथ गाः आयतीः प्रतीक्षते एताः आचरन्ति मधुमत् दुहानाः प्रजावतीः यशसः विश्व रूपाः बह्वीः भवन्तीः उपजायमानाः इह वः इन्द्रः रमयतु गावः इति महेन्द्रः इति वा यदि महेन्द्र याजी भवति,अथ प्रतीक्षते गाः आयतीः एताः आचरन्ति मधुमत् दुहानाः प्रजावतीः यशसः विश्व रूपाः बह्वीः भवन्तीः उपजायमानाः इह वः इन्द्रः रमयतु गावः इति महेन्द्रः इति वा यदि महेन्द्र याजी भवति,[0] -> [1] -> [2] -> [3] -> [4] -> [5] -> [6]
आपः स्वराजः इति मरीचीः गृहीत्वा गृहीत्वा अञ्जलिना सर्वासु संसृजति,आपः स्वराजः इति गृहीत्वा मरीचीः गृहीत्वा अञ्जलिना सर्वासु संसृजति,[0] -> [1] -> [2] -> [3] -> [4] -> [5] -> [6]
सम् अन्याः यन्ति इन्धनम् प्रयुञ्जानः न पिपासया म्रियते,सम् अन्याः यन्ति प्रयुञ्जानः इन्धनम् न पिपासया म्रियते,[0] -> [1] -> [2] -> [3] -> [4] -> [5] -> [6]
इदम् उग्राय इति अन्वक्तान् अक्षान् विदेवनाय अध्वर्यवे प्रयच्छति,इदम् उग्राय इति विदेवनाय अध्वर्यवे प्रयच्छति अन्वक्तान् अक्षान्,[0] -> [1] -> [2] -> [3] -> [4] -> [5] -> [6]
शम् अद्भ्यः शम् ओषधीभ्यः इति अवशिष्टाः अनु पृष्ठम् निनीय दक्षिणेन नाभिम् प्राच् अग्रम् बर्हिः निदधाति ओषधे त्रायस्व एनम् इति,शम् अद्भ्यः शम् ओषधीभ्यः इति अनु पृष्ठम् निनीय अवशिष्टाः दक्षिणेन नाभिम् प्राच् अग्रम् बर्हिः निदधाति ओषधे त्रायस्व एनम् इति,[0] -> [1] -> [2] -> [3] -> [4] -> [5] -> [6]
अग्नेः जनित्रम् असि इति अधिमन्थनम् शकलम् निदधाति वृषणौ स्थः इति प्राञ्चौ दर्भौ,अग्नेः जनित्रम् असि इति निदधाति अधिमन्थनम् शकलम् वृषणौ स्थः इति प्राञ्चौ दर्भौ,[0] -> [1] -> [2] -> [3] -> [4] -> [5] -> [6]
ब्रह्म जज्ञानम् भवाशर्वौ इति आसन्नम् अरण्ये पर्वतम् यजते,ब्रह्म जज्ञानम् भवाशर्वौ इति अरण्ये यजते आसन्नम् पर्वतम्,[0] -> [1] -> [2] -> [3] -> [4] -> [5] -> [6]
दिवे स्वाहा इमम् यवम् इति चतुरः उद पात्रे संपातान् आनयति द्वौ पृथिव्याम्,दिवे स्वाहा इमम् यवम् इति उद पात्रे आनयति चतुरः संपातान् द्वौ पृथिव्याम्,[0] -> [1] -> [2] -> [3] -> [4] -> [5] -> [6]
चात्वाले पत्नी अपः अवमृशति आपः देवीः शुद्धायुवः इति,चात्वाले पत्नी अवमृशति अपः आपः देवीः शुद्धायुवः इति,[0] -> [1] -> [2] -> [3] -> [4] -> [5] -> [6]
अथ अभिप्रातर् एव स्थालीपाक आवृता आज्यम् चेष्टित्वा स्थालीपाकस्य उपघातम् जुहोति अग्नये _ अनुमतये _ देवाय सवित्रे _ प्रसवाय _ इति,अथ अभिप्रातर् एव स्थालीपाक आवृता आज्यम् चेष्टित्वा उपघातम् जुहोति स्थालीपाकस्य अग्नये _ अनुमतये _ देवाय सवित्रे _ प्रसवाय _ इति,[0] -> [1] -> [2] -> [3] -> [4] -> [5] -> [6]
देवेभ्यः शुन्धस्व इति ताम् प्रोक्ष्य देवेभ्यः शुम्भस्व इति स्वधितिना वपाम् उन्मृज्य देवेभ्यः कल्पस्व इति अभिमन्त्र्य अ छिन्नः रायः सु वीर इति ताम् अधस्तात् उत्कृन्तति,देवेभ्यः शुन्धस्व इति ताम् प्रोक्ष्य देवेभ्यः शुम्भस्व इति स्वधितिना उन्मृज्य वपाम् देवेभ्यः कल्पस्व इति अभिमन्त्र्य अ छिन्नः रायः सु वीर इति ताम् अधस्तात् उत्कृन्तति,[0] -> [1] -> [2] -> [3] -> [4] -> [5] -> [6]
नीयमाने प्रमुच्यमानहोमान् जुहुयात् प्रमुच्यमानः भुवनस्य गोप पशुः नः अत्र प्रति भागम् एतु अग्निः यज्ञम् त्रिवृतम् सप्त तन्तुम् देवः देवेभ्यः हव्यम् वहतु प्रजानन् यौ ते दंष्ट्रौ रोपयिष्णू जिह्मायेते दक्षिणा सम् च पश्यतः अनाष्ट्रम् नः पितरः तत् कृणोत यूपे बद्धम् प्रमुमुचिम यत् अन्नम् अ ह्रस्तः त्वम् अभिजुष्टः परेहि इन्द्रस्य गोष्ठम् अपिधाव विद्वान् धीरासः त्वा कवयः संमृजन्तु इषम् ऊर्जम् यजमानाय दत्त्वा इति,नीयमाने जुहुयात् प्रमुच्यमानहोमान् प्रमुच्यमानः भुवनस्य गोप पशुः नः अत्र प्रति भागम् एतु अग्निः यज्ञम् त्रिवृतम् सप्त तन्तुम् देवः देवेभ्यः हव्यम् वहतु प्रजानन् यौ ते दंष्ट्रौ रोपयिष्णू जिह्मायेते दक्षिणा सम् च पश्यतः अनाष्ट्रम् नः पितरः तत् कृणोत यूपे बद्धम् प्रमुमुचिम यत् अन्नम् अ ह्रस्तः त्वम् अभिजुष्टः परेहि इन्द्रस्य गोष्ठम् अपिधाव विद्वान् धीरासः त्वा कवयः संमृजन्तु इषम् ऊर्जम् यजमानाय दत्त्वा इति,[0] -> [1] -> [2] -> [3] -> [4] -> [5] -> [6]
तेन यक्ष्यमाणः अमावास्यायाम् पौर्णमास्याम् वा षड्ढोतारम् मनसा अनुद्रुत्य आहवनीये स ग्रहम् जुहोति सूर्यम् ते चक्षुः इति,तेन यक्ष्यमाणः अमावास्यायाम् पौर्णमास्याम् वा षड्ढोतारम् मनसा अनुद्रुत्य आहवनीये जुहोति स ग्रहम् सूर्यम् ते चक्षुः इति,[0] -> [1] -> [2] -> [3] -> [4] -> [5] -> [6]
परस्याः अधि संवतः इति वैकङ्कतीम् समिधम् आदधाति परमस्याः परावतः इति शमी मयीम्,परस्याः अधि संवतः इति आदधाति वैकङ्कतीम् समिधम् परमस्याः परावतः इति शमी मयीम्,[0] -> [1] -> [2] -> [3] -> [4] -> [5] -> [6]
आपश्यति इति सदंपुष्पा मणिम् बध्नाति,आपश्यति इति बध्नाति सदंपुष्पा मणिम्,[0] -> [1] -> [2] -> [3] -> [4] -> [5] -> [6]
भुवः इति एव यजुर्वेदस्य रसम् आदत्त,भुवः इति एव आदत्त यजुर्वेदस्य रसम्,[0] -> [1] -> [2] -> [3] -> [4] -> [5] -> [6]
स्थिते मरुत्वतीये होता विसंस्थित संचरेण निष्क्रम्य आग्नीध्रीये तिस्रः आज्य आहुतीः जुहोति औदुम्बरेण स्रुवेण अनु माम् इन्द्रः अनु माम् बृहस्पतिः अनु सोमः अनु वाच् देवी आवीत् अनु माम् मित्रावरुणौ इह आवताम् अनु द्यावापृथिवी पूर्व हूतौ आदित्याः मा विश्वे अवन्तु देवाः सप्त राजानः ये उद अभिषिक्ताः वायुः पूषा वरुणः सोमः अग्निः सूर्यः नक्षत्रैः अवतु इह मा नु पितरः मा विश्वम् इदम् च भूतम् पृश्नि मातरः मरुतः सु अर्काः ये अग्नि जिह्वाः उत वा यजत्राः ते नः देवाः सु हवाः शर्म यच्छत इति,स्थिते मरुत्वतीये होता विसंस्थित संचरेण निष्क्रम्य आग्नीध्रीये जुहोति तिस्रः आज्य आहुतीः औदुम्बरेण स्रुवेण अनु माम् इन्द्रः अनु माम् बृहस्पतिः अनु सोमः अनु वाच् देवी आवीत् अनु माम् मित्रावरुणौ इह आवताम् अनु द्यावापृथिवी पूर्व हूतौ आदित्याः मा विश्वे अवन्तु देवाः सप्त राजानः ये उद अभिषिक्ताः वायुः पूषा वरुणः सोमः अग्निः सूर्यः नक्षत्रैः अवतु इह मा नु पितरः मा विश्वम् इदम् च भूतम् पृश्नि मातरः मरुतः सु अर्काः ये अग्नि जिह्वाः उत वा यजत्राः ते नः देवाः सु हवाः शर्म यच्छत इति,[0] -> [1] -> [2] -> [3] -> [4] -> [5] -> [6]
पूर्वाह्णे दक्षिणेन अग्नि आयतनानि गत्वा यत्र अग्निम् मन्थिष्यन्तः स्युः तद् दक्षिणतस् निरस्तः परावसुः इति दक्षिणा तृणम् निरस्येत्,पूर्वाह्णे दक्षिणेन अग्नि आयतनानि गत्वा यत्र अग्निम् मन्थिष्यन्तः स्युः तद् दक्षिणतस् निरस्तः परावसुः इति दक्षिणा निरस्येत् तृणम्,[0] -> [1] -> [2] -> [3] -> [4] -> [5] -> [6]
स ते मा अस्थात् इति पश्चात् प्राञ्चम् उपगूहति,स ते मा अस्थात् इति उपगूहति पश्चात् प्राञ्चम्,[0] -> [1] -> [2] -> [3] -> [4] -> [5] -> [6]
अन्न पते इति अन्नस्य जुहुयात्,अन्न पते इति जुहुयात् अन्नस्य,[0] -> [1] -> [2] -> [3] -> [4] -> [5] -> [6]
भवाशर्वौ इति सप्त काम्पील पुटान् अपाम् पूर्णान् संपातवतः कृत्वा दक्षिणेन अवसिच्य पश्चात् अपविध्यति,भवाशर्वौ इति संपातवतः कृत्वा सप्त काम्पील पुटान् अपाम् पूर्णान् दक्षिणेन अवसिच्य पश्चात् अपविध्यति,[0] -> [1] -> [2] -> [3] -> [4] -> [5] -> [6]
स भूः इति एव ऋग्वेदस्य रसम् आदत्त,स भूः इति एव आदत्त ऋग्वेदस्य रसम्,[0] -> [1] -> [2] -> [3] -> [4] -> [5] -> [6]
शीत उष्णाभिः अद्भिः स्नात्वा युवम् वस्त्राणि पीवसा वसाथे इति अहते वाससी आच्छाद्य अश्मनः तेजः असि चक्षुः मे पाहि इति चक्षुषी आञ्जयीत,शीत उष्णाभिः अद्भिः स्नात्वा युवम् वस्त्राणि पीवसा वसाथे इति आच्छाद्य अहते वाससी अश्मनः तेजः असि चक्षुः मे पाहि इति चक्षुषी आञ्जयीत,[0] -> [1] -> [2] -> [3] -> [4] -> [5] -> [6]
सु आवेशः असि इति प्रथम परापातितम् शकलम् अधस् त्वक्कम् अवधाय घृतेन द्यावापृथिवी आपृणेथाम् स्वाहा इति हिरण्यम् निधाय स्रुवेण अभिजुहोति,सु आवेशः असि इति अवधाय प्रथम परापातितम् शकलम् अधस् त्वक्कम् घृतेन द्यावापृथिवी आपृणेथाम् स्वाहा इति हिरण्यम् निधाय स्रुवेण अभिजुहोति,[0] -> [1] -> [2] -> [3] -> [4] -> [5] -> [6]
वैश्वदेव वत् आज्य सादन अन्तम् कृत्वा देवस्य त्वा इति अभ्रिम् आदाय अर्धम् अन्तर्वेदि अर्धम् बहिर्वेदि सर्वतस् प्रादेश संमितम् यूप अवटम् त्रिस् प्रदक्षिणम् परिलिखितम् इति परिलिखति,वैश्वदेव वत् आज्य सादन अन्तम् कृत्वा देवस्य त्वा इति अभ्रिम् आदाय अर्धम् अन्तर्वेदि अर्धम् बहिर्वेदि त्रिस् प्रदक्षिणम् परिलिखितम् इति परिलिखति सर्वतस् प्रादेश संमितम् यूप अवटम्,[0] -> [1] -> [2] -> [3] -> [4] -> [5] -> [6]
इन्द्रम् अहम् इति पण्यम् संपातवत् उत्थापयति,इन्द्रम् अहम् इति उत्थापयति पण्यम् संपातवत्,[0] -> [1] -> [2] -> [3] -> [4] -> [5] -> [6]
तेषु सांनाय्य तपनीम् अधिश्रयति द्यौः असि पृथिवी असि विश्व धायाः असि परमेण धाम्ना दृंहस्व मा ह्वार् इति,तेषु अधिश्रयति सांनाय्य तपनीम् द्यौः असि पृथिवी असि विश्व धायाः असि परमेण धाम्ना दृंहस्व मा ह्वार् इति,[0] -> [1] -> [2] -> [3] -> [4] -> [5] -> [6]
बर्हिषी अन्तर्धाय दधि आनयति ऋध्यासम् अद्य पृषतीनाम् ग्रहम् पृषतीनाम् ग्रहः असि इति,बर्हिषी अन्तर्धाय आनयति दधि ऋध्यासम् अद्य पृषतीनाम् ग्रहम् पृषतीनाम् ग्रहः असि इति,[0] -> [1] -> [2] -> [3] -> [4] -> [5] -> [6]
इमम् मे वरुण तत् त्वा यामि त्वम् नः अग्ने स त्वम् नः अग्ने त्वम् अग्ने अयासि प्रजापते यत् अस्य कर्मणः अत्यरीरिचम् इति च अत्र एके जय अभ्यातानान् राष्ट्रभृतः इति उपजुह्वति यथा पुरस्तात्,इमम् मे वरुण तत् त्वा यामि त्वम् नः अग्ने स त्वम् नः अग्ने त्वम् अग्ने अयासि प्रजापते यत् अस्य कर्मणः अत्यरीरिचम् इति च अत्र एके उपजुह्वति जय अभ्यातानान् राष्ट्रभृतः इति यथा पुरस्तात्,[0] -> [1] -> [2] -> [3] -> [4] -> [5] -> [6]
प्रजापतिः प्रायच्छत् इडाम् अग्ने इति स्विष्टकृतम् _ _ _ अर्धे जुहुयात्,प्रजापतिः प्रायच्छत् इडाम् अग्ने इति _ _ _ अर्धे जुहुयात् स्विष्टकृतम्,[0] -> [1] -> [2] -> [3] -> [4] -> [5] -> [6]
अभ्युक्ष्य अग्निम् प्रतिष्ठापयेत् भूः भुवः स्वर् इति,अभ्युक्ष्य प्रतिष्ठापयेत् अग्निम् भूः भुवः स्वर् इति,[0] -> [1] -> [2] -> [3] -> [4] -> [5] -> [6]
विद्म शरस्य अदः यत् इति मुञ्ज शिरः रज्ज्वा बध्नाति,विद्म शरस्य अदः यत् इति रज्ज्वा बध्नाति मुञ्ज शिरः,[0] -> [1] -> [2] -> [3] -> [4] -> [5] -> [6]
स्रुचः सादयित्वा अग्रेण ध्रुवाम् वेदम् सादयित्वा सावित्रेण अभ्रिम् आदाय अग्रेण आहवनीयम् यूप अवटम् परिलिखति अर्धम् अन्तर्वेदि अर्धम् बहिर्वेदि परिलिखितम् रक्षः परिलिखिताः अरातयः इति,स्रुचः सादयित्वा अग्रेण ध्रुवाम् वेदम् सादयित्वा सावित्रेण अभ्रिम् आदाय अग्रेण आहवनीयम् परिलिखति यूप अवटम् अर्धम् अन्तर्वेदि अर्धम् बहिर्वेदि परिलिखितम् रक्षः परिलिखिताः अरातयः इति,[0] -> [1] -> [2] -> [3] -> [4] -> [5] -> [6]
_ धन्वन्तरी पुत्र व्रती _ मेषाभ्याम् इष्ट्वा दीर्घानाम् व्याहृतिभिः कुमारम् चतुः प्राशयेत् आयुः दाः देवैः इति च,_ धन्वन्तरी पुत्र व्रती _ मेषाभ्याम् इष्ट्वा दीर्घानाम् व्याहृतिभिः कुमारम् प्राशयेत् चतुः आयुः दाः देवैः इति च,[0] -> [1] -> [2] -> [3] -> [4] -> [5] -> [6]
